index,user,title,content,comment,link,date,view,rate,comment_count
40321754,밀리에밀리,소재가 '많은' 건 그렇게 중요하지가 않은게,"활용할 소재가 '많은' 건안 그런 나라가 없음애초에 전통이란 게 없는 국가란 게 존재할까?요점은 그게 '어필이 되느냐?' 혹은 '팔리느냐', '먹히느냐' 하는 거임하회탈이나 구미호, 한식 같은 게 진짜로외국인들에게 의미 있는 수준으로 먹히지는 않잖아","[{'user': '00000#82591124', 'comment': '십덕 겜에 그런거 따지나 꼴리면 끝나는것이지'}, {'user': '밀리에밀리', 'comment': '십덕겜 얘기는 하지도 않았는데 뭐라는거임'}, {'user': '뷰룻', 'comment': '(emoticon)'}, {'user': '그냥막만든아이디#22831543', 'comment': '보통 우리가 생각하는 한국적인 요소보다 오징어게임이나 디바같은 뜬끔없는게 먹히지'}, {'user': '마에스트로', 'comment': '하회탈은 가능성있을거같은데 옵치 아나스킨이나 신암행어사 팬텀솔져느낌으로'}, {'user': '응애슌', 'comment': '홍보에 따라 갈릴것 같음. 닌자도 사실 청부살인인데 걔네가 이미지 메이킹을 엄청 잘한거지'}, {'user': '우주전사히맨#85188497', 'comment': '그것도 열심히 팔아야지 팔리지 애초에 팔지를 않는테 팔리길 기대하는게 문제 아닐까'}, {'user': '유나사랑해#74442742', 'comment': '의미있는 수준으로 먹히는거는 그걸 전파하는 놈이 현지화를 어케 하느냐에 달린거지\n우리가 보기엔 좆병신같은데 외국애들이 보기엔 존나 센세이셔널할수도 있는거라'}, {'user': 'ㅇㅇ#20907218', 'comment': '진짜로 의미있는 수준으로 먹히는지도 안해봤는데 어찌암'}]",https://arca.live/b/counterside/40321754,2021-12-14 12:45:10,121,1,9
40321751,SDAKAJUXIM,얼리부드기상,잘잤다,,https://arca.live/b/counterside/40321751,2021-12-14 12:45:06,8,0,0
40321744,팔도,꼴리는 매카누짤,,"[{'user': '비염싫어', 'comment': '(emoticon)'}]",https://arca.live/b/counterside/40321744,2021-12-14 12:44:57,48,0,1
40321734,겨울동화샤오린#99311481,노무콘 달아줘,,"[{'user': '뷰룻', 'comment': '(emoticon)'}, {'user': '겨울동화샤오린#99311481', 'comment': '(emoticon)'}, {'user': '나유빈', 'comment': '(emoticon)'}, {'user': '겨울동화샤오린#99311481', 'comment': '(emoticon)'}, {'user': '맛있는힐데리아', 'comment': '(emoticon)'}, {'user': '숲토끼', 'comment': '(emoticon)'}, {'user': '겨울동화샤오린#99311481', 'comment': '(emoticon)'}, {'user': '숲토끼', 'comment': '(emoticon)'}, {'user': '겨울동화샤오린#99311481', 'comment': '(emoticon)'}, {'user': '고졸무직백수', 'comment': '(emoticon)'}, {'user': '숲토끼', 'comment': '(emoticon)'}, {'user': '겨울동화샤오린#99311481', 'comment': '(emoticon)'}, {'user': '동성회직계69대회장아스나', 'comment': '(emoticon)'}]",https://arca.live/b/counterside/40321734,2021-12-14 12:44:39,45,0,13
40321725,"ㅇㅇ, 116.40",주변국들이 저래서 미국한테 미친듯이 자금 자원받으며 떡상한거임,이렇게 풍요로워진지 진짜 얼마 안됨  건국이래 최전성기다 미국 진짜 형님으로 모셔야됨,"[{'user': 'ㅇㅇ, 175.203', 'comment': '형님 형님 형님빽만 믿겠다'}, {'user': '도라에몽#87462610', 'comment': '중러 견제 최적이긴함'}, {'user': '4nk', 'comment': '미국은 자국이익때문이긴하지만, 솔직히 고마움'}]",https://arca.live/b/counterside/40321725,2021-12-14 12:44:28,82,0,3
40321723,도스분충우지챠,오들오들 이상한 그림학원.manhwa,,"[{'user': '블루아카이브', 'comment': '(emoticon)'}, {'user': '카늒네', 'comment': '(emoticon)'}, {'user': '아카라이브아카녹화엌ㅋㅋ', 'comment': '(emoticon)'}, {'user': 'ㅇㅇ#36099854', 'comment': '(emoticon)'}, {'user': 'KIRAREKI', 'comment': '코스믹 호러 로맨스...?ㅅㅂ 이게 뭐야'}, {'user': '템푸스', 'comment': '(emoticon)'}, {'user': '4nk', 'comment': '(emoticon)'}]",https://arca.live/b/counterside/40321723,2021-12-14 12:44:28,127,10,7
40321696,클러스트,한섭이 기니피그 서버가 아닌이유,mmm보유중임,"[{'user': '카늒네', 'comment': '(emoticon)'}, {'user': '블루아카이브', 'comment': '(emoticon)'}]",https://arca.live/b/counterside/40321696,2021-12-14 12:44:01,82,2,2
40321688,왜그러니,애초에 우리나라 전통문화로 일본 중국이랑 전통문화적으로 맞다이가 불가능한게,"교류한 역사가 너무 깊음우리가 미술책에서 봤던 빈센트 반 고흐다이 아재의 뒤를 잘보면 일본느낌나는 그림이 보일텐데 저게 일본의 우키요에다근데 어쩌다가 저기에 그려졌냐우키요에가 상당히 어이없게 유럽에 도달했는데그냥 도자기를 보호, 포장하기 위해 사용했던 우키요에 그림이 그려진 '포장지' 가 화가들에게 큰 충격을 줬었다일본에서는 그냥 굴러다니는 쓰레기가 유럽에선 오우쉣 오마이갓 거리면서 고가에 거래되기까지 이를정도로 인기있었음그리고 많은 화가들에게 영향을 주었는데대표적으로 위에 있는 고흐와 고갱 등이 있다그래서 저게 무슨상관이냐고?고흐가 1800년도에 활동하던 사람이였다애초에 교류한 역사 깊이부터가 달라서 비집고 들어가기가 어려운거다","[{'user': '딥러닝다람쥐', 'comment': '그냥 걔네가 개화를 일찍해서'}, {'user': 'ㅇㅇ#20907218', 'comment': '역사의 깊이 따지면서 1800년대 사례를 들고오는건 좀 차라리 세계화가 먼저 됐다는게 나은듯'}, {'user': '응애슌', 'comment': '깊이 따지면 우리가 훨씬 오래됐을텐데'}, {'user': '왜그러니', 'comment': '교류라고 했어야했네..'}, {'user': '유나사랑해#74442742', 'comment': '그냥 교류의 정도 차이 아닌가?'}, {'user': '팔도', 'comment': '오'}, {'user': 'Rhidelz', 'comment': '저 그림은 일본의 우키요에가 네덜란드랑 교류할때 포장지로도 많이 쓰여서 그걸로 유입된거임'}]",https://arca.live/b/counterside/40321688,2021-12-14 12:43:46,169,-1,7
40321244,기린그린,나나하라 치후유,"이름 : 나나하라 치후유포지션 : 스트라이커 / 카운터등급 : SSR코스트 : 3역할 : 딜러 / 탱커 / 서포터(디버프)기본기 : 기본공격 (유효타격수 1) (0.34 * 3 = 1.02)도검을 휘둘러 전방에 범위 피해를 입힌다.LV.2기본공격 피해량 +5%LV.3기본공격 피해량 +5%LV.4기본공격 피해량 +5%LV.5기본공격 피해량 +5%패시브 : 사앵지섬 (유효타격수 1) (0.34 * 3 + 0.68 = 1.7)연격으로 방어를 허문다. 기본 공격을 2회 시전하면 다음 기본공격에 피해받은 대상은 4초간 방어력이 10% 감소되며, 피해받은 대상 중 하나를 1초동안 스턴시킨다.LV.2디펜더 유닛에게 피해량 +5%LV.3디펜더 유닛에게 피해량 +5%LV.4디펜더 유닛에게 피해량 +10%LV.5특수기와 궁극기가 발동 조건에 포함됨, 감소하는 방어력이 20%로 변경특수기 : 벚나무 떨구기 (유효타격수 3 / 쿨타임 18초) (2.635)발도술로 전방에 범위 피해를 입힌다, 스킬 시전 시 영구적으로 공격력이 5%씩 증가하여 최대 15%까지 증가한다.LV.2피해량 +5%LV.3피해량 +5%LV.4피해량 +15%LV.5피해받은 대상이 5초간 스킬봉인(보스 함선 제외)궁극기 : 절기 화권도월 (유효타격수 3 / 쿨타임 46초) (0.51 + 0.595 * 2 + 2.125 = 3.825)어퍼컷 이후에 이어지는 검격으로 전방에 범위 피해를 입힌다. 스킬 시전 후 15초간 공격속도가 30% 증가한다.LV.2피해량 +5%LV.3피해량 +5%LV.4피해량 +15%LV.5스킬 시전 후 15초간 특수기 이하의 경직 면역 효과 추가댓글로 이 사원에 대한 평가와 사용하는 장비에 관한 의견을 남겨주시길 바랍니다.",,https://arca.live/b/counterside/40321244,2021-12-14 12:36:33,4,0,0
40321240,"ㅇㅇ, 220.70",카사 한국논란은 좀 맥락이 다르지,다른나라 사람 다 놔두고한국인만 말소당해서 기분나쁜것,"[{'user': '엘빅이', 'comment': '(emoticon)'}]",https://arca.live/b/counterside/40321240,2021-12-14 12:36:27,8,0,1
40321229,사관사냥,나나하라 이벤트 200명도 안했네,이럼 당첨확률 5%가 넘는데 킹직히 .....,"[{'user': '하고싶다', 'comment': '(emoticon)'}, {'user': '블루아카이브', 'comment': '(emoticon)'}, {'user': 'CCCAAA', 'comment': '아 시발 깜빡했다 좆같노'}]",https://arca.live/b/counterside/40321229,2021-12-14 12:36:14,36,0,1
40321219,풍기문란위원회,한국적요소 너무 바라지마라,유배가는 힐데 스킨 보고싶냐...?,"[{'user': '블루아카이브', 'comment': '(emoticon)'}]",https://arca.live/b/counterside/40321219,2021-12-14 12:36:02,23,0,1
40321202,ㅇㅇ#36099854,점검 1시 꽉채우나 보네,이거이거 배가 불렀구만,,https://arca.live/b/counterside/40321202,2021-12-14 12:35:47,13,0,0
40321186,1q2w3,이집트는 겁나 신비하긴 함,얼마전에 피라미드 관련 영상 봤었는데 진짜 말도 안되더라 ㅋㅋㅋ,,https://arca.live/b/counterside/40321186,2021-12-14 12:35:35,26,0,0
40321178,Kyria,솔직히 한국적 요소로 굳이 조선시대 삼국문명 이런거 없어도 되지,대충 한국식 제4공화국 감성겜에서 저런 풍경을 다 보네 싶긴 했는데아무튼 생각해보면 진짜 근대 한국적 전통이 맞다,"[{'user': '엘빅이', 'comment': '(emoticon)'}]",https://arca.live/b/counterside/40321178,2021-12-14 12:35:26,34,0,1
40321160,도라에몽#87462610,진짜 양념치킨만한 남녀노소 나이불문 국적불문 좋아할만한 한식 없을듯,좆치 그만하고 양념치킨합시다,"[{'user': '아카라이브아카녹화엌ㅋㅋ', 'comment': '응애입맛'}, {'user': '도라에몽#87462610', 'comment': '양념치킨은 우리나라 태생이니까'}, {'user': '블루아카이브', 'comment': '(emoticon)'}, {'user': 'CCCAAA', 'comment': '씨발년좆나꼴리게생겼네'}, {'user': '불타는쓰레기', 'comment': '줄'}]",https://arca.live/b/counterside/40321160,2021-12-14 12:35:08,52,1,5
40321159,KIRAREKI,카사에서 한국적인거 별로 없긴하네,배경 한국인건 넘어가고주시윤 칼 이순신 장군님이 쓰시던 칼 모티브 받은거랑 이지수? 빼면 없는듯,,https://arca.live/b/counterside/40321159,2021-12-14 12:35:07,15,0,0
40321156,팔도,남자 무당캐릭이 ㄹㅇ 신선하더라,혹시 웹툰 한줌물망초 아십니까?,"[{'user': '꿀때지', 'comment': '(emoticon)'}, {'user': '블루아카이브', 'comment': '(emoticon)'}]",https://arca.live/b/counterside/40321156,2021-12-14 12:35:04,40,0,1
40321137,꿀때지,이집트문명 <~~~~~ ㄹㅇ 개씹 말도안되던데 ,"이거 말고도 별에별거 다 잇음심지어 엄청난 먼거리를 ""해외출장"" 갓다오기도하고비데도 잇엇다던가? ","[{'user': '유나사랑해#74442742', 'comment': '진짜 개무서운게 고왕국시대-클레오파트라 간격이 클레오파트라-현대인게 ㅋㅋㅋ'}, {'user': 'Rhidelz', 'comment': '인구가 많으면 못하는게 없다'}, {'user': '헤비흡연충', 'comment': '이집트가 세계 최강대국인 시절 > 아닌 시절'}, {'user': 'lemonade', 'comment': '역시 유희왕의 나라...'}, {'user': '라익스가드#56229398', 'comment': '저거 피라미드 로마 때도 관광지였음ㅋㅋ'}, {'user': 'KIRAREKI', 'comment': 'ㄷㄷㄷㄷ이집트 왤캐 쌤 ㄷㄷ'}, {'user': 'temprun', 'comment': '전동딜도를 개발한 이집트문명'}, {'user': '밀리에밀리', 'comment': '지식이 늘었따'}]",https://arca.live/b/counterside/40321137,2021-12-14 12:34:48,69,0,7
40321133,"ㅇㅇ, 115.71",중국하니 생각나는거.. 중국 반미운동보고 어리석은 애국이라 비웃던 한국,얼마뒤 중국이 하던짓 그대로 따라하게된다..,,https://arca.live/b/counterside/40321133,2021-12-14 12:34:35,21,1,0
40321112,Paka,치후유가 이렇게 컸나,이 구도에 저 크기면 젖겜급 아님??,"[{'user': '유나사랑해#74442742', 'comment': '치후유 실제로도 존나 크잖아'}, {'user': '갤쁘리', 'comment': '오히려좋아'}, {'user': '아카라이브아카녹화엌ㅋㅋ', 'comment': '원본도 좆나 크긴 함'}, {'user': '꿀때지', 'comment': '(emoticon)'}, {'user': '밀리에밀리', 'comment': '치아가는 아가 아니야......존나 음탕해'}, {'user': '바싹구운생선', 'comment': '기본이나 수영복도 ㅈㄴ큼'}]",https://arca.live/b/counterside/40321112,2021-12-14 12:34:19,57,0,6
40321091,동성회직계69대회장아스나,근데 왜 갑자기 한국적 떡밥임,무슨일이고,"[{'user': '아카라이브아카녹화엌ㅋㅋ', 'comment': '쿨마다 돌아오는 븅슨같은 떡밥'}, {'user': '뚜빵이', 'comment': '일썹 나오고 일본캐만 나오는거 아니냐고 한국적인 캐릭터도 내달라는 뭐 그런 떡밥'}, {'user': '뚜빵이', 'comment': '약간 분리불안인가봐'}]",https://arca.live/b/counterside/40321091,2021-12-14 12:34:04,48,0,3
40321065,꿀때지,오싹오싹 문명부심 레전드.jpg,,"[{'user': 'ㅐㄴ', 'comment': '이집트 처음 기록된 시기 ~ 클레오파트라 ~ 지금 하면 클레오파트라 ~ 지금 이 더 짧은 시간이라던데ㅋㅋ'}]",https://arca.live/b/counterside/40321065,2021-12-14 12:33:48,70,0,1
40321058,uid136369,얼불춤에서 계속 기억에 남는 노래,이상하게 기억에 남음,,https://arca.live/b/counterside/40321058,2021-12-14 12:33:39,14,0,0
40321026,ㅇㅇ#78441027,섹스섹스보지털,섹스,"[{'user': '아카라이브아카녹화엌ㅋㅋ', 'comment': '3d치워라 이기'}, {'user': '밀리에밀리', 'comment': '마영전인가?'}, {'user': 'ㅇㅇ#78441027', 'comment': '이번에 뭐 대포걸 나왔다는데 겜은 살아 있음?'}, {'user': '밀리에밀리', 'comment': '이번에 뭐 대포걸 나왔다는데 겜은 살아 있음?'}, {'user': 'ㅇㅇ#78441027', 'comment': '잘 살아있음'}, {'user': '밀리에밀리', 'comment': '(emoticon)'}, {'user': 'CCCAAA', 'comment': '린완'}]",https://arca.live/b/counterside/40321026,2021-12-14 12:33:07,77,0,7
40321024,dwsss,그런데 초창기 기획캐인 민병대 이후로,한국 이름 없는거보면 얘내 캐릭터 명칭 통합 위해 앞으로 한국 이름 안나올 수도 있음ㅋㅋㅋ,"[{'user': '카붐', 'comment': '(emoticon)'}, {'user': '닉넴물음표못넣는거실화냐#48013268', 'comment': ""ㅇㅇ 북한첩보극을 찍거나 하지 않는이상 이미 다 '한국인'이 라기 보단 '내국인' 개념으로 들어가서 다 이름 번역시킬지도 모르겠네\n오히려 외국인 설정 센(한국어를 잘 못한다던가) 일본인 캐릭이 안나와서 다행일지도 몰라, 이상하게 꼬였을듯""}]",https://arca.live/b/counterside/40321024,2021-12-14 12:33:06,37,0,0
40321023,뚜빵이,치후유 옆으로 묶은 머리가 좋아서 좋아했던건데,머리스타일 바꾼걸 좋아해야하나.....?사야하나......???,,https://arca.live/b/counterside/40321023,2021-12-14 12:33:05,34,0,0
40321015,flawless,문혁없는 중국은 어떤곳일까,쩌뚱이는 사실 한국과 일본을 사랑한게 아닐까,"[{'user': '상자새끼', 'comment': '중국을 부순다...오로지 그 생각뿐이었다...'}, {'user': 'Rhidelz', 'comment': '문화대혁명으로 공자 무덤 파헤치고 자금성도 중국 2인자가 막아서 그렇지 파괴될 뻔했는데 뭐ㅋㅋ'}]",https://arca.live/b/counterside/40321015,2021-12-14 12:32:56,32,0,2
40321014,유나사랑해#74442742,가장 한국적인 문화,하시발 치킨먹고싶네,"[{'user': '카챈용계정', 'comment': '실례지만 양념치킨하나만 사주십쇼'}, {'user': '도라에몽#87462610', 'comment': '한식 양념치킨'}, {'user': '보지#81425240', 'comment': '치킨카운터'}]",https://arca.live/b/counterside/40321014,2021-12-14 12:32:55,63,1,3
40321011,1q2w3,사실 일본이든 한국이든,최종까지 올라가면 대부분 중국 영향이 아니었을까 싶긴 함지금은 짱깨니까 지들 꺼라고 주장하는건 좆까라 하고,"[{'user': '엘빅이', 'comment': '그건 당연한거지 지금의 유럽문화도 근간은 지금은 좆된 그리스랑 강대국의 최소라 불리는 이탈리아 좆물들인데'}, {'user': '1q2w3', 'comment': '최대이자 마지막 아웃풋 로마'}]",https://arca.live/b/counterside/40321011,2021-12-14 12:32:54,29,0,2
40321009,엘빅이,그래도 다들 한복 좋아하시죠?,https://arca.live/b/counterside/40081632개추 100개넘게 받았으니 그런거 같음,"[{'user': 'moonu', 'comment': '(emoticon)'}, {'user': '라익스가드#56229398', 'comment': '꼴리잖아'}]",https://arca.live/b/counterside/40321009,2021-12-14 12:32:53,58,-2,2
40320997,상점누나가좋아#52539577,한류는 그래도 성공했음, K국에서 한류가 국뽕에 좀 뭔가 아니다 싶은데 일본 중국에서 벤치마킹하고 있음   국가 주도로 하니까 망하고 기업들보고 하라니까 잘안되는데 힌국에서 기업주도에 정부가 보조 맞춰줘서 성공하니까 연구중임,,https://arca.live/b/counterside/40320997,2021-12-14 12:32:43,17,0,0
40320972,내알아한다고,수능 끝났다고 하는 게임이 너무 많음,카사 에픽 붕괴 원신던파 메이플 클저친구들 롤하자면 롤까지ㅋㅋ,"[{'user': '아카라이브아카녹화엌ㅋㅋ', 'comment': '부자노?'}, {'user': '내알아한다고', 'comment': '던은 무좆금중임 붕괴 원신도 찍먹중이라 무좆금이고'}, {'user': 'Artcore', 'comment': '(emoticon)'}, {'user': '독호메', 'comment': '수능쳤다고 인생 놨노'}, {'user': '내알아한다고', 'comment': '(emoticon)'}, {'user': 'KaWori', 'comment': '(emoticon)'}]",https://arca.live/b/counterside/40320972,2021-12-14 12:32:21,80,0,6
40320966,뷰룻,카사의 한국적 요소,한국적인 k 운영,,https://arca.live/b/counterside/40320966,2021-12-14 12:32:16,36,0,0
40320952,시니즈,한국의 고유한 문화,통베충 릴리,,https://arca.live/b/counterside/40320952,2021-12-14 12:32:05,21,0,0
40320940,극한의가능충,이거 무슨 관계냐,에리어스 스킬 훈련 대사에 에잇 이라고 적힌거 누르면 여기로 넘어가던데 무슨 관계임,"[{'user': 'ㅇㅇ#37159935', 'comment': '개병신같은 네덕 잼민이들'}, {'user': '극한의가능충', 'comment': '?'}, {'user': '미니스트라', 'comment': '성우가 같다는거겠지'}, {'user': '헤비흡연충', 'comment': '보통 이해 안가는 리다이렉트는 성우개그임'}, {'user': '아내', 'comment': '쟤가 에잇거리면서 플레이어 캐릭터들 괴롭힘'}, {'user': '극한의가능충', 'comment': '(emoticon)'}, {'user': 'temprun', 'comment': '아무 관계 없다'}]",https://arca.live/b/counterside/40320940,2021-12-14 12:31:57,82,0,7
40320926,KIRAREKI,한국적인 캐릭터 나올게 뭐가 있나...,한복은 뭐 전통 강조할거면 기본이니까 넘어가고무기는 환도 국궁 말고는 생각 딱히 안나고...캐릭컨셉은 구미호 정도만 생각나네내 머리에선 별로 안나온다 나올만한거 뭐가있지,"[{'user': '팔도', 'comment': '무당'}, {'user': 'KIRAREKI', 'comment': '오'}, {'user': '응애슌', 'comment': '캡틴 이순신'}, {'user': 'KIRAREKI', 'comment': '엌ㅋㅋㅋㅋ'}, {'user': 'ㅇㅇ#37093991', 'comment': '활 쏘는 지나가던 선비'}, {'user': 'KIRAREKI', 'comment': '경 읊어서 버프주나'}, {'user': 'ㅇㅇ#37093991', 'comment': '과거 보러 가는데 길막으면 호랑이건 이무기건 다 쏴죽임'}]",https://arca.live/b/counterside/40320926,2021-12-14 12:31:45,65,0,7
40320923,풍기문란위원회,왜갑자기 국뽕챈됨ㅋㅋㅋㅋㅋ,ㅇㄴㅋㅋ,"[{'user': '00000#82591124', 'comment': '모든커뮤니티 쿨타임'}]",https://arca.live/b/counterside/40320923,2021-12-14 12:31:41,43,1,1
40320922,응애슌,한국적인거는 전통문화는 힘들지,우리나라 전통문화는 무 보다는 문이 주류라 엔터테인먼트에서 쓸 캐빨요소가 적은거 같음. 차라리 지금 인기있는 현대문화를 넣는게 좋을것 같음.예를 들자면.. 뭐 이번에 유명해진 달고나라든가? 그런게 잏지않을까?,,https://arca.live/b/counterside/40320922,2021-12-14 12:31:39,32,0,0
40320907,Rhidelz,수능 봤었을땐,필수한국사 만점에 사탐 역사과목 만점이었는데 지금은 공부 안해서 긴가민가함그래도 그 지식으로 떡밥에 참여할 수 있네,,https://arca.live/b/counterside/40320907,2021-12-14 12:31:22,35,0,0
40320884,오조오벅번째카붕#17295083,과거로 국뽕 부릴 수 있는 나라는 몇없음,이정도는 되야지,"[{'user': '유나사랑해#74442742', 'comment': '쟤넨 고대문명 끝판왕이잖아요'}, {'user': 'Arya#51802422', 'comment': '저 동낸 걍 오픈문 아니냐 들어가면 따먹던데'}, {'user': '꿀때지', 'comment': '(emoticon)'}, {'user': '도라에몽#87462610', 'comment': '너무 과거인데 ㅋㅋ아'}, {'user': 'Rhidelz', 'comment': '쟤네 나일강때문에 허구한 날 두들겨 맞던 동네인데'}, {'user': '닉넴물음표못넣는거실화냐#48013268', 'comment': '틀딱문화를 들고오네'}, {'user': 'lemonade', 'comment': '과거가 유희왕이라 ㅆㄱㄴ'}]",https://arca.live/b/counterside/40320884,2021-12-14 12:31:03,115,0,7
40320844,ㅂㅇㅇ#40033130,K-메스가키,드라코도 많이 사랑해줘,"[{'user': 'Rococo', 'comment': '어데 드씹니까?'}, {'user': '독호메', 'comment': '프론트베이니까 전만 드씨 종손'}, {'user': '독호메', 'comment': '전만 드씨는 ㅇㅈ이지'}, {'user': '밀리에밀리', 'comment': '스캐빈저 본거지로 데리고 가서 마구마구'}, {'user': '팔도', 'comment': '(emoticon)'}, {'user': '알파버지니스', 'comment': '자위하시오 유서애 내이름 쓰고'}, {'user': '블루아카이브', 'comment': '(emoticon)'}]",https://arca.live/b/counterside/40320844,2021-12-14 12:30:23,134,4,7
40320841,미니스트라,사실 뭘 내놔도 고유의 뭔가라하기엔 좀..,딱 눈에 보이는 순간 아! 이건 한국꺼야!이렇게 되는게 이상적인건데대부분 중국? 일본? 하다가 아 한국꺼~하니까..,"[{'user': 'dwsss', 'comment': '사실 그런게 있어도 짱깨들이 지네꺼라고 함ㅋㅋ'}, {'user': '도라에몽#87462610', 'comment': '한중일 다 서로 영향 받던 나라들이라 좀 그런건 잇ㅅ지'}]",https://arca.live/b/counterside/40320841,2021-12-14 12:30:22,59,0,2
40320839,꿀때지,"""진짜"" 한국적인거.jpg",,"[{'user': 'KIRAREKI', 'comment': '짤 이왜진?'}, {'user': '밀리에밀리', 'comment': '이거 메에스가키네요'}]",https://arca.live/b/counterside/40320839,2021-12-14 12:30:22,116,3,2
40320808,건전한닉네임123,온천스킨 잘나와봤자 사기 애매하네,피오네는 장난감으로도 못쓰고에리어스는 레이싱 있고로비엔 오로치 세워야하니,,https://arca.live/b/counterside/40320808,2021-12-14 12:30:01,48,0,0
40320790,"ㅇㅇ, 121.133",가은이 그대로 컷으면 진짜 창녀루트밖에없지않냐,장님이라 돈도 포주가 다 가져가서 노예로 부릴듯..,"[{'user': '꿀때지', 'comment': '(emoticon)'}, {'user': '보지#81425240', 'comment': '장님임?'}, {'user': 'ㅇㅇ, 58.229', 'comment': '장남이였는데 어릴때 관리자가 고쳐줌'}, {'user': 'ㅇㅇ, 58.229', 'comment': '장님'}, {'user': '밀리에밀리', 'comment': '(emoticon)'}]",https://arca.live/b/counterside/40320790,2021-12-14 12:29:41,84,2,5
40320785,극한의가능충,에리어스 병약 미소녀였구나,꼴리네,,https://arca.live/b/counterside/40320785,2021-12-14 12:29:32,55,0,0
40320780,dwsss,애들이 한국적인 거 찾는건,뭐 국뽕을 바라고 그런게 아니라금상이 아직 국내를 버리지 않았다고 용서할 수 있는 증거를 찾고 있는게 아닐까...?,"[{'user': '1q2w3', 'comment': '그런거보단 떡밥에 한 숟가락 올린거'}]",https://arca.live/b/counterside/40320780,2021-12-14 12:29:28,55,0,1
40320363,꿀때지,가으니도 한국인이니까 쓰다듬어조....,,"[{'user': '보노본호', 'comment': '외노자련'}, {'user': 'Arya#51802422', 'comment': '(emoticon)'}, {'user': '킹헤일로', 'comment': '그로니아 창녀'}]",https://arca.live/b/counterside/40320363,2021-12-14 12:22:36,22,-1,3
40320350,1q2w3,사실 성균관유생들의 나날에서 멋있어보이는건,얼굴에 개연성이 있어서인거 같긴해,,https://arca.live/b/counterside/40320350,2021-12-14 12:22:18,32,0,0
40320346,킹헤일로,의외로 한국적인 애니,통베충 죠죠,"[{'user': '블루아카이브', 'comment': '(emoticon)'}, {'user': '밀리에밀리', 'comment': '어떻게 강아지 이름이 이기 ㅋㅋ'}, {'user': 'ㅇㅇ, 121.185', 'comment': 'ㅋㅋㅋㅋㅋㅋ협력해 줘야겠다 이기야는 ㅋㅋ 꿀밤한번 씨게 놔주고싶네 ㅋㅋ'}, {'user': '유나사랑해#74442742', 'comment': '어둠의 노사모'}, {'user': '하루한캔데자와#77832622', 'comment': '개이름이 어떻게 이거 ㅋㅋㅋ'}]",https://arca.live/b/counterside/40320346,2021-12-14 12:22:12,43,3,4
40320342,Such,업뎃 왜 나만 안뜸?,겜 접으라는건가? 아 ㅇㅋ,,https://arca.live/b/counterside/40320342,2021-12-14 12:22:10,14,0,0
40320340,copo#63984080,전에 말했던 대놓고 노린 스킨이 이번건가?,아 쉑기가 괜히 그런소리해서 기대햇더니 심심해지네,"[{'user': '하고싶다', 'comment': '노린 거 치고는 가릴 거 다 가려서 아쉽'}]",https://arca.live/b/counterside/40320340,2021-12-14 12:22:08,12,0,1
