index,user,title,content,comment,link,date,view,rate,comment_count
41903375,꿀때지,와 씨 주차장에 이게뭐야 ,발로 죽차버릴라 하다가그럼 치울사람만 힘들어져서 걍 지나갓음웃긴건 물은 얼어잇음고문인가?걍 주차장 칸 하나 가운데 넣어놧더라 어쩌라는건지,"[{'user': 'Ozymandias', 'comment': '너 먹으라고 내놨네'}, {'user': '밀리에밀리', 'comment': '충격과 공포의 현장'}, {'user': '중국몽죄인', 'comment': '거따 타이레놀 넣어놔야지'}, {'user': 'djdojo', 'comment': '대충 알약분쇄기사서 타이레놀을 가루약처럼 곱게 갈아버린다음\n저위에 솔솔 뿌려주면 알아서 털바퀴가 사라짐'}, {'user': '비질란테', 'comment': '차 주차하는 칸에 넣어놨다고?'}, {'user': 'ㅇㅇ#49517918', 'comment': '이제 저 위에 차 세우면 좆냥이가 저거 쳐먹으러 기어들어갔다가 어? 차 좀 따땃한가보네?하고 차속으로 쳐 들어가서 부릉부릉할때 갈려 뒤지는거임'}, {'user': '벤자민', 'comment': '걍 버려버리지 진짜 개민폐임 씨발련들'}, {'user': 'ㅇㅇ#83721190', 'comment': '저거 사료 걍 버리면 안됨?'}, {'user': '꿀때지', 'comment': '(emoticon)'}]",https://arca.live/b/counterside/41903375,2022-01-06 15:37:09,73,0,9
41903373,벤자민,신규 오퍼 언제 나오냐,신규오퍼는 그냥 찍어 내면 되는거 아닌가? 신캐 안낼꺼면 오퍼라도 좀 내지?,,https://arca.live/b/counterside/41903373,2022-01-06 15:37:06,8,0,0
41903324,통키#78092969,각등이 각종 pve에서도 많이 쓰던데 이제 1티어임??,융핵 박는거 어떻게 생각함?????,"[{'user': '던붕이', 'comment': '나쁘지않지 딜은 보장되니까'}, {'user': '닉변이야', 'comment': '(emoticon)'}, {'user': '비질란테', 'comment': '후회없는 선택'}, {'user': '물룽이', 'comment': '성능캐임'}, {'user': '리라크엘', 'comment': '걍 뭔일이 있은 융핵 최우선은 각성이라고 생각함. 이지수 제외'}, {'user': '헥토르', 'comment': '딜은 출시때부터 보장이 되어 있고 \n이번 밸패는 부족했던 생존성을 어느정도 보완해준거라 이제 진짜 국밥 맞음\n특정 기믹 아니면 출격해도 될껄?'}]",https://arca.live/b/counterside/41903324,2022-01-06 15:36:09,57,0,6
41903321,던붕이,사실 부담안갈 정도로만 지르는게 제일 좋긴하지,내가 -던-할땐 좀 생각없이 질러서 꽤 썼는데 카사는 그래도 생각하면서 지르는중임...,"[{'user': 'Ozymandias', 'comment': '-던-'}, {'user': '정실부인은이수연', 'comment': '닉값'}]",https://arca.live/b/counterside/41903321,2022-01-06 15:36:07,51,0,2
41903320,닉변이야,나도 낚시덱이나 해야지,페도가 낚이는덱,,https://arca.live/b/counterside/41903320,2022-01-06 15:36:05,31,2,0
41903315,금은동태,근데 사실,본편에서 메스가키짓 한 적 없음,,https://arca.live/b/counterside/41903315,2022-01-06 15:36:01,11,0,0
41903299,한남대장뿡뿡뿡#36176673,뭔가를 지를떄는 생각하고 지르면 안됨,딱 적금 붓고 예상외 비용 저축하고 생활비 남기고 남은거 과금 통장에 넣고 생각없이 지르는거임캐시맨도 그래서 설치 안 함 설치하면 자괴감듬,"[{'user': 'Ozymandias', 'comment': '주식이네'}]",https://arca.live/b/counterside/41903299,2022-01-06 15:35:43,25,0,1
41903251,Vergil,글고보면 카사 월정액은 좀 비싸지,얼마더라 합치면 2만 얼마였나 암 생각없이 다 지르는데,"[{'user': 'kimjino#87804663', 'comment': '16,000+5,900=21,900'}, {'user': '밀리에밀리', 'comment': '6000원짜리가 18일짜리니까 사실상 10000원이지'}, {'user': 'kimjino#87804663', 'comment': '거의 두번사야되긴함'}, {'user': '무야홍어', 'comment': '비싼건가?'}, {'user': '한남대장뿡뿡뿡#36176673', 'comment': '게임 월정액치고는 비싼거 맞음'}, {'user': '무야홍어', 'comment': '결국은돈값하냐가중요한거라..\n\n돈값하니까 문제가없음'}, {'user': '한남대장뿡뿡뿡#36176673', 'comment': '아니 물어보셔놓고 답정너 선언하시면'}, {'user': 'ㅇㅇ#49517918', 'comment': '돈마블 마블 무슨겜은 월정액만 75만이라는데 비싼가?'}, {'user': 'Ozymandias', 'comment': '어후'}, {'user': 'Vergil', 'comment': '그건 ㄹㅇ 존나 특이하게 많은거니 뭐... 얼마나 하겠어 그걸 다'}, {'user': 'ham_human', 'comment': '타 겜과 비교를 하면 한도 끝도 없음. 그런식으로 가다보면 리니지에 비하면- 되버림\n2만원 가량 든다고 했을 때 실제로 얻을 수 있는 이득+만족도+이 돈으로 할 수 있는 기회비용을 생각해야지'}, {'user': '닉변이야', 'comment': '예전에 하던겜 월정액 4만원돈 하던거 생각하면 그럭저럭 ㄱㅊ한듯'}]",https://arca.live/b/counterside/41903251,2022-01-06 15:35:01,117,0,12
41903165,헥토르,근데 진입이 어떻든 부분유료화 왜 하는건지 알긴할거 같음,내가 예전부터 즐기던 인디게임사였던 P팀이 스팀에서 패키지 게임 2개 내서 다음 작도 스팀에서 파는 패키지 게임인줄 알았는데다음작이 스토리에서 가장 큰 뼈대를 구축할거라 꾸준한 업데이트와 퀄리티를 보장하기 위해 패키지게임 포기하고 부분유료화로 전환한거 보면확실히 요즘은 부분유료화 없으면 목표치만큼 벌리지가 않나봄,"[{'user': '밀리에밀리', 'comment': '비교가 안됨 걍'}, {'user': 'Ozymandias', 'comment': '부분유료화,, 와우,, 정기구독,,'}, {'user': '머스크암초가추천하는코인', 'comment': '규모를 키우려면 정기적인 수익원이 필요하긴 하지'}]",https://arca.live/b/counterside/41903165,2022-01-06 15:33:32,85,0,3
41903119,클러스트,난 저럴까봐 출석 안하고 기부만함 ㅋㅋㅋ,,"[{'user': 'kimjino#87804663', 'comment': '(emoticon)'}, {'user': '삭제예정', 'comment': '(emoticon)'}]",https://arca.live/b/counterside/41903119,2022-01-06 15:32:37,99,2,2
41903090,잉딩,마망단은 잘 들어라,앞으로 마망은 퀸마망이다카나데마망까진 봐줌,"[{'user': '닉변이야', 'comment': '케이시마망'}, {'user': '잉딩', 'comment': '(emoticon)'}, {'user': 'Ozymandias', 'comment': '건쉽이 아니야?..'}, {'user': '잉딩', 'comment': '(emoticon)'}, {'user': '클러스트', 'comment': '미야 ㅇㄷ'}, {'user': '잉딩', 'comment': '그건 마망이 아니야'}, {'user': '중국몽죄인', 'comment': '(emoticon)'}, {'user': '클러스트', 'comment': '(emoticon)'}, {'user': '잉딩', 'comment': '(emoticon)'}, {'user': '중국몽죄인', 'comment': '(emoticon)'}, {'user': 'ㅇㅇ#65299563', 'comment': '(emoticon)'}, {'user': '잉딩', 'comment': '(emoticon)'}, {'user': '마싯는감자칩', 'comment': '(emoticon)'}, {'user': '잉딩', 'comment': '(emoticon)'}, {'user': '하례아', 'comment': '쟤 때문에 기채 천장에 가까워진게 연속 3번인데 퀸 마망 아님'}, {'user': '하례아', 'comment': '(emoticon)'}, {'user': '잉딩', 'comment': '그럼 좆집으로 써'}, {'user': '고오급물티슈#98293471', 'comment': '수연이 ㅇㄷ?'}, {'user': '잉딩', 'comment': '(emoticon)'}, {'user': 'djdojo', 'comment': '솔직히 이정도면 마망 맞음'}, {'user': '잉딩', 'comment': '솔직히 이정도면 마망 맞음'}, {'user': 'djdojo', 'comment': '(emoticon)'}, {'user': 'djdojo', 'comment': '솔직히 이정도면 마망 맞음'}, {'user': 'djdojo', 'comment': '(emoticon)'}, {'user': '금태링다메다메', 'comment': '(emoticon)'}, {'user': '잉딩', 'comment': '(emoticon)'}, {'user': '스트로베리샤베트', 'comment': '스카이마망'}, {'user': '잉딩', 'comment': '(emoticon)'}]",https://arca.live/b/counterside/41903090,2022-01-06 15:32:06,136,4,28
41903071,병투vs오니짱,대마인 카운터 추가 쫌,ㄹㅇ,,https://arca.live/b/counterside/41903071,2022-01-06 15:31:54,2,0,0
41903066,김리본,난 과금효율 안따짐,과금 액수 = 그만큼의 행복/만족감이거만 성립하면 효율 딱히 안 따지고 지르는편임그래서 요즘 일섭에만 지르는중임 ㅋㅋ,,https://arca.live/b/counterside/41903066,2022-01-06 15:31:48,10,1,0
41903053,DButton,저거 나도 써먹어야겠다,공헌도 높은 컨소원부터 일단 물색해야지,,https://arca.live/b/counterside/41903053,2022-01-06 15:31:40,7,0,0
41903044,유나사랑해#74442742,모야 얘 여기서부터 언급됬었네,울지않은너를위해에서 처음 언급된줄,,https://arca.live/b/counterside/41903044,2022-01-06 15:31:34,10,0,0
41903021,ㅐㄴ,그래도 쿼츠 기채권 없어질 걱정은 없네,나는 오늘 본섭 키면서 설마 쿼츠 기채권 없나 걱정했음그말은 곧 한섭에서도 없어질 수 있다는 말이니까그런데 쿼츠 기채권 있는거 보고 안심했음ㅋㅋ,"[{'user': '물룽이', 'comment': '그거 이제와서 없어지면 섭종급임'}]",https://arca.live/b/counterside/41903021,2022-01-06 15:31:11,18,0,1
41903004,하례아,라우라 재무장하면 타오린 급임?,솜뭉치가 그렇게 아프다던데한번 재무장 도전해보니까 다른것도 끌리네,"[{'user': 'ㅇㅇ#94801077', 'comment': '아니요'}, {'user': '한남대장뿡뿡뿡#36176673', 'comment': '그건 아님'}, {'user': '갓똥겜', 'comment': '성능좋은 호위무사'}]",https://arca.live/b/counterside/41903004,2022-01-06 15:30:45,33,0,3
41902971,초특가가챠다,뉴비 침식체 구분법,챌린지 끝까지 3별 올클 했는지 물어보면됨나는 안하니깐 뉴비임 ㄹㅇㅋㅋ,"[{'user': '미나링', 'comment': '침식체'}, {'user': '초특가가챠다', 'comment': '(emoticon)'}, {'user': 'Ozymandias', 'comment': '못한다= 뉴비\n안한다= 침식체'}, {'user': '초특가가챠다', 'comment': '(emoticon)'}, {'user': 'kimjino#87804663', 'comment': '나도4-5까지왓고 중간중간마다 3별도없으니 뉴비임 수구'}, {'user': '초특가가챠다', 'comment': '(emoticon)'}, {'user': '류드남친', 'comment': '(emoticon)'}, {'user': '초특가가챠다', 'comment': '(emoticon)'}]",https://arca.live/b/counterside/41902971,2022-01-06 15:30:19,40,0,8
41902953,ㅈㅇㅈㅎ#19865107,전략전덱 걍 풀파워로 잠궈야지,열어놓은새끼가 한놈도없네,"[{'user': '닉변이야', 'comment': '살려줘'}, {'user': '갓똥겜', 'comment': '그래도 다 뚫림 수구'}]",https://arca.live/b/counterside/41902953,2022-01-06 15:30:00,38,-5,2
41902924,리라크엘,걍 기채도 한번 비틱하면 꽤 쌓이긴 해,매주 구입하는 기채 패키지랑 여기저기서 주는게 많아서,,https://arca.live/b/counterside/41902924,2022-01-06 15:29:29,24,0,0
41902905,갓똥겜,라우라 좀 껄리네,허벅지 쌉 지리네배뷰지도 지리는데 벅지가 섹스다 섹스,"[{'user': 'ㅇㅇ#83721190', 'comment': 'ㄹㅇㅋㅋㅋ 시발마녀 재무장 해준다고 채용권 다 거덜남'}, {'user': '갓똥겜', 'comment': '(emoticon)'}]",https://arca.live/b/counterside/41902905,2022-01-06 15:29:13,29,0,2
41902900,ham_human,그래서 난 갠적으로 과금효율이나 말 나올 때마다,"다른 겜은 어떻다고 비교하면서 충분히 괜찮다, 창렬이다 말하는데폰겜보다 콘솔/패키지 겜을 더 많이 하는 입장에서 좀 어질어질 함.저녁 간단하게 먹으려고 배달앱을 켰는데 신사동, 청담동 같은 곳에서 켜서 모든 음식점들이 기본 김밥 한 줄에 2만원 3만원 하는 걸 보는 기분이랄까","[{'user': '밀리에밀리', 'comment': '폰겜하면 뇌구조가 망가짐 ㄹㅇ'}]",https://arca.live/b/counterside/41902900,2022-01-06 15:29:10,32,0,1
41902885,엿이나처무라#99513101,카사 여캐들이 윙크를 하는 이유,양한솔을 꼬시기 위해 유혹의 윙크를 한다,"[{'user': '닉변이야', 'comment': '(emoticon)'}, {'user': '엿이나처무라#99513101', 'comment': '(emoticon)'}, {'user': 'kimjino#87804663', 'comment': '(emoticon)'}, {'user': '엿이나처무라#99513101', 'comment': '(emoticon)'}, {'user': 'djdojo', 'comment': '(emoticon)'}, {'user': '숲토끼', 'comment': '(emoticon)'}, {'user': '엿이나처무라#99513101', 'comment': '(emoticon)'}, {'user': '숲토끼', 'comment': '(emoticon)'}, {'user': '숲토끼', 'comment': '(emoticon)'}, {'user': '별빛하늘', 'comment': '(emoticon)'}, {'user': '초특가가챠다', 'comment': '(emoticon)'}]",https://arca.live/b/counterside/41902885,2022-01-06 15:28:56,60,1,10
41902879,꿀때지,근데 콘솔게임 가격들 물가상승에 비해서 좀 낮다는 감은잇음 ,"패키지게임 산지 오래된사람들은 대충 패키지게임 가격 5만? 정도 생각할텐데그게 몇년전 가격임 지금 슬금슬금 올라서 6~7만 함 근데 물가상승이나 인건비 같은거 고려하면 게임업계에선 7만이상은 받아야된다고 말하더라물론 게임 소프트웨어는 한번 만들어놓으면 그 파일을 줄창 팔면서 돈복사가 가능하기떄문에일반적인 공산품과는 좀 달라서 가격인상폭이 그렇게 극적이지 않은듯그래도 좀 더 벌고싶은지 dlc 장사, 스킨장사 같은거도 많고요즘은 풀프라이스 패키지겜도 인앱결제 같은거 달려잇음 ㅋㅋ","[{'user': '시니즈', 'comment': '작년애 건담겜 스팀에서 사는데 왤케 비싸졌지 생각 들긴 하더라ㅋㅋ'}, {'user': '헥토르', 'comment': '요즘 패키지게임도 부분유료화 당연히 들고 나오더라'}, {'user': '밀리에밀리', 'comment': '패키지게임은 조금 더 받아도 된다고 생각함 반대로 모바일게임은 좀 칼질해야돼고'}, {'user': '중국몽죄인', 'comment': '유비새끼덜 고리와랜부터 인앱결제 오지게 넣어둬서 개빡침'}]",https://arca.live/b/counterside/41902879,2022-01-06 15:28:46,45,0,3
41902855,EDF,백합 컨소원들에게,"방금전에 런한 컨소장임한동안 해외섭, 일섭 때문이라고 이해하려고 했는데일섭오픈 해놓고, 1월에 당당히 없뎃 선언은 못버티겠다.이놈들 챌린지, 장비파밍, 재무장 위주로 갈 생각인거 같은데장비파밍이랑 성의없는 재무장은 관심없고사실 그 2개 안하면 인게임 재화는 남아서매일 들어가서 뭐하는 짓인가 싶더라카바할까 업데이트 있는 날만 잠깐씩 들어갈까 고민중인데컨소장이 미접 며칠씩 떠있으면 다들 도망갈까봐컨소는 바로 나왔음전 컨소장이 1주년쯤에 갑자기 나한태 넘기고 카바해버려서어떻게 해야하나 고민이 많았었는데알아서 잘 굴러가는 컨소덕에 지금까지 남아있었던거 같음컨소장은 저번처럼 공헌도 제일 높은 사람에게 넘김","[{'user': '미나링', 'comment': '(emoticon)'}, {'user': 'ㅇㅇ#81020245', 'comment': '(emoticon)'}, {'user': '숲토끼', 'comment': '(emoticon)'}, {'user': '헥토르', 'comment': '(emoticon)'}, {'user': '쇠고기육포캔', 'comment': '(emoticon)'}, {'user': 'kimjino#87804663', 'comment': '(emoticon)'}, {'user': 'Ozymandias', 'comment': '컨소장이 도망친다!!! 잡아!!'}, {'user': '한남대장뿡뿡뿡#36176673', 'comment': '(emoticon)'}, {'user': 'djdojo', 'comment': '어어.. 금태야 기니피그가 또 탈주한다\n안막냐?!'}, {'user': '상점누나가좋아#52539577', 'comment': '(emoticon)'}, {'user': '닉변이야', 'comment': '고생많았다'}, {'user': '카린웡', 'comment': '(emoticon)'}]",https://arca.live/b/counterside/41902855,2022-01-06 15:27:58,135,25,11
41902854,병투vs오니짱,유이라는 이름 들어가면 다 이쁜 미소녀노,ㄹㅇ,"[{'user': '김리본', 'comment': '히이로 유이'}, {'user': 'ㅇㅇ#81020245', 'comment': '(emoticon)'}, {'user': 'ㅇㅇ#81020245', 'comment': '(emoticon)'}, {'user': '병투vs오니짱', 'comment': '(emoticon)'}, {'user': '류드남친', 'comment': '첫번째는 어디의 어떤유이임'}, {'user': '병투vs오니짱', 'comment': '투러브'}, {'user': '우선도낮은컨텐츠#59699096', 'comment': '유이건'}]",https://arca.live/b/counterside/41902854,2022-01-06 15:27:57,59,0,6
41902849,헥토르,근데 정액제해도 부분유료화는 그대로일거같은데,오히려 진입장벽만 더 높아질거같음,"[{'user': '마싯는감자칩', 'comment': '이미 많은 온라인 게임 시장이 무료 다운 + 부분 유료화가 국룰이다 보니 어쩔수 없는듯.\n괜히 배그도 무료로 바뀌는게 아님, 그냥 시대가 그럼\n그나마 지금 가장 이상적으로 서비스 하는게 파판14인거 같음'}]",https://arca.live/b/counterside/41902849,2022-01-06 15:27:52,30,1,1
41902835,djdojo,부분유료화>유료겜,이젠 유료겜이 부분유료화겜에 비해 훨씬 더 가성비가 뛰어나게 바뀌어졌어..,,https://arca.live/b/counterside/41902835,2022-01-06 15:27:38,16,0,0
41902828,김리본,나 없이 너는 행복한건지~,혹시 나만 아픈건 아닌지~우리 사랑했던 시간만큼만 힘들면 널 잊을련지~,,https://arca.live/b/counterside/41902828,2022-01-06 15:27:33,12,0,0
41902827,비질란테,니트 새로 산거 와서 입어봤는데,ㅈㄴ 왤케 따가움;;셔츠나 반팔티 레이어드 해서 입어야겠노,"[{'user': '김리본', 'comment': '니트는 안에 무조건 뭐랑 같이 입어야댐'}, {'user': 'ㅇㅇ#83721190', 'comment': '설마 그걸 안에 런닝도 안 입고 입음?'}, {'user': '비질란테', 'comment': '니트 자체를 첨 입어봄\n난 후드랑 맨투맨만 자주입어서'}]",https://arca.live/b/counterside/41902827,2022-01-06 15:27:32,19,0,2
41902817,시니즈,ㄹㅇ 드라코는 가짜같음,몰?루 무츠키 진짜 게꼴리더라..겜은 안해봤는대 망가나 일러가 그것을 증명..,"[{'user': '밀리에밀리', 'comment': '(emoticon)'}, {'user': '류드남친', 'comment': '얘 좀 꼴림..'}, {'user': '시니즈', 'comment': '얘 좀 꼴림..'}, {'user': '김리본', 'comment': '(emoticon)'}, {'user': '비질란테', 'comment': '(emoticon)'}, {'user': '렘딘', 'comment': '(emoticon)'}]",https://arca.live/b/counterside/41902817,2022-01-06 15:27:19,57,1,6
41902816,소월이,재무장 재화는 그 해고말고 데이터 전송실 그걸로 얻는거 맞지?,클래스 별이던건 통합된거 같은데 그래도 창렬같아 보이는건 왜지,"[{'user': 'ㅇㅁㅇ#97291063', 'comment': '데이터 전송실 맞움'}]",https://arca.live/b/counterside/41902816,2022-01-06 15:27:18,12,0,1
41902812,Ozymandias,뉴비 침식체 구분법@@@@,"쪼렙 업적(전당1,5챕,머기업 퀘등) 스샷 찍고 고수라함 = 뉴비스샷 안 찍고 자칭 고수라 함 = 침식체본인 뉴비라고 지칭하면서 육성 과정 질문 없음 = 침식체","[{'user': '닉변이야', 'comment': '응애 나 아가카붕쿤'}, {'user': 'Ozymandias', 'comment': '이런 새끼특) 씹고인물'}, {'user': '닉변이야', 'comment': '다이브 50층도 못깨는 고인물이 어딨어'}, {'user': 'Ozymandias', 'comment': '깰수 있는데 억지로 안 깨면서 응애 ㅇㅈㄹ'}, {'user': '닉변이야', 'comment': '깰수 있는데 억지로 안 깨면서 응애 ㅇㅈㄹ'}, {'user': 'Ozymandias', 'comment': '깰수 있는데 억지로 안 깨면서 응애 ㅇㅈㄹ'}, {'user': '닉변이야', 'comment': '이프리트는 인정'}, {'user': 'Ozymandias', 'comment': '이프리트는 인정'}, {'user': '하례아', 'comment': '몰?루'}, {'user': 'Ozymandias', 'comment': '우욱 침식파'}]",https://arca.live/b/counterside/41902812,2022-01-06 15:27:13,55,0,10
41902796,정실부인은이수연,근데 모바일 패키지가 더 혜자 아니냐,물가는 계속 오르는데 1트럭 가격은 몇년째 그대로 자너,"[{'user': 'djdojo', 'comment': '(emoticon)'}, {'user': '정실부인은이수연', 'comment': '(emoticon)'}]",https://arca.live/b/counterside/41902796,2022-01-06 15:27:06,31,0,2
41902752,ㅇㅇ#83721190,내 캐릭터 옷은 윗옷 하나에 20장인데,내 윗옷은 10장은 커녕 5장도 음....좀 비싸네.....하면서 사는 쿠소세상임 ㄹㅇㅋㅋㅋㅋ,"[{'user': '마싯는감자칩', 'comment': '(emoticon)'}, {'user': 'ㅇㅇ#83721190', 'comment': '(emoticon)'}, {'user': 'AllesKlar', 'comment': '내 윗옷 : 안꼴림\n캐릭터 윗옷 : 꼴림'}, {'user': 'ㅇㅇ#83721190', 'comment': '아ㅋㅋㅋㅋㅋ'}, {'user': '닉변이야', 'comment': '(emoticon)'}, {'user': 'kimjino#87804663', 'comment': '나는 옷도 4장이나5장만살거같음싼걸로 ㅋㅋ'}, {'user': 'ㅇㅇ#83721190', 'comment': '솔직히 현실 옷 4~5장이면 ㅆㅅㅌㅊ지ㅋㅋㅋ'}, {'user': 'kimjino#87804663', 'comment': '나도 2년전에자취하고느낀건 쌓아두지말자해서 옷도 그정도만입을거같음ㅋㅋ'}]",https://arca.live/b/counterside/41902752,2022-01-06 15:26:02,52,0,8
41902747,클러스트,부분유료화가 제일 악질이야,,,https://arca.live/b/counterside/41902747,2022-01-06 15:25:56,30,1,0
41902745,한펭,금전감각 이상하면 어떰 ㅋㅋ,배경에 오로치보고 생각해봐슴.. ,"[{'user': '밀리에밀리', 'comment': '생?각'}, {'user': '한펭', 'comment': '(emoticon)'}, {'user': 'ㅇㅇ#83721190', 'comment': '오로치는 어쩔수없지...'}, {'user': '한펭', 'comment': '맞지맞지..'}]",https://arca.live/b/counterside/41902745,2022-01-06 15:25:55,61,0,4
41902732,닉변이야,이런거 로비하던때가 있었지,,"[{'user': 'CY7989', 'comment': '(emoticon)'}, {'user': 'kimjino#87804663', 'comment': '(emoticon)'}, {'user': 'AllesKlar', 'comment': '(emoticon)'}, {'user': '닉변이야', 'comment': '(emoticon)'}, {'user': '비질란테', 'comment': '(emoticon)'}]",https://arca.live/b/counterside/41902732,2022-01-06 15:25:31,62,3,5
41902720,Vergil,과금을 멈추면 행복해져,가질 수 없기에 아름다운 것도 있대,"[{'user': 'djdojo', 'comment': '-by 실좃-'}]",https://arca.live/b/counterside/41902720,2022-01-06 15:25:22,26,0,0
41902716,모닝빵우유,아 ㅋㅋ 나 오전에 개뻘짓 했네,외장하드 1테라 짜리 다 차서 4테라 산거 오늘 왔길래 아무 생각없이 마이그레이션 해서 옮겼는데포맷은 생각 안하고 옮겨서 데이터는 다 옮겼는데 mbr포맷이 덮어써져서 4테라짜리 외장하드에 2테라밖에 인식을 못함 ㅋㅋmbr2gpt로 어케 변환해볼랬는데 자꾸 에러나길래 걍 다시 포맷하고 gpt로 바꾼다음에 파일 하나하나 옮기는중..,,https://arca.live/b/counterside/41902716,2022-01-06 15:25:18,14,0,0
41902703,Badfinger,카사 메스가키 시급,,"[{'user': 'AllesKlar', 'comment': '(emoticon)'}, {'user': '밀리에밀리', 'comment': '드라코 센쵸 있자나'}, {'user': 'Badfinger', 'comment': '노꼴임 대사가'}, {'user': 'ㅇㅇ#81020245', 'comment': '(emoticon)'}]",https://arca.live/b/counterside/41902703,2022-01-06 15:25:09,62,0,4
41902695,마싯는감자칩,요즘 콘솔겜들도 굳이 좋은 가격 같지는 않음 ,"대충 보통 패키지가 8만원 정도에 사면 버그는 거의 무조건 딸려오고나중에 Dlc도 따로 사야하고코스튬도 대부분 별로도 구매, 그것도 몇만원임 ","[{'user': '꿀때지', 'comment': '(emoticon)'}, {'user': '한남대장뿡뿡뿡#36176673', 'comment': '도대체 무슨 게임 하는거냐'}, {'user': '한남대장뿡뿡뿡#36176673', 'comment': '혹시 코드 베인이나 크라이스타같은 이상한 게임만 골라서 함?'}, {'user': '마싯는감자칩', 'comment': '왜 진짜야'}, {'user': '한남대장뿡뿡뿡#36176673', 'comment': '왜 진짜야'}, {'user': '마싯는감자칩', 'comment': '예전에 데가 할때도 dlc에 코스튬 매번 사다보면 돈 존나 나갔음'}, {'user': '한남대장뿡뿡뿡#36176673', 'comment': '데가는 온라인 게임이지 콘솔겜으로 안침'}, {'user': '쇠고기육포캔', 'comment': '사이버버그 생각하면 ㅂㄷㅂㄷ하지'}, {'user': '마싯는감자칩', 'comment': '사펑은 그래도 난 그냥 할만했음, 상점에서 뭘 더 사라고 한것도 아니고'}]",https://arca.live/b/counterside/41902695,2022-01-06 15:24:59,66,0,9
41902691,비질란테,모바일겜하면서 금전감각 박살났다는 글 많네,난 월정액충이라 잘 몰?루겠어요,"[{'user': '중국몽죄인', 'comment': '(emoticon)'}]",https://arca.live/b/counterside/41902691,2022-01-06 15:24:57,44,0,1
41902643,ㅇㅅㅇ#75844449,과거의 나는 뭔 생각이였냐,카사 접었다가 어제 자기 전에 다 다운하고 오늘 지하철에서 켰더니 시발 하필 이거냐 옆 사람은 핸드폰해서 못 봤다고 해도 앞에 사람은 봤을거 같은데하필 화면 밝기도 밝아서 잘보이고 지랄일단 내리는 역이라 내렸는데 개같다 진짜,"[{'user': '삭제예정', 'comment': '(emoticon)'}, {'user': 'kimjino#87804663', 'comment': '(emoticon)'}, {'user': 'ㅇㅇ#49517918', 'comment': '섹-스'}, {'user': '중국몽죄인', 'comment': '(emoticon)'}, {'user': 'ㅇㅇ#81020245', 'comment': '(emoticon)'}, {'user': '초특가가챠다', 'comment': '(emoticon)'}, {'user': '밀리에밀리', 'comment': '뒤에서 다가오는 카붕이의 손길'}, {'user': '스트로베리샤베트', 'comment': '앞사람도 카붕이라서 흐뭇해했을거임'}, {'user': 'Lb', 'comment': '지하철에서 카사를 켜는 게 잘못됐다고는 생각하지 못 하는'}, {'user': '비질란테', 'comment': '???:어머 자기야 저 사람 좀 봐바, 저런걸 어떻게 지하철에서 하지?'}, {'user': '갓똥겜', 'comment': '(emoticon)'}, {'user': '하례아', 'comment': '겜 좀해'}, {'user': '촤드', 'comment': '(emoticon)'}, {'user': '각성김철수', 'comment': '(emoticon)'}, {'user': '소닉', 'comment': '터치도 해주지그랬어'}]",https://arca.live/b/counterside/41902643,2022-01-06 15:23:59,203,16,15
