index,user,title,content,comment,link,date,view,rate,comment_count
41884530,알파퀸,근데 A급 카운터라고 넘사벽은 아닌가봐,"작중에서 카운터의 등급을 측정하는 기준이CRF(현실개변력=카운터의 이능력 수치)인데이 수치가 카운터로서 전투력에 가장 직관적인연관성이 있다고는 하지만 카운터로서CRF가 낮아도 개인의 무예 수준이나 경험 등으로월등히 높은 수준을 이루는 경우가 있는데대표적인게 D급따리지만 검술 경지가 높아고등급 카운터도 상대할 수 있는 나나하라 치후유가 있음반면 CRF가 아예 없어도 고등급 카운터를상대할 수 있는데 카운터가 아닌 전투요원중고등급 카운터를 제압한 전적이 있는건대표적으로 베로니카가 있음(vs드라코)카운터가 일반인과 가장 크게 차별화되는게CRF를 통한 현실개변=이능력을 다룬다는것과등급차에 따라 다르지만 고등급의 경우신체능력 강화나 강력한 방어막 등을 두르는 등일반인이 흉내 낼 수 없는 수준의 방호력을갖추게 되는것인데 이 수준이 A급 카운터기준으로 보면 그리 압도적인건 아닌가싶은경우가 종종 나옴가령 앞에 언급한 드라코 전도 베로니카가드라코 압도하는 묘사로 나오고(베로니카는 평온한 상태지만 드라코는당황하며 물러섬)이유미는 RPG에 직격당하고나서 부상과 기절로전투불능이 됨검은 평의회 정회원이신 성냥팔이 선생은바로 옆에서 대량의 폭탄이 터졌는데도옷 좀 타고 상처 좀 입고 마는 수준이었지만이거야 대비하고 방어막 전개한걸수도 있고,하여튼 카운터 등급이 높아도 단순 피지컬에선여전히 현대의 보편적인 병기나 총 등은카운터에게도 어느정도 유효한가 봄강소영이 이유미를 방패삼아 총 막는것처러일반적인 총으로는 고등급 카운터에게 유효타넣기 힘들겠지만 고화력 폭탄같은건 충분히먹히는거같다역시 이능물에서 이능력자들은공격력이 훨 뛰어나지 방어력이 뛰어난 경우는거의 없는 듯각성 힐데도 3종 침식체가 입에 물고 우물우물씹으면 걸레짝 될지도 모른다 이말이야","[{'user': '제이크', 'comment': '그러고보니깐 S급이라고 오피셜로 뜬건 이수연 뿐인가'}, {'user': 'TerminalVelocity', 'comment': '우리가 스토리가 이레귤러\n천국인건 감안 해야 하지만'}]",https://arca.live/b/counterside/41884530,2022-01-06 09:42:47,52,0,1
41884508,비질란테,이거 외전2 갈아엎어야 되는거 아니냐ㅋㅋㄲ,앞으로 스토리에서 적지 않게 등장할텐데그때마다 와! 용병 학살자! 이러고 있으면 모양세가 안좋은데,,https://arca.live/b/counterside/41884508,2022-01-06 09:42:18,6,0,0
41884494,동성회직계69대회장아스나,얼른 샤오린 재무장 시키고싶다,그래가지고 건틀렛에서 나 6연패 시킨 그녀석한테 복수하지,,https://arca.live/b/counterside/41884494,2022-01-06 09:41:47,6,0,0
41884366,ㅇㅇ#99402221,념글 19보고싶다,밖이라 참는다...,"[{'user': '숲토끼', 'comment': '(emoticon)'}, {'user': 'kimjino#87804663', 'comment': '(emoticon)'}, {'user': '콸#63912321', 'comment': '상남자특)그런거 신경 안쓰고 그냥 봄'}, {'user': 'ㅇㅇ#99402221', 'comment': '(emoticon)'}]",https://arca.live/b/counterside/41884366,2022-01-06 09:38:06,66,0,4
41884344,샤라링,제이크는 악당이 맞다,용병들의 눈물이 바로 그 증거,"[{'user': 'kimjino#87804663', 'comment': '짤 너무귀엽누'}, {'user': '제이크', 'comment': '?ㅋ'}]",https://arca.live/b/counterside/41884344,2022-01-06 09:37:31,40,0,2
41884309,ㅇㅇ#99402221,제이크가 악역일리가 없는이유,원본이 악역일수없는 캐릭이라서,,https://arca.live/b/counterside/41884309,2022-01-06 09:36:47,33,0,0
41884245,여린,라우라 픽업해,,,https://arca.live/b/counterside/41884245,2022-01-06 09:34:35,12,0,0
41884181,시니즈,재무장1렙이랑 각성1렙이랑 같이키우는데 렙차 2-30나네ㅋㅋ,"쳐도른겜,,,진자 너무하는고아닌가,,","[{'user': 'kimjino#87804663', 'comment': '(emoticon)'}, {'user': '한남대장뿡뿡뿡#36176673', 'comment': '(emoticon)'}]",https://arca.live/b/counterside/41884181,2022-01-06 09:32:43,29,0,2
41884166,비질란테,카붕이들의 노예가 된 미나 vs,,"[{'user': '이리스유마', 'comment': '둘다 행복함'}, {'user': 'ㅇㅇ#98211038', 'comment': '전자가 내가 행복하니 전자 ㄱㄱ'}, {'user': '한남대장뿡뿡뿡#36176673', 'comment': '시윤이 퇴근 기다리면서 저녁 준비하는 미나'}]",https://arca.live/b/counterside/41884166,2022-01-06 09:32:22,46,1,3
41884144,Clink,드디어 얻었다,일룡인 감격이야,"[{'user': 'ㅇㅇ#87218383', 'comment': '(emoticon)'}, {'user': 'Clink', 'comment': '(emoticon)'}, {'user': 'kimjino#87804663', 'comment': '나도이제 3일차인데 언제다하누ㅋㅋ'}, {'user': 'Clink', 'comment': '솔직히 개극혐인데 어떻게든 꾸역꾸역했다'}, {'user': 'kimjino#87804663', 'comment': '나왠지 저거중간에 잊어먹어서 다못할가능성높은데 ㅋㅋ'}]",https://arca.live/b/counterside/41884144,2022-01-06 09:31:41,44,0,5
41883938,ㅇo,솔덱 은신으로 빈집털이오니까 답이 없네,각우 없다고 무시하는거 같아서 기분 나쁨,"[{'user': 'kimjino#87804663', 'comment': '세리나로 개같이멸망 ㅋㅋ'}, {'user': '굽네바사삭', 'comment': '알렉스로 커버 안되려나?'}, {'user': 'Cowshoesfrozen', 'comment': '솔이 누구임? 솔베드가이말하는거같진않은데 맞나?'}]",https://arca.live/b/counterside/41883938,2022-01-06 09:24:36,51,0,3
41883882,보노본호,댕시 달리는 콘 존나 하찮은 미물같아서 웃김,하찮은 미물=카붕이그러니까 댕시는 카붕이같다는소리임,"[{'user': '제이크', 'comment': '(emoticon)'}, {'user': '보노본호', 'comment': '(emoticon)'}, {'user': '블루아카이브', 'comment': '(emoticon)'}, {'user': '블루아카이브', 'comment': '(emoticon)'}, {'user': 'temprun', 'comment': '(emoticon)'}, {'user': '블루아카이브', 'comment': '(emoticon)'}, {'user': '여린', 'comment': '(emoticon)'}, {'user': '굽네바사삭', 'comment': '(emoticon)'}]",https://arca.live/b/counterside/41883882,2022-01-06 09:22:58,74,-1,8
41883859,ㅇo,"""니가와""",,,https://arca.live/b/counterside/41883859,2022-01-06 09:22:18,10,0,0
41883812,별빛하늘,카사 복귀하고 이틀 동안 그림판으로 그린것들,그림 그리는 법을 몰라서선 따는 법이랑 그런거 어제 처음 보고 그린게 마지막이셈 아무튼 내 목표가 그림 그리는거 더 배워서타이탄까지만 그리고 런 때릴거야,"[{'user': 'Haeseun', 'comment': '(emoticon)'}]",https://arca.live/b/counterside/41883812,2022-01-06 09:20:31,31,2,1
41883742,제이크,와 이 씹련들 공방 제작칸 위치는 왜 바꿈?,그냥 쒸부랄 눈 뜨고 코 베일 뻔햇네 ㄹㅇ,"[{'user': '이리스유마', 'comment': '왜 2개임?'}, {'user': '제이크', 'comment': '1개면 충분한데 예에엣날에 자다 깨서 두들기다 한번 잘못 열어서'}, {'user': '이리스유마', 'comment': '(emoticon)'}, {'user': '제이크', 'comment': '(emoticon)'}, {'user': 'kimjino#87804663', 'comment': '몇일전에 어떤사람 잘못열고 념글로가버림ㅋㅋ'}, {'user': '제이크', 'comment': '난 여태 바뀐 줄도 모르고 있었노'}]",https://arca.live/b/counterside/41883742,2022-01-06 09:18:04,67,0,5
41883739,동성회직계69대회장아스나,근데 전장 세트효과도 랜덤임?,난 지금까지 고정인줄,"[{'user': 'kimjino#87804663', 'comment': '랜덤임ㅋㅋ'}]",https://arca.live/b/counterside/41883739,2022-01-06 09:17:59,33,0,1
41883598,새벽비,씹숍새끼때문에 기어코 이걸 뽑네,씨발 아깝다,"[{'user': 'kimjino#87804663', 'comment': '(emoticon)'}, {'user': 'temprun', 'comment': '(emoticon)'}]",https://arca.live/b/counterside/41883598,2022-01-06 09:12:35,34,0,2
41883588,극한의가능충,노예(대학원생)는 왜 하는거임,안하면 안되나,"[{'user': '새벽비', 'comment': '찰나의 실수'}, {'user': '극한의가능충', 'comment': '바로 고거엿노'}, {'user': '새벽비', 'comment': '가스라이팅'}, {'user': '클린유저', 'comment': '(emoticon)'}]",https://arca.live/b/counterside/41883588,2022-01-06 09:12:16,37,0,4
41883581,동성회직계69대회장아스나,얼버기,오늘도 달려!,,https://arca.live/b/counterside/41883581,2022-01-06 09:12:07,11,0,0
41883462,시니즈,각성솔저 출시 언제해,내 안의 메이즈스충이 울고있어,"[{'user': 'kimjino#87804663', 'comment': '그게밀리아엿다고함 수구'}, {'user': '숲토끼', 'comment': '(emoticon)'}]",https://arca.live/b/counterside/41883462,2022-01-06 09:07:58,17,0,2
41883297,병투vs오니짱,리코리스 언니 추가 쫌,개꼴리는 붉은 생머리  ,,https://arca.live/b/counterside/41883297,2022-01-06 09:01:48,20,0,0
41883291,제이크,카사에서 허락한 유일한 마약,그림자 전당 첩첩작전x3 캬캬,,https://arca.live/b/counterside/41883291,2022-01-06 09:01:26,19,0,0
41883254,허다,빠른스충,더욱 빠른 배신,"[{'user': 'kimjino#87804663', 'comment': '내가 배신하겠다~'}, {'user': '숲토끼', 'comment': '(emoticon)'}, {'user': '카늒네', 'comment': '(emoticon)'}]",https://arca.live/b/counterside/41883254,2022-01-06 08:59:41,37,0,3
41883175,베베파우,전장 비틱무기,캡틴카운터사이드 방패.,"[{'user': 'kimjino#87804663', 'comment': '(emoticon)'}, {'user': '숲토끼', 'comment': '(emoticon)'}, {'user': '숲토끼', 'comment': '(emoticon)'}, {'user': '찹쌀콩찰떡', 'comment': '(emoticon)'}, {'user': '홍삼', 'comment': '점마 웨 T7노,,,?'}, {'user': '리벳', 'comment': '핵탄두 못막잖아'}, {'user': '클린유저', 'comment': '(emoticon)'}]",https://arca.live/b/counterside/41883175,2022-01-06 08:56:48,61,2,6
41883142,상점누나가좋아#52539577,상점누나 언제 pv 나옴,카사최고 미인 상점누나 pv내달라,,https://arca.live/b/counterside/41883142,2022-01-06 08:55:05,12,0,0
41883137,Sato,뉴비 질문받아주세양!,이름바로왼쪽에 원 안에 숫자는 뭔 뜻이죠???예를들면 윗짤 라이노 글자왼쪽 원안의 5,"[{'user': 'Konzept', 'comment': '코스트'}, {'user': 'Sato', 'comment': '(emoticon)'}]",https://arca.live/b/counterside/41883137,2022-01-06 08:54:52,13,0,2
41883114,dwsss,rpg 게임에서,하루종일 업적작이나 이상한 아이템만 모으는 아저씨 있었는데처음에 이상한 괴짜같아서 말 안걸었음.그런데 나중에 보니까 씹고인물이더라.,,https://arca.live/b/counterside/41883114,2022-01-06 08:53:37,16,0,0
41883083,ㅇㅇ#98211038,메스충 쓰는 솔저잇음?,죄다 특수기 없던데..,"[{'user': 'kimjino#87804663', 'comment': '존메이스 보스스봉걸때말곤거의없는듯'}, {'user': 'ㅇㅇ#98211038', 'comment': 'ㅇㅋㅇㅋ'}, {'user': '화선', 'comment': '밀리아'}, {'user': 'ㅇㅇ#98211038', 'comment': '공불전장인데수...'}, {'user': '유나사랑해#74442742', 'comment': 'zx스마트가이xz'}, {'user': 'TLCrow', 'comment': '아이언사이드'}, {'user': 'ㅇㅇ#98211038', 'comment': 'ㄷ ㄷ ㄷ'}, {'user': 'Irosis', 'comment': '존메'}]",https://arca.live/b/counterside/41883083,2022-01-06 08:52:16,48,0,8
41883027,보노본호,얼리버드 출근,씨발,,https://arca.live/b/counterside/41883027,2022-01-06 08:49:42,0,0,0
41883015,ㅇㅇ#52172593,ㅋㅋ 난 전장 첫트에 바로 종결템 먹음,그건 바로 스충 조호진 전장이야!!!!!,,https://arca.live/b/counterside/41883015,2022-01-06 08:49:24,6,1,0
41882982,새벽비,와 무지성 스작해주다보니 조졌네 ㅋㅋㅋㅋ,정보 없어서 컨소에소 명예로 2000개 삼 ㅋㅋㅋㅋㅋㅋㅋ,"[{'user': 'kimjino#87804663', 'comment': '(emoticon)'}]",https://arca.live/b/counterside/41882982,2022-01-06 08:47:45,26,1,1
41882977,dwsss,내가 아는 게임 플레이 정보들 출처,이전에 비슷한 좆망겜에서 얻은 경험 15%튜토리얼 5%직접 삽질 5%커뮤니티에서 마망 젖빨고 싶다 이지랄하는 새끼의 댓글  75%,"[{'user': '새벽비', 'comment': 'ㅋㅋㅋㅋㅋㅋㅋㅋㅋㅋㅋㅋㅋㅋㅋㅋㅋㅋㅋㅋㅋㅋㅋㅋㅋㅋㅋㅋㅋㅋㅋ'}, {'user': '블루아카이브', 'comment': '(emoticon)'}]",https://arca.live/b/counterside/41882977,2022-01-06 08:47:26,25,1,2
41882933,광고보고옴#42714269,이정도면 50위권 삽가능이냐?,30위권은 밀릴꺼같고 50위 안정권이겠지 아 ㅋㅋ,"[{'user': '벤자민', 'comment': '아슬아슬함 밀릴수도 있음'}, {'user': '광고보고옴#42714269', 'comment': '(emoticon)'}, {'user': '클린유저', 'comment': '아직 4일 남아서 무조건 밀림 ㅋㅋ\n3일전 50위였는데 100위 밖으로 팅긴 적도 있음'}, {'user': '광고보고옴#42714269', 'comment': '(emoticon)'}, {'user': 'ㅇㅇ#87218383', 'comment': '(emoticon)'}, {'user': '새벽비', 'comment': '이거보고 죽이러간다'}]",https://arca.live/b/counterside/41882933,2022-01-06 08:44:39,68,0,6
41882900,블루아카이브,저는 재무장 도둑이에요,가진 재화를 전부 내놓으세요,,https://arca.live/b/counterside/41882900,2022-01-06 08:42:53,3,0,0
41882851,잉딩,나도 전장 비틱 오지게한거 하나 있긴함,아주 빠른 천안문,"[{'user': '레드라이더', 'comment': '(emoticon)'}, {'user': 'kimjino#87804663', 'comment': '(emoticon)'}]",https://arca.live/b/counterside/41882851,2022-01-06 08:41:06,22,0,2
41882810,새벽비,근대 너희들 SSR말고 안쓰는 SR이랑 R N 들도 스작해줌?,역시 안해주지???,"[{'user': '글리스터', 'comment': '안해쥼'}, {'user': '리벳', 'comment': '게임오래하다보면 모든캐릭터 다 하게 되더라'}, {'user': '시니즈', 'comment': '업받거나 격전업받거나 이벤트에 스킬렙업있을때만'}, {'user': 'kimjino#87804663', 'comment': '오래하게되면 다하게됨ㅋㅋ'}, {'user': '잉딩', 'comment': '재무장 전엔 다 해줬음'}, {'user': '뱅레이', 'comment': '박현수 같은애들 해줄 필요 없어서 안함 필요해지는순간 그냥 그때그때 하면대니까'}, {'user': '백합덕후#78782383', 'comment': '쓰는 애들 있어서 하는데'}, {'user': '백합덕후#78782383', 'comment': '탱커나 힐러진이라던가 구관리국 그리고 항공부대는 했었지'}]",https://arca.live/b/counterside/41882810,2022-01-06 08:39:39,47,0,8
41882800,낮은사람,근데 전장 셋옵 이게 정상이냐 ㄹㅇ......,셋바 ㅈㄴ 쳐바른 샤오린꺼랑 상시파밍가능한 하운드꺼 빼고 모든 전장셋옵이 다 구데기야ㄹㅇ 모든 전장이...,"[{'user': 'kimjino#87804663', 'comment': '나도그렇게나옴'}, {'user': '레드라이더', 'comment': '뭔 유효옵이 샤오린하나뿐이노'}, {'user': '낮은사람', 'comment': '그나머도 필요해서 셋바 ㅈㄴ 쳐바른거'}, {'user': '리벳', 'comment': '정상'}, {'user': '백합덕후#78782383', 'comment': '정상이지ㄹㅇ\n샤오린에게 꼴아박은 셋바도 장난 아닌데 치명피로 타협함ㅋㅋ'}]",https://arca.live/b/counterside/41882800,2022-01-06 08:39:26,44,0,5
41882783,레드라이더,일섭 기채 모르는 애들도 많음,"어제도 유튜브 하꼬방송인이 카사하면서  건틀렛 플래도전 이러길래 한시간정도 보다가간신히 플래찍고 존나 기뻐하면서 내일 힐데도 뽑겠음 이러면서 쿼츠랑 파란채용권 모아놓은걸로 이정도면 천장도 무과금쌉가능 이러면서 도야가오하던데 ㅋㅋㅋ누가 그래서 그걸로 못뽑음 이러면서 기채랑 주화에대해 설명함그래서 내가 카운터패스로 기채 몇장받은거 있으니 창고가보셈이라고 했더니창고열었더니 20장있음""이거 20연가능하다는거?"" 이러길래""ㄴㄴ 그게 1회분임www""딱 이런느낌 ㅋㅋㅋㅋㅋㅋㅋㅋㅋㅋㅋ4.5만엔이 천장이에양 이러니까아 좀 비싸네 그래도 페그오보단 싼데 이러면서 좀 떠들다 방종했음채팅 분위기도 모르는 애들 꽤 있었으니까 의외로 쇼크받을지도? ㅋㅋㅋ","[{'user': 'kimjino#87804663', 'comment': '기채는 까보면앎'}, {'user': '카늒네', 'comment': '(emoticon)'}, {'user': '백합덕후#78782383', 'comment': '근데 솔직히 나도 뉴비때 이런것 1도 겜에서 설명안해줌.\n그나마 여긴 커뮤니티에서 배우지 막 신생인 거기서 알리도 없고'}, {'user': '액션쾌감', 'comment': '일섭에 각힐 나옴?'}]",https://arca.live/b/counterside/41882783,2022-01-06 08:38:25,60,1,4
41882776,새벽비,따흑흑 거렁뱅이 됬다,SSR들 전부 스작해주니까 절반으로 줄어듬 ㅋㅋㅋㅋ,"[{'user': '카늒네', 'comment': '기만인가요'}, {'user': '카늒네', 'comment': '(emoticon)'}]",https://arca.live/b/counterside/41882776,2022-01-06 08:38:05,28,2,2
41882758,리벳,라우라 5장을 어느세월에 뽑아,재무장 찢어버리기로 결심했다,"[{'user': 'kimjino#87804663', 'comment': '(emoticon)'}]",https://arca.live/b/counterside/41882758,2022-01-06 08:37:06,28,0,1
41882722,낮은사람,카운터사이드 왤케 좆망겜이야?,이게 말이 되나?,"[{'user': 'ㅇㅇ#25829526', 'comment': '저거 빼고 다 비틱했구나'}, {'user': '낮은사람', 'comment': 'ㅅㅂ다른거도 올려줘?'}, {'user': '홍삼', 'comment': '(emoticon)'}]",https://arca.live/b/counterside/41882722,2022-01-06 08:35:20,20,0,3
41882720,컨섹,정보 5만 넘게잇엇는데 머지 ,버근가?,"[{'user': 'kimjino#87804663', 'comment': '(emoticon)'}, {'user': '잉딩', 'comment': '좆무장이 재화 다 털어간다~~~~'}]",https://arca.live/b/counterside/41882720,2022-01-06 08:35:17,12,0,2
41882711,잉딩,크래딧챌 너무 행복해,,"[{'user': '뱅레이', 'comment': '카사가 크레딧 떔에 이렇게 피똥싸게 될줄은 몰랏는데'}, {'user': '잉딩', 'comment': '맨날 몇억씩 모아놨었는데 시발..'}]",https://arca.live/b/counterside/41882711,2022-01-06 08:34:57,13,0,2
41882692,ㅇㅇ#81720027,이제 각성함선 가챠뽑기로 나옴,옛날에는 함선 가챠였다는 새빨간 거짓말을 들었어구라좀 적당히 ㅋㅋㅋ아무리 금상이 불족발이어도 함선을 가챠질로 냈겠냐,"[{'user': '레드라이더', 'comment': '(emoticon)'}]",https://arca.live/b/counterside/41882692,2022-01-06 08:33:36,22,1,1
41882685,폴리네시아,아침부터 달려!,,"[{'user': '블루아카이브', 'comment': '(emoticon)'}, {'user': 'kimjino#87804663', 'comment': '(emoticon)'}]",https://arca.live/b/counterside/41882685,2022-01-06 08:33:09,21,0,2
41882670,홍삼,섻스,,"[{'user': '컨섹', 'comment': '(emoticon)'}]",https://arca.live/b/counterside/41882670,2022-01-06 08:32:23,16,0,1
41882666,레드라이더,문득 든 생각인데 얘네 혹시 각성함선 이런건안내겠지?,아무리그래도 그런 미친짓은 안할거야,"[{'user': '컨섹', 'comment': '이미 몰루코핀마타 3대 각성함선인데'}, {'user': '레드라이더', 'comment': '(emoticon)'}, {'user': '뱅레이', 'comment': '각성 오퍼나 재무장 오퍼가 먼저 나올듯'}, {'user': '레드라이더', 'comment': '(emoticon)'}, {'user': 'ㅇㅇ#81720027', 'comment': '각성함선 가챠뽑기 나옴 ㅅㄱ'}, {'user': '레드라이더', 'comment': '(emoticon)'}, {'user': '잉딩', 'comment': '블루브릿지 타입:길티기어\n\n솔3마리 밀리아3마리 이노3마리 나옴'}, {'user': '레드라이더', 'comment': '(emoticon)'}, {'user': '블루아카이브', 'comment': '함선 재무장각이다'}, {'user': '레드라이더', 'comment': '시발 재무장 ㅋㅋㅋㅋㅋㅋㅋㅋㅋㅋ'}, {'user': '삭제예정', 'comment': '(emoticon)'}, {'user': '레드라이더', 'comment': '(emoticon)'}]",https://arca.live/b/counterside/41882666,2022-01-06 08:32:05,56,0,12
41882665,ㅇㅇ#81720027,용병을 왜이렇게 미워함,그럼 군대가 시민을 안전하게 지키는 사회를 만들던가명치가 뻥라이트닝 익스큐션이 울컥울컥,"[{'user': '콸#63912321', 'comment': '(emoticon)'}]",https://arca.live/b/counterside/41882665,2022-01-06 08:32:02,17,1,1
41882637,ㅇㅇ#81720027,다들 왜이렇게 제이크 조와함,게이게이야,"[{'user': '잉딩', 'comment': '(emoticon)'}, {'user': '삭제예정', 'comment': '(emoticon)'}]",https://arca.live/b/counterside/41882637,2022-01-06 08:30:45,31,0,2
41882608,새벽비,이젠 진짜 고인물된거 체감되네,"""넘쳐나다""","[{'user': '컨섹', 'comment': '난 빨책 2천개 잇던거 하루아침에 털렷는데 뭐노'}, {'user': '잉딩', 'comment': '실례가 안된다면 빨책좀 나눠주십쇼'}, {'user': 'MBT', 'comment': '개쌉고인물이네 나보다 두배는 많노'}]",https://arca.live/b/counterside/41882608,2022-01-06 08:28:59,17,0,3
41882574,으으,에이미 진짜 머리아프긴 하네,각호쓸땐 그냥 강소영으로 머리돌리면 크게위험한줄 몰랐는데 퀸이나 캐오린 드니까 그냥함선에 박아둔거 맵중앙까지 끌어와서썰어버리는데 시발 부들부들 떨린다,"[{'user': '컨섹', 'comment': '걍 에이미 내성 이빠이 잇는덱 하면 편함'}]",https://arca.live/b/counterside/41882574,2022-01-06 08:27:15,24,0,1
41882570,ㅇㅇ#25829526,흑역사 어서오고,한달에 50개도 안팔리는 IP는 넥슨 주요타이틀이 아닙니다,"[{'user': '삭제예정', 'comment': '(emoticon)'}, {'user': '컨섹', 'comment': 'ㅋㅋㅋ 짤렷네'}, {'user': 'kimjino#87804663', 'comment': '(emoticon)'}]",https://arca.live/b/counterside/41882570,2022-01-06 08:27:08,31,1,3
41882513,잉딩,누비 방금 레벨업함,6레벨 달성,"[{'user': '뱅레이', 'comment': '보지잇나요'}, {'user': '잉딩', 'comment': '(emoticon)'}, {'user': '글리스터', 'comment': '(emoticon)'}, {'user': '잉딩', 'comment': '(emoticon)'}, {'user': '카늒네', 'comment': '괘씸하거든요'}, {'user': '잉딩', 'comment': '(emoticon)'}, {'user': '홍삼', 'comment': '(emoticon)'}, {'user': '잉딩', 'comment': '(emoticon)'}]",https://arca.live/b/counterside/41882513,2022-01-06 08:25:02,51,0,8
41882476,글리스터,쓰알들만 재무장 해준건데 재화 개빨림,태포 맹글겠다고 팬드 가챠 돌리다 천장까지 침스알은 다 어떻게 하지,,https://arca.live/b/counterside/41882476,2022-01-06 08:22:48,3,0,0
41882471,컨섹,근데 솔직히 용병 좆같은거 맞음 ,니네 말야 니네 시발,,https://arca.live/b/counterside/41882471,2022-01-06 08:22:31,10,0,0
41882378,학점대폭발,하림이 포켓몬스터 하는 느낌일듯,희귀하거나 귀여운 동물보면 능력으로 포켓몬 겟또다제 할 듯,"[{'user': 'Konzept', 'comment': '이건 곰이야 찢어'}, {'user': '밀리에밀리', 'comment': '야생의 카일 페도필리아가 나타났다!'}, {'user': '구관조리병', 'comment': '동물을 전자신호로 갈기갈기 분해'}, {'user': 'MBT', 'comment': '(emoticon)'}]",https://arca.live/b/counterside/41882378,2022-01-06 08:16:46,55,0,4
41882369,MBT,그야 미나링이 꼴리고 이쁘니까,솔직히 고백하면 나는 일러 바뀌기 전에도 처음부터 볼때 꼴렸음...,,https://arca.live/b/counterside/41882369,2022-01-06 08:16:14,5,0,0
41882363,홍삼,그러고보니 일섭 각힐채용관련 사전안내사항 하나도업내,"미래시본넘들이야 기채로 뽑는거 알고잇겟지만모르고잇는넘들이 훨씬 마나서 대부분 체용건이나 쿼츠로 뽑을수잇을거라 생각중일텐대이거 다이죠부,,??",,https://arca.live/b/counterside/41882363,2022-01-06 08:15:55,9,0,0
41882347,로하림,제이크 용병학살은 중간에 설정바뀐거일듯,적당히 괴물같은 느끼한 악역으로 설정했다가테라사이드 5부쯤에 상연이나 금태가 제이크를 민간인을 외부의 위헙으로부터 지키고 싶어하는 군인으로 바꾼거같아아니면 용병들의 추악한모습을 넣으려했는데 여러가지 문제로 못넣거나 토미와떨거지들 설명이면 충분한줄 알고 안넣었거나,,https://arca.live/b/counterside/41882347,2022-01-06 08:14:51,16,0,0
41882327,역시난,가끔 카챈 영광의 시절이 기억나긴 해,그 때는 매일 글젠 1등이여서아침마다 념글 한 페이지 새로 봤어야했는데,"[{'user': '베버', 'comment': '에이미때 그러긴 했지'}, {'user': '극한의가능충', 'comment': '이새끼 웃는데요?'}, {'user': '구관조리병', 'comment': '그래서 영광의 글리젠 1125를 재현 해드리겠습니다'}, {'user': '블루아카이브', 'comment': '계획중인게..'}, {'user': '로하림', 'comment': '좆무장때도 잠깐 한눈팔면 념글 한페이지가 쌓이긴했지'}]",https://arca.live/b/counterside/41882327,2022-01-06 08:13:13,38,0,5
41882317,밀르스,썩은물들 긴장해라,드디어 완성한 첫 메이즈셋 퀸이 간다,"[{'user': '광3', 'comment': '(emoticon)'}, {'user': '극한의가능충', 'comment': 'T7 메이즈 스충 ㅇㄷ'}, {'user': '밀르스', 'comment': '(emoticon)'}, {'user': '극한의가능충', 'comment': '(emoticon)'}]",https://arca.live/b/counterside/41882317,2022-01-06 08:12:30,31,0,4
41882283,밀리에밀리,얼버기상,2022년에는 바른생활카붕이가 될 것,"[{'user': '극한의가능충', 'comment': '바른생활을 하는 사람은 이딴 게임 안함 ㅅㄱ'}, {'user': '밀리에밀리', 'comment': '(emoticon)'}]",https://arca.live/b/counterside/41882283,2022-01-06 08:10:03,25,0,2
