index,user,title,content,comment,link,date,view,rate,comment_count
41935166,경구,일섭 의외로 나나하라 스토리 안 열어주네,일섭 접대용 에피소드라서금방 낼 줄 알았는데,,https://arca.live/b/counterside/41935166,2022-01-06 23:46:56,16,0,0
41935150,59XZa#80792176,와 얘네들은 이제 공지할때 이거 달아주네,귀하의 브라우저는 html5 video를 지원하지 않습니다.하나눈나ㅏㅏㅏㅏㅏ,"[{'user': '나도줘#28169842', 'comment': '(emoticon)'}, {'user': '눈꽃1', 'comment': '(emoticon)'}, {'user': 'ㅇㅇ#87218383', 'comment': '일섭은 이런거 좋아하네 블루아카도 일섭 트위터 이런식이었던 거 같던데'}]",https://arca.live/b/counterside/41935150,2022-01-06 23:46:43,32,0,3
41935121,결왕,여기 근데 카사챈이 아니라 스비챈임,스비 직원만 개추누르라고 하면 추천 50개 박힘,"[{'user': '눈꽃1', 'comment': '(emoticon)'}, {'user': '비질란테', 'comment': '사내 커뮤니티 ㄷㄷ'}]",https://arca.live/b/counterside/41935121,2022-01-06 23:46:19,41,3,2
41935112,소미맘#94263386,흠,흠 이걸 음.......,,https://arca.live/b/counterside/41935112,2022-01-06 23:46:13,11,0,0
41935100,MBT,라니 왜 건틀렛은 안돌리는거냐,빨리 3천점 온나매운맛 좀 보여야지,"[{'user': '블루아카이브', 'comment': '(emoticon)'}, {'user': 'ㅇㅇ#87218383', 'comment': '1월말에 친선 생기면 이제 라니와 친선 매칭 가능할듯 ㅋㅋ'}, {'user': 'MBT', 'comment': '라니 딱대라 ㅋㅋ'}, {'user': '잉딩', 'comment': '전력으로'}]",https://arca.live/b/counterside/41935100,2022-01-06 23:45:56,34,0,3
41935050,NaNi#52381415,제발 부탁인데 스비 직원들 있으면 좀 읽어봐라," 제발 부탁인데 무리하게 신규 컨텐츠 추가할 생각하지 말고 기존 컨텐츠 유지보수방향으로 업댓방향 틀어라 제발 좀. 진짜 장난안치고 재무장 재화를 지금 초전도 잡스충 파밍용 말고은 아무런 가치도 없어서 버려진 컨텐츠인 레이드에서 파밍이 가능하도록 설계만 했어도 재무장 사태 안났거든? 진짜 많이 봐줘서 니들이 처음에 내걸었던 그 좆같은 재화량도 이랬으면 애들이 폭발할 정도는 아니었을거다. 그러면서 씨발 재무장 재화를 넉넉하게 주는 가성비 패키지랑 SSR재무장 하나 만들 정도의 재화를 패키지를 주화로 팔았으면 우리도 기꺼이 지갑 벌렸을테니 수익이 기가막히게 났겠지? 그리고 지금 게임 자체가 여러번 대형 수술 거치면서 존나 온몸이 기형적으로 틀어져서 컨텐츠가 중구난방이라고. 이거 일섭에서도 뉴비가 낚일만한 함정이 너무 많다고 그러잖아. 이게 다 뭐겠니? 이게 니들이 벌인거야. 그러니까 수습은 해야지? 일단 기형적으로 꺾였던 내부 시스템부터 전부 일관성 있게 고치고 버려진 컨텐츠에 새 역할 부여해줘라 좀. 레이드는 돈 낭낭하게 주게 패치하고 지부 일반 다이브는 적성핵 같은 것도 주는 식으로 바꿔서 정보가치를 올려줌과 동시에 새로운 정보 파밍처를 만들어서 이터니움 사용처 분산을 시켜. 그런다음에 고효율 이터 패키지를 팔아봐 시발. 돈이 진짜 호박째로가 아니라 넝쿨째로 굴러들어올거다. 또, 제발 쿼츠 패키지를 좀 부활을 좀 시켜라 대체 왜 없앤거냐? 고효율 쿼츠 패키지를 자주 판매해서 비율 맞추겠다고? 그럼 물어보겠는데 한번에 거금 긁지 못하는 애들은 어쩌고? 그냥 달마다 쿼츠 월정액 긁어서 만족하던 애들은 뭐가되고? 니들이 그 패키지를 정말 자주 팔긴 하디? 니들이 언제 그걸 팔지 우리는 알 수는 있니? 언제 어떻게 팔지 예측이 전혀 안되는데 유저가 과연 그걸 기분좋게 받아들일까? 그것도 기존에 있던거를 뺏기면서까지 바뀐 건데? 이럴거면 그냥 월초 패키지에 3배 쿼츠도 추가를 시키던가 시발.뭐? 그래서 일일 2배 쿼츠 구매랑 주화 패키지 더 추가하지 않았냐고? 아니 씨발 유저가 그거 깨작 긁겠다고 매일매일 상점들어가서 그걸 사야되? 왜이렇게 불편하게 만든건데 어? 뭐 우리보고 이득보고 싶으면 우리 돈 주고 동전 주워가라는 말이랑 뭐가 다르냐? 그리고 재화의 간편화? 좋다 이거야. 근데 왜 씨발 소비자한테 선택지를 줬다 뺏냐? 선택지를 뺏아가는 짓 좀 하지마 제발. 유저한테 과금 유도하는거 보다 선택지를 뺏는게 더 유저들을 더 불쾌하게 만드는 영역이야. 제발 좀 우리말 좀 들어봐라 제발. 우리도 이 게임 좋아하는 사람들이라 니들이 돈을 더 버는게 좋지 덜 버는거 전혀 안좋아해. 니들이 번 돈으로 우리에게 제대로 재투자만 한다면 린저씨들 마냥 대가리 깨져서 뇌수 질질 흘리면서 지갑 열 사람들 수두룩하다고. 이제 곧 있으면 2주년일텐데 그걸로 사료 존나 뿌려대도 이렇게 게임 시스템이 중구난방이면 과연 유저들이 이 겜에 오래 정착할까? 미끼를 존나 뿌려대도 그물에 구멍이 숭숭 뚫려있는데 물고기가 잡히겠냐고. 또 1주년처럼 전부 놓치고 싶어? 제발 좀 바꿔라 제발요약)1.무리하게 신규컨텐츠 추가하지말고 기존의 쓰임새를 잃은 컨텐츠에게 역할을 주는 식으로 유지보수해라2.재무장 추가할 때 재무장 전용 재화 파밍처랑 함께 적절한 패키지를 같이 팔았으면 재무장사태 안났다.3. 쿼츠 월정액 부활시켜라, 아니면 하다못해 월초 패키지에 3배 쿼츠를 추가시키던가.4.우리는 아직까지도 카운터사이드를 사랑하는 유저들이다.","[{'user': 'ㅇㅇ, 121.179', 'comment': 'BM은 지들이 그렇게 밀고나가겠다는데 어쩌겠노 ㅋㅋ'}]",https://arca.live/b/counterside/41935050,2022-01-06 23:45:01,64,3,1
41935044,ㅇㅇ#34452657,애니 신작 보고옴,2000년대 감성 그림체 ㅋㅋㅋ,"[{'user': 'Tetra', 'comment': '먼 애니에요'}, {'user': 'ㅇㅇ#34452657', 'comment': '리아데일의 대지'}, {'user': '크리스피크림', 'comment': '왜 필러박스마저 그대로임'}, {'user': '여우불', 'comment': '벌써 1분기 애니가 나오네 세월빠르노'}]",https://arca.live/b/counterside/41935044,2022-01-06 23:44:51,58,0,4
41935017,,(권한 없음),,,,,0,0,0
41934931,크리스피크림,잠시 메카누함,깡통이 호라이즌 같이 쓰는거 너무 역겨워서 이세계 호라이즌 젖 빨고옴,"[{'user': '독호메', 'comment': '메카레지나'}, {'user': 'ㅇㅇ#87218383', 'comment': '역시 메카 맛집 라오야'}, {'user': 'ㅇㅇ#36099854', 'comment': '먼겜임?'}, {'user': '크리스피크림', 'comment': '라오'}, {'user': 'ㅇㅇ#36099854', 'comment': '(emoticon)'}, {'user': '비질란테', 'comment': '젖?'}, {'user': '크리스피크림', 'comment': 'ㅖㅏ'}, {'user': '비질란테', 'comment': '(emoticon)'}, {'user': '헥토르', 'comment': '레지나 메카버전 ㄷㄷ'}, {'user': '나도줘#28169842', 'comment': '1000일 티켓으로 글라시아스 받앗어야 하는데'}, {'user': '갓똥겜', 'comment': '오 ㅈㄴ 섹스하게 생겼노'}]",https://arca.live/b/counterside/41934931,2022-01-06 23:43:09,88,0,11
41934901,비질란테,근데 스비 분탕 때문에 분탕이 됐다는것도 ㅈㄴ 어이없는데,"카사가 ㅈ같아서 접은거면게임한테 지랄을 해야지 왜 같은 피해자인 우리를 조져연쇄 살인마한테 가족 살해당한 남성이다른 피해자 유가족 찾아가서 살해하면그새끼 미친놈이라고 부를거냐,불쌍한 사람이라 부를거냐","[{'user': '구관조리병', 'comment': '카사를 아직도 소비하는 카붕이들을 죽인다..!'}, {'user': 'Tetra', 'comment': '맞는말인거 같은데 왜 비추가 박히지;'}, {'user': '비질란테', 'comment': '예로부터 이유 없이 비추 박는 사람은 준내 많았다'}, {'user': '나도줘#28169842', 'comment': 'ㄹㅇㅋㅋ'}, {'user': '히어로람쥐', 'comment': '자기네들은 살인자를 죽이고 싶은데 우리가 옹호안해주니까 공범으로 생각하는거지 ㅋㅋ'}, {'user': '아루엘', 'comment': '인터넷상이니까 사람이 현실에서보다 얼마든지 과격해질 수 있어서 그런거 아닐가??? 누군지도 모르고 볼일도 없으니까, 내가 증오하는 게임을 아직도 한다고? 니네도 그냥 싹 죽어!!!! 하는거지'}, {'user': '비질란테', 'comment': '하나 확실한건 그새끼 정공일듯'}, {'user': 'Tetra', 'comment': '그건 사회적으로 봐도 정상참작이 안되는데…'}, {'user': 'ㅇㅇ#87218383', 'comment': '겜이 망해야 된다는 사람도 있었는데 사용자를 전부 고로시해버리면 목적 달성은 될듯'}, {'user': '비질란테', 'comment': '커뮤 폭파시키면 이주하면 그만 아닌가?\n아무리 생각해도 ㅈㄴ 의미 없고 비효율적인데'}, {'user': '카사뉴비임', 'comment': '분탕치면서 공감 못해주면 욕 쳐박는거 너무 역겨움'}]",https://arca.live/b/counterside/41934901,2022-01-06 23:42:35,143,3,10
41934899,copo#63984080,셋바 250모았는데,뭐에홀린듯 실비아전장에 다털림;,"[{'user': '카늒네', 'comment': '(emoticon)'}, {'user': '늒네#86893131', 'comment': '(emoticon)'}, {'user': 'k0909#54155798', 'comment': '(emoticon)'}]",https://arca.live/b/counterside/41934899,2022-01-06 23:42:34,31,0,3
41934880,새벽비,일섭도 라이노가 지배하나보네,쟤들도 라루썬의 기쁨늘 보면 좋겧다,"[{'user': 'ㅇㅇ#87218383', 'comment': '거긴 썬볼 없다던데'}, {'user': '새벽비', 'comment': '(emoticon)'}]",https://arca.live/b/counterside/41934880,2022-01-06 23:42:19,45,0,2
41934848,클린유저,구인한다고 3번 글 썼습니다,4일 미접만 안 뜨면 됩니다 ㄱㄱ2주년 떡상하믄  자리 없어...뉴비도 와도 된다,"[{'user': '아키야마시류', 'comment': '(emoticon)'}, {'user': '아키야마시류', 'comment': '(emoticon)'}, {'user': '클린유저', 'comment': '(emoticon)'}, {'user': '구관조리병', 'comment': '(emoticon)'}, {'user': '아키야마시류', 'comment': '(emoticon)'}, {'user': '카늒네', 'comment': '(emoticon)'}, {'user': '블루아카이브', 'comment': '(emoticon)'}, {'user': 'ㅇㅇ#87218383', 'comment': '(emoticon)'}, {'user': '늒네#86893131', 'comment': '(emoticon)'}, {'user': '늒네#86893131', 'comment': '(emoticon)'}, {'user': '클린유저', 'comment': '(emoticon)'}, {'user': '늒네#86893131', 'comment': '(emoticon)'}, {'user': '나도줘#28169842', 'comment': '여기 들어갓더니 페그오 극장판 강제로 시청시키네요...'}]",https://arca.live/b/counterside/41934848,2022-01-06 23:41:44,78,0,13
41934821,블루아카이브,디렉터랑 혈소판 광고밖에 안보이노,다른건 하나도 안보인다,"[{'user': '비질란테', 'comment': '그거 필터 때문에 그럴지도\n나도 필터 다 끄니까 바로 보였음'}, {'user': '블루아카이브', 'comment': '(emoticon)'}]",https://arca.live/b/counterside/41934821,2022-01-06 23:41:26,40,0,2
41934814,결왕,각우는 존재가 그냥 섹스다,,"[{'user': '류금테이오', 'comment': '(emoticon)'}]",https://arca.live/b/counterside/41934814,2022-01-06 23:41:20,69,1,1
41934809,1q2w3,리그전 20점 너만 오면 고,점수 받아가라 얘들아,,https://arca.live/b/counterside/41934809,2022-01-06 23:41:17,16,0,0
41934789,불타는쓰레기,요즘 다른 챈 돌면서 19탭 훔쳐봄,다른 겜도 꼴리는 캐릭 많더라,"[{'user': '눈꽃1', 'comment': '(emoticon)'}]",https://arca.live/b/counterside/41934789,2022-01-06 23:40:55,34,0,1
41934785,평생흑우,일본음성 버전이랑 한국음성버전이랑 느낌이 확 다르네,일본어버전이 훨씬 씹덕같음,"[{'user': '독호메', 'comment': '그야... 니홍고니까'}, {'user': '꿀통뺏긴푸', 'comment': '씹덕계의 라틴어'}, {'user': 'k0909#54155798', 'comment': 'ㅇㅇ 태섭 음성 듣다 본섭 음성 들으니까 이미지가 매치가 안됨'}]",https://arca.live/b/counterside/41934785,2022-01-06 23:40:51,34,0,3
41934784,머스크암초가추천하는코인,어제 그린거 참고해서 그려본 호라이즌 전신,SD이건 전신 그릴 때 참고한 어제 돚거한 콘,"[{'user': '각성김철수', 'comment': '(emoticon)'}, {'user': '소미맘#94263386', 'comment': '(emoticon)'}, {'user': '구관조리병', 'comment': '(emoticon)'}, {'user': '샌디치크스', 'comment': '(emoticon)'}]",https://arca.live/b/counterside/41934784,2022-01-06 23:40:51,32,4,3
41934774,엿이나처무라#99513101,카사 접속할때마다 진짜 행복하고 즐거운 이유,요즘 카사 킬때마다 아주 즐거운 기분이든다개꼴리는 4명의 여인네들이섹시하게 유혹의 윙크를 해줘서 기분 좋음,"[{'user': '카늒네', 'comment': '(emoticon)'}]",https://arca.live/b/counterside/41934774,2022-01-06 23:40:42,32,2,1
41934704,늒네#86893131,침몰하던 일섭을 구원한 여신님,일섭은 다 여신님 지지해,"[{'user': '아키야마시류', 'comment': '(emoticon)'}, {'user': '늒네#86893131', 'comment': '(emoticon)'}, {'user': 'AllesKlar', 'comment': '(emoticon)'}, {'user': '늒네#86893131', 'comment': '(emoticon)'}, {'user': 'Starrk#72468956', 'comment': '(emoticon)'}, {'user': '늒네#86893131', 'comment': '(emoticon)'}, {'user': 'ㅇㅇ#81071525', 'comment': '(emoticon)'}, {'user': '늒네#86893131', 'comment': '(emoticon)'}]",https://arca.live/b/counterside/41934704,2022-01-06 23:39:52,93,0,8
41934583,컨섹,머야 일섭은 왜 기채 1일 1회 무료임,우리는 업는데각힐 나올때 우리도 햇나,"[{'user': '비질란테', 'comment': 'ㅇㅇ 서버마다 다 그랬대'}, {'user': '가자미', 'comment': '예스예스미'}, {'user': '구관조리병', 'comment': '너만 못 받았어'}, {'user': 'ㅇㅇ#87218383', 'comment': '네네카 콘'}, {'user': '치후유', 'comment': '겜안분'}]",https://arca.live/b/counterside/41934583,2022-01-06 23:38:00,108,0,5
41934409,비질란테,난 왜 광고 분탕 닉 검색해도 안나오지,몬가 잘못됐음....,"[{'user': '블루아카이브', 'comment': '(emoticon)'}, {'user': '늒네#86893131', 'comment': '닉변했겠지'}, {'user': '힝힝', 'comment': 'https://arca.live/b/girlcafe/41873654'}, {'user': '비질란테', 'comment': '아니 카챈에 쓴 글'}, {'user': '힝힝', 'comment': '(emoticon)'}, {'user': 'ㅇㅇ#87218383', 'comment': '살아있어 카챈에서 활동했던 닉은 다른거고'}, {'user': '비질란테', 'comment': '닉변한건 어케 알았대 반고닉도 아닌데'}, {'user': 'ㅇㅇ#87218383', 'comment': '그냥 말하는 주제가 같다보니까 보다보니까 알게 됬음 항상 무슨 캐릭 좋아하는 사람은 그 캐릭만 말하니까 눈치채기 좀 쉽지'}, {'user': '비질란테', 'comment': '(emoticon)'}, {'user': 'ㅇㅇ, 121.133', 'comment': '시ㅇㅇ'}]",https://arca.live/b/counterside/41934409,2022-01-06 23:35:12,226,0,10
41934398,ㅇㅇ#46187445,더 복서 보고 왔는데 개미침,간만에 보고 완결까지 쿠키 다 구웟네;,"[{'user': '반갑노', 'comment': '엔딩 나름 잘 끝낸거 같더라'}]",https://arca.live/b/counterside/41934398,2022-01-06 23:35:02,52,0,1
41934379,늒네#86893131,홍어가 알을 낳았따,과연 누구의 알일까,"[{'user': '나도줘#28169842', 'comment': '(emoticon)'}, {'user': '늒네#86893131', 'comment': '(emoticon)'}, {'user': '블루아카이브', 'comment': '(emoticon)'}, {'user': '늒네#86893131', 'comment': '(emoticon)'}, {'user': '결왕', 'comment': '(emoticon)'}, {'user': '늒네#86893131', 'comment': '(emoticon)'}, {'user': '구관조리병', 'comment': '(emoticon)'}, {'user': '늒네#86893131', 'comment': '(emoticon)'}]",https://arca.live/b/counterside/41934379,2022-01-06 23:34:43,63,0,8
41934377,류금테이오,분탕광고 건 놈 계삭튀도 안했네,독하다 독해겜을 고로시하지 왜 채널을 고로시 할려고 하냐,"[{'user': '숲토끼', 'comment': '(emoticon)'}, {'user': '비질란테', 'comment': '병신 저능아 새끼니까'}, {'user': '늒네#86893131', 'comment': '계정 그대론데 닉변 때매 그럴걸'}, {'user': 'ㅇㅇ, 121.179', 'comment': '겜 고로시라...'}, {'user': 'ㅇㅇ#46187445', 'comment': '멀쩡히 있는데?'}, {'user': '류금테이오', 'comment': '아 그렇네..'}, {'user': '엿이나처무라#99513101', 'comment': '분탕 말고 매운탕은 없나'}]",https://arca.live/b/counterside/41934377,2022-01-06 23:34:41,150,0,7
41934369,현붕이,갓오하 보고 왔는데 미쳤네,만신펀치!만신펀치!,"[{'user': '페미니스트김유식', 'comment': '갓오하 나옴?'}, {'user': '현붕이', 'comment': '(emoticon)'}, {'user': '나도줘#28169842', 'comment': '나온줄도 몰랏네ㅋㅋ 보러가야겟다ㅋㅋㅋ'}, {'user': '순애가낭만이다', 'comment': '바로 미리보기 결제 다했다...박용제 그는 만신이 맞다'}]",https://arca.live/b/counterside/41934369,2022-01-06 23:34:35,74,1,4
41934346,ㅇㅇ#30732005,일섭 5ch 반응 -28-,"742무료 160연차 이제 끝인가그냥 상시 캠페인으로 해주면 좋을 것 같은데846그렇게 분탕치던 애들 다 어디 갔냐 평화로워졌네862가끔은 점검 연장하고서 사과 보상 받는것도 나쁘지 않아997기채는 아끼고 각성 유나나 NTR판 서윤 뽑는다part1834우오오오오!!스승!! 나랑!! 결혼해줘!!49빙고 이벤트? 로 갑자기 각성 부사장 줘서 웃었다w54융합은 업데이트 안 됐어?60기밀채용도 매일 무료 1회라니 갓겜이냐w64각성 안대는 인권 취급이던데 공짜로 뿌리는 거냐따뜻한 것에도 정도가 있다67기채 1일 1회 무료 채용 해외 형님들은 이런 거 말한 적 없는데 저쪽에도 있었던 요소임..?68안대 2종류 있어서 이번에 뿌리는건 인권 아닌 쪽의 안대임헷갈리니까 안대 벗어라69미안 첫 10연차에서 각힐 나왔다76미안 무료 가챠 한번에 각힐 나왔어www116각성 힐데는 특수기나 궁극기 설명 보면 버프된 성능이네너무 강한 거 아냐 이거?128BAN이 이런데 힐데 버프된 버전으로 나오는 거냐ww159로자리아 힐데 천장 쳤다뭐 다른 게임에 비하면 싸니까 후회는 안 해203게다가 천장 스택 계승인가따뜻하네. 투자하면 일단 낭비가 되지 않는다211따뜻한 게임이지만 랭크전은 똥겜이 됐다힐데랑 라이노 밖에 안 보여216잘 안 나와서 3만엔 썼다힐데 2개 뽑았다각각 육성해서 소대마다 넣으면 좋나?287각성 과금 안 해도 얻을 수 있으면 아무도 과금 안 할텐데wwww301머리 벗겨지지는 않았지만 로자리아 님에게 밟히고 싶다https://i.imgur.com/h8qTxRr.jpg299트위터 거지는 왜 우리가 없으면 게임 망한다는 식으로 자신만만한 걸까. 정말 머리 이상하다그냥 쳐접든가 하지 잘못된 정보 퍼뜨려서 게임의 평판 떨어뜨리니까 정말 최악308폰겜 여론은 항상 트위터 쓰레기들이 운영 옹호하고 5ch에선 운영 까는 게 일상인데 이번에는 역전 현상 벌어지고 있다언제까지고 트위터와 5ch은 양립할 수 없는 존재구나333방송 보니까 랭크전 서로 안 뒤지는 똥겜 되어있어서 웃었다w338스승에게 유리할 것 같은 캐릭은 지금 7코(가은)와 4코(구관총)야349미니스트라는 다른 사이트에서도 엄청 평가 높지만 캐릭터로서는 아무런 매력도 느껴지지 않네356퀸을 빨리 뽑고 싶다. 변태 보디 하고 있음😋371스토리 너무 길잖아괴롭히고 있는 건가428리플레이서 퀸의 허벅지 사이에 들어가고 싶다495가챠 연출 스킵해버리는 일이 잦다각성캐 가챠 연출 보고 싶은데 실수로 스킵해버리면 좀 시들해진다499각힐 연습모드에서 체크해봤을 땐 아직 버프 전 성능이다516■힐데 : 타입 지크프리트의 스킬 설명에 맞게 효과가 발동하지 않는 현상※게임 내의 스킬 설명문이 맞는 내용입니다. 효과가 정상적으로 적용되지 않는 문제는 조사중입니다.지금 있는 힐데는 심지어 약한 버전인 건가 😭 랭크전 멸망544서윤 쨩 배신했던 거 아니었네573각성 힐데 인권임? 해외 티어는 낮지 않았나579>>573지금의 SEA 티어 정상인 각서윤이 한국의 평가는 높지 않은 걸 보면 업데이트된 시점과 나중에 인플레로 밀려난 시점의 평가가 다른 거임576각성 캐릭터 스킬책 들어가는 양 버겁다순식간에 다 날아갔어577(각성 힐데) 드럼통 (몸매가 평탄하단 뜻)581>>577세계에서 가장 귀여운 드럼통이다575음악 정말 좋네626스토리 재밌었어 다음 빨리628>>575전투 BGM도 굉장히 좋다EP5 마지막에서 BGM이 보컬판으로 바뀌는 연출도 진부하긴 하지만 나는 이거 죽을 만큼 좋았음638트위터 공지에 따르면 하루 1회 무료채용이 있지만 SEA판? 한국판?에선 힐데 픽업 끝나고 나서 사라졌다고 한다이쪽도 그런 식으로 무료채용 사라지면 또 기채 창렬이라고 억까할 듯650비숍 쨩 귀여워663실화냐. 카운터사이드의 3대 미인 중 한 명인 이지수를 배포 해준다니 믿을 수 없다669클리포트 게임이란 게 세계를 멸망시키는 현상인 건가?로자리아도 잠깐 나왔지만 적인가 보네671로자리아한테 자지 밟혀서 사정관리 되고 싶어672왜 이 게임 적으로 나온 애가 동료인 척 하는 거임?682각성 드럼통보다 로자리아가 중요680이번 주 최강 캐릭터 각성 힐데와 라이노를 카운터치는 발리스타 군 최강발리스타 없찐?www684발리스타 없찐? 같은 말 이번 주 지나면 들을 일 없겠지그럼에도 불구하고 점수를 올리고 싶다www735종합 54위, 게임 카테고리 38위인가많이 노력했구나751실시간 매출랭킹 38위까지 올라갔잖아어케했노 넥슨764ACT5 쓸데없이 길다796「패권」이네 ✋😎798세계가 프리라이더즈에게만 엄격하다805각성 아줌마 이벤트 배포하면 기채상품에 있는 건 아무 의미도 없는 거잖아역시 운영 바보인 건가821그러고보니 엉덩이펜 팀업은 본편이랑은 전혀 관련 없었네 나중에 나오나824급하게 힐데 뽑은 거 좀 후회되네분명 무료 가챠에서 나올 것 같은데871시간이 지나면 선행판의 상황과 동일해지겠지만 지금 일본의 절망적인 BAN 상황이나 각성 힐데가 업그레이드 되어서 출시된 것 같은 일본판 자체의 환경도 감안해서 생각해야 한다 🤔무지성으로 ""해외에서는"" 만 하다보면 건틀렛에서 이길 수 없다 ✋😎901쌍둥이들 엉덩이를 늘어놓고 싶다928주화 비싸네..적어도 1주화=1엔 상품 항상 팔면 좋겠는데930각성 힐데는 왜 하의 안 입는 거?931>>930그 상태로 평범하게 대화하는 거 보면 자각 없는 변태라서","[{'user': '건공', 'comment': '고생한다 고맙다 재밌는거보여줘서'}, {'user': 'lemonade', 'comment': '라이노가 지배하는 건...'}, {'user': '술과고기', 'comment': '스파 이지수 여기서도 부사장행 ㅋㅋㅋㅋ'}, {'user': '빡돈', 'comment': '(emoticon)'}, {'user': '무야홍어', 'comment': '킹리스타 ;;'}, {'user': 'MBT', 'comment': '(emoticon)'}, {'user': '헥토르', 'comment': '그 안대 아니야 ㅋㅋㅋㅋㅋㅋㅋㅋㅋㅋ'}, {'user': 'AllesKlar', 'comment': '(emoticon)'}, {'user': '머랭머랭머랭', 'comment': '(emoticon)'}, {'user': 'ㅈㅇㅈㅎ#19865107', 'comment': '(emoticon)'}, {'user': '1q2w3', 'comment': '프리덤라이더즈라고 ㅋㅋㅋ'}, {'user': 'ㅇㅇ#65299563', 'comment': '나도 첨에 할땐 둘이 자매인줄 알았어'}, {'user': '59XZa#80792176', 'comment': '(emoticon)'}, {'user': '경구', 'comment': '그 안대 아니래 ㅋㅋㅋㅋㅋㅋㅋㅋㅋㅋ'}, {'user': '경구', 'comment': '트위터랑 저기 관계 어디서 많이 보던 관계인데 ㅋㅋ'}, {'user': 'ㅇㅇ#81071525', 'comment': '(emoticon)'}, {'user': '여우불', 'comment': '(emoticon)'}, {'user': '람네', 'comment': '""쌍둥이들 엉덩이를 늘어놓고 싶다""'}, {'user': 'Starrk#72468956', 'comment': '349\n\n미니스트라는 다른 사이트에서도 엄청 평가 높지만 캐릭터로서는 아무런 매력도 느껴지지 않네'}, {'user': '로하림', 'comment': '저쪽은 기채도 1일 1회 무료임?'}, {'user': '그림판뉴비#69792060', 'comment': '다들 미니스트라 싫어하네 난 매력있어서 좋던데 나만 좋아하는듯...'}, {'user': '금태링다메다메', 'comment': '(emoticon)'}]",https://arca.live/b/counterside/41934346,2022-01-06 23:34:22,302,25,22
41934304,ㅇㅇ#40129633,"""오르카.. 어딨냐?""",옆집 에저씨,"[{'user': '숲토끼', 'comment': '(emoticon)'}, {'user': '우선도낮은컨텐츠#59699096', 'comment': '아니 왜 맨날 올리고 없어지는데'}, {'user': '나도줘#28169842', 'comment': '오르카를 찾아도 너희 둘은 죽는다'}, {'user': '마에스트로', 'comment': '(emoticon)'}, {'user': '비질란테', 'comment': '(emoticon)'}, {'user': '샌디치크스', 'comment': '(emoticon)'}]",https://arca.live/b/counterside/41934304,2022-01-06 23:33:41,116,14,6
