index,user,title,content,comment,link,date,view,rate,comment_count
32624982,"ㅇㅇ, 58.77","세리나가 박정자시대 끝낸건 좋다고생각, 박정자 픽업기간은 분탕이라생각",출시 시기가 욕먹을건 맞지건공들 오퍼 눈 뒤집히면 몇십 몇백 박는데바로 무용지물로 만들어버리는 카드가 나오는데 당연히 화나지차라리 분탕마망 출시하지 그랬냐세리나 이벤트에서 존나 억지로 끼워넣고관남충이 불러놓고는 뭐 팝콘이나 튀겨놔??에바참치임근데 박정자 죽인건 좋다 헤헿,"[{'user': '주블', 'comment': '박정자만 죽은 게 아닌데 ㅋㅋ'}, {'user': 'ㅇㅇ, 58.77', 'comment': '그렇긴 하지 시부엉'}, {'user': 'ㅇㅇ, 182.226', 'comment': '사실 메타 자체가 뒤집혔다는 점에서는 좋은 출시라고 생각하는데\n모두의 마블 에서나 볼 법한 출시 + 스킬 세팅이라 욕먹는거지. 이벤트로 민심 좋은거 아니었으면 또 챈 불탓음 ㄹㅇ'}, {'user': 'ㅇㅇ, 58.77', 'comment': '인정합니노'}]",https://arca.live/b/counterside/32624982,2021-08-24 17:28,108,0,0
32624943,문총통,"몰루킹, 공익 풀리면 세리나의 진면목을 보게될것",감히 박정자 못 꺼내고 서로 세리나끼리 고로시하다가 슬쩎 시그마 먼저 꺼내는쪽이 이길듯,,https://arca.live/b/counterside/32624943,2021-08-24 17:28,50,0,0
32624794,클린유저,세리나 리워크각임?,솔직히 어제 떴을때부터 개좋을것같았는데ㅋㅋ좋된것같네..,"[{'user': '주블', 'comment': '현상 수정은 몰라도 리워크까진 안 할 듯'}, {'user': 'ㅇㅇ, 119.70', 'comment': '오퍼레이터로는 불타기 힘듬 상위권 아닌이상 다들 대충 태포로만 뽑아먹고 안건드니까'}]",https://arca.live/b/counterside/32624794,2021-08-24 17:26,100,0,0
32624740,HeyHo,세리나 좋음?,시그마 박정자 있으면 세리나 사면 되나?,"[{'user': '아키는아니키', 'comment': 'ㅇㅇ'}, {'user': '홍차폭탄', 'comment': '박정자 버프를 꺼버린단 말이 있더라'}, {'user': '주블', 'comment': '아직 좀 기다려봐야할 듯'}, {'user': '포요오', 'comment': '박정자 카운터인데.. 정작 박정자를 안쓰면 또 몰?루'}, {'user': '묘갤러', 'comment': '박정자 아니라도 코핀 1스 버프도 끄고 알비온 은신도 끄고 베로롱 불사 킹 장풍  이런것도 다 꺼버려서 좋다더라'}, {'user': '포요오', 'comment': '데뎃..? 그럼 사기캐였누.. 나도 뽑으러간다'}]",https://arca.live/b/counterside/32624740,2021-08-24 17:25,152,0,0
32623873,진간장도시락,각시윤 버리고 킹을 선택했는데,각시윤 기다리다가 킹 뽕맛 좋다길래140뽑 천장 언저리에 킹 뽑아서 110찍어주고 메공속 맞춰주고패작 그만하고 이제 건틀렛좀 돌려볼까 했는데 이틀뒤에 세리나 때문에 플라잉니그로가 되버렸네 ㅅㅂ,"[{'user': '역린#17405198', 'comment': '킹 병신됨? ㄷㄷ'}, {'user': 'oo, 182.228', 'comment': 'ㅇㅇ뒤짐'}, {'user': '역린#17405198', 'comment': '옴메.. 오늘 풀융핵했는데'}]",https://arca.live/b/counterside/32623873,2021-08-24 17:09,101,0,0
32623096,eca,세리나 업뎃으로 건 어떻게 된거임,킹 공익 둘다 뒤지고 이볼브가 원탑 먹게 된거?,"[{'user': 'ㅈㅇㅈㅎ#19865107', 'comment': '박정자도 디짐'}, {'user': '포요오', 'comment': '마타베로롱도 티어 떨어진듯'}, {'user': 'xile#17342824', 'comment': '아마도?'}, {'user': '주블', 'comment': '박정자 공익, 알비온 러쉬, 킹, 마타베로롱 다 뒤짐\n씹볼즈좆만 살아남음\n기순이도 못 써서 저거 못 뚫음'}, {'user': 'Ninomiya', 'comment': '밸런스보다 쌔끈한 스킨생각하기 바쁜 듯'}]",https://arca.live/b/counterside/32623096,2021-08-24 16:56,135,0,0
32622498,에이미세컨드윙,난 세리나 걱정 없는게,건은 진작에 밀리아 분탕칠때부터 때려쳤다고 ㅋㅋㅋㅋ,[],https://arca.live/b/counterside/32622498,2021-08-24 16:46,109,1,0
32622408,하랍픽업좀,세리나 시발 좀 많이 심각한가보네,건 챈 뭐냐밀리아 2전장 때 급인데,"[{'user': 'Ludovicus', 'comment': '진짜 제대로된 분탕인데'}, {'user': '젓망겜#36102415', 'comment': '오퍼레이터 아님?'}, {'user': '하랍픽업좀', 'comment': '오펀데 상대편 영구버프 제외한 모든 버프 싹다 제거함ㅋㅋ'}, {'user': '하랍픽업좀', 'comment': '+8렙기준 13초 동안 버프도 못주게함ㅋㅋ\n1렙은 6초'}, {'user': '젓망겜#36102415', 'comment': '갸꿀'}, {'user': 'Ludovicus', 'comment': '오히려 오퍼인게 더문제지 ㅋㅋ'}, {'user': '젓망겜#36102415', 'comment': '근대 8렙찍을려면 중복이 몇개여 ㅡㅡ 8개 언제 뽑음?'}, {'user': 'ㅇㅇ#45050405', 'comment': '깡통빼고 모든캐릭을 죽임'}, {'user': '나카노아즈사', 'comment': '오퍼라서 건챈만 불탐 ㅋㅋ 시그마 다음에 공익 출시한 급으로 분탕 패치인데'}]",https://arca.live/b/counterside/32622408,2021-08-24 16:45,236,0,0
32622302,대깨카입니다,예거랑 세리나 둘 다 뽑아?,ㅇㅇ?,"[{'user': 'Ludovicus', 'comment': '세리나는 무조건인데 문크는 기다려'}]",https://arca.live/b/counterside/32622302,2021-08-24 16:43,85,0,0
32622189,"ㅇㅇ, 39.122",세리나 오퍼 애?미 뒤진거 같음,저게 뭐노 시발 ㅋㅋㅋㅋ먼 시발 버프고뭐고 다지워버리고 내꺼 쭉밀리는데 저거 박정자로 막아짐? 박정자도 지우냐?,"[{'user': '소나기나기', 'comment': '박정자 지움 ㅋㅋㅋㅋ'}, {'user': 'ㅇㅇ, 39.122', 'comment': '애미시발 드디어 스비의 분탕이 시작됐노'}, {'user': '극한의가능충', 'comment': '박정자도 지워짐'}, {'user': 'Ludovicus', 'comment': '박정자도 지움 ㅋㅋ'}]",https://arca.live/b/counterside/32622189,2021-08-24 16:41,155,0,0
32622182,ㅇㅇ#36099854,세리나 버프 해제가 1개도 아니도 그냥 싹 지우는거였네,거기에 버프 금지까지 붙고,"[{'user': 'ㅇㅇ#64962009', 'comment': '베로니카 바로컷 ㄷㄷ'}, {'user': 'xile#17342824', 'comment': '재출격아니면 버프빨로 싸우는건 안될듯'}, {'user': 'ㅇㅇ, 122.47', 'comment': '버프를 1개만 해제하는게 아니라 전부 지운다???\n\n남아있는 버프가 아무것도 없다???'}]",https://arca.live/b/counterside/32622182,2021-08-24 16:41,104,0,0
32622154,극한의가능충,어제 박정자 실수로 또 구매했는데,세리나가 좋다니..,,https://arca.live/b/counterside/32622154,2021-08-24 16:41,59,0,0
32622029,가으응,베로롱 불사가 세리나 쓰면 풀림??,에반데,"[{'user': 'Ludovicus', 'comment': '맞아!'}, {'user': 'xile#17342824', 'comment': '근데 베로롱 한번만내는건 못봐서 어케될진 몰?루'}, {'user': 'xile#17342824', 'comment': '근데 베로롱 한번만내는건 못봐서 어케될진 몰?루'}, {'user': '병아리가삐약삐약', 'comment': '킹 장풍도 풀림 ㅋㅋㅋ'}]",https://arca.live/b/counterside/32622029,2021-08-24 16:38,153,0,0
32621794,하랍픽업좀,스비 왤케 걱정되냐... 매출보다 카붕이들을 선택했네,리코 스킨 쿼츠에오퍼 세리나 처음부터 수영복 버전에...진짜 카사 매출 안 나와서류박듀오 월급 못 받는거 아니나 ㅠㅠ걱정되네는 시1ㅏ발 다음 분탕 뭐 준비중이냐빨리 바른대로 말해마음의 준비 좀 하게역시 각성 주시윤이냐?빨리 말하라고!!!!!!!,[],https://arca.live/b/counterside/32621794,2021-08-24 16:34,1476,36,0
32621743,에트리안#99131387,킹 세리나 맞으면 원시킹보다 구져짐?,설마 그정돈 아니지?,"[{'user': 'Ludovicus', 'comment': '원시킹보다 나은게 피감 5퍼 올라간것일뿐인데 구져지진않네 ㅋㅋ'}, {'user': '에트리안#99131387', 'comment': '2코의 가치 = 피감 5퍼 ㅋㅋ'}, {'user': '모건빵', 'comment': '패시브벞자체를 못받으니까 뎀감도없이 플라잉니거하지'}]",https://arca.live/b/counterside/32621743,2021-08-24 16:33,103,0,0
32621155,페퍼로니더블,이볼비 덱 쓰면 시그마 키우는게 낫냐?,지금 시그마 명함 따놓고 키우려 하고 있는데여기서 세리나로 안갈아타고 시그마 키우는게 나을까?,"[{'user': '그림즈#42621815', 'comment': '이볼브 덱에는 시그마 안씀'}, {'user': '페퍼로니더블', 'comment': '오퍼 얘기임'}, {'user': '그림즈#42621815', 'comment': '아 그럼 시그마 오퍼가 최고임'}]",https://arca.live/b/counterside/32621155,2021-08-24 16:22,72,0,0
32621107,flaw,생각해보니 기순이 버프도 세리나에게 사라지네?,깡볼브원 어케잡아?,[],https://arca.live/b/counterside/32621107,2021-08-24 16:21,72,0,0
32620999,ㅇㅇ#81071525,150뽑해도 오퍼 노쓰알 ㅋㅋ,세리나는 커녕 쓰알 자체가 멸종 ㅋㅋ,"[{'user': 'ㅇㅇ#79729761', 'comment': '그냥 수채하지 ㅋㅋㅋ'}, {'user': '역린#17405198', 'comment': '그냥 수채하지 ㅋㅋㅋ'}]",https://arca.live/b/counterside/32620999,2021-08-24 16:19,77,1,0
32620957,색인,오퍼 세리나가 이볼브원빼고 모든덱 카운터임?,김하나때처럼 밸붕이다 이러면서 호들갑 떠는거 아니고?,"[{'user': 'Ludovicus', 'comment': '세리나 오퍼 켜지면 킹 강평 꺼짐'}, {'user': '색인', 'comment': '와 미쳤노 ㅋㅋ'}, {'user': 'Ludovicus', 'comment': '공익도 박정자 버프꺼지고 지랄남 이볼브원도 코핀 1스 버프를 딴 메카들이 효과를 못보긴하는데 얘네들보단 피해가 덜해'}]",https://arca.live/b/counterside/32620957,2021-08-24 16:19,123,0,0
32620753,색인,세리나가 혹시 베로니카 불사버프도 해제함?,ㅇㅇ? 마타도르 베로니카 너무 날뛰니까 밸런스패치 한것인가?,[],https://arca.live/b/counterside/32620753,2021-08-24 16:15,199,0,0
32620503,SDAKAJUXIM,유튜브에 세리나 통화도 있네??,너네 이거 봣슴?,"[{'user': '유나펀치', 'comment': '""느려""'}, {'user': 'SDAKAJUXIM', 'comment': 'ㅠㅠ'}, {'user': '괴식가#15601290', 'comment': '1000000번은 본듯'}]",https://arca.live/b/counterside/32620503,2021-08-24 16:10,125,1,0
32620087,눅진4겨드랑이티아맷,세리나 움직이는거 나만 불편하냐?,왜이리 목각인형같지,,https://arca.live/b/counterside/32620087,2021-08-24 16:01,44,0,0
32619569,직무유기,세리나 누나가 카운터 못치는 상대,,[],https://arca.live/b/counterside/32619569,2021-08-24 15:52,155,0,0
32619517,5648#30152853,이제 오퍼 시그마가 압도적 1티어 된건가?,박정자는 밀리아 이프 밴먹고 공익 노밴 아니면 요즘 써먹을 각도 잘 안나오고이젠 세리나에 카운터도 당하노,"[{'user': 'xile#17342824', 'comment': '근데 시그마 판치면 또 굳이 세리나 쓸지는 모르겠네'}, {'user': 'xile#17342824', 'comment': '운빨될듯'}, {'user': '1q2w3', 'comment': '시그마만 있으면 세리나 들어가고 그걸 노리고 박정자 다시 슬슬 나오고 하겠지'}]",https://arca.live/b/counterside/32619517,2021-08-24 15:51,195,0,0
32619448,미야,세리나 오퍼레이터 성능 어떰?,써보니까 어때??,"[{'user': '라최지', 'comment': '박정자 씹는게 커서 메타에 영향주는거같던데 잘몰?루'}, {'user': 'b0ss', 'comment': '박정자 드럼통에 넣고 담궈버림'}, {'user': 'b0ss', 'comment': '킹덱도 카운터 되는거 보면 엄청 좋아 보임'}, {'user': 'b0ss', 'comment': '생각해 보니 마타 베롱도 카운터 되네'}, {'user': '소나기나기', 'comment': '박정자 카운터'}]",https://arca.live/b/counterside/32619448,2021-08-24 15:50,201,0,0
32619428,좆123문가,이야 이집 맛집이네!,테포가 맛집이네...세리나 170뽑+만랩 중복오퍼 2장딸배 천장...,"[{'user': '둔까쓰킹', 'comment': '그래도 과금 하시죠?'}]",https://arca.live/b/counterside/32619428,2021-08-24 15:49,83,5,0
32619217,Ludovicus,세리나보니깐 이제 버프해제불가 쏟아져나올듯,일개 오퍼한테 병신되는 각성캐를 낼순없지,"[{'user': 'xile#17342824', 'comment': '그냥 패시브를 줄지도'}, {'user': '클러스트', 'comment': '버프해제 불가 파괴'}, {'user': '가룬쨩', 'comment': '그냥패시브주겟네'}, {'user': 'Brune', 'comment': '에이미 패시브처럼 걍 특정 스탯 조져놓고 조건부로 발동되게 할 수도 있음'}]",https://arca.live/b/counterside/32619217,2021-08-24 15:46,105,0,0
32619144,눅진4겨드랑이티아맷,아이고 뉴비야,세리나랑 섹스하겠다고 오퍼뽑에 채용권 다 꼴아박고 리플킹 좋냐고 나한테 물어보네존나 슬퍼서 울었다,"[{'user': 'bean', 'comment': 'ㅋㅋ'}]",https://arca.live/b/counterside/32619144,2021-08-24 15:44,48,0,0
32618903,쿠키부시기엄지로,세리나 오퍼뽑50질렀는데,더이상못하겠다 한번을 안나오네 ㅆㅂ,"[{'user': 'ㅇㅇ#36099854', 'comment': '오퍼뽑 하지마셈'}, {'user': '쿠키부시기엄지로', 'comment': '하나만 뽑으려했지..걍테포로 뽑음'}, {'user': '융합해제', 'comment': '그건 하면 안됨'}, {'user': '쿠키부시기엄지로', 'comment': '세리나 10초까지만 늘려줘도 개좋을텐데..'}]",https://arca.live/b/counterside/32618903,2021-08-24 15:40,99,0,0
32618571,융합해제,기분탓인가 세리나가 유독 눈뽕 심하네,뭔가 혼자만 뿌옇네 ㅋㅋ,"[{'user': '담소이', 'comment': '하얘서 그런게 아닐까요'}, {'user': '네모현#32744865', 'comment': '빛나는 응딩이'}, {'user': '보노본호', 'comment': '샤이닝 애스ㄷㄷㄷㄷ'}, {'user': '눈물요정', 'comment': '온몸에 정액칠해서 그럼'}]",https://arca.live/b/counterside/32618571,2021-08-24 15:34,149,2,0
32618502,4nk,오퍼.세리나도 그렇고 이볼브에 희린.시그마 들어가는거도그렇고,최상위 우선순위로 걍 다들어가는듯클래스만 따지고...예외같은걸 미리 고지좀하지..이쯤되면 버그라고도 안하고 의도라고하는듯,,https://arca.live/b/counterside/32618502,2021-08-24 15:33,54,0,0
32618491,반갑노,세리나 쓸만한 부옵이 지광근원임?,요거 네개가 젤나음?,"[{'user': '주블', 'comment': '광 >>> 지 > 근 >= 원'}, {'user': '소나기나기', 'comment': '건용이니까 그렇지'}, {'user': '파워레이', 'comment': '1순위 광피감\n1.5순위 지피감\n2순위 근피감\n2.5순위 원피감'}]",https://arca.live/b/counterside/32618491,2021-08-24 15:32,71,0,0
32618339,진실의문#23527495,세리나 오퍼 패시브 공속인데,이거 쓸모있음?,"[{'user': '쿠키부시기엄지로', 'comment': '피감류보단 그닥이지만 쓸만하다고는 들음'}]",https://arca.live/b/counterside/32618339,2021-08-24 15:30,64,0,0
32618205,소나기나기,세리나 성능은 모르겠고 명함은 따놔야지 ㅋㅋㅋㅋ,하 너무 꼴린다부옵은 광피감 지피감 떴냐?,"[{'user': 'b0ss', 'comment': '아주 빠르게 꼬라박습니다'}, {'user': '소나기나기', 'comment': '내 태포 돌려줘'}, {'user': 'b0ss', 'comment': '안된다!'}]",https://arca.live/b/counterside/32618205,2021-08-24 15:27,141,0,0
32618161,도라에몽#87462610,세리나 얘 생각보다 크네 ,크다,,https://arca.live/b/counterside/32618161,2021-08-24 15:27,85,0,0
32618139,씨에스,세리나도 광피감임?,광피감이야?,"[{'user': 'MMT', 'comment': '오 ㄱㅅ'}, {'user': '씨에스', 'comment': '오 ㄱㅅ'}]",https://arca.live/b/counterside/32618139,2021-08-24 15:26,116,0,0
32618064,Brune,무료150뽑 덕분에,태포로 낭낭하게 세리나 눈나 먹었다.근데 부옵이 이속인,[],https://arca.live/b/counterside/32618064,2021-08-24 15:25,135,0,0
32617999,"ㅇㅇ, 39.118",박정자 세리나에 풀리는거 버그아님?,해로운 효과 면역이면 버프해제도 막는게 맞는거아니냐?원래 버프해제 맞으면 박정자 풀렸었음?버프해제 다른애들도 많잖아,"[{'user': 'xile#17342824', 'comment': '버프해제가 1개해제 이런게 많아서 몰?루'}, {'user': '밥은먹고다니냐', 'comment': '아예 박정자 조지려고 작정하고 낸거 같아서\n그대로 갈거 같음'}]",https://arca.live/b/counterside/32617999,2021-08-24 15:24,98,0,0
32617983,쿠키부시기엄지로,세리나 만렙찍어줄 필요있나?,6초만해도 충분할것같은데,"[{'user': 'b0ss', 'comment': '만렙이 멋지잖어'}, {'user': 'EUSTIA#23249615', 'comment': '2밴데 체감시간 쥰내길듯'}]",https://arca.live/b/counterside/32617983,2021-08-24 15:24,59,0,0
32617828,아기릴리,킹은 왜 세리나한테 약함?,킹 없어서 기믹을 잘 모르는데 버프때메 센거임?,"[{'user': 'bean', 'comment': '장풍 못날림'}, {'user': '아기릴리', 'comment': '아군사망 버프로 장풍 날리는거임?'}, {'user': 'xile#17342824', 'comment': 'ㅇㅇ. 아군죽을때 버프.'}, {'user': 'xile#17342824', 'comment': '근데 10몇초정도면 힐러빨로 버티긴 할텐데'}, {'user': 'ㅇㄷㄴ#69699297', 'comment': '피감버프가 잇어야 장풍이 나와요'}, {'user': '유나펀치', 'comment': '세리나 먹으면 풍압권이랑 피감 버프 싹다 날라간다...'}]",https://arca.live/b/counterside/32617828,2021-08-24 15:21,129,0,0
32617661,하랍픽업좀,"세리나 아직 아무리 좋아도 가챠폭사, 정가교환 하지마셈",밀리아알제?건공이라 당장 존나 쓸거 아니면하루이틀 최대 일주 이주좀 기다려보삼그래도 일욜정도에는 1개 정가 쳐야지,"[{'user': '힐데0', 'comment': '로비 세우는거만해도 가격값함'}, {'user': '하랍픽업좀', 'comment': '그렇긴 함 ㄹㅇㅋㅋ'}]",https://arca.live/b/counterside/32617661,2021-08-24 15:18,122,0,0
32617526,eca,수연이 맘마에 묻혀서 그렇지 ,건틀렛은 좀 곱창난것같은데 세리나로정자가 뒤지면 메카닉은 어디까지 떡상함,[],https://arca.live/b/counterside/32617526,2021-08-24 15:16,135,0,0
32617508,ㅇㅇ#65778446,세리나 이뿌다,로비 바꿔보니 세리나가 돋보이는군,"[{'user': 'ㅣlㅣlㅣlㅣ', 'comment': '너무 밝아 눈뽕'}]",https://arca.live/b/counterside/32617508,2021-08-24 15:15,80,0,0
32617485,진실의문#23527495,세리나 태포로 샀는데...,공속이내 ㅠㅠ,,https://arca.live/b/counterside/32617485,2021-08-24 15:15,42,0,0
32617462,유나펀치,세리나의 힘으로도 죽이지 못한 새끼,솔직하게 카사의 미래를 위해서너프하고 리콜하는게 어떤가 하는생각이 들기 시작함,[],https://arca.live/b/counterside/32617462,2021-08-24 15:15,140,0,0
32617402,묘갤러,세리나가 진짜 좆사기인가 보네,건챈 가보니까 메카닉 빼고 메타캐릭미니 밀리아 정도 빼면 싹다 고로시한거 같은데,[],https://arca.live/b/counterside/32617402,2021-08-24 15:13,216,0,0
32617303,뇌간망가,세리나 야자수 몇 개에 옷 다 팔아 넘기던데,얘도 뭔가 금전 감각이 맛 갔는데?,"[{'user': 'ㅇㅇ, 175.121', 'comment': '관광지 바가지가격으로 팔아다가 옷값수급할라나보지'}, {'user': '겨누스야드랑이', 'comment': '모네 엄마가 입는 것만으로도 홍보효과가 지리잖아 가성비 씹상타취지'}]",https://arca.live/b/counterside/32617303,2021-08-24 15:12,61,0,0
32616846,eca,세리나 뽑아야되냐?,태포 3천 ㄱ?오퍼 올컬렉 각 보고는 있었는데,"[{'user': '네모현#32744865', 'comment': '마타베롱 잡을라면 ㄱ'}, {'user': '하고싶다', 'comment': '-건-할 거면 뽑아야할듯'}]",https://arca.live/b/counterside/32616846,2021-08-24 15:04,94,0,0
32616774,Brune,역시 경멸하는 표정 최고야,귀한 집 자식인 세리나 눈나조차 경멸하게 만드는 프리덤 라이더즈...!부럽다!,,https://arca.live/b/counterside/32616774,2021-08-24 15:03,137,0,0
32616729,하랍픽업좀,박정자 이제 0티어는 아니네 그러면,"키는 순간에만 디버프, 수면 해제로 쓸만하고세리나 맞으면 바로 힐증가는 날라가는거네","[{'user': 'xile#17342824', 'comment': '그냥 힐러내는김에 디버프 해제하는 수준일듯'}, {'user': 'xile#17342824', 'comment': '그냥 힐러내는김에 디버프 해제하는 수준일듯'}, {'user': '1q2w3', 'comment': '이제 무지성으로 키면 장땡인 오퍼에서 생각해야하는 오퍼로 된 거 같음'}]",https://arca.live/b/counterside/32616729,2021-08-24 15:02,179,0,0
32616031,flaw,세리나가 박정자 고인만드네,그와중에 이볼브원스택은 못없앰,,https://arca.live/b/counterside/32616031,2021-08-24 14:50,55,0,0
32615677,클러스트,이번 세리나 스킬로 알 수 있는거,버프해제는 이로운 효과다,,https://arca.live/b/counterside/32615677,2021-08-24 14:44,66,0,0
32615274,도츠게키,아 박정자 채용권 다박앗는데 세리나가 카운터친다는거 사실임?,개지랄맞네 시발...로자 이중으로 힘들게 뽑고 단일 통수 맞는것도 좆같더니 왜이러냐 얘들 진짜 시발;;,"[{'user': '히롬', 'comment': '이젠 그냥 건안하는걸로..'}]",https://arca.live/b/counterside/32615274,2021-08-24 14:37,123,0,0
32615260,우투리#61891923,세리나 박정자 싸움 뭔가 이상하네,둘 다 해제불가 어쩌고 달려있는데텍스트로만 읽어보면 먼저 발동한게 이겨야 하는거잖아?해제불가 버프를 걸었는데 버프해제를 당하는게 ㅋㅋㅋㅋ박정자 먼저 발동하는거 기다렸다가 세리나 걸어서풀어버리는건 아닌거 같음,"[{'user': 'ㅇㅇ#36099854', 'comment': '박정자 해제불가 버프 아닐탠데'}, {'user': 'xile#17342824', 'comment': '박정자 해제불가 아님'}, {'user': '갓겜유저', 'comment': '박정자가 해제불가가 아니라서'}]",https://arca.live/b/counterside/32615260,2021-08-24 14:37,149,0,0
32614878,스트로베리샤베트,근데 박정자 픽업중인데 세리나 내는거 맞냐?,얘네 지난번에도 로자 이중픽업 한지 몇주나 되었다고 바로 단일픽업해서 통수치더만이번에도 박정자 픽업해서 존나 팔아먹고 바로 카운터오퍼 내버리네ㅋㅋ,"[{'user': 'xile#17342824', 'comment': '오퍼뽑은....'}]",https://arca.live/b/counterside/32614878,2021-08-24 14:31,81,0,0
32614843,서현#46344578,스포일러) 세리나 출시로 알수있는 카운터 사이드의 미래,"""해제불가"" 버프 달린 캐릭, 오퍼 출시""해제불가버프 해제"" 스킬 달린 캐릭출시""절대해제불가 버프""개 좆됐다 카운터 사이드!!!","[{'user': 'xile#17342824', 'comment': '팩트) 해제불가는 이미 있다'}, {'user': 'xile#17342824', 'comment': '캐릭 오퍼 둘다'}, {'user': '1q2w3', 'comment': '해제 불가 베리어'}]",https://arca.live/b/counterside/32614843,2021-08-24 14:30,163,-1,0
32614754,쎅쓰머신,세리나 오퍼때문에 나락간놈,공익 박정자 못바름킹 장품 못쏨스비가 메카안하면 건하지말래,"[{'user': '하와와#91395212', 'comment': '이볼브원도 해제불가 아니지않냐'}, {'user': '쎅쓰머신', 'comment': '좆볼브원 출격때제물버프는 못막음'}, {'user': '2월유입', 'comment': '마타도르 베로니카도 병신됨'}]",https://arca.live/b/counterside/32614754,2021-08-24 14:29,199,0,0
32614088,Dahlia,세리나샀다 옵 떴냐 ㅋㅋ,뎃?,,https://arca.live/b/counterside/32614088,2021-08-24 14:18,89,0,0
32613693,하와와#91395212,세리나가 정자 버프 지우는거임?,세리나터지니까 체력회복도 안되는거같고 디버프도 걸리는거같은데 기분탓이냐,"[{'user': 'xile#17342824', 'comment': '해제불가 아니면 지우는듯'}, {'user': 'xile#17342824', 'comment': '해제불가 아니면 지우는듯'}, {'user': '포소기', 'comment': 'https://arca.live/b/counterside/32612740?target=all&keyword=%EC%A0%95%EC%9E%90&p=1'}, {'user': '네모현#32744865', 'comment': '해제불가 아니면 다 지움 ㅇㅇ'}]",https://arca.live/b/counterside/32613693,2021-08-24 14:11,157,0,0
32613663,하늘엘,세리나 크루 대사 모음,,[],https://arca.live/b/counterside/32613663,2021-08-24 14:11,95,2,0
