index,user,title,content,comment,link,date,view,rate,comment_count
32669555,ㅇㅇ#52172593,세리나 뽑기로 씹비틱 옵션 나옴 ㅋㅋ,pvp 원툴 오퍼에 pve 비틱 스킬이 나옴,"[{'user': 'Clink', 'comment': '(emoticon)'}, {'user': 'ㅇㅇ, 106.246', 'comment': '치피증 pve에 조흠?'}, {'user': 'ㅇㅇ#52172593', 'comment': 'pve에선 1티어라는거같드라'}, {'user': 'ㅇㅇ, 106.246', 'comment': 'ㅇㅎ'}]",https://arca.live/b/counterside/32669555,2021-08-25 12:34,168,0,0
32668483,제이크,세리나 뭔가 흠 뭔가 뭔간데,콜걸이냐???,"[{'user': 'diqkf운터', 'comment': '(emoticon)'}, {'user': '좆123문가', 'comment': '5'}, {'user': '하혜령', 'comment': '컨소장아'}, {'user': '하혜령', 'comment': '혹시있니'}, {'user': 'OldKing', 'comment': '?_?'}, {'user': '하혜령', 'comment': '나 컨소원인데 내가 군인이라 게임을 3개나 하는데 관리하기가 힘들어서 팔려고..'}, {'user': '하혜령', 'comment': '그래서 아무말없이 탈퇴하는건 예의가 아닌거같아서'}, {'user': 'OldKing', 'comment': '암튼.. 미안했고.. 말은하고갈게..'}, {'user': '하혜령', 'comment': '암튼.. 미안했고.. 말은하고갈게..'}, {'user': 'OldKing', 'comment': '미안할거 없음 다치지 말고 건강하게 전역하셈'}, {'user': '제이크', 'comment': '말해줘서 고마워! 이제 봤어 다치지 말고 아프지말고 건강하게 전역하길 바랄게'}]",https://arca.live/b/counterside/32668483,2021-08-25 12:13,188,0,0
32668213,ㅇㅇ#81071525,세리나 광피감 시발 성공 ,광피감 멘마 모네카 날려버리고 세번째 이식에서 성공 했는데 진짜 3연 실패했으면 현탐 찐하게 올뻔했다 시발 성공한 흑우가 될게..,"[{'user': '우치하루피', 'comment': '(emoticon)'}, {'user': '쿠키부시기엄지로', 'comment': '얼마를 쓴거임..ㄷㄷ'}, {'user': 'ㅇㅇ#81071525', 'comment': '몰라몰라 ㅋㅋ..'}, {'user': '쿠키부시기엄지로', 'comment': '광피감 세리나ㅊㅊ 만렙임? 써보고 체감좀'}, {'user': 'diqkf운터', 'comment': '(emoticon)'}]",https://arca.live/b/counterside/32668213,2021-08-25 12:08,203,4,0
32668103,MBT,세리나 스킬 터지니까 겜이 확 밀리네,이게 게임인가,,https://arca.live/b/counterside/32668103,2021-08-25 12:06,71,0,0
32667611,쿠키부시기엄지로,박정자 힐은 들어감?,세리나 맞아도 힐은 들어가지?,"[{'user': '셰이브', 'comment': '힐도 버프에 통합되서 들어가는거일걸'}, {'user': '굽네바사삭', 'comment': '힐 자체가 안들어갈거임'}, {'user': 'Ludovicus', 'comment': '걘 캐릭이 도트힐하는게아니라 도트힐이 버프에 달려있어서 사라지는거아님?'}, {'user': 'xile#17342824', 'comment': '힐이 버프랑 묶여있을걸'}]",https://arca.live/b/counterside/32667611,2021-08-25 11:57,91,0,0
32666414,ㅇㅇ#90362386,세리나 스킬 발동 해도 힐은 들어가지?,설마 힐도 안되냐?,,https://arca.live/b/counterside/32666414,2021-08-25 11:33,43,0,0
32666123,에트리안#99131387,태포 3000 모였는데 세리나 명함 vs 김하나 명함 뭐할까,아무래도 PVE는 김하나가 낫겠지?,"[{'user': '좆123문가', 'comment': '세리나 보스면역이라 사실상 pve는 쓸데가 없는듯'}, {'user': '백합덕후#78782383', 'comment': 'ㅇㅇ 세리나 건용'}, {'user': '종말#38406147', 'comment': '세리나는 pve에 필요없지'}, {'user': '아라비#86128420', 'comment': '지금 피빕 안한다고 하나뽑으면 한달내로 후회함ㅋㅋ'}, {'user': '에트리안#99131387', 'comment': 'ㅋㅋㅋㅋ'}]",https://arca.live/b/counterside/32666123,2021-08-25 11:26,115,0,0
32666083,평생카사해,이볼브원도 존나 불합리해서 짜증남,머 시발 꺼내는게 존나 어려운거도 아닌데뒤지지도 않고 그냥 시간좀 뻐기다이건 핵이야 맞으면 죽어!! 하면우리팀 전열 싹 갈아마심ㅋㅋㅋ사실상 핵박기전에 녹이던가 하라는건데 상대는 이볼브원 꺼내놓고 유튜브만 보나 같이나오는 야누스이프리트오버플로기수에 스피라까지 하나같이잡기도 어렵고 딜은 딜대로 세고 ㅋㅋㅋ이번에 세리나까지 대놓고 이볼브원 쓰라고 내준거보면머 얘네 나아지나 싶다가도 밸런스는 완전히 손 놓은건가싶다,"[{'user': '암왕제군', 'comment': '건 상대로 계속 호구잡이 장사할 거 같은데 각시윤도 어마어마할걸'}, {'user': 'diqkf운터', 'comment': '피감 60%때문에 기순이 없으면 못잡는 수준인데 그 기순이마저 밴때려버림'}, {'user': '평생카사해', 'comment': '이볼브덱에 기순이까지 있으면 우리 탱커도 살살녹음ㅋㅋ'}]",https://arca.live/b/counterside/32666083,2021-08-25 11:25,112,1,0
32666036,야벅지,기껏 킹 뽑아놨더니 세리나 좆같네 아..,줌마 라이더,"[{'user': '지붕', 'comment': '(emoticon)'}, {'user': 'xile#17342824', 'comment': '(emoticon)'}]",https://arca.live/b/counterside/32666036,2021-08-25 11:25,120,0,0
32666016,에이미세컨드윙,세리나 때문에 건 밸런스 작살났다는데,걱정마라 대적자 나유빈 세리나 덕분에 상향명분생겨 상향받고 다시 떡상함 ㅋㅋ,"[{'user': '아키는아니키', 'comment': '이게맞다'}, {'user': '카붕가붕이#67881991', 'comment': '성장형주인공 나유빈'}, {'user': '종말#38406147', 'comment': ""'다크나이트'""}]",https://arca.live/b/counterside/32666016,2021-08-25 11:24,163,0,0
32665479,ㅇㅇ#73986791,이볼브원 생각해보면 진짜 말도 안됨,니가와 하는데 러쉬에 강함버프를 받을수 없음 하지만 오퍼 시그마 버프는 받음니가와 말고 러쉬로 써도 존나 쎔버프해제 힐밴 유틸도 다 있어 약점 적음궁극기로 상대방 강제 타임어택세리나로 다른 경쟁자들 고로시 됬는데 깡통은 영향 없음궁 범위가 함선 끝까지 다음상대 할때마다 불합리 그 자체임,"[{'user': 'diqkf운터', 'comment': '시그마 버프 코핀 버프 다 받아놓고 버프 면역 ㅋㅋㅋㅋㅋㅋㅋ\n보상이랍시고 받은 디버프 면역은 죄다 면역이고 ㅋㅋㅋㅋㅋㅋㅋ'}]",https://arca.live/b/counterside/32665479,2021-08-25 11:12,139,3,0
32664398,컨섹,태포 3000 찼는데 누구살까,지금 세리나 시그마 멘션 마스터 올리비에 박 잇슴이제 누구삼??????????,"[{'user': '암왕제군', 'comment': '김하나도 하나 잇으면 조음'}, {'user': '암왕제군', 'comment': '근데 3000은 항상 여유자금으로 남겨두는 게 나을걸 새 오퍼 나오면 바로 사게'}, {'user': '컨섹', 'comment': '(emoticon)'}, {'user': 'bean', 'comment': '레나가 없네'}, {'user': '응애나추룡아가', 'comment': 'PVP 하면 하나 집중하고 아니면 걍 꼴리는 애'}, {'user': '백합덕후#78782383', 'comment': '건공이면 세리나? 근데 슬슬 오퍼기술전수도 ㄱㅊ은듯?'}, {'user': 'mosquito', 'comment': '싹다명함이면 레나/김하나 명함따는거추천'}, {'user': '컨섹', 'comment': '둘중에 아무나 사겟슴 ㄳㄳ'}]",https://arca.live/b/counterside/32664398,2021-08-25 10:48,147,0,0
32664323,우흥으로들었소#83797893,세리나 오퍼 pve 에서도 좋음??,박정자보다도 좋아?,"[{'user': '전기톱추적자', 'comment': '(emoticon)'}, {'user': 'xile#17342824', 'comment': '해제필요할때나 씀'}, {'user': 'xile#17342824', 'comment': '아직 범용성은 별루'}, {'user': '백합덕후#78782383', 'comment': '그건 아닌듯?'}, {'user': 'ㅈㅇㅈㅎ#19865107', 'comment': '지금까지 나온 Pve에서 상대버프 해제할일이 없을텐데'}]",https://arca.live/b/counterside/32664323,2021-08-25 10:46,69,0,0
32664255,"ㅇㅇ, 58.236",잡옵 세리나 or 광피감 박정자 해도 전자야?,이번주 밴이각성 디펜 3개중에 공익만 밴이라 좋은게 더 고평가 받는 느낌 같은데그냥 전체적으로도 차이가 압도적일지 궁금해서지난주 딱3천모아서 박정자 레벨올렸더니 뒷통수 얼얼,"[{'user': 'ㅇㅇ#50644440', 'comment': '둘이 붙으면 박정자 덱이 못이길정도야'}, {'user': 'ㅇㅇ, 58.236', 'comment': '각힐뺀 각성디펜중 세리나 영향 가장 적은게 공익일텐데 얘 노밴주간에도 마찬가지일까?? 스커를 써야만 하는게 내 캐릭터 육성 상태상 손해보는게 많아서'}]",https://arca.live/b/counterside/32664255,2021-08-25 10:45,88,0,0
32663714,ㅇㅇ#92834652,이번 오퍼 세리나 맞나? 애 사야댐?,수영복 입은거 재 필수임?,"[{'user': 'Ludovicus', 'comment': 'pvp할거면 거의 필수같은데'}, {'user': 'Ozymandias', 'comment': '건 할거면'}, {'user': 'bean', 'comment': 'pve는 필요없음'}, {'user': '네비얀', 'comment': '건할거면 지르고 pve만 하면 로비에 세울거 아니면 별로 쓸모ㅜ없음'}]",https://arca.live/b/counterside/32663714,2021-08-25 10:33,109,0,0
32663460,Ludovicus,세리나 이볼브원 만나면 킹은 멸망인데,반대로 걔네둘 안만나면 먹고살만함,"[{'user': 'ㅇㅇ#55992975', 'comment': '걔아니면 미러전아니노?'}, {'user': 'Ludovicus', 'comment': '하긴 마타도르도 세리나 들고다니겠다'}, {'user': 'lllBoomerlll', 'comment': '세리나만 안맞으면 후열 작살내는건 여전하니까'}, {'user': '암왕제군', 'comment': '하지만 건틀렛은 이제 세리나로 가득 찰 운명인걸'}, {'user': 'Ludovicus', 'comment': '(emoticon)'}, {'user': 'bean', 'comment': '문제는 킹만 멸망하는게 아님ㅋㅋ'}, {'user': 'Ludovicus', 'comment': '딱 걸렸다! 좆볼브씹!'}, {'user': 'bean', 'comment': '(emoticon)'}, {'user': '힐데져아', 'comment': '먹고 살만한 선을 넘는데...건하면서 오픈좀 그만했으면 좋겠어 좆킹만나면 좆같아서 오픈하는데'}, {'user': 'Ludovicus', 'comment': '마타도르,이볼브원,세리나 다없으면 이번주 킹 이기기 힘들지'}]",https://arca.live/b/counterside/32663460,2021-08-25 10:28,136,0,0
32663185,신선한뉴비,세리나 성능 어때?,ㅈㄱㄴ,"[{'user': '잉딩', 'comment': '미친년'}, {'user': '전기톱추적자', 'comment': '재앙'}, {'user': 'ㅇㅇ, 221.160', 'comment': '엄마 뒤졌다던데'}, {'user': '액션쾌감', 'comment': 'https://arca.live/b/counterside/32651724'}]",https://arca.live/b/counterside/32663185,2021-08-25 10:22,144,0,0
32662959,암왕제군,이거 3000 초반대까지 내려오니까 세리나 잘 안 쓰네,아직 보급이 늦는 거 뿐인가,"[{'user': '응애나추룡아가', 'comment': '다이아는 가야 건틀렛에 좀 투자한 애들이지 플레까진 일반인이야'}, {'user': '시니즈', 'comment': '플래밑은 일퀘하는애들밖에엄서!'}]",https://arca.live/b/counterside/32662959,2021-08-25 10:17,92,0,0
32662691,직무유기,"세리나 고향 친구인데요, 솔직히 실망스럽습니다.",세리나가 좀 어리숙해도 착하고 개념있는 친구였는데이번에 로봇이랑 손잡고 인간 멸종을 외치는거보고 실망했습니다동창들도 다 실망했네요 세리나야 네가 누군진 모르지만 그렇게 살면 안된다,,https://arca.live/b/counterside/32662691,2021-08-25 10:10,58,0,0
32662236,Fractal,제발 다음주 빨리 와라,차라리 나유빈 출소시켜달라이볼브원 세리나는 카운터가 없다...근데 생각해보면 나유빈 퀸이 지배할듯 ㅋㅋㅋ,"[{'user': '암왕제군', 'comment': '박정자 없으면 나유빈 잡을만 할 거 같음'}, {'user': '쿠키부시기엄지로', 'comment': '왜? 이볼브원이 그래도 압도적아니야?  이볼브랑 밀리아같이 쓰니까 답없던데'}, {'user': 'Fractal', 'comment': '그니까 다음주에 밴먹고 나유빈 출소 하겠지'}]",https://arca.live/b/counterside/32662236,2021-08-25 9:59,92,0,0
32661422,5648#30152853,세리나 원피감 떴는데 그냥 이거 키울까?,아니면 지피감 근피감 광피감 뜰때까지 존버?,"[{'user': '쿠키부시기엄지로', 'comment': '원피감 좋은데'}, {'user': '씨에스', 'comment': '광피감 기다리다 메타 또 바뀔듯'}, {'user': 'DisplayPort', 'comment': 'ㅋㅋㄹㅇ'}]",https://arca.live/b/counterside/32661422,2021-08-25 9:33,130,0,0
32660783,히롬,플래1인데 세리나 보급률 개높네 ㅋㅋㅋ,세리나5 박정자 2 이수연1 시그마2 이런느낌 가끔씩 모네카도 보임..,"[{'user': '반갑노', 'comment': '(emoticon)'}, {'user': '히롬', 'comment': '(emoticon)'}, {'user': 'diqkf운터', 'comment': '박정자는 거의 포기해야 할듯\n다음주에 시그마 쓰는 공익 간다 ㅋㅋ'}, {'user': '히롬', 'comment': '(emoticon)'}, {'user': 'diqkf운터', 'comment': '(emoticon)'}, {'user': 'copo#63984080', 'comment': '엠뒤 박정자련 죽일카드가 생겼다는게 너무 고무적임 ㅋㅋ 아이신나'}]",https://arca.live/b/counterside/32660783,2021-08-25 9:14,255,0,0
32657687,더듬어민주당,각성 뭐 돌릴까,갖고 싶던 건 다 가졌고 나머진 좆도 안 꼴림...그나마 킹에 넣고 있다가 세리나 당했네ㅋㅋㅋㅋㅅㅂ각수연?홍어?,"[{'user': '1주년카붕이', 'comment': '각수연이 안꼴린다면 당장 비뇨기과를'}, {'user': '더듬어민주당', 'comment': '퀸마망이 개꼴리는데'}, {'user': '더듬어민주당', 'comment': '(emoticon)'}, {'user': 'SDAKAJUXIM', 'comment': '홍'}, {'user': 'ㅇㅇ, 182.228', 'comment': '누렁이'}, {'user': 'ㅌㅈ', 'comment': '서윤 수연중에 하면댈듯??'}, {'user': '더듬어민주당', 'comment': '존나 고민이노ㅋㅋㅋㅋ'}, {'user': '박하온', 'comment': '수연 솔찍히 이쁨'}, {'user': '아카살정실은예니카', 'comment': '건 위주면 각수연?'}]",https://arca.live/b/counterside/32657687,2021-08-25 6:05,147,0,0
32657453,ㅇㅇ#83447100,아 씨발 이건 세리나 안 주네 ㅋㅋ,까비아깝숑~,,https://arca.live/b/counterside/32657453,2021-08-25 5:40,91,0,0
32657425,ㅇㅇ#90362386,세리나 궁 처맞는 킹은 어떻게 되는 거임?,그냥 대머리 남캐 각힐 되는 거임?,"[{'user': '스트로베리샤베트', 'comment': ""플라잉 니그로'""}, {'user': '여긴배틀시티', 'comment': '어게인 공중디펜더 ㅋㅋㅋ'}]",https://arca.live/b/counterside/32657425,2021-08-25 5:38,114,0,0
32655861,ㅇㅇ#90362386,충동적으로 세리나 가챠 돌릴뻔,ㅋㅋㅋ 절대 안뽑지테포 모으면 공짜인데 왜 뽑아,,https://arca.live/b/counterside/32655861,2021-08-25 3:38,55,0,0
32655532,"ㅇㅇ, 58.236",지난주 박정자 추가 정가했는데 세리나 나옴,채용권 57개중 30개 태우고 나서야 재정신 컴백-> 물런 SSR 다른오퍼도 안나옴 세리나 획득 x테스크포스 포인트 벌이용 무료연 얼마나 남았나각시윤때 정가쳐야지 얌전히,,https://arca.live/b/counterside/32655532,2021-08-25 3:20,97,0,0
32655351,"ㅇㅇ, 58.236",세리나 박정자말고 킹 공익도 카운터 치나,킹은 내가 봐도 알겠는데 공익은 모르겠어공익은 노밴주간에 상대오퍼 세리나든 아니든 쓸 수 있을꺼 같기도 하고,"[{'user': '메사이어', 'comment': '공익이 박정자 의존도가 높아서'}, {'user': 'ㅇㅇ, 58.236', 'comment': '러쉬형 말고 공익포함 2각성 힘싸움 버전은 괜찮을꺼 같아서 글 저리 써본거\n공익+미니스트라 같은건 실제로 일부러 박정자 늦게 터트리기도 하잖아'}, {'user': '메사이어', 'comment': '힘싸움 하기엔 몰루킹이랑 이볼브원이 워낙 강한지라\n후열배치 안 터지면 어케 되긴 할듯'}]",https://arca.live/b/counterside/32655351,2021-08-25 3:12,107,0,0
32655285,가은이배빵,아 세리나 좋은거 맞아?,난 왜 잘모르겠지 그냥 박정자 시그마랑 비슷한 체감인데 버프제거도 타이밍잡기도 힘들고세리나 6렙에 광피감쓰는데 막 논란되고 욕먹고 수준의 성능인지는 잘모르겠음그냥 이볼브원이 사기아니야?,"[{'user': '클러스트', 'comment': '베로롱을 완벽하게 카운터치고 킹도 카운터 침'}, {'user': '가은이배빵', 'comment': '그렇긴한데 그것만보고 쓰기에는...좀 그냥 박정자가 더 좋은거 같은데'}, {'user': '메사이어', 'comment': '이볼브원은 사기가 맞고 세리나는 킹카운터'}, {'user': '마싯는감자칩', 'comment': '이볼브원 더 강하게 해줘서 체감이 더 큰듯'}, {'user': '가은이배빵', 'comment': '그건 좀 크긴하더라'}]",https://arca.live/b/counterside/32655285,2021-08-25 3:09,219,0,0
32654256,가은이배빵,세리나도 광피감이지?,부옵은 무조건 광피감 0티어 맞지?,"[{'user': 'Brune', 'comment': 'pvp는 광피감이 0티어'}]",https://arca.live/b/counterside/32654256,2021-08-25 2:26,108,0,0
32652852,ngcn,진짜 오퍼뽑은 하지말자.,300뽑 3세리나진짜 딱 100뽑에 하나꼴로 나오네 오퍼뽑 진짜 창렬하다.,"[{'user': '영원한라뉴비', 'comment': '300에 3개면 비틱수준같은데...'}, {'user': '포요오', 'comment': '항상 뜨겠지? 하고 돌리면 라플레이서 부사장만 ㅈㄴ 나옴 ㄹㅇㅋㅋ'}, {'user': 'dlo', 'comment': '비틱'}, {'user': 'ngcn', 'comment': '(emoticon)'}, {'user': '반갑노', 'comment': '비틱틱님 한판해요'}, {'user': 'ngcn', 'comment': '(emoticon)'}, {'user': '아키는아니키', 'comment': '비틱'}, {'user': 'ㅇㅇ, 220.117', 'comment': '잘뽑앗는데?'}, {'user': 'ngcn', 'comment': '(emoticon)'}, {'user': '천의지현', 'comment': '그런데 저거 원하는건 드럽게 안나옴. 멘션일때 다른거 노리고 해봣는데 멘션 드럽게 나와서 빡쳐서 끔.'}, {'user': '반갑노', 'comment': '(emoticon)'}, {'user': 'ngcn', 'comment': '난 멘션때 명함만뽑고 손절함'}, {'user': '천의지현', 'comment': '내가 순진했음. ssr보다 sr이 더 안나올줄 몰랐지. 그냥 명함으로 뽑으려고 한 sr인데...'}, {'user': '페로로로쉥', 'comment': '비틱이네 시발 누구는 200개 꼴아박아도 안뜨는데'}, {'user': 'ngcn', 'comment': '그래....미안...하다....'}, {'user': 'ㅐㄴ', 'comment': '그정도면 진짜 잘나온거임'}, {'user': '보리스#63017734', 'comment': '(emoticon)'}]",https://arca.live/b/counterside/32652852,2021-08-25 1:45,224,-9,0
32652026,카린웡,뒤늦게 이벤트 본 소감,챈 대문보고 누고? 이년은? 강간 마렵노했는데 부사장이었고 일러 미쳤노... 일러팀 게이들 따봉준다땡컨모네 트로피로 주노?안주면 참 그렇거든요?당장 줬으면 좋겠어릴리 알가슴 양손으로 주물주물 하고싶노세리나 게이 왕응디 양손으로 꽉 쥐고 흔드르라!모네엄마 모네아빠 보는 앞에서 ntr 이거 못참습니다!드라코 게이도 참 이뻤습니다.예아 스비 일러팀 참 수고 많았노,"[{'user': '마에스트로', 'comment': '(emoticon)'}, {'user': 'Ninomiya', 'comment': '(emoticon)'}]",https://arca.live/b/counterside/32652026,2021-08-25 1:26,248,2,0
32651978,마에스트로,박정자 저격하는 오퍼가 세리나라 그래,박사학위를 딴 SSR 이윤정이 저격했다면 모두들 수긍했을것...,"[{'user': '누소', 'comment': '(emoticon)'}]",https://arca.live/b/counterside/32651978,2021-08-25 1:25,94,1,0
32651895,umtyson,세리나가 박정자를 저격하니까,"정자를 저격..정자를 죽인다즉, 정관수술이라고 불러도 될듯","[{'user': '카이하베르츠29', 'comment': '(emoticon)'}]",https://arca.live/b/counterside/32651895,2021-08-25 1:23,88,3,0
32651538,프룸,님들아 진짜 큰일났음,라라 개사기 같은데세리나 뽑는다고 채용권을 다 써버렸어,"[{'user': '서리별2#59547846', 'comment': '(emoticon)'}, {'user': 'ㅇㅇ#25201098', 'comment': '왜 천장없는걸 먼저돌리지??'}, {'user': '글림픽', 'comment': '친구야 라라부터 뽑았어야지...'}]",https://arca.live/b/counterside/32651538,2021-08-25 1:15,99,0,0
32650558,영원한라뉴비,갑자기 또 세리나땜시 빡치네,아까 박정자 세리나가 조진다는거 듣고 눈돌아가서 채용권 80개 오퍼뽑 박았는데왜그랬지 시발...,"[{'user': '솔라스', 'comment': '(emoticon)'}, {'user': '마에스트로', 'comment': '(emoticon)'}]",https://arca.live/b/counterside/32650558,2021-08-25 0:55,160,0,0
32649805,정실부인은이수연,아 베로니카 창이 왜 부러졌나 했더니,세리나 때문이었구나 그럼 제 110렙 베로니카는 이제 어떻게되는거죠?,"[{'user': 'Javascript', 'comment': '버프금지일때는 그냥죽는거지'}, {'user': '정실부인은이수연', 'comment': '(emoticon)'}, {'user': '암왕제군', 'comment': '건유저는 점점 다 세리나쓰게 될 거고 그게 치명적인 캐릭은 모두 물러날듯'}, {'user': '정실부인은이수연', 'comment': '(emoticon)'}]",https://arca.live/b/counterside/32649805,2021-08-25 0:41,163,0,0
32649675,스트로베리샤베트,시그마 니가와로 이볼브덱 잘잡았는데 지금도 먹히나?,시그마타베로롱으로 이볼브덱 꽤 잘잡았었는데 세리나 나오고서도 되려나 모르겠네이프 기순이가 이볼브를 기가맥히게 때려잡아서 가능했던건데 세리나 때문에 이제는 몰?루,"[{'user': '솔라스', 'comment': '볼브에서 이프 기순 타이밍에 세리나 키면'}, {'user': 'xile#17342824', 'comment': '아직 쓰이긴 하는거같던데'}]",https://arca.live/b/counterside/32649675,2021-08-25 0:39,97,0,0
32649041,쿵쿵홍,솔직히 킹이 다시 퇴물이 된건 아님,시발 세리나 때문에 뒤졌다고?세리나 없찐인 나한테는 이볼브 원이든 킹이든 공익이든 개씹 좆같기만 함,"[{'user': '힐데져아', 'comment': '저 셋 안쓰는 입장에서 저 셋중에 제일 나은게 공익이 된게 시발 몇달전만해도 상상도 못할 사태네'}, {'user': '쿵쿵홍', 'comment': 'ㄹㅇ 그게 무서움'}, {'user': '힐데져아', 'comment': '라인전을 뒤흔드는 공익이 아니라 미야 궁마냥 라인전을 안하는 캐릭이 그것도 디펜더로 둘이나 나올줄이야 ㅋㅋㅋㅋ'}]",https://arca.live/b/counterside/32649041,2021-08-25 0:28,192,0,0
32648372,DisplayPort,박정자 픽업후 바로 세리나는 ㄹㅇ 악질임,시발ㅋㅋ 너무 대놓고 빨대 꽂는거 아니냐고..,"[{'user': '솔라스', 'comment': '(emoticon)'}, {'user': '가자미', 'comment': '(emoticon)'}, {'user': 'dlo', 'comment': '킹도 저번주 판매 아니었나? ㅋㅋ'}, {'user': 'DisplayPort', 'comment': '푸하하'}, {'user': 'ㅇㅇ#81071525', 'comment': 'ㄹㅇ 이럴수가 있냐'}, {'user': '힐데져아', 'comment': '나도이게좀 시발...'}, {'user': 'starseeker', 'comment': '이거 비슷한거 있지 않았나? 뭐 픽업하고 바로 다음에 카운터치는 캐릭 내서 반병신 만든 적 있었던 것 같은데 ㅋㅋㅋ'}, {'user': 'DisplayPort', 'comment': 'ㅋㅋㅋㅋ시그마/이프/야누스 였나 3중픽업 후 나유빈'}, {'user': 'starseeker', 'comment': '아 그래, 그거다 ㅋㅋㅋㅋ'}, {'user': 'starseeker', 'comment': '(emoticon)'}, {'user': 'sksnvoelsmc', 'comment': '장사치들 속셈에 당한거지 어차피 쟤들도 팔아먹는 놈들인데 착하게만 팔겠냐 ㅋㅋ'}]",https://arca.live/b/counterside/32648372,2021-08-25 0:18,224,6,0
32647833,가은이배빵,광피감vs지피감,박정자 광피감세리나 지피감뭐쓸꺼임?,"[{'user': 'bean', 'comment': '후'}, {'user': '가은이배빵', 'comment': '합성 시도나 해볼까?'}, {'user': '네모현#32744865', 'comment': '세리나가 압승.'}, {'user': '가은이배빵', 'comment': '그냥 합성해볼까'}, {'user': '네모현#32744865', 'comment': '아껴두셈. 세리나 리콜 될 수도 ㅋㅋ'}]",https://arca.live/b/counterside/32647833,2021-08-25 0:09,137,0,0
32646907,gkdhkdhk,오늘 비틱 좆되게 했노 ㅋㅋ,라라예거 단뽑비틱세리나 정가 부옵 광피감떴노 ㅋㅋ 차단 당할듯,"[{'user': '숲토끼', 'comment': '(emoticon)'}, {'user': 'bean', 'comment': '(emoticon)'}, {'user': '박희리씨', 'comment': '(emoticon)'}, {'user': 'ㅇㅇ#36099854', 'comment': '(emoticon)'}, {'user': '포요오', 'comment': '(emoticon)'}, {'user': '굽네바사삭', 'comment': '(emoticon)'}, {'user': '패턴', 'comment': '(emoticon)'}]",https://arca.live/b/counterside/32646907,2021-08-24 23:56,197,4,0
