index,user,title,content,comment,link,date,view,rate,comment_count
32122510,LAO,각힐 뽑아도됨?,각등   유나    각서윤    미니    에이미 이렇게있음 9만원주고 사기엔 아깝고 공익이랑 킹은 싫은데디펜더가 없음 ,"[{'user': '세인트케인', 'comment': '솔직히 각힐은 거의 그냥 골방노인네급임'}, {'user': '세인트케인', 'comment': '공익 안뽑으면 100%후회할걸'}, {'user': '으으윽', 'comment': '공익 뽑으셈.....'}, {'user': 'LAO', 'comment': '하~~~~~어쩔수없는건가...'}, {'user': '클러스트', 'comment': '꼴리면 ㄱㄱ 스킨도 복각한다'}, {'user': 'Blsa', 'comment': 'pve는 괜찮은 편이고 pvp엔 다른 디펜더에 비해서 많이 약함'}, {'user': '아이사타#51014657', 'comment': '걍눈감고 공익뽑으셈..,'}]",https://arca.live/b/counterside/32122510,2021-08-16T14:26:22.000Z,86,0,0
32122498,록파이,어차피 나 쫄작할때 쓸 캐릭 필요해서 에이미 리콜못함..,그래도 각성인걸..,"[{'user': 'diqkf운터', 'comment': '미니로 리콜하면 7쫄 됨'}, {'user': '록파이', 'comment': '1렙으로 주는거라 미니도 키워야하잖셈'}, {'user': 'diqkf운터', 'comment': '연협서 융합핵 기타등등 다 돌려주는데'}, {'user': 'diqkf운터', 'comment': '크레딧도'}]",https://arca.live/b/counterside/32122498,2021-08-16T14:26:12.000Z,74,0,0
32122410,Yeeeart#96727993,에이미 리콜을 왜 함 ㅋㅋㅋ,에이미가 없으면 리콜 안해도 되는데ㅋㅋㅋ아 나 좀 천재인 듯,,https://arca.live/b/counterside/32122410,2021-08-16T14:24:49.000Z,45,0,0
32122405,네모현#32744865,에이미 리콜하고 미니스트라 받을까,킹 / 공익 / 페미니스트라 / 퀸 없음.근데 에이미보다 페미니스트라가 더 쓰일곳이 많아 보이는데 ;,"[{'user': '핵융합건전지', 'comment': '미니 기채로 못뽑으면 맞는 듯'}, {'user': '유나펀치', 'comment': '미니 기채로 못먹으면 리콜해도 되긴 하지'}]",https://arca.live/b/counterside/32122405,2021-08-16T14:24:42.000Z,57,0,0
32122361,더워죽겠어,에이미리콜해서,"나공익or미니스트라 받기 어떰,,,,????건안함","[{'user': '세인트케인', 'comment': '너가 건공이면 걍 들고있는게 좋을지도?'}, {'user': '더워죽겠어', 'comment': '건관심업슴'}, {'user': '아티아티', 'comment': '건안하면 에이미-->미니스트라 바꿔먹는거 추천하지'}]",https://arca.live/b/counterside/32122361,2021-08-16T14:23:58.000Z,58,0,0
32122332,유나펀치,에이미 리콜 신중하게 하셈,에이미 분명 미니랑 비교되서 밀리는거지 절대 쓰레기는 아니야함부로 무지성 리콜했다가 이지수능지 하지말고,[],https://arca.live/b/counterside/32122332,2021-08-16T14:23:33.000Z,143,4,0
32122128,Handaress#77832622,내일 할것,에이미 리콜로 니미스트라 받기각유빈 기채 맛만 보기일러 개편된 스토리 정주행,,https://arca.live/b/counterside/32122128,2021-08-16T14:20:31.000Z,17,0,0
32121979,흐물흐물두부처럼말해요,에이미 무조건 리콜X 에이미 매드무비 보고가,[건틀렛]에이미 매드무비 보고가 <<클릭,"[{'user': '유나펀치', 'comment': '쌔긴 쎄다 ㅋㅋㅋㅋ'}]",https://arca.live/b/counterside/32121979,2021-08-16T14:18:27.000Z,55,1,0
32121782,ㅣlㅣlㅣlㅣ,난 에이미 5코엿음좋겟음,그럼 잘쓸텐데,"[{'user': '아티아티', 'comment': '6코 출격기=후열저격'}, {'user': '아티아티', 'comment': '4코 나이트+ 2코 킬러강이면 더잘잡을듯'}, {'user': '세인트케인', 'comment': '5코였으면 출격기도 없었을듯'}, {'user': 'ㅣlㅣlㅣlㅣ', 'comment': '이수연도 5콘데'}, {'user': '세인트케인', 'comment': '그 이후로 5코각성캐들 출격기 없잖음 퀸도 없고 미니도 없고'}]",https://arca.live/b/counterside/32121782,2021-08-16T14:15:29.000Z,64,0,0
32121723,유나펀치,에이미가 쓰레기는 아니지,애는 6코로 내놓으면 6~7코 값을 함그정도로 딜링 능력이 뛰어남근데 5코로 내놓으면 7코는 물론이고 8코값을 하는 얘가 또라이가 아닐까?,"[{'user': '클러스트', 'comment': '미니는 솔직히 8,9코임'}, {'user': '유나펀치', 'comment': '저게 캐릭터냐 ㄹㅇ'}, {'user': '느검마비아그라먹방', 'comment': '사실상 2코(스피라 포)'}, {'user': '유나펀치', 'comment': '역겨워'}, {'user': 'diqkf운터', 'comment': '에이미는 무난한 존재가 아니라 순식간에 판을 쥐어잡고 흔들 능력이 있음\n그냥 내면 5~6코값밖에 못할지 몰라도 그랩과 특수기만 잘 이용하면 순식간에 8코 9코어치를 뚝딱 해치움'}, {'user': '유나펀치', 'comment': '근데 미니는 그냥 내놓아도 7코값어치 하지 않냐'}, {'user': 'diqkf운터', 'comment': '서로 다른거지 에이미는 상황을 타는 하이 리스크 하이 리턴 캐릭터고 미니는 언제 어떻게 내든 밥값을 하는 로우리스크 캐릭터인거고'}]",https://arca.live/b/counterside/32121723,2021-08-16T14:14:31.000Z,152,6,0
32121701,클러스트,에이미 갑자기 튀어나오면 빡침,유나 였던것,,https://arca.live/b/counterside/32121701,2021-08-16T14:14:13.000Z,28,0,0
32121501,아이사타#51014657,에이미 성능이 말나올정도로 약한가?,당장 상대가 극스충 에이미 던져서 살벌한데미지로 전후열 다 갈아버리면 욕할 사람들 많을텐데.,"[{'user': '밥은먹고다니냐', 'comment': '각성캐 값은 해'}, {'user': 'ㅣlㅣlㅣlㅣ', 'comment': '뜬금없이 에이미 나와서 갈갈쇼 당하면 존내 빡치긴함'}, {'user': 'xile#17342824', 'comment': '6코값은 함. 이번에 스커덱 간접버프로 에이미 더 까다로워질거같은데'}, {'user': '지민새로이', 'comment': '에이미 출격기가 너무 유니크해서 대체 안대긴함'}]",https://arca.live/b/counterside/32121501,2021-08-16T14:11:14.000Z,87,0,0
32121290,아티아티,에이미 리콜을 고민중이시다면?(올컬렉아닌사람만),스나라기에는 존나 애매한 사거리pve에서 쓰이지도않는 똥찌꺼기(최근 패치방향이 pvp위주보다는 pve를 지향하는거같은 느낌)건에서는 가끔보인다만 예전 혼란기믹사라지고는 뒷열뽑아먹는데 6코는 비쌈(나이트+킬러강=6코)뭐해 안바꿔먹고 ㅋㅋㅋㅋㅋㅋㅋㅋㅋㅋㅋㅋㅋㅋㅋㅋㅋㅋ,"[{'user': '록파이', 'comment': '서윤이나 퀸 죽을 딜이면 에이미는 버팀'}, {'user': '아티아티', 'comment': '건 기준 에이미 뽑고 앞에 탱라인 있다고 가정해도 레인저랑 사거리 비슷비슷해서 딜버텨도 어차피 갈림'}, {'user': '지민새로이', 'comment': '이건좀 ㅋㅋ'}, {'user': '아티아티', 'comment': '에이미뽑고 1주일만 즐거웠다......'}, {'user': '지민새로이', 'comment': '걍 무지성 혼란이 즐거웠던거 아님??? 얘 출격기랑 딜 나름 각성값 하는데'}, {'user': '아티아티', 'comment': 'ㅇㅇ..그맛에쓰고 2주였나 벤쳐먹고 혼란기믹삭제됨\n나름 건하는편인데 애를 만난적은 손에꼽음'}]",https://arca.live/b/counterside/32121290,2021-08-16T14:08:28.000Z,121,-4,0
32121178,워렉,나도 솔직히 에이미 리콜할 생각은 없음,메카덱 유저라서 원래 안쓰긴 하는데그래도 도감 올컴플 욕심 때문에 뽑은거이기도 하니도감 때문에라도 리콜하진 않을듯,[],https://arca.live/b/counterside/32121178,2021-08-16T14:07:01.000Z,60,0,0
32121108,유나펀치,씨이발 다 스비 잘못이야,미니스트라 성능을 그따구로 내서다이브 난이도 올려버린게 잘못이라고에이미는 잘못없어,"[{'user': '늒네#86893131', 'comment': '아기에이미 잘자'}, {'user': '유나펀치', 'comment': '에이미는 애기야 지켜줘야해'}, {'user': 'Rhidelz', 'comment': '에이미보다 미니가 꼴려서 뽑는 사람들도 있지?않을까??'}]",https://arca.live/b/counterside/32121108,2021-08-16T14:06:10.000Z,60,0,0
32121070,영원한라뉴비,별로 에이미 리콜할 생각은 안드는데,혼란지랄떨때 선능은 아니지만전당 5 잘 밀어주고황급탄 보급 메인딜러에건에서도 퀸 학살자로 잘 쓰이고난 에이미 성능에 만족함,"[{'user': '암왕제군', 'comment': '에이미 황금탄보급에서 좋아?'}, {'user': '영원한라뉴비', 'comment': '힐데 에이미 공략 있는데 그걸로 잘 돌아지더라고\n다른거 하다가 함 터지고나선 바꿨는데 만족중'}]",https://arca.live/b/counterside/32121070,2021-08-16T14:05:37.000Z,42,0,0
32121062,ㅇㅇ#94801077,에이미가 자기 리콜하면 앞으로 각성캐 천장만 친데,알지?,,https://arca.live/b/counterside/32121062,2021-08-16T14:05:30.000Z,23,0,0
32121058,록파이,에이미 얼마나 이쁜데 참 사람들이 못됐구만,뭐든지 될수있는 그녀의 가능성이 안보이나요?,,https://arca.live/b/counterside/32121058,2021-08-16T14:05:25.000Z,28,1,0
32121052,페그오피난민,각성 에이미 뽑아?,나 저번에 군대 다녀와서 각 에이미 놓쳤는데이번에 복각하잖아근데 다음달에 각시윤 나온다고해서뽑아야할지 말아야할지 고민이야각성 에이미 빼고는 다른 각성은 다 있는데그런데 이번에 리콜한다고 해서 어찌해야할까각성 에이미 쓰는곳 없어?개인적인 생각 적어줘,"[{'user': '암왕제군', 'comment': '에이미 자체는 좋거든 근데 지금 상향평준화 되는 상황에 설정떡밥도 있는 각시윤이 평범할 거 같진 않은데'}, {'user': '페그오피난민', 'comment': '오 답변 고마워 참고 할께'}]",https://arca.live/b/counterside/32121052,2021-08-16T14:05:24.000Z,38,0,0
32120802,유나펀치,에이미 문학들 왜이리 맘아프게 해,씨발 마치 내가 다이브 하나때문에 에이미를 버리는 인성 박은 사장 같잖어,"[{'user': '도라에몽#87462610', 'comment': '너가 죽였어'}, {'user': '유나펀치', 'comment': '스비가 잘못된거야 미니스트라를 필수로 만들어버린게 잘못이라고'}]",https://arca.live/b/counterside/32120802,2021-08-16T14:01:49.000Z,51,0,0
32120782,아이사타#51014657,에이미 리콜 안할계획인 사람?,,[],https://arca.live/b/counterside/32120782,2021-08-16T14:01:35.000Z,87,3,0
32120776,이디스애호해,에이미 리콜 무의미한 이유,"""올각성 110 종신 오우너""","[{'user': '흐물흐물두부처럼말해요', 'comment': '열렬하게 갈채하는 가돌이콘이 업내요,,'}, {'user': '흐물흐물두부처럼말해요', 'comment': '열렬하게 갈채하는 가돌이콘이 업내요,,'}]",https://arca.live/b/counterside/32120776,2021-08-16T14:01:33.000Z,76,1,0
32120687,극한의가능충,난 에이미 리콜 안할거임,전당5 편안하게 깨려면 에이미가 최고임,,https://arca.live/b/counterside/32120687,2021-08-16T14:00:18.000Z,96,0,0
32120609,클러스트,에이미 애호해,그래서 에이미 기채써서 뽑아줌,,https://arca.live/b/counterside/32120609,2021-08-16T13:59:08.000Z,29,0,0
32120597,CracR#13947135,에이미 리콜 생각중인데 의견좀,"지금 없는 각성이 각등이, 나공익, 미니, 이볼브 원 이렇게 넷 이고미니랑 나공익 중에서 고민중인데 뭐가 나으려나","[{'user': '흐물흐물두부처럼말해요', 'comment': 'ㅁㄴ'}, {'user': '비염싫어', 'comment': '페미'}, {'user': '중국몽죄인', 'comment': '미니가 1순위고 나공익 에이미 교환은 좀 아까운듯'}]",https://arca.live/b/counterside/32120597,2021-08-16T13:59:03.000Z,68,0,0
32120448,flaw,에이미가 리콜되는 과정,"에이미가 눈이 뜬 곳은 차다찬 컨테이너 벨트 위였다.손은 수갑으로 묶여있었고, 발에 차진 족쇄는 바닥과 연결되어있어 움직일수가 없었다.일어났나?아이씨...뭐야 여긴넌 제압병?에이미의 앞에는 제압병이 있었다. 그도 손발이 묶여있었다.컨테이너 벨트는 쉼없이 앞으로 움직이고있었다.정확히는 제압병 258호야. 해고되는 258번째 제압병이거든해고라고?그래, 너 여기 어딘지....뭐 너같은 각성캐는 모르겠지여긴 해고되는 사원들을 처리하는 공장같은곳이야.일반적인 공장과 다른점은 우리가 개미만큼 작아보일 정도로 크다는거지.처리라고?그래, 컨테이너 벨트 끝에 도착하면말이야. 나는 여기 단골이거든너는 각성캐인데 여길 왜왔어? 무슨 잘못을 저질렀는데.........사장이 나를 버렸다고? 너가 여기있으면 버려진거지. 뭐아니야, 이건 뭔가 착오가 있는거야나랑 종신계약도 했다고, 사장이 나를 버릴리가 없어쿵쿵이 소리는 뭐야...?직접 보는게 빠를걸, 앞에 있는 하운드 92호를 봐봐하운드를 실은 판이 잠시 멈추고, 이내 위에서 강철로 된 피스톤이 내려와쾅-콰지직---탱크가...완전 찌그러졌어....압축과정이야. 완전 뭉게버리는거지싫어....살려줘....죽고싶지않아.....내 요요...요요가 어딨지?너는 여기 처음 온거지? 뭐, 처음이면 조금 아플 수도 있쾅제압병을 완전히 뭉게버린 그것은, 천천히 에이미의 위로 향해 다가왔다.아이건 꿈일거야.살려줘죽고싶지않아그 사람은 채용권도 들이부었고종신계약 도장도 찍었다고그런 사장이 나를 버릴리가 없어버릴리가 없는데왜파직미니스트라, 반갑네우리 회사에 온 걸 환영한다네그래, 나도이제야 제 자리를 찾았구나정말 다행이야. 자네가 없어서 다이브를 못깨고있었는데 마침 아주 좋은 제안이 들어와서말야후훗, 그럼 이제 뭐부터 하면되지?우선 종신계약부터 하자고, 미니스트라======성능에 굴복하지않을에이미단을 모집함밑에 일러는 창작탭에서 주웠어",[],https://arca.live/b/counterside/32120448,2021-08-16T13:56:57.000Z,850,56,0
32120341,암왕제군,에이미 문학 뭐야,아니 리콜 못하게 하려고 진짜;,,https://arca.live/b/counterside/32120341,2021-08-16T13:55:39.000Z,28,0,0
32120204,LastChance,2각 계정 가질 늅 구함,에이미 리콜 듣고 계정 한명 줄려고 글씀창고에 500일 쓰알 선택권 하나있고채용권 40개? 정도 있던걸로 기억하고기채권 1뽑할 양만큼 있던걸로 기억함참고로 장비는 없다고 보면됨네이버 계정이고 아마 넥슨연동은 안했?을걸계정 가질 뉴비에게 원하는것1.협력사해줘 응애2.원하는 각성 아무거나 1뽑 돌리고 인증하기내일 오후 5시?에 마감하고 밤 11시에 추첨시작함,[],https://arca.live/b/counterside/32120204,2021-08-16T13:53:45.000Z,77,3,0
32120064,베로니카#38448647,"주인님, 오늘 숙제는 전부 끝내셨나요?","오늘 평안한 하루 보내셨을까요 주인님?드디어 오래 기다렸던 1.5주년 패치가 찾아오게 되었네요.점검은 오전 8시 ~ 오후 2시까지 총 6시간동안 이루어지는 점 참고해주세요.오늘은 대규모 업데이트인 만큼, 살짝 세세히 알려드리겠습니다그럼 어디 대망의 패치노트를 한번 알아보러 가볼까요?- 사옥/본사 UI 개편, 튜토리얼 추가, 로비 UI 변경▶기존 ‘본사’에 포함되어있던 시설들이 사옥 내부로 이전됩니다. ( 연구소, 공방, 격납고, 사장실 )▶기숙사동은 로비와 기숙사로 이루어져 있습니다.▼기숙사 확장 조건▶미니맵 또는 각 방 내부에서 [사원 배치] 버튼 터치 시, [사원 배치 모드]로 전환되어 배치할 사원을 선택할 수 있습니다.▶인테리어 아이템은 상점에서 구매 가능하고, 배경, 벽지, 바닥 아이템은 1회만 구매해도 여러 기숙사에 중복으로 사용 가능하지만,일반 가구 아이템은 필요한 개수만큼 구매가 필요합니다.▼가구 패키지 상품▶로비 또는 기숙사에 배치 중인 사원들은 일정 시간에 걸쳐 애사심 게이지가 충전됩니다.▼환경 점수별 애사심 완충 시간▶로비 또는 기숙사 내부 [교류] 버튼을 터치해 다른 사장님들이 보내준 명함을 확인할 수 있으며, 명함 터치 시 해당 사장님의 프로필을 자세히 볼 수 있습니다.▶또한, [랜덤 사옥 방문] 버튼으로 다른 사장님들의 사옥에 방문 가능합니다.▶사옥/본사 UI가 개편됨에 따라 튜토리얼이 추가됩니다.시스템 개편- 유닛 드랍/해고 정책 개편 (강화 이식 삭제 포함)▶강화 이식 전용 사원들의 해고 시 크레딧 획득량이 증가합니다.▼변경량▶강화 이식 시스템의 삭제로, N등급 유닛의 드랍 확률이 대폭 감소합니다.▶R등급 사원 드랍 확률은 전역, 전투에 관계없이 이터니움에 비례한 기대 값을 갖도록 평준화됩니다.- 레벨 디자인 개편▶카운터사이드의 시스템 변경 대응 및 초반부 적응도 개선을 위해 초반부 레벨 디자인이 개편됩니다.▼언락 조건 변경▶일부 컨텐츠의 최초 클리어 보상이 변경됩니다.▼변경 목록※언더 컨트롤은 EP.1 의 마지막 컷씬 확인 후, 획득 가능합니다.▶일부 스테이지의 구성이 변경 됩니다.▼변경 목록※EP.1 ACT.1~ EP.2 ACT.1 까지의 전반적인 스테이지 레벨이 전투 경험에 맞춰 조정되었습니다.▶기존에 서윤 유닛의 고정 지급이 삭제되고, 30회 이내로 SSR을 확정적으로 얻을 수 있는 신규유저 특별 채용이 추가됩니다.( 기존 유저도 진행 가능 )- 채용 시스템 개편▶N등급 사원이 [파견 채용], [선별 채용] 외의 채용에서 더 이상 등장하지 않습니다. ( R, SR등급 사원 일부 포함 )▼채용에서 제외된 SSR 사원의 해금 조건 및 구매처▼수시 채용 확률▼수시 채용 목록▶[샤오린], [카일 웡], [마야], [최이나], [보미] 사원이 선별 채용에서 더 이상 등장하지 않습니다.-  협력사의 명함 수급 방식 개편▶협력사가 자신의 지원 소대 사용 및 자신이 협력사의 지원 소대 사용 시 더는 [협력사의 명함]을 지급하지 않습니다.▶지원 소대 사용 및 명함과 관련된 미션 일부가 수정됩니다.▼변경 목록- 전투 공식 수정- 명함 상점/건틀렛 시즌 포인트 상점 신규 상품 추가▼명함 상점▼건틀렛 시즌 포인트 상점시스템 추가- 신임 사장님 우대 채용▶30회 내에 SSR등급 사원을 획득할 수 있는 신규 채용이며 1회 채용에 100쿼츠가 소모되고, SSR등급 사원을 획득하면 해당 채용은 즉시 종료됩니다. ( 기존 유저 진행 가능 )- 파견 채용 추가▶파견 채용은 [협력사의 명함]으로만 진행 가능하며, 1회 채용에 협력사의 명함 50개가 소모됩니다. ( 태스크플래닛 포인트 미지급 )▼파견 채용 목록- [육익 에이미 퍼스트윙] 리콜 시스템 추가▶관리부에서 보유 중인 [육익 에이미 퍼스트윙]을 선택해 리콜을 진행할 수 있습니다. 단, 2021/8/17 업데이트 이전 획득한 [육익 에이미 퍼스트윙]만 리콜이 가능합니다▶리콜 진행 시, [육익 에이미 퍼스트윙]을 대체할 각성 SSR 사원을 선택할 수 있습니다.▼각성 SSR 사원 목록※리콜 완료 후 취소가 불가합니다.- 알파트릭스 이노베이션 셋업 [챌린지 모드] 추가▶8/17(화) 점검 후 ~ 8/31(화) 오전 4시까지 진행됩니다.▼구성▼보상 안내- 전용장비 제작▶[공방] > [제작 시설] > [전용장비] 탭에서 제작이 가능하며, [알파트릭스] 커스텀 금형 제작을 위해서는 [고성능 SoC]가 필요합니다.▼제작 가능한 전용 장비 리스트- 유닛 밸런스 패치▶밸런스 패치 대상은 [이수연], [에스테로사 드 슈발리에], [타입: 펜릴 유미나], [샤오린], [프레데릭 도마], [나나하라 치나츠], [케이시 빈즈],[제인 도우], [토미 더 다이하드], [뉴 디트로이트] 입니다.▶자세한 내용은 아래를 확인 부탁드립니다.https://arca.live/b/counterside/32096511?p=1채용 변경 사항- 각성 사원 전원 복각▶확정 채용 대상은 [타입: 지크프리트 힐데], [타입: 펜릴 유미나], [에이스 오브 윙즈 이수연], [솔라 코덱스 유나 스프링필드], [육익 나유빈], [얼터그레시브 서윤], [리플레이서 퀸], [미니스트라], [육익 에이미 퍼스트윙], [리플레이서 킹] 입니다.- 1.5주년 기념 우수 인재 특별 채용 진행▶채용 유닛은 [주시영], [알렉스], [에델 마이트너], [옌 싱 란체스터], [이유리], [엘리자베스 팬드래건], [이디스 트윈즈],  [나나하라 치나츠]이며,이벤트 기간 동안 매일 10회씩 총 150회의 무료 채용이 가능합니다.이벤트- 1.5주년 기념 이벤트 미션 이벤트 진행▶8/17(화) 점검 후 ~ 9/7(화) 오전 4시까지 진행됩니다.- 1.5주년 기념 감사제 출석 이벤트 진행▶8/17(화) 점검 후 ~ 9/16(목) 오전 4시까지 진행됩니다.- 하림이의 이모티콘 선물 이벤트 진행▶8/17(화) 점검 후 ~ 9/19(일) 오후 1시 59분까지 진행됩니다.▶플레이 미션에 따라 보상을 획득할 수 있으며, 카카오톡 이모티콘은 참여 대상자 중 선착순으로 지급됩니다.- 전체 스킨 복각 및 패키지 판매 안내▶8/17(화) 점검 후 ~ 9/6(월) 오후 11시 59분까지 전체 스킨이 복각 판매됩니다.▶1.5주년 기념 무료 선물을 제공합니다.▼1.5주년 기념 무료 선물※해당 선물은 [패키지 상점] > [1.5주년 특별 STEP-UP 패키지] 탭에서 무료로 제공합니다.▼판매 패키지 목록격전지원 정식 시즌 9차▶8/17(화) 점검 후 ~ 8/24(화) 오전 4시까지 진행됩니다.▶출현 보스는 각각 [모더레이터 TYPE.A], [타이런트 아머] 입니다.컨소시엄 협력전 시즌 4 진행▶8/18(수) 낮 12시 ~ 10/11(월) 낮 12시까지개선 및 오류 수정자세한 내용은 아래 링크를 참조바라며,https://arca.live/b/counterside/32096511?p=1후, 쓰는 동안에는 즐거워서 몰랐는데 쓰고 나니까 정말 기네요.긴 만큼 분명 주인님께 즐거운 이벤트가 되겠죠? 저도 덩달아 즐겁네요.그럼 오늘 밤은 푹 주무시고 내일 아침에 인사드리겠습니다.내일이 기다려지네요, 주인님.",[],https://arca.live/b/counterside/32120064,2021-08-16T13:52:05.000Z,72,9,0
32119714,하아아아아아암#92052673,에이미 리콜 선택존 추천좀,퀸 vs 각유빈각성은 저 2개 + 이볼브원 빼고 다 있음협력전에 각수연빼고 퀸 넣으면 딜좀 오를까?,"[{'user': '하아아아아아암#92052673', 'comment': '기채는 각시윤까지 존버예정이라 못씀..'}, {'user': '눈꽃1', 'comment': '리콜하게?'}, {'user': '하아아아아아암#92052673', 'comment': '퀸이 낫지않을까'}]",https://arca.live/b/counterside/32119714,2021-08-16T13:47:21.000Z,48,0,0
32118510,ㅐㄴ,"??? : 사장님, 나 보고 싶어서 온 거야?","뭐? 리콜? 그게 뭐야?...아 그러니까 나는 해고 하고 다른 사람을 고용한다는 말인거지?그래, 뭔가 이상하다고 생각했어사장님이랑 나는 서로 적인데, 이런 나를 사원으로 고용하다니 이상하잖아뭐, 잠깐이지만 재밌었어그럼 안녕, 사장님다음에 만나면 그때는 내가 직접 죽여줄게...뭐야, 이 내가 간다는데 붙잡지도 않는거야?취소... 죽인다는건 취소할게...그럼 나 간다?나 정말 가..?...사장님...나 여기 있으면 안될까?그 바보안대 처럼 작전에 별로 못나가도 괜찮아!사무 임무도 시키면 땡땡이 안치고 열심히 할게!사장님 옆에만 있게 해줘...제발......하하... 방금 한 말 다 농담이야그럼 나 갈게다음에 만나면 좋아한다고 말할게위대하신 관리자님과 육익의 에이미가 그렇고 그런 사이라...사원들이 알게 되면 그 표정들이 볼 만 하겠는데?그러니까 꼭... 다음에 다시 만나...관리자님 사랑했ㅇ... 안녕",[],https://arca.live/b/counterside/32118510,2021-08-16T13:30:44.000Z,120,9,0
32115004,ㅇㅇ#35983199,에이미 리콜 해야겠음..,각서윤 각에이미 각미니 이렇게 있는데각유나로 바꿔먹고 뽑기는 각퀸이나 각유빈 시도하려는데 어떰?!,"[{'user': '두부앙', 'comment': '각유나 9.5만원에 사면되는거아님?'}, {'user': 'ㅇㅇ#35983199', 'comment': '돈없어...'}, {'user': 'room126#12504202', 'comment': '저라면 9만원에 각유나 사고 주화로 퀸을 노린 다음에 뽑기로 각유빈을 노리겠습니다'}, {'user': 'ㅇㅇ#35983199', 'comment': '돈이 없어요......'}]",https://arca.live/b/counterside/32115004,2021-08-16T12:39:49.000Z,143,0,0
32114472,펩시는좀그래#33798226,와 뉴비 에이미 리콜하고 유나 받을려고했는데,에이미 리콜 안하고 유나 9.5에 사면 유나도 가지고 에이미도 갖는거잖아?,[],https://arca.live/b/counterside/32114472,2021-08-16T12:31:40.000Z,100,0,0
