index,user,title,content,comment,link,date,view,rate,comment_count
32831745,4G5G,"""씨발이 빨리 리콜해서 나유빈을 받아라...""","292이지수""시간 얼마 안 남았다....""""이렇게 쓰면 돼, 대장??""공익""잘하셨습니다.""""덧붙여서 혼란도 없어진 놈은 얼른 갖다 버리고 대적자 받아라. 이렇게도 써주세요.""이지수""알았어, 대장!!""공익""역시 가이드 영상에는 이런 게 올라가야죠.""에이미""미친놈들아!!""""무슨 글을 올리는 거야!!""공익(씨발 들켰네)""...""""저는 아무짓 안했습니다만?""에이미""대장이 시킨 거잖아!!""""빡통이는 리콜이 뭔지도 모른다고!!""이지수""리콜 뭔지 아는데.""""바보 취급 하지마!!""에이미""....""""뭔데?""이지수""이거잖아!!""""얘가 쓰는 거!!""에이미""그거 아니라고!!""이지수""아니야??""""얘 기술 이름 리콜인데??""에이미""그러니까 같은 말이어도 다른 뜻이라고!""""니 이름이 이지수라고 easy 水, 쉬운 물은 아니잖아!""이지수""내 이름이 그런 뜻이었어??""에이미""그러니까 아니라고!!""공익""진정하세요, 에이미 양.""""지수 씨가 아무 것도 모르고 올린 글입니다.""""너그럽게 용서하고 넘어가시죠.""에이미""시켜놓고 개소리 하지 마!!""공익""...""""자꾸 시끄럽게 굴면 문 안 열어 줍니다?""""펜릴 전대 가서 야간 다이브 굴러 보실래요??""에이미""...""""개새끼야!!!""모음집1~100화101~200화201화~[대회] 모네 자유 창작 대회 '모네상스'를 개최합니다 [대회] {메이드 앤 비키니} 대회를 개최합니다:) ","[{'user': 'Cabala', 'comment': '펜릴 야간 다이브 ㅋㅋㅋㅋㅋㅋ'}, {'user': '박하온', 'comment': '(emoticon)'}, {'user': 'ㅇㅇㅇ#78472433', 'comment': '쉬운 지수뷰지 좀 꼴리네'}, {'user': '헤으응#69384400', 'comment': '이지뷰지 ㄷㄷ'}, {'user': 'ㅇㅇㅇ#78472433', 'comment': '금방 가버리는 허접뷰지..'}, {'user': '소나기나기', 'comment': '(emoticon)'}, {'user': 'ㅇㅇ#22198827', 'comment': '(emoticon)'}, {'user': 'xile#17342824', 'comment': '(emoticon)'}, {'user': '천공분열', 'comment': '(emoticon)'}, {'user': '힐데져아', 'comment': '이지수 틀타하노 ㅋㅋㅋㅋ'}, {'user': '4G5G', 'comment': '공익이 하는 걸 봤을 뿐...'}, {'user': '힐데져아', 'comment': '역시 30대 후반ㅋㅋ'}, {'user': 'Asu', 'comment': '스타는 인정이지'}, {'user': '하빌밀런', 'comment': '(emoticon)'}, {'user': 'flaw', 'comment': '아직도 비밀번호 몰라?'}, {'user': 'ㅇㅇ#53674895', 'comment': '아직도 밖이야?ㅋㅋㅋㅋㅋㅋ 씨발이 고생하네 ㅋㅋㅋㅋㅋㅋㅋㅋㅋㅋㅋㅋㅋㅋㅋㅋㅋ'}, {'user': '4G5G', 'comment': '아냐 문 열어줘서 들어오긴 들어옴...\n다음부터 안 열어준다는 의미로..'}, {'user': 'ㅇㅇ#53674895', 'comment': '아 ㅋㅋㅋㅋ 그런거였구나 ㅋㅋㅋㅋㅋㅋㅋㅋㅋㅋㅋ'}, {'user': 'ㅇㅇ, 220.84', 'comment': '빡통이 리콜로 이상한거 받을거 같네 ㅋㅋ'}, {'user': 'ㅇㅇ#78677898', 'comment': '공익 ^^ㅣ발 뻔뻔한거 봐ㅋㅋㅋㅋㅋㅋ'}, {'user': '시나리', 'comment': '진짜 이지수 개귀엽네ㅋㅋㅋㅋㄱㄲ'}, {'user': '으으윽', 'comment': '50층에선 쓸모도 없는 물렁디펜주제에'}, {'user': '꼬리를문뱀#24619419', 'comment': '(emoticon)'}, {'user': '겨누스야드랑이', 'comment': '공익 쓰레기네ㅋㅋㅋㅋㅋㅋㅋㅋㅋㅋㅋㅋㅋㅋㅋㅋ'}, {'user': 'DUFOJE', 'comment': '(emoticon)'}, {'user': '타이탄리전', 'comment': '(emoticon)'}, {'user': 'ㅇㅇ, 116.33', 'comment': '쉬운물 ㅋㅋㅋㅋ'}, {'user': '공원의수호자#44549237', 'comment': '(emoticon)'}, {'user': '무적그랜저', 'comment': '(emoticon)'}, {'user': '신선한라임', 'comment': '그와중에 아직도 안알려줬네'}]",https://arca.live/b/counterside/32831745,2021-08-27 21:06:40,1284,41,30
32829118,시금치를싫어하는시그마,미니스트라 1각성 전당 4 공략,"함선은 엔터 사용몰루도 상관없을텐데 아무래도 장기전이니까 버프 효과 오래 못갈거같아서 영구버프인 엔터썼음룸 1특이점은 딱히 없고 디펜더가 막혔기 때문에 탱포터 레지나를 썼다는 거 정도?룸 2,3 (세팅 동일)마지막 로자리아 자리에 에이미,서윤,퀸 등의 다른 각성캐나 혹은 다른 일반 딜러가 있다면 그 캐릭터를 넣어도 무방함, 1각성 컨셉을 맞추기 위해 로자리아를 넣음룸4세라펠은 다른 디펜더로 대체가 가능함 잘 버텨주기만 한다면 ㅇㅇ 구관총 신지아도 다른 2코 딜러, 3코 딜러/서포터로 대체가 가능함대망의 룸5탱커들을 쌓아 놓고 서포터로 무한부활시키는 전략오퍼는 김하나, 시그마를 사용했는데김하나는 짧은 발동 조건과 코스트 펌핑으로시그마는 쉬운 발동 조건과 보호막을 통한 약간의 생존력 증가를 위헤 사용함둘 모두 다른 적절한 오퍼로 바꿔도 상관없음 발동시킬수만 있다면템세팅은미니 대적자 스충분탕 초전도 체방세라펠 초전도 방방양하림 단테 스충 (+전용장비)에블린 초전도 스충카일 초전도 스충 (+전용장비)가은 초전도 공속 (+전용장비)로자리아 스펙트럴 불렛(명중) 체인(치명)에델 데빌 공속구관총 초전도 공속신지아 커리지메이즈 체체이 덱의 장점은 독보적으로 낮은 장비 세팅임메스충 허메골골 이런거 필요없고솔직히 대적자는 보급장비니까잡스충 3셋 잡공속 3셋 방어(체력,회피포함) 3셋 전당 1셋이것만 있으면 충분함대신 캐릭풀이 좀 빡세긴한데... 그래도 다들 필수캐 라인이니까 어느 정도는 구비하고 있을거임 1각성이기도 하고다들 전당4 파이팅하자!!!당연히 풀오토고 클탐은 대충 이정도","[{'user': '릴리는여고생', 'comment': '(emoticon)'}]",https://arca.live/b/counterside/32829118,2021-08-27 20:27:23,102,2,1
32822840,ㅇㅇ#34925052,약쟁이 에이미,,,https://arca.live/b/counterside/32822840,2021-08-27 18:50,36,0,0
32821327,ThatYoU,각성 에이미 뽑을 필요없제?,ㄹㅇㅋㅋ,"[{'user': '클러스트', 'comment': '(emoticon)'}, {'user': 'diqkf운터', 'comment': '안뽑으면 게이'}, {'user': 'ThatYoU', 'comment': '기채업서'}, {'user': 'diqkf운터', 'comment': '게이야...'}, {'user': 'ThatYoU', 'comment': '불쌍하지?'}, {'user': 'diqkf운터', 'comment': '응 완전'}]",https://arca.live/b/counterside/32821327,2021-08-27 18:25:39,56,0,6
32820290,보리스#63017734,난 병신이야..,각시윤 나오는데 100스택 못참고 퇴물에이미 뽑았어..날 병신이라고 불러줄래..?,"[{'user': 'diqkf운터', 'comment': '물론이지... ""꼴잘알""'}, {'user': 'diqkf운터', 'comment': '그리고 에이미 퇴물 아님'}, {'user': '보리스#63017734', 'comment': '(emoticon)'}]",https://arca.live/b/counterside/32820290,2021-08-27 18:09:08,33,0,3
32818860,보리스#63017734,에이미 뽑을까 말까??,스택 100/150 이라 뽑을수는 있는데뽑으면 각시윤 거의 포기해야함..각시윤 9.14쯤 나온다는데 몇주간 팔까?대충 예상가는사람??에이미도 뽑고싶고 각시윤도 갖고싶은데..선택장애 판단좀 도와주라ㅜ,"[{'user': 'diqkf운터', 'comment': '오늘 개노 올라올 가능성도 있으니 기다리고 판단'}, {'user': 'ㅇㅇ#39235734', 'comment': 'ㅋㅋㅋㅋㅋㅋ 에이미 뽑고 각시윤 10뽑으로 뽑으면 되지'}]",https://arca.live/b/counterside/32818860,2021-08-27 17:46:34,32,0,2
32818671,ㅇㅇ#99123492,어 제가 에이미 분탕때 탈출한 사람인데요,가으니 광고보고 들와봄이제 분탕 안침?겜 할만 함?,"[{'user': 'ㅇㅇ#85245304', 'comment': '(emoticon)'}, {'user': '비질란테', 'comment': '지금 사료도 뿌리고 수영복도 팜\n라니가 생방송도 함'}, {'user': 'ㅇㅇ#99123492', 'comment': '라니가 생방송을 할리가 없는데..?'}, {'user': '비질란테', 'comment': '한번 더 바뀌어서 그럼\n카사 유튜브 채널에 영상들 많이 올라옴'}, {'user': '나는빡빡이다', 'comment': '(emoticon)'}, {'user': '영원한라뉴비', 'comment': '지금은 분위기 많이 좋음'}, {'user': '앤뱃살', 'comment': '(emoticon)'}, {'user': '소나기나기', 'comment': '(emoticon)'}, {'user': '주블', 'comment': '건틀렛 안 할 거면 ㄱㅊ'}, {'user': '서묘', 'comment': 'https://youtu.be/dBdzHCCQQLk 쇼케이스 한번 보고와'}, {'user': 'diqkf운터', 'comment': '에이미 변경후에 혼란 개씹련에서 그냥 메타캐로 바뀜'}, {'user': '스튜비급강하폭격기', 'comment': '(emoticon)'}, {'user': 'Huan#98504946', 'comment': '분위기엄청좋음 1점대까지내려갔다가 3점대 까지 복귀함 쿠폰도 많이 뿌림'}, {'user': 'Huan#98504946', 'comment': '분위기엄청좋음 1점대까지내려갔다가 3점대 까지 복귀함 쿠폰도 많이 뿌림'}]",https://arca.live/b/counterside/32818671,2021-08-27 17:43:39,104,7,14
32807710,사무라이칼,에이미좋은지 잘 모?루겠음,에이미  제값하는거 못본거같음차라리 밴된 홍어가 더 도움이 되는거 아닐까 싶었음,"[{'user': '소나기나기', 'comment': '잘라먹기용인데 지금은 이볼브원하고 타워가 깽판쳐서 힘듬'}, {'user': 'SDAKAJUXIM', 'comment': '초전도치피셋주면 말도안대게쎔 평타가 무조건치명타라서'}, {'user': '시이시이', 'comment': '궁 쓰기만하면 이새끼가 젤쌘거같던데'}, {'user': 'diqkf운터', 'comment': '홍어보단 나을걸 워낙 딜량이 세서'}]",https://arca.live/b/counterside/32807710,2021-08-27 14:35:37,65,0,4
32806482,달고나좋아,다음주에 에이미 뽑개 해주세요 ,지금 보내면 언제 올지 모르갰네 ,"[{'user': '메론빵#23632297', 'comment': '(emoticon)'}, {'user': '달고나좋아', 'comment': '(emoticon)'}]",https://arca.live/b/counterside/32806482,2021-08-27 14:11:44,51,0,2
32805808,0115,에이미 그냥 뽑지말까,얘만뽑으면 풀각계인데 최단퇴 소리들으니까 뇌가 팍식어버리노,"[{'user': '주블', 'comment': '퇴물 아닌데 무슨 소리하노'}, {'user': '비질란테', 'comment': '주시윤 존버ㄱ'}, {'user': '소나기나기', 'comment': '각시윤 존버하자'}, {'user': '앗발꿍', 'comment': '다있다고 자랑하노'}, {'user': '0115', 'comment': '자랑할것도 많노..'}, {'user': 'MMT', 'comment': '잘쓰고 있는데 최단퇴는 아닌거같음'}, {'user': 'spu', 'comment': '퇴물 절대 아님'}, {'user': '0115', 'comment': 'ㅇㅋ뽑아야겠다 다들ㄱㅅ'}]",https://arca.live/b/counterside/32805808,2021-08-27 13:58:18,94,0,8
32799728,flaw,이거 살까?,각디펜 힐데있고 각스나 에이미있는데,"[{'user': '소나기나기', 'comment': '둘다 없으면 사자'}, {'user': 'flaw', 'comment': '킹퀸 둘다 애매하다니까 스킨살까고민되는데'}, {'user': '소나기나기', 'comment': '각디펜은 많을수록 좋고 퀸은 건말고도 많이 쓰이니까\n근데 스킨은 못참는데'}, {'user': 'diqkf운터', 'comment': '없으면 사고'}]",https://arca.live/b/counterside/32799728,2021-08-27 11:54:03,58,0,4
32789845,도도코76#15451839,복귀했는데 6장에서 스토리 막혀가지고 육성만함,에이미 리콜 된다 그래서 미니로 바꿀려고 ㄱㄱ?,"[{'user': '독호메', 'comment': '괜찮음'}, {'user': '도도코76#15451839', 'comment': 'ㅇㅋ'}, {'user': '각성김철수', 'comment': '에이미는 혼란 없어지고 광역 스봉 극딜러로 바뀌었음\n미니스트라 유틸성이 넘사라 추천함'}]",https://arca.live/b/counterside/32789845,2021-08-27 04:30:32,98,0,3
32786848,그런방안입니다,응애 조합 짜 줘,에이미 저년은 배째고 유나 얻으라던데 걍 추출만 누르면 선택권으로 바뀌는거야??,"[{'user': '펭귄국밥', 'comment': '리콜누르면 원하는각성으로바꿀수있음'}, {'user': '그런방안입니다', 'comment': '조합도 부탁해!'}, {'user': '갤쁘리', 'comment': '(emoticon)'}, {'user': '펭귄국밥', 'comment': 'ssr은이게끝이야?'}, {'user': '그런방안입니다', 'comment': '응 아직 무슨 선택권은 안씀'}, {'user': '펭귄국밥', 'comment': '스토림미는데 큰건없고 탱딜만 하나씩넣어두면됨'}, {'user': '그런방안입니다', 'comment': '탱캐릭은 없는디 암거나 넣고 각서윤에 모든거 몰빵해서 하면대?'}, {'user': '펭귄국밥', 'comment': '기본적으로 탱딜딜딜탱딜딜딜 이렇게 소대를만듬'}, {'user': '펭귄국밥', 'comment': '2소대굴린다고치면 스피라 서윤에 베로니카 미니이렇게두개굴리면되겠다'}, {'user': '그런방안입니다', 'comment': '에이미는 배 째지마?'}, {'user': '펭귄국밥', 'comment': '에이미배째고 유나로바꾸면 소대하나가 유나로도 돌아가긴해'}, {'user': '그런방안입니다', 'comment': '겜 너무 어렵군..'}, {'user': '펭귄국밥', 'comment': '나중컨텐츠인 전당공략글에 유나많이쓰니깐 유나로바꿔도될듯? 유나가 쓰이는곳이많아서'}]",https://arca.live/b/counterside/32786848,2021-08-27 02:12:16,83,0,13
32784174,Irosis,다음 110찍을거 추천좀,위에 홍어 공익 미니 에이미 알렉스는 110임,"[{'user': '역시난', 'comment': '이수연'}, {'user': 'Irosis', 'comment': 'ㅇㅋ 부사장 ㄱ다'}, {'user': 'ㅇㅇ#23344063', 'comment': 'z미니'}, {'user': 'ㅇㅇ#75999277', 'comment': '각성은 다 해야지'}, {'user': '정실부인은이수연', 'comment': '미니'}]",https://arca.live/b/counterside/32784174,2021-08-27 01:11:37,64,0,5
32783087,씨에스,저번주까지만 해도 -건-에 재미붙였는데 다시 접음,"박정자 오퍼 광피감이 우연히 떠서건 챈에서 조합 좀 찾아보고 하니까좀 티어 올라가더라진짜 재미 붙이기 일보 직전이었는데세리나 출시 이후 다시 건은 손 때기로 맹세함장비, 오퍼 부옵작이 기약이 있는 게임도 아닌데맞추고 나니까 바로 패치하나로 ㅂㅅ만들어 버리는데그거 못버팀 진짜이미 각에이미로 전적도 있고박정자 확업이후 세리나는 진짜 너무 의도가 뻔해이게임은 건만 제대로 안하면할만한 게임이라건은 건포만 뺄거",,https://arca.live/b/counterside/32783087,2021-08-27 0:52,45,-1,0
32782531,왕소라,에이미로 건포빼는데 넘 편하다,이볼브원 안보이는 구간이라 걍 에이미가 다 쓸어먹네인식구데기라 나만 쓰는중임,"[{'user': '피해제한탱커좀', 'comment': '플레부턴 니가와부터 시작해서 자주 보이더라'}]",https://arca.live/b/counterside/32782531,2021-08-27 00:42:20,51,0,1
32782172,중사,뉴비 카사 시작함,찍먹계 사서 일단 지식을 쌓고 제대로된 리세계 살려고함에이미잇는데 이거 리콜 가능하던데 뭘 바꾸면됨?서윤 유나<-이렇게 각성잇음그리고 일단 메인스토리 밀면되는겁니까?그리고 로자리아 너무이쁨,"[{'user': '클러스트', 'comment': '(emoticon)'}, {'user': '백합덕후#78782383', 'comment': '미니 ㄱㄱ!'}, {'user': 'OwoM', 'comment': '바꿀거면 미니스트라'}, {'user': 'OwoM', 'comment': '메인이랑 외전부터 밀다가 못 깨겠으면 이벤맵 돌면서 레벨링 하면 됨'}, {'user': 'ㅇㅇ#98127272', 'comment': '찍먹계 얼마에삼?'}, {'user': '중사', 'comment': '만원'}, {'user': '백합덕후#78782383', 'comment': '메인보다 지금은 이벤트 ㄱㄱ추천해.\n거기서 돈모우고 이벤트교환해야해'}, {'user': '중사', 'comment': '이거 레벨이 좀 그런데..이벤트는 레벨 상관없나요?'}, {'user': '백합덕후#78782383', 'comment': 'ㅇㅇ 상관없을거임. 아니면 일단 메인1스만 밀자!'}, {'user': '펭귄국밥', 'comment': '연봉협상이랑 스작을 유나랑 서윤한테줘서 최대한밀어보삼'}, {'user': '중사', 'comment': 'ㅇㅋㅇㅋ 감사합니다'}, {'user': '펭귄국밥', 'comment': '상점가면 이벤트재회쓰는곳 다털어먹는다는 생각하삼 메인스토리는 이벤트 중간중간쉬는텀에 미는게 효율좋음 스토리궁금하면 밀어도되고'}, {'user': '백합덕후#78782383', 'comment': '뉴비때는 캐릭레벨보다 캐릭 강화시킬 재료가 모자람.\n그래서 각성딜러 1,2명 몰빵'}, {'user': 'xile#17342824', 'comment': '1.5주년 미션 읽어보고 클리어준비 ㄱㄱ'}, {'user': 'xile#17342824', 'comment': '모작권, 애사심 이런건 쿼츠좀 써야할듯'}, {'user': '펭귄국밥', 'comment': '메인스토리는 천천히밀고 이벤트부터 밀생각하삼 기간이 있어서 맨밑에 부사장휴가이벤트로 재화먹으면됨'}]",https://arca.live/b/counterside/32782172,2021-08-27 00:36:20,172,8,16
32779639,SmuSaj,뭐야 라라 에이미한테 그냥 털리네,완전회피라면서요,"[{'user': '토깡이', 'comment': '폭딜'}, {'user': 'xile#17342824', 'comment': '필중은 못피하고 스나가 명중높아서 스나한테 약함'}, {'user': 'ㅇㅇ#18208157', 'comment': '회피가 0이라 명중 회피 뎀감 다 받아서 고명중이면 약함'}, {'user': 'diqkf운터', 'comment': '(emoticon)'}, {'user': '굽네바사삭', 'comment': '에이미 스탯도 높고 걔 체퍼뎀이라 회피고 뭐고 딜 잘 들어감'}]",https://arca.live/b/counterside/32779639,2021-08-26 23:56:37,100,0,5
32778964,그런방안입니다,이거 살만함?,에이미 뭐 리콜해서 유나로 하면 댄다는데 이정도면 고급찍먹 가능?,"[{'user': '유나펀치', 'comment': '평생카사해야할 수준인데'}, {'user': 'xile#17342824', 'comment': '(emoticon)'}, {'user': 'ㅣlㅣlㅣlㅣ', 'comment': '스피라 밀리아 있네 나쁘지 않은듯'}, {'user': '소나기나기', 'comment': '2각계중에선 최고일듯'}, {'user': '소나기나기', 'comment': '대적자 장비는 있나?'}, {'user': 'chobo#96766903', 'comment': '에이미는 써도되고'}, {'user': 'ㅇㅇ#50644440', 'comment': 'ㄹㅇ 알짜베기만 골라모았노. 평생카사하자'}, {'user': '하랍픽업좀', 'comment': 'ㄱㄱㄱㄱㄱㄱ'}, {'user': '하랍픽업좀', 'comment': '6만원이냐?\n각성선택권 포함 8만원?'}, {'user': '모드니몽#16600741', 'comment': '(emoticon)'}, {'user': 'ngcn', 'comment': '대적자 장비만 있다면 이거 좋음'}]",https://arca.live/b/counterside/32778964,2021-08-26 23:45:43,163,0,11
32778148,Ludovicus,에이미 이볼브원 부역자 노릇하다가,정작 이볼브원이 존나 치고올라오니깐 이볼브원 잡겠다고 나온 타워는 못잡아서 안나오는거보면 아이러니하다,,https://arca.live/b/counterside/32778148,2021-08-26 23:32,46,0,0
32778054,아이사타#51014657,에이미 쓰는애들이 없네,왜없지..,"[{'user': '도츠게키', 'comment': '디펜더 강세고 정자가 뒤졋으니까?'}, {'user': 'Ludovicus', 'comment': '세리나때문에 이볼브원이 너무 강세인게 큰거같은데 얘 잡는다고 나오는것도 타워임'}]",https://arca.live/b/counterside/32778054,2021-08-26 23:30:34,67,0,2
32777894,Sorfe,오늘 건 잘 안풀리길래 공익 간만에 꺼내봤는데 성능확실하네,공익으로 밀리아 핑챙 릴리 다죽임7코로 11코 교환하는 대적자 클래스근데 에이미는 공익으로도 조지기 좆같던데 뭐로 조지냐 보통?,"[{'user': 'Ludovicus', 'comment': '이볼브원'}, {'user': '하따먹', 'comment': '더 강한 공익이용'}, {'user': 'Sorfe', 'comment': '요즘 공익 템 뭐가냐'}, {'user': '하따먹', 'comment': '허메골골끼죵'}]",https://arca.live/b/counterside/32777894,2021-08-26 23:27:38,157,0,4
32773965,달고나좋아,에이미 다음주에 와줄거지?,다음주에 재발 와줘 너만 오면 육익 다 모여 각유빈도 둘이나 있고 둘다 110에 종신이야 얼른와! ,,https://arca.live/b/counterside/32773965,2021-08-26 22:30,38,0,0
32773832,페로로로쉥,스토리 밀때 좋은 각성캐 추천좀,일단 킹 미니 유나 에이미 있는데 다른 각성캐중에 누가 스토리 밀때 좋아?,"[{'user': '닉네임최대글자수는몇글자까지일까', 'comment': '있어'}, {'user': '페로로로쉥', 'comment': '있어'}, {'user': '던붕이', 'comment': 'Pve는 유나가 패왕임'}, {'user': '서묘', 'comment': '서윤'}, {'user': '페로로로쉥', 'comment': '(emoticon)'}, {'user': '제주삼다수군통제사', 'comment': '서윤'}, {'user': '페로로로쉥', 'comment': '(emoticon)'}, {'user': 'ngcn', 'comment': '스토리는 그냥 탱커나 딜탱류면 걍 다 잘밈'}, {'user': '페로로로쉥', 'comment': '(emoticon)'}, {'user': '천공분열', 'comment': '(emoticon)'}, {'user': '굽네바사삭', 'comment': '그럼 서윤 각힐'}, {'user': '기린그린', 'comment': '서윤'}, {'user': '앤뱃살', 'comment': '유나 서윤이면 아주빠르게 밀림'}, {'user': '소나기나기', 'comment': '서윤'}]",https://arca.live/b/counterside/32773832,2021-08-26 22:28,94,0,0
32773403,그런방안입니다,"리세계 봐 ""줘""","미니를 미나로 잘못봐서 유미나로 찾았었음 ㅠㅠ이외에 에이미+각유나는 매물이 너무많아서 내가 뭐 판단 할 수가 없더라.. 도와""줘""아까 밀리아 포함 헝앱 매물 봐달라한거는 며칠전에 팔렸었더라..https://www.hungryapp.co.kr/bbs/bbs_view.php?pid=35286&page=1&bcode=counterside&bcode2=counterside&short_llink=counterside&pid=35286&bcode=counterside&page=1이  링크가 3각+ 밀리아 남아있는 매물 이라고 함 ","[{'user': '소나기나기', 'comment': '타오바오 중에서는 1번이 5각계라서 가장 좋고'}, {'user': '소나기나기', 'comment': '헝앱에 밀리아 없음'}, {'user': '그런방안입니다', 'comment': '내가 잘못올린듯 수정했어!'}, {'user': '소나기나기', 'comment': '근데 저 타오바오 가격 다 똑같아? 각성 개수가 다 다른데'}, {'user': '그런방안입니다', 'comment': '각성이 먼지몰라서 걍 필수캐 두개 필터링하다보니 그렇게 된듯.. 괜찮은거만 추천해주라 가격은 그중에 골라야하륻ㅅ'}, {'user': '소나기나기', 'comment': '당연히 각성이 많을수록 좋은데 그만큼 가격이 올라감  리세계에 얼마정도 쓸건지 정하고 구해'}, {'user': 'ngcn', 'comment': '헝앱 링크에 밀리아가 안보이는데?'}, {'user': '그런방안입니다', 'comment': '아 내가 잘못올렸나봐 수정했어'}, {'user': 'ㅇㅇ#58814467', 'comment': '맨 위에 얼마임?'}, {'user': 'ngcn', 'comment': '타오바오는 3각계 고를거면 2번고를듯'}, {'user': 'ngcn', 'comment': '그냥 이중에서고른다고하며 1번고르고'}, {'user': '이히힝#28957736', 'comment': '밀리아 있는게 이제별로없나보네..'}, {'user': 'ngcn', 'comment': '헝앱 2번 3번 둘다 애매한데 그나마 쓰알풀 더 넓은 2번고를듯'}]",https://arca.live/b/counterside/32773403,2021-08-26 22:22,135,2,0
32771968,역시난,하여튼 스탯 0인 놈들이 항상 문제야,에이미 치명 0세라펠 회피 0딸배 회피 0셋 다 건 메이저픽임,"[{'user': 'bean', 'comment': '씹볼브원'}, {'user': '역시난', 'comment': '걔도 회피 0이였나'}, {'user': 'bean', 'comment': '스탯0은 아닌데 개쌍년인건 맞음'}, {'user': '역시난', 'comment': '(emoticon)'}, {'user': '열상', 'comment': '지금 건틀렛엔 회피 0짜리 깡통도 있음'}, {'user': '역시난', 'comment': '(emoticon)'}, {'user': '시금치를싫어하는시그마', 'comment': '실비아 회피 0'}]",https://arca.live/b/counterside/32771968,2021-08-26 22:02,79,0,0
32771695,"ㅇㅇ, 220.84",더 달려? 멈춰?,남은 기채 3600천장 75스택지수한테 주화쓰긴 아까워서에이미 1개 더 뽑아서 리콜로 이지수 뽑중임더 가? 멈춰?,"[{'user': '우리유나귀엽죠', 'comment': '?'}, {'user': '우리유나귀엽죠', 'comment': '아..지수 뽑고 싶으면 ㄱㄱㄱ'}, {'user': '반갑노', 'comment': '달려가~~'}, {'user': 'ngcn', 'comment': '나라면 멈춘다...'}, {'user': '소나기나기', 'comment': '각시윤뽑아야자'}, {'user': 'SDAKAJUXIM', 'comment': '니좆에물어봐'}, {'user': 'xile#17342824', 'comment': '에이미 2호기를 뽑고 전에뽑은걸 리콜하겠다는거?'}, {'user': 'xile#17342824', 'comment': '그건 자기맘이라 몰?루'}, {'user': 'ㅇㅇ, 220.84', 'comment': 'ㅇㅇ 그거'}, {'user': 'xile#17342824', 'comment': '마음가는대로 하는거지 머'}]",https://arca.live/b/counterside/32771695,2021-08-26 21:58,107,0,0
