index,user,title,content,comment,link,date,view,rate,comment_count
32716039,flaw,'관리자님의 테라브레인이 이거군요',"이제 이것만 해킹하면 관리국의 수많은 정보를 쥘 수 있어요근데 이 도시락통 비밀번호가 걸려있어요 대장어떻게 하실건가요?걱정마세요 파견나가있던 에이미양이 보내준 쪽지가 있거든요여기에 테라브레인 활성화코드가 적혀있습니다어디보자, 비밀번호가.........(틱틱틱)테라브레인-갑 활성화저희가 관리자님을 너무 고평가하고있었나봐요비밀번호가 뭐길래 그러시나요?SSB요SSB? 무언가의 약어인가요?Sex Sex Bojiteol이요 시발","[{'user': '라킁', 'comment': '(emoticon)'}, {'user': '역시난', 'comment': '(emoticon)'}, {'user': '소나기나기', 'comment': '(emoticon)'}, {'user': 'diqkf운터', 'comment': '(emoticon)'}, {'user': '하랍픽업좀', 'comment': 'BBS아니고 SSB 입니다~'}, {'user': 'dlbodkel', 'comment': '(emoticon)'}, {'user': '우지다', 'comment': '(emoticon)'}, {'user': '겨누스야드랑이', 'comment': 'ㅋㅋㅋㅋㅋㅋㅋㅋㅋㅋㅋㅋㅋㅋㅋ관남충게이야'}, {'user': '1234#13256798', 'comment': '진영수 ㅋㅋㅋㅋㅋ'}, {'user': '반갑노', 'comment': '섹섹보'}, {'user': '옌', 'comment': 'ㅋㅋㅋㅋㅋㅋㅋㅋㅋㅋㅋㅋ'}]",https://arca.live/b/counterside/32716039,2021-08-26 1:32,1283,52,0
32714232,응애나추룡아가,에이미는 확실히 고난이도에서 좋네,체퍼뎀이 피돼지들 상대로 개사기임,"[{'user': '세라펠', 'comment': '에이미가 지금 대부분 컨텐츠 공략법이 있어서 상대적으로 잘 안쓰이는것 같아.\n딜 포텐은 각성캐릭터중 탑급이라고 생각해'}]",https://arca.live/b/counterside/32714232,2021-08-26 0:58,45,1,0
32364020,치킨카레라이스,뉴비 아이디사왔는데 리콜이렇게해??,유나랑 에이미있는거삿음,[],https://arca.live/b/counterside/32364020,2021-08-20 18:14,49,0,0
32360306,ㅇㅇ#12363032,미니 있으면 에이미 리콜 그저그런가,"좆데, 공익, 유나, 서윤, 킹, 미니, 이볼브 원 이렇게 있는데 그냥 놔둘까 각수연이 땡기긴 함","[{'user': 'SDAKAJUXIM', 'comment': '에이미가 구린게 절대 아니라서 놔두는게 좋을듯?'}, {'user': '니퍼#38747506', 'comment': '개인적으론 에이미가 더 조은것 같음'}, {'user': '네모현#32744865', 'comment': '미니 공익 있다면 안바꿔도 됨.'}, {'user': '진실의문#23527495', 'comment': '굳이 각수연으로 바꿔야할까 싶은데'}]",https://arca.live/b/counterside/32360306,2021-08-20 17:15,40,0,0
32360073,"ㅇㅇ, 183.101",에이미 리콜 어떤가요,"에이미 리콜해서 다른 각성 얻는게 좋을까요 아님 에이미 계속 쓸까요? 에이미도 써보니 성능 좋던데 고민되네요...지금 없는 각성이 이볼브 원 제외하고 미니스트라, 킹 두가지인데 리콜 추천한다면 어느게 좋으려나요","[{'user': 'SDAKAJUXIM', 'comment': '미니'}, {'user': '천공분열', 'comment': '미니 없으면 에이미 리콜 고려할만함.'}, {'user': 'ㅇㅇ#75999277', 'comment': '미니'}, {'user': '땅국#36049359', 'comment': '미니미니미'}, {'user': 'Clink', 'comment': '미니 없으면 해볼만함'}, {'user': '니퍼#38747506', 'comment': '미니 있으면 걍 에이미, 없으면 미니가 최선인듯'}, {'user': '뚜빵이', 'comment': '에이미 예쁘잖아 꼭 시체로 리콜 해야할까?'}]",https://arca.live/b/counterside/32360073,2021-08-20 17:11,77,0,0
32359156,비질란테,빨리 시윤옵빠 등장모션 보여줘,이볼브원 에이미보다 멋있게 나오겠지?,,https://arca.live/b/counterside/32359156,2021-08-20 16:55,51,0,0
32356547,엘빅이,각성캐를 순위로 딱 정하긴 애매하고,Pve 유나 미니스트라 투탑체재있으면 든든한 탱커 나유빈 킹있으면 든든한 딜러 유미나 서윤 에이미 퀸공중이 벼슬 이수연Pvp 이볼브원 미니스트라 나유빈 킹 사황있으면 무조건 쓰는 캐릭터 퀸 이수연 에이미있으면 간혹 쓸 수 있는 캐릭터 유나그나마 다이브라도 쓰는 캐릭터 힐데아무대도 안쓰는거 이지수이 정도로 분류하는게 최선인듯,,https://arca.live/b/counterside/32356547,2021-08-20 16:08,328,2,0
32356505,OmO,개인적인 범용성 기준 각성캐 순위,범용성을 항목으로 잡은 내 개인적인 각성캐릭 순위는1. 각서윤 각유나2. 미니 각유빈3. 킹4. 퀸 힐데5. 에이미6. 각등이7. 이볼브원8. 이지수하이엔드급 컨텐츠에서 미니 디버프가 애미가 없어서 대체가 불가능해지는 영역이 있어서 그렇지개인적으로 미니 / 각유빈은 각서윤 / 각유나보다 7쫄작하거나 pve 할때 전열이나 후속유닛이 없으면 오래걸리거나 실패하는데각유나 각서윤은 1마리로 다 커버 되고 미는 속도도 준수한 편이고전당 협력전 등등 기용되는 컨텐츠도 많아서 범용성을 기준으로 할 경우 개인적으론 배점을 높게 잡았음,[],https://arca.live/b/counterside/32356505,2021-08-20 16:07,98,5,0
32356410,rhyme,에이미 리콜잇자나.. 그때 2개 뽑은사람은,2개 다 뺏어간다며 ㄹㅇ임?,"[{'user': '진실의문#23527495', 'comment': '하나만인디?'}, {'user': 'rhyme', 'comment': 'ㅇㅎ 누가 두 개 다가져갓다는얘기 본거같아서'}, {'user': '진실의문#23527495', 'comment': '2개 가져가는게 그 이야기겠지 에이미하고 다른 각성'}, {'user': '진실의문#23527495', 'comment': '사실상 에이미 중복이라 1개 취급했는데 리콜되니 2개지'}, {'user': 'SDAKAJUXIM', 'comment': '2개뽑았으면 승리자인거지'}, {'user': '뚜빵이', 'comment': '두개 가져갔다는 애는 하나 융핵 대용으로 갈아넣은 애 말하는 거일듯'}, {'user': '뚜빵이', 'comment': '얼마전에 카바한다고 념글갔던 애아니냐'}, {'user': 'rhyme', 'comment': 'ㅇㅇ'}, {'user': '사관사냥', 'comment': '애초에 리콜도 한번만 될텐데'}]",https://arca.live/b/counterside/32356410,2021-08-20 16:05,108,0,0
32356294,시금치를싫어하는시그마,각성캐 순위는 간단하게 이정도아님?,"반박불가 0티어가 미니그 밑 0.5티어가 공익1티어가 퀸, 킹, 서윤유나는 이번이벤트 7쫄작도 못하고 그래서 1.5티어 이수연도 은근 별로같지만 온갖데 다쓰니까 동일티어 에이미도힐데는 그래도 고난이도 pve서 쓰고 뉴비들한텐 통곡의 벽이니 2티어각등이 3티어이지수 4티어근데 힐데도 상향얘기 스멀스멀 기어나오는거 보면 딱 1.5티어가 마지노선임","[{'user': '암왕제군', 'comment': '이거도 많이 이상한데 기준 멀로 잡은거임'}, {'user': '시금치를싫어하는시그마', 'comment': 'pve pvp 다합쳐서? 그냥 쓰임새'}, {'user': '암왕제군', 'comment': 'pvp랑 pve 합치면 확실히 공익이 좋긴 조은듯'}]",https://arca.live/b/counterside/32356294,2021-08-20 16:04,132,0,0
32356234,나나코챤,에이미 야누스 땡겨서 밟혀 뒤지는거 개웃기네,역시 각성 메카닉,,https://arca.live/b/counterside/32356234,2021-08-20 16:03,68,0,0
32356233,Clink,님들 에이미 리콜 빨리 하셈,그래야 건에서 나만 쓰지,,https://arca.live/b/counterside/32356233,2021-08-20 16:03,60,0,0
32355997,ㅇㅇ#83346868,리세계 결국 샀는데,에이미랑 펜릴선택권 뭐랑 뭐로 바꿔먹음?지금 각성이 미니 서윤있음,"[{'user': 'eca', 'comment': '선택권은 존버해'}, {'user': '흐물흐물두부처럼말해요', 'comment': '에이미는 유나\n펜릴선택권은 힐데'}, {'user': '누르망디', 'comment': '에이미는 굳이 안바꿔먹어도 되는데 미니 서윤있으면'}, {'user': 'Tiferet', 'comment': '미니 서윤이 있다면 굳이 에이미를?'}]",https://arca.live/b/counterside/32355997,2021-08-20 15:58,88,0,0
32351423,새벽비,와 진짜 개쩐다 너희도 카운터사이드 건틀릿 오브 월드챔피언쉽 보러갔냐?,나 좌석도 3층 끝좌석이라서 존나 쭈뼛쭈뼛하면서 앉아있었는데거기 경비원들이 오더니 나한테 핸드폰 보여달라고 하더라고 존나 무서워서 어버버거리면서 보여주긴 했는데 내 핸드폰으로 카사 키더니 내가 카사 여름뉴비인거보고 특등석으로 안내해준다고 1층까지 내려가서  VIP석에서 보고왔다.옆에는 머리 희끗희끗한 류금태가 그만 불족발먹다가 발가락을 찧어서 병원에 입원한 박상연의 사진 들고 앉아있더라내가 왜 여기에 와있는지도 몰라서 존나 조용히 앉아있었는데 류금태가 자기 핸드폰 켜서 카사보여주더니 닉네임이 나 건틀릿에서 항상 줘패던 그새끼라서 뚝배기 깨버릴려고 하다가류금태가 감사하다고 나한테 시그마 몸이랑 세부 데이터담긴 파일 보내줬음다 끝나고 돌아와서 생각해보니 방금 있었던 일이 ㄹㅇ 꿈만 같고 건틀릿에서 누가 각성 에이미를 각성 주시윤으로 반격하더니 그걸 또 각성 주시윤으로 반격하고 그걸 또 각힐데 전체 무적 출격기로 씹는것도 돌아오는길에 유튜브 보고 알았음너희도 카운터사이드 건틀릿 오브 월드 챔피언쉽 참여했음? ㄹㅇ 개꿀잼이었는데,[],https://arca.live/b/counterside/32351423,2021-08-20 14:35,55,3,0
32350459,냉동삼겹최창식,내 선택은 틀리지 않았어,램아가와 시영눈나는 오늘부터 성능픽이다에이미 퀸 업미야 샤오린 리코리스 류드밀라 에델 최지훈 사나에 아르티 빼고 다 덤벼,[],https://arca.live/b/counterside/32350459,2021-08-20 14:18,99,0,0
32344986,리타X대시,소신발언) 에이미로 어채겜한사람들 다시해야됨,왜너희만개이득바!!!!!,"[{'user': '카붕가붕이#67881991', 'comment': '각성2호기 받을게있나? 홍어?'}, {'user': '리타X대시', 'comment': '못뽑은거있을수도있지 침식체냄새;;;'}, {'user': '카붕가붕이#67881991', 'comment': '다 뽑고 어채겜까지 했는데 스비가 구조해주겠지?'}]",https://arca.live/b/counterside/32344986,2021-08-20 12:26,96,0,0
32344861,ㅇㅇ#18955490,에이미 리콜을 하는 사람이 있을까?,이게 젤 궁금함,"[{'user': 'ㅇㅇ#33682323', 'comment': '꽤 많드라'}, {'user': '이라리', 'comment': '에이미 개좋던데'}, {'user': 'ㅇㅇ#87218383', 'comment': '바꾸는 사람들 있던데 미니 아니면 굳이란 생각 들긴함'}, {'user': '누르망디', 'comment': '미니로바까먹음'}, {'user': 'diqkf운터', 'comment': '미니는 해야됨...'}, {'user': 'ㅇ반고닉ㅇ', 'comment': '에이미 ~> 에이미 되면 크레딧번다'}]",https://arca.live/b/counterside/32344861,2021-08-20 12:24,113,0,0
32344577,네비얀,기채 킹 에이미 각수연중에 누기 우선도 제일 높냐,그 셋이랑 각등이 없는대 역시 몰루의 왕이 제일 우선순위 높을까?,"[{'user': '흐물흐물두부처럼말해요', 'comment': '킹'}, {'user': '뉴비는애기야#36482885', 'comment': 'ㅋ'}, {'user': 'diqkf운터', 'comment': '킹-> 에이미'}]",https://arca.live/b/counterside/32344577,2021-08-20 12:18,52,0,0
32343420,불타는백두산,에이미 이 짤 원본이 이건가,,"[{'user': '유나펀치', 'comment': '아잇 밖에서 보다가 ㅈ댈뻔했네 19탭 붙여'}, {'user': '불타는백두산', 'comment': '올리고 보니까 안달려 있어서 호다닥 수정해씀...'}]",https://arca.live/b/counterside/32343420,2021-08-20 11:53,283,1,0
32343085,극한의가능충,비록 에이미가 성능이 구려졌지만 그냥 안바꿀래,,"[{'user': '로테#43499356', 'comment': '떡정'}]",https://arca.live/b/counterside/32343085,2021-08-20 11:46,160,0,0
32342968,비질란테,옛날에 ㅈㄴ 웃긴 문학 있었는데,"사장님, 밥먹어?나는 그대로 에이미의 대가리를 후려쳤다",[],https://arca.live/b/counterside/32342968,2021-08-20 11:43,64,0,0
32339531,볼딩이,에이미뭔가 잘안쓰게되는데 리콜을할까,리콜하고 퀸이나 킹받는게 당장은 더 쓸모있을거같기도하고...,"[{'user': 'Ludovicus', 'comment': '퀸이랑 바꾸는건 별의미없고 킹이랑 바꾸면 즐거운 건틀렛은가능'}, {'user': 'diqkf운터', 'comment': '킹은 좀 끌리긴 해도 에이미 만으로 잘 쓰임\n미니가 없는 건에는 에이미가 왕이다'}]",https://arca.live/b/counterside/32339531,2021-08-20 10:16,82,0,0
32339457,불면증환자,이볼브덱 어케쓰냐,글리치 돈까스망치 카일윙 스페로우이볼브원 에이미 분탕 가은오퍼 시그마좆핀6이렇가냐?,"[{'user': 'Ludovicus', 'comment': '가은빼고 야누스'}, {'user': '불면증환자', 'comment': 'ㅇㅋ'}, {'user': 'Ludovicus', 'comment': '카일웡도 빼고 이프리트넣는게 나아보이긴하는데 써도 문제는없을듯'}, {'user': '불면증환자', 'comment': 'ㅖㅏ'}]",https://arca.live/b/counterside/32339457,2021-08-20 10:14,37,0,0
32336979,생생우동,에이미 아직 좋음?,6코 너무 무겁지않음?,"[{'user': 'Ludovicus', 'comment': '6코가 당연한값인데'}, {'user': 'Ludovicus', 'comment': '아직도 많이좋음 ㅇㅇ'}]",https://arca.live/b/counterside/32336979,2021-08-20 8:54,114,0,0
32334919,촤드,와 전당5-3 진짜 왜 이러지?,7연속 전복나네멀쩡하게 잘돌아가던 에이미 덱인데7번 다 지켜봤는데에이미 출격할때 나유빈 안딸려옴 뭐야 이거,"[{'user': 'qpqp#95340672', 'comment': '회피 떴나?'}, {'user': 'qpqp#95340672', 'comment': '그거 그냥 노각성덱이 더 좋던데'}, {'user': '촤드', 'comment': 'ㅇㅋ'}, {'user': 'ㅇㅇ#85245304', 'comment': '에이미 말고 노각덱으로 바꿔'}, {'user': '촤드', 'comment': 'ㅇㅇ ㅇㅋ'}, {'user': '암왕제군', 'comment': '그거 이제 안되니까 새 공략 보고 다시 짜셈'}, {'user': '촤드', 'comment': '안된다고? 시벌'}, {'user': '암왕제군', 'comment': 'https://arca.live/b/counterside/32248466 이거 해봐 나 이렇게 깨는데 템 나보다 조으면 댐'}, {'user': '촤드', 'comment': '함 해본다'}, {'user': '청안아이', 'comment': '이거 잘된다 고맙다'}, {'user': '갤쁘리', 'comment': '에델 카일 리코리스 이유미 힐데 뒤 자유 함선 엔터'}, {'user': '촤드', 'comment': 'ㄳㄳ'}, {'user': '촤드', 'comment': '각힐임?'}, {'user': '갤쁘리', 'comment': '스알힐데'}]",https://arca.live/b/counterside/32334919,2021-08-20 6:42,108,0,0
32334415,벼와쌀을분리해주마,에이미 스피릿이나 극스충줘야뎀?,얘 딜 지분이 어떻게 되는지 모르겠는데 스킬설명만 보면 스충은 안챙기는게 나아보이는거같은데 걍 다 스충쓰라카네,"[{'user': 'ㅇㅇ#34535044', 'comment': '극스충 고르디줘서 단단하게 가는경우도 있음'}, {'user': '마싯는감자칩', 'comment': '궁 빨리터트리는게 그나마 좋긴하니까 그럼, 전당 오토에서 쓸떄도 스충템 쓰는게 딜 차이 많이 남'}, {'user': '시이시이', 'comment': '그냥 궁한방에 4명이 싹쓸림 궁빨리쓰는게최고다'}]",https://arca.live/b/counterside/32334415,2021-08-20 5:32,89,0,0
32334317,스트로베리샤베트,진짜 이번주 니가와 존나많더라,시그마킹 마리아킹 시그마유나 시그마각수연 마리아에이미 존나 정신나갈거같았음,"[{'user': 'ㅇㅇ#34535044', 'comment': '깡통도 니가와라구'}, {'user': 'ㄱㄴㅇㄹㅁ', 'comment': '걍 싹다니가와더라'}, {'user': 'ㄱㄴㅇㄹㅁ', 'comment': '마타몰고오는거빼고는'}, {'user': '상자새끼', 'comment': '다크나이트 공익님 그립읍니다'}, {'user': '종말#38406147', 'comment': '공익 없고 깡통 새끼가 니가와만 시전하니 전부 니가와함 ㅋㅋㅋㅋ'}]",https://arca.live/b/counterside/32334317,2021-08-20 5:20,107,0,0
32332260,"ㅇㅇ, 218.239",건틀렛 무슨 덱을 쓰든 쳐발리네 ,근데 쳐발리는것보다 화나는 건 에이미 리콜해서 킹을 받앗는데 그 킹을 쓰고도 좆발리니까 씨발 너무 빡침 개 좆같은 대머리년 ,"[{'user': '이거갓겜이냐', 'comment': '허접ㅋㅋ'}]",https://arca.live/b/counterside/32332260,2021-08-20 3:06,105,0,0
32331347,dus,카생중 가장 힘든 고민하는중,에이미 리콜로 각유나를 만들것인가98000원으로 원조를 받을것인가,"[{'user': 'bean', 'comment': '9.8쓰자 ㄱㄱ'}, {'user': '누소', 'comment': '유나 바꿔먹고 69천짜리 주화패키지 사서 vol2 킹 받기'}]",https://arca.live/b/counterside/32331347,2021-08-20 2:33,50,0,0
32330976,LILY,구인구직탭 많이 활발해졌네,혼란 에이미 나왔을때는 구인구직탭 글 올라오는거 보기 힘들었는데 ,"[{'user': '순애가낭만이다', 'comment': '구인난이 엊그제 같았는데 이제 사람 모이더라'}, {'user': 'bean', 'comment': '컨소 구인만 죽어라 올라왔음 ㄹㅇㅋㅋ'}]",https://arca.live/b/counterside/32330976,2021-08-20 2:22,66,0,0
32329423,59XZa#80792176,요번 챌린지에서 에이미 진짜 잘쓰고있음,그다음으로 램리썰 개 잘쓰고있음 ㄹㅇ 체력비례뎀 개사기야,,https://arca.live/b/counterside/32329423,2021-08-20 1:41,60,0,0
32329176,lllBoomerlll,에이미 진짜 이쁘다,솔직히 그 좆같은 무지성 혼란 박아넣은 운영진들 아니였으면내 종신계약을 가져가는 몇 안되는 살덩이였을거임이제 종신이랑 융합이랑 다줘야지,[],https://arca.live/b/counterside/32329176,2021-08-20 1:35,158,1,0
32328936,Clink,에이미를 애들이 많이 리콜해야,건에서 나만 쓸텐데빨 리 해 라 !,"[{'user': '왕소라', 'comment': '아 이거 비밀인데'}]",https://arca.live/b/counterside/32328936,2021-08-20 1:30,135,0,0
32328171,노가다겜좋아,기체 뭐뽑아야됨?,"일단 있는 각성은홍어,등어,공익,에이미,유나 이렇게 5명인데 뭐 뽑아야하나?","[{'user': 'Eizen', 'comment': '미니스트라'}, {'user': '노가다겜좋아', 'comment': '미니가 그렇게 좋은가요?'}, {'user': '메카흐응#52700503', 'comment': '건 유저가 아니고 다이브 \n50층 뚫었으면 없어도 되긴함'}, {'user': '노가다겜좋아', 'comment': '-건-:실딱\n다이브 :36 \n\n\n음! 미니를 뽑자'}, {'user': '느검마비아그라먹방', 'comment': '니플 킹'}, {'user': '노가다겜좋아', 'comment': '니플이 뭐임?'}, {'user': '느검마비아그라먹방', 'comment': '리플'}, {'user': '노가다겜좋아', 'comment': '아 리플레이서 킹... 확인'}, {'user': '메카흐응#52700503', 'comment': '건용임'}, {'user': '하랍픽업좀', 'comment': '미니'}, {'user': '노가다겜좋아', 'comment': '확인'}, {'user': 'ㅇㅇ, 210.90', 'comment': '킹퀸 패키지 사고 기채는 미니 뽑자'}, {'user': '노가다겜좋아', 'comment': '확인!'}]",https://arca.live/b/counterside/32328171,2021-08-20 1:13,101,0,0
32327999,돌아#54959433,요즘에이미어떰,에이미대란떄접음,"[{'user': '왕소라', 'comment': '메인딜 1타강사'}, {'user': '돌아#54959433', 'comment': '혼란바꼇다며 요즘도 나오면 다떄려부심?'}, {'user': '왕소라', 'comment': '에이미 하나넣고 나머지 탱으로 채워도 에이미가 후열까지 다갈갈갈갈 해버림\n딜 조오오오오온나 쌔다 진짜\n근데 혼란사라진거때문에 내려치기 ㅈㄴ당해서 리콜한다는 애들도 많음\n팩트는 혼란 사라져도 조오오오오오온나 쌔단거임 내가 존나 당했어 에이미 이 요요씨불련한테....'}, {'user': '돌아#54959433', 'comment': '나유빈이랑비교하면어떰'}, {'user': '왕소라', 'comment': '둘다 역할이 달라서 직접비교 힘들고\n나유빈은 박정자 퀸이나 아르티 이런애들 있으면 원맨쇼 가능한데\n에이미는 걍 무지성으로 원맨쇼 가능함\npve는 아직 연구가 덜돼서 나유빈이 좀더 나을듯?'}, {'user': 'Clink', 'comment': '후열 그랩과 스봉으로 씹창냄'}]",https://arca.live/b/counterside/32327999,2021-08-20 1:09,73,0,0
32327335,"ㅇㅇ, 210.90",애지간하면 에이미 걍 갖고 있는게 좋을거 같은데,미니스트라 없는거 아니면 진짜 굳이 싶다건은 말할거도 없고 pve도 성능 좀 저평가 되어 있는거 같음킹도 그렇고,"[{'user': '왕소라', 'comment': '에이미 지금 내려치기 ㅈㄴ 당해서 갖고있으면 꿀빠는거임'}, {'user': 'ㅇㅇ#85245304', 'comment': '킹 미니가 0티어 각성이고 나머지는 다 고만고만해서 각힐 각등이 지수 빼고'}, {'user': 'ㅇㅇ#85245304', 'comment': '이볼브는 pvp 졷사기지만 pve에서 써먹을 일이 없으니'}, {'user': 'OmO', 'comment': '미니 서윤 없으면 바꿈\n서윤이 진짜 만능유닛'}, {'user': 'OmO', 'comment': '격전 협전 건 쫄작 등등 좋은듯'}]",https://arca.live/b/counterside/32327335,2021-08-20 0:57,106,0,0
32326384,턱턱툭탁,우리 에이미 주려고 메스충도 만들어 놓았단다,언제쯤 오니,,https://arca.live/b/counterside/32326384,2021-08-20 0:41,34,0,0
32326266,"ㅇㅇ, 220.126",초전도,치명타피해 붙은 장비는 샤오린이나에이미한테만 좋나요?,"[{'user': '냉동삼겹최창식', 'comment': '써먹으려면 확치 붙은 애들한테  줘야함 카사는 장비로 치확 100퍼 못맞춰서'}, {'user': '마에스트로', 'comment': '이 겜 치명 특성상 확치가 있는애가 좋슴니다 딴겜만큼 치피셋의 효율이 좋지않아요 샤오린이 치피는 젤좋고 에이미도 스츙효율이 최고일거임'}, {'user': 'ㅇㅇ, 220.126', 'comment': '각에이미는 세트랑 부옵션을 스충으로 채우면 되지않나요?'}, {'user': '마에스트로', 'comment': '딜이 스충풀로땡긴거보단 약할검니다 저도 템이없어서 스펙트럴스마이트끼고(전당 치피) 있긴하지만 에이미가 자체치명이 0이라 스킬에는 치명타가안터지기때문에 치피에 스충을땡기면 오히려 스킬쓸때마다 치명이안터지는 스킬을 쓰는셈이라 딜로스가 생기지않을까? 싶어요 실험은안해봤지만 같은이유로 스충땡긴 샤오린은 모잠비크드릴을쓰는게 오히려 딜로스가나서'}, {'user': 'ㅇㅇ, 220.126', 'comment': '알려주셔서 감사합니다.'}]",https://arca.live/b/counterside/32326266,2021-08-20 0:39,103,0,0
32325047,아주르#83922820,형님들 에이미 퍼스트윙 리콜 뭔가요??,무슨일있나요? 리콜떳는데 리콜하는게좋은건가요? 왜 리콜이된건가요???,"[{'user': '후려', 'comment': '미니 있으면 안돌리는게 나아'}, {'user': '아주르#83922820', 'comment': '미니스트라랑 에이미랑 같이쓰이나요?? 미니스트라 있긴한데 그냥 냅두면 되는거죠?'}]",https://arca.live/b/counterside/32325047,2021-08-20 0:20,105,0,0
32324260,각등이,에이미 리콜 하고 싶은데 왜 안되냐고 ,함선 본사 보급작전 모의작전 외전 챌린지 로비 이벤트 내가 볼 수 있는 곳 다 들어가서 쳐 빼놨는데 자꾸 어디 소대에 기어 들어가는 건지  시발련아 좀 나가!!!!,"[{'user': '흐물흐물두부처럼말해요', 'comment': '전략전 랭크전 레이드?'}, {'user': '각등이', 'comment': '전당까지 빼놨는데 이 시발련 도대체 어디 쳐 기어 들어간거야!!'}]",https://arca.live/b/counterside/32324260,2021-08-20 0:07,95,2,0
32322779,갓겜만골라서함#91887491,각성 고민중인데 뭐 뽑아야하지..?,각힐은 돈주고 살생각이고 남은게 나유빈 에이미 퀸 이 세 개인데 공익이 pvp용이라고 들었고 나머지는 잘 모르겠는데 뭐부터 뽑아야할까 알려조,"[{'user': 'ㅇㅇ#74194811', 'comment': '애이미 > 킌 > 나유빈'}, {'user': '갓겜만골라서함#91887491', 'comment': '에이미가 그리좋은편이여??'}, {'user': 'ㅇㅇ#74194811', 'comment': '디펜더 빼고 다 갈아버리는 놈인데 사거리가 좀 아쉬움'}, {'user': '갓겜만골라서함#91887491', 'comment': '쉽.. 많이 고민되네 pvp유저는 아니라서'}, {'user': '요일', 'comment': '피빕할거면 나유빈 선이고\n에이미, 퀸은 거기서 거기인듯'}, {'user': '갓겜만골라서함#91887491', 'comment': '어 pvp보단 pve더 선호하긴하는데 \n그 다이브에서 나공익 쓴다던데 필요없나?'}, {'user': '요일', 'comment': '아마 다른 버젼도 있긴 있을거임\n있으면 좋은데 ㄹㅇ 필수다 수준은 아니라'}, {'user': '갓겜만골라서함#91887491', 'comment': '아 감사'}]",https://arca.live/b/counterside/32322779,2021-08-19 23:44,68,0,0
