index,user,title,content,comment,link,date,view,rate,comment_count
42851546,토마호크스테이크,지금까지 카사를 세번 접었다,오로치보고 온게 세번째 복귀인데인격배설 리플퀸을 보자 대가리가 깨졋다,"[{'user': '이식빵아', 'comment': '(emoticon)'}, {'user': '토마호크스테이크', 'comment': '(emoticon)'}, {'user': 'Nyx#34512140', 'comment': '꼴잘알'}, {'user': '토마호크스테이크', 'comment': '(emoticon)'}]",https://arca.live/b/counterside/42851546,2022-01-21 04:06:25,39,0,4
42848155,ㅇㅇ#10271370,카사유저는 다 성능충이야,오로치 인격배설로 챈 도배될때는 언제고성능 김소빈보다 구린거 나오니까언급 1도 없음 외모도 성능이다 는 명백한 가짜뉴스,"[{'user': '누소', 'comment': '(emoticon)'}, {'user': 'Nyx#34512140', 'comment': '초창기 팬드맘 싹다 뒤진거보면 모르냐'}, {'user': 'ㅇㅇ#10271370', 'comment': '틀니 3일압수'}, {'user': 'Nyx#34512140', 'comment': '(emoticon)'}, {'user': '메이크유나그레이트어게인#78677898', 'comment': '하긴 주시영정도면 성능캐지 ㄹㅇ'}, {'user': '부식되는세계', 'comment': '인격배설은 떡밥이 드러워'}]",https://arca.live/b/counterside/42848155,2022-01-21 02:08:56,32,0,6
42845420,Badfinger,오로치 쓸만한데 이거,네르비에 병신만들기 되긴한데 스작이 덜되서 좀 약하네,"[{'user': '피해제한탱커좀', 'comment': '뭔데 스페로우를 쓰노'}, {'user': '독호메', 'comment': '오'}]",https://arca.live/b/counterside/42845420,2022-01-21 01:11:12,56,0,2
42824833,모건빵,격전 네르비에 6캐릭노템 풀오토 특별육성반업(각성x),"함선 : 엔터오퍼 : 부옵 치피증스카이로 초반에 스나쫄 대신맞아주면서 에델쫄작을하고 오브젝트들로 밀고들어가는 빌드노템기준 은신동안 회피운빨로 스나 3방정도 맞아줄수있음케이시가 스나쫄 출격넉백, 보스특수기넉백에 계속 뒤로날아가며 탱하기때문에 복귀하는동안 잠깐 맞아줄 오브젝트들이 필요함오르카죽창이 노템이 맞나싶을정도로 강하니 템조합에따라 배치조절 잘 해보길바람레피지피 스피릿스충 72*스카이가 없다이전처럼 루시드끌고와서 에델쫄작하며 밀고가면됨오로치말고 가은이로 굴러가긴한데 이상한곳으로 백스텝칠가능성이 있으니 오로치쓰는걸 추천함*괜찮았던픽들1. 카나데네르비에 특성상 다단이 많고 명중이낮아 카나데 회피스텍채우기 매우 편했음공중폼으로 넉백패턴때 공중딜러대신 맞아주는 탱역할도 가능하고 특수기 고뎀으로 유사오르카짓 가능2. 드라코영상 날려먹음궁에 경직면역있어서 넉백패턴에 안밀려나 공중딜러 보호하면서 버티는게 가능함단 스나쫄에 그대로 죽창날수있으니 그부분은 딜러쿨 맞춰서 처리하든가 해야함*블루브릿지 쓰면 난이도 확 내려감근데 소드풀오토서도 블루브릿지쓰는게 편해서 둘중 하나고르라면 개인적으론 소드에서 쓰는걸 추천함","[{'user': 'Nyx#34512140', 'comment': '센세 믿고 있었습니다'}]",https://arca.live/b/counterside/42824833,2022-01-20 19:59:48,31,2,1
42815381,병,pve만하는데 오퍼가 없어서,하나 뽑아볼라하는데지금 시그마랑 상점애랑 오로치랑 누가조음?여기서 좋은애없으면 안뽑고,"[{'user': 'SS급경장딜포이', 'comment': 'pve원탑오퍼는 김하나임'}, {'user': '하랍픽업좀', 'comment': '김하나가 없어서 시그마도 괜찮긴 함'}, {'user': '하랍픽업좀', 'comment': '근데 비추 ㅋ pve는 김하나가 너무 원툴임'}, {'user': '병', 'comment': '나중에 김하나 오면 뽑아야겠다 ㄱㅅ쇼'}, {'user': 'SS급경장딜포이', 'comment': '굳이뽑자면 시그마가 무난하긴할텐데 굳이느낌이고'}, {'user': '병', 'comment': '(emoticon)'}]",https://arca.live/b/counterside/42815381,2022-01-20 17:26:49,44,0,6
42794159,아루엘,일상충 스토리 그래도 이정도면 ㅅㅌㅊ지,"마냥 일상이 소중해~ 일상조아~ 친구들 모여라~ 하하호호 ㅇㅈㄹ하는게 아니라인간의 존재가치에 대한 서로의 정의를 부딪히며 싸우는 스토리이기에 감히 ㅅㅌㅊ라 말할수있음.""인간은 호의를 둘리로 아는 좆간새끼들 투성이다. 전인류의 안락사 그것만이 유일한 소망."" 이라는 오로치""좆간새끼가 있다 해서 모든 인간이 그렇지는 않다. 선량한 이들의 일상까지 위협하겠다면 나도 용서치 않겠다."" 라는 미나토일상으로 시작했지만 인간의 악함과 선함을 서로 강조하며 첨예하게 대립하는 정도면 잘만든거 맞다는걸 요즘따라 더더욱 깊게 느끼는 중임 ㄹㅇ",,https://arca.live/b/counterside/42794159,2022-01-20 10:37:12,70,1,0
42793303,금태링다메다메,난 나나하라 볼만했는데,라노벨 1권 짜리 스토리 느낌 나서 그냥 볼만했음솔직히 일상타령이야 뭐 '와따시는 평범한 고등학생이다' 랑 비슷한 느낌으로 보고 넘겨서 그러려니 했다 ㅋㅋㅋ그냥 오로치가 의외로 포스도 약하고 그냥 착해보여서 좀 아쉬웠다스토리 뜨기전엔 마왕이라고 봐서 김샜어,"[{'user': '하빌밀런', 'comment': 'ㄹㅇ 오로치가 너무 임팩트가 없었음'}]",https://arca.live/b/counterside/42793303,2022-01-20 10:14:42,86,0,1
42783831,"ㅇㅇ, 119.206",길티콜라보때 접고 복귀2일차인대 ,그 이후 캐릭보니  야마타노 오로치?  애랑 무슨 성녀?  개가 좆꼴리게생겻ㄱ는대 픽업안함 ? ,"[{'user': '미닛메이드', 'comment': '1주년 쓰알 선택권있으니 뽑고 싶으면 뽑으셈'}, {'user': '미닛메이드', 'comment': '1주년 쓰알 선택권있으니 뽑고 싶으면 뽑으셈'}]",https://arca.live/b/counterside/42783831,2022-01-20 01:45:04,64,0,2
42722098,토마호크스테이크,창작 념글간거 다시보면 부끄러워,,"[{'user': 'MBT', 'comment': '오로치 성능캐인데'}, {'user': '토마호크스테이크', 'comment': '(emoticon)'}, {'user': '제이크', 'comment': '최근 신캐련들 싹 다 상향 좀 해야됨 이쁘게 잘 만들어놓고 성능 개 좆박아놓음'}, {'user': '토마호크스테이크', 'comment': '루시드 첨나왔을때 개꼴 하면서 무지성 채용권 박다 이월 안되서 피눈물 흘림'}, {'user': 'DOGE76', 'comment': '루시드 처음 나온 건 패스잖아?'}, {'user': '토마호크스테이크', 'comment': '맞네 잘못 생각한듯 그때 어디다 채용권 다박았는데'}, {'user': '토마호크스테이크', 'comment': '라라 예거다 시벌 거기에 채용권 70개 박고 매카노함'}, {'user': 'DOGE76', 'comment': '라라는 성능은 좋았는데'}, {'user': '토마호크스테이크', 'comment': '못뽑앗어..'}, {'user': '독호메', 'comment': '로비 0티어'}, {'user': '토마호크스테이크', 'comment': '로비에 세워놓고 목소리만 듣는중'}, {'user': '와아와', 'comment': '외모도 성능이다 이거야'}, {'user': '이식빵아', 'comment': '(emoticon)'}, {'user': '로리힐데', 'comment': '(emoticon)'}, {'user': '한국인어서오고', 'comment': '风'}, {'user': '팔도', 'comment': '(emoticon)'}, {'user': '랑편#60846748', 'comment': '(emoticon)'}]",https://arca.live/b/counterside/42722098,2022-01-19 02:38:20,1770,36,17
42721041,TONE,관리자의 기억을 들여다본 오로치가 보고 싶다,"오로치는 관리자를 자기의 수하로 삼기 위해 계속해서 영생을 미끼로 꼬셔봤지만 그때마다 관리자는 “난 너무 오랫동안 살아왔네...” 이런 대답으로 번번이 거부해왔다 오로치는 이러한 대답을 단순히 인간 노인들이 자주 하는 한탄으로 넘겨짚었지만, 그녀의 움직임을 경계하던 그의 부하인 이수연의 말에 그의 말이 단순한 한탄이 아니라는 걸 알게 되었다. “당신의 꼬드김은 사장님에게는 엇나간 꼬드김입니다. 그분은 너무나도 많은 상처를 받아왔습니다.” 하지만 이수연의 이러한 조언은 역으로 오로치에 있어서 엄청난 흥미를 돋우게 했다. 그래서 오로치는 관리자에게 요청했다. “그대가 내 제안을 거절하는 이유를 알고 싶구나. 허니 그대의 인생을 살펴봐서 그 이유를 알고자 한다. 만약 그 이유가 납득이 가면 이젠 그대에게 제안을 하지 않겠다.” 관리자는 슬슬 오로치의 꼬드김이 귀찮아지던 참에 그녀의 불간섭 제안은 나름 달갑게 느껴졌지만, 그게 그녀에게 있어서 감당이 가능할지 또한 걱정되었다. “그대의 생각이 보이는구나. 걱정 말거라. 나 또한 수백 년은 살아온 몸. 그대의 인생 정도는 별 탈 없이 들여다 볼 수 있는 그릇을 가졌다.” 여전히 미덥긴 하지만 자신만만한 그녀의 표정을 본 관리자는 결국 자신의 기억을 보는걸 허락했다. 관리자의 허락이 떨어지자마자 바로 관리자의 이마에 손을 얹고 기억을 읽어내기 시작했다. 그 찰나의 순간이었다. 오로치는 순간 기력이 풀린 듯 주저앉아 쓰러지려고 했고 관리자는 그러한 그녀의 몸이 쓰러지지 않게 손으로 잡아주었다. 잠시 동안의 시간이 지난 이후 정신을 차린 건지 겁에 질린 표정으로 오로치가 서서히 얼굴을 들었다 관리자의 얼굴과 그녀의 얼굴의 물리적인 거리는 가까웠고, 이전에도 분명 그렇게 느꼈다. 그러나 지금은 달랐다. “그대는...” 관리자의 기억의 한 단면을 읽은 지금은 그의 얼굴이 저 하늘 너머에 있는 거 같았다. “그대는 대체...” 아주 잠깐 동안인데도 불구하고 솟구쳐오는 절망과 고통의 기억. 평범한 사람이 그 기억을 읽는다면 순식간에 쇼크사 했겠지만, 기력을 잃고 쓰러지는 수준에서 끝난 건 그녀가 가진 역신이란 직함이 보여주기 수준이 아니라는 걸 증명해주는것 같았다.  “정체가...” 다시 말하면 수백 년 동안 살아온 역신이라는 존재조차 그 기억의 한 단면은 감당하기 어렵단 소리였다. “무엇이냐...” 그러한 절망과 고통의 기억을 가지고 있음에도 태연하게 자신을 걱정하는 모습을 보이는 관리자의 얼굴은 그녀의 전신에 소름이 끼칠 만큼 두렵게 느껴졌다.라면서 쓰러진 오로치를 뱀술로 담궈버리고 싶다","[{'user': '으으윽', 'comment': '엔딩 뭔데'}, {'user': '토마호크스테이크', 'comment': '술을 먹이고 실금시키면 뱀?술이 아닐까'}, {'user': 'xile#17342824', 'comment': '(emoticon)'}, {'user': 'windy', 'comment': '엔딩 급커브 무엇'}, {'user': '샌디치크스', 'comment': '(emoticon)'}, {'user': 'MUON', 'comment': '아니 결말 뭔데 ㅋㅋㅋ'}, {'user': '클러스트', 'comment': '결말 ㅋㅋㅋ'}, {'user': '이디스애호해', 'comment': '뱀술 마시고 이수연 따먹는거 못참지 ㄹㅇ..'}, {'user': '마에스트로', 'comment': '이거네 ㅋㅋㅋㅋㅋㅋㅋㅋㅋㅋㅋㅋㅋㅋ 개웃기네'}, {'user': '마에스트로', 'comment': 'ㅋㅋㅋㅋㅋㅋㅋ이게 반전이지'}, {'user': '청정뉴비', 'comment': '(emoticon)'}, {'user': '랑편#60846748', 'comment': 'ㅋㅋㅋㅋ'}, {'user': '초록풀때기', 'comment': '꽐라로 만든 다음에 따먹으면 그게 뱀술아닐까'}]",https://arca.live/b/counterside/42721041,2022-01-19 02:07:45,855,33,13
42704062,916740#25118327,ㅋㅋㅋ 씹 폭사하고 결국 환생했다,류드 스피라 쌍으로 정가가니까 개 현타오네 ㅋㅋㅋㅋ 심지어 오로치만 4필뚥 걍 4각계로 환생했다 이럴줄 알았으면 진작할껄 ㅋㅋㅋㅋ이전계정 구글에서 한번에 환불받는 방법 아시는분 도움좀 ㅋㅋㅋ,"[{'user': 'DLoy', 'comment': '원래 몇각계임?'}, {'user': '916740#25118327', 'comment': '킹이랑 유나 이렇게 2개 있었음'}, {'user': 'DLoy', 'comment': '그럼 할만했네 어중간하게 되면 환생도 애매해져서'}, {'user': '마에스트로', 'comment': '(emoticon)'}, {'user': 'DLoy', 'comment': '구글 3개월내 아니면 환불 안되지않나?'}, {'user': 'DLoy', 'comment': '이중재화 구조가 환불 막으려고 있는걸로 아는데'}, {'user': '916740#25118327', 'comment': '최근 질러서 아직 일주일도 안됨 ㅋㅋㅋㅋ'}, {'user': '916740#25118327', 'comment': '일단 본계정으로 블루프린트 뽕 뽑고 환불해야것다'}]",https://arca.live/b/counterside/42704062,2022-01-18 21:30:24,117,1,8
42682138,Ozymandias,마그마를 내가 마그마 ㅋㅋㅋ,오렌지 먹은지 얼마나 오렌지 ㅋㅋ주시윤한테 공중공격좀 주시윤 ㅋㅋ타이탄 위에 일단 타 이탄 ㅋㅋ시그마가 이열을 시그마 ㅋㅋ바나나 먹으면 나한테 바나나 ㅋㅋ오로치 당신은 나만 오로치 바라봐줘 ㅋㅋ힐데야 나 딸핀데 힐 데? ㅋㅋ알렉스 애기렉스 티렉스 ㅋㅋ시드니에 가면 꽃이 시드니 ㅋㅋ이유리양 이 유리 좀 갈아주게나 ㅋㅋ도마가 잡일을 도마타 한다 ㅋㅋ,"[{'user': 'kimjino#87804663', 'comment': '(emoticon)'}, {'user': '늒네#63701435', 'comment': '(emoticon)'}, {'user': 'ㅇㅇ, 211.231', 'comment': '(emoticon)'}, {'user': '콘싸개', 'comment': '(emoticon)'}, {'user': 'ㅇㅇ#67770628', 'comment': '(emoticon)'}, {'user': '소미맘', 'comment': '(emoticon)'}, {'user': 'Asu', 'comment': '(emoticon)'}, {'user': 'euneisan', 'comment': '(emoticon)'}, {'user': '랑편#60846748', 'comment': '(emoticon)'}]",https://arca.live/b/counterside/42682138,2022-01-18 15:56:37,104,0,9
42661840,야한눈나,아니 루시드도 구리고 셰나도 구리고,드라코도 구리고 닌자걸도 구리고 오로치도 구려???신캐 왜 맨드는거임??,"[{'user': '백합덕후#78782383', 'comment': '(emoticon)'}, {'user': '아이러브타우ㅜ', 'comment': '대신에 깡우 각우 어떤 새끼가 생각햇는지 대가리 까보고 싶을 정도로 애미디졋음'}, {'user': '야한눈나', 'comment': '머 각성은 각성끼리 놀라하고...왤캐 구린 캐릭만 내나'}, {'user': '무야홍어', 'comment': '로비장식'}, {'user': '쏘닝#87464880', 'comment': '재무장 존버임 그거 스비새끼들 아님말고'}, {'user': 'Konzept', 'comment': '채용권 회수'}, {'user': 'Cowshoesfrozen', 'comment': '깡우도 쌔잖아'}, {'user': '이리스유마', 'comment': '(emoticon)'}]",https://arca.live/b/counterside/42661840,2022-01-18 08:55:22,184,0,8
42629347,ㅇㅇ#75592947,먼가 찜찜했는데 오로치 유기했네,뽑고 한번도 안쓴거 같은데 ㅋ요즘 신캐들 맨날 까먹고 100렙도 안찍어줌 닌자 셰나도 유기함재무장하느라 바쁘니까 걍 버림 똥캐년들,,https://arca.live/b/counterside/42629347,2022-01-17 19:17:09,39,0,0
42569638,시영이#15396404,오로치는 약간 물로켓 느낌???,막 가은단 같이 세력이 만들진건 아닌듯 출연이 너무 적어서 그런가,,https://arca.live/b/counterside/42569638,2022-01-16 19:40:31,43,0,0
42531853,딥러닝다람쥐,"""싶다""",오로치랑 '임신섹스' 하고싶다,"[{'user': '누소', 'comment': '(emoticon)'}]",https://arca.live/b/counterside/42531853,2022-01-16 01:39:33,85,0,1
42518131,리이파#93609301,진짜 순수한 궁금증임.,"신지아 가슴이 큼?아니 작은 건 아닌데, 카사 세계관에서 저 정도 보통 아님?유미나나 서윤이 저거랑 비슷한데.알렉스나 이디스, 카린도 스킨 보면 보통은 다 저정도 사이즈이지 않나?아예 없는 애들 빼면.이번에 순불 웹툰에서 나온 대사는 제이나나 오로치 급만 할 수 있는 거 아님?","[{'user': '두트리오', 'comment': '1주년스킨보면 답 나옴'}, {'user': '극한의가능충', 'comment': '퀸이랑 비교해보니 전부 빈유임'}, {'user': '꿀통뺏긴푸', 'comment': '벗으면 엄청난듯'}, {'user': 'ㅇㅇ#32573035', 'comment': '서윤보단 확실히 크고 미나랑은 모르겠다'}, {'user': 'windy', 'comment': '비교대상이 나머지 알파트릭스 애들이니까 머'}, {'user': 'xile#17342824', 'comment': '근데 지아 옆에있는애들이'}, {'user': '비질란테', 'comment': '팩트)홍어랑 닥등이가 무식하게 큰거다'}]",https://arca.live/b/counterside/42518131,2022-01-15 21:46:52,69,0,7
42509822,ㅇㅇ#23551891,애초에 게임에서 인기는 성능임,카사가 인기캐를 대접 안한다는 그런 글에 스토리관련된 말만 있어서 뭔가 안타까워서 쓰는건데진짜 아르티마냥 성능이 커버 못칠정도의 극소수 취향인게 아닌 이상 성능은 인기의 전부임아카 광고까지 터트린 이디스건 여름 카사를 먹여살린 에델이건 인기투표 1등 최다 기록자인 알렉스건 뭐건 성능 밀리니까 퇴물되고오로치건 카나데건 드라코건 성능 안좋으니까 출시 당시에만 반짝 하고나서 그 뒤로는 가끔 언급되기만 하는 수준인데호라이즌도 각우건 깡우건 할거 없이 장애인이었으면 딱 일주일 가서 언급 쥐꼬리도 안나왔을걸아무리 예뻐도 사용을 안하면 저절로 마음에서 멀어지는법임옛날엔 대공여왕이 카린이었는데 파워 밀리고 나서 커피포트 밈으로 먹고 살다가 이젠 퇴물된지 너무 오래되서 그것조차 언급도 안나오는것마냥스토리를 아무리 좋게 나오고 많이 나와도 성능이 구리면 이디스 에델 알렉스처럼 점점 인기 식어서 퇴물되는거고자기는 스킨도 안받는 주제에 이벤트 나올때마다 꼽사리 껴도 성능만 좋으면 아무런 반발도 없는법임당신의 최애캐가 과거에 인기 많던 성능고자라구요?스토리를 아무리 잘뽑아줘도 지금의 스비처럼 재무장만 뽑아내는 방식이면 평생 그대로일걸난 그래서 재무장이 싫어총겜 모드2나 깡겜 개2 정도는 되야지 성의도 없고 변하는것도 없이 돈만 보는주제에 밸패도 이제 재무장때문에 절대 일반캐한테 옛날 카일 로자 옌 치후유 수준의 밸패는 절대 안할거잖음,"[{'user': '류금테이오', 'comment': '(emoticon)'}, {'user': '머랭머랭머랭', 'comment': '나만 좋아하면 쓰이든 안쓰이든 상관없음'}, {'user': 'ㅇㅇ#23551891', 'comment': '그게 맞는데 해탈하지 못하면 그게 너무 슬퍼지고 화나더라 내가 그래서 자기 화 못이기고 잠깐 롤토체스로 매카노 했었음'}, {'user': '머랭머랭머랭', 'comment': '(emoticon)'}, {'user': '앤뱃살', 'comment': '사실 밸런스문제는 조정으로 잡고 스킬셋들이 낙후되서 메타에 안맞는애들을 재무장시켜주면 좋겠는데... 안해줄거같음'}]",https://arca.live/b/counterside/42509822,2022-01-15 19:25:54,81,1,5
42497207,동성회직계69대회장아스나,솔직히 힐데보단 꼴리는애들 수두룩임,이수연이나 오로치 퀸 같이 개꼴리는 애들이 너무 많음,"[{'user': '철덩이', 'comment': '타이탄이 꼴리긴하지'}]",https://arca.live/b/counterside/42497207,2022-01-15 15:02:14,33,0,1
42493486,ㅇㅇ#10271370,오로치 상향해..,인격배설이니 뭐니 하더니 성능 구리니까 바로 언급삭제되는거봐,,https://arca.live/b/counterside/42493486,2022-01-15 13:40:50,16,0,0
42489339,ㅇㅇ#83721190,카나데 오로치 전부 빨통은 씹오지면서,빨통원툴캐들....ㅅㅂ.....,"[{'user': '극한의가능충', 'comment': '퀸 보다 작음'}]",https://arca.live/b/counterside/42489339,2022-01-15 12:10:05,20,0,1
42461567,"ㅇㅇ, 220.79",오로치마루였나 걔랑 닌자 새로나온 애들은 각성캐였음?,걔네 스토리도 나왔나,"[{'user': 'windy', 'comment': '오로치랑 하야미 카나데 스토리 나왔고 일반캐릭임'}, {'user': 'ㅇㅇ, 220.79', 'comment': '통언뜬 노려야겠구만'}, {'user': '초특가가챠다', 'comment': '새로나온 닌자 캐릭은 각성 없음'}, {'user': 'ㅇㅇ, 220.79', 'comment': 'ㄳㄳ'}, {'user': 'Nanoha', 'comment': '오로치는 채용쓰알, 카나데는 패스'}, {'user': '쇠고기육포캔', 'comment': '일반캐 정도는 갑자기 이벤트스토리로 한번 갑툭튀하고  출시하는편. 각성케릭은 스토리빌드업 제대로 하는편이라 이벤트스토리 2개나 메인스트림에 주연급으로 나와야 출시함'}, {'user': 'ㅇㅇ, 220.79', 'comment': '그러네 생각해보니까 멘스 주연급이나 이벤트스토리 잔뜩 먹는애 아니면 안나왔노'}, {'user': '쇠고기육포캔', 'comment': '기밀채용 자체가 그나마 돈이 되니까 ㅋㅋㅋ'}]",https://arca.live/b/counterside/42461567,2022-01-14 21:56:26,66,0,8
42450501,windy,요즘 신캐들 성능 병신이라 묻힌 애들이 한둘이 아님,드라코루시드셰나카나데오로치공통점: 일러만 공개됐을땐 다들 찬양 일색이었음,"[{'user': 'ㅇㅇ, 1.238', 'comment': '드라코 나올땐 모네 엄마만 빨렸는데'}, {'user': '님얼굴비매너', 'comment': '(emoticon)'}, {'user': 'ㅇㅇ, 121.179', 'comment': '사실 저게 정상적인 성능인거임;'}]",https://arca.live/b/counterside/42450501,2022-01-14 19:20:32,44,0,3
42449220,대적자리이헤븐즈사인민혁,오로치 누나 인기 절정이었던 순간,,"[{'user': '아루룽', 'comment': '(emoticon)'}, {'user': '클러스트', 'comment': '이거 완전 루크레시아'}, {'user': 'ㅇㅇ#45050405', 'comment': '이벤병신 성능병신 최단기퇴물'}, {'user': '에시온', 'comment': '성능 병신까진 아니던데 대체재가 너무 많을 뿐 ㅋㅋ'}, {'user': '슽헤잌흐#83177257', 'comment': '마왕조차 아니었던년..'}, {'user': 'ㅇㅇ#83721190', 'comment': 'ㅋㅋㅋㅋㅋㅋㅋㅋㅋㅋ'}]",https://arca.live/b/counterside/42449220,2022-01-14 19:02:48,82,0,6
42438940,대적자리이헤븐즈사인민혁,나오기 전에는 인기 좋았던,오로치,"[{'user': 'kimjino#87804663', 'comment': '(emoticon)'}, {'user': '렘딘', 'comment': '(emoticon)'}, {'user': '카늒네', 'comment': '(emoticon)'}, {'user': '누소', 'comment': '(emoticon)'}, {'user': 'ㅇㅇ#10807347', 'comment': '공개땐 이뻣는데 뭔가 얼굴이 몬생겼어'}, {'user': '클러스트', 'comment': '인격배설 원툴'}, {'user': 'ㅇㅇ#84900491', 'comment': '루크는 인기많아'}, {'user': '카늒네', 'comment': '루크는 인기많아'}, {'user': '카늒네', 'comment': '(emoticon)'}, {'user': '새벽비', 'comment': '성능이 너무 처참함'}]",https://arca.live/b/counterside/42438940,2022-01-14 16:49:36,117,0,10
42414248,화이트래빗,오로치 마왕 아닌걸로 확정 났음?,ㅈㄱㄴ,"[{'user': '늒네#86893131', 'comment': '아닐 가능성 높지'}, {'user': '카늒네', 'comment': '걍 잊혀짐'}, {'user': '블루아카이브', 'comment': '희귀종'}, {'user': '뇌가있는용기병', 'comment': '모르겠음'}, {'user': '촤드', 'comment': '걍 고대종인듯'}]",https://arca.live/b/counterside/42414248,2022-01-14 08:20:10,146,0,5
42404639,ㅇㅇ#45050405,확실히 이게임은 언급이라도 되려면 기본적인 성능은 있어야한다고 느낀게,오로치 병신년은 스토리도 좋은평은 아닌데다가 성능도 좆박아서 이벤 끝나고 픽업 끝나자마자 귀신같이 증발함ㅋㅋㅋ,"[{'user': '매복', 'comment': '진짜 약자를 놀리는건 비겁한 쥐새끼같은 행동이다'}, {'user': 'ㅇㅇ#45050405', 'comment': '진짜 약자를 놀리는건 비겁한 쥐새끼같은 행동이다'}, {'user': 'ㅇㅇ#74194811', 'comment': '그래도 뽑아놓음'}, {'user': 'ㅇㅇ#45050405', 'comment': '(emoticon)'}, {'user': '늒네#86893131', 'comment': '미카 셰나처럼 제대로 좆박으면 아주 가끔 언급은 되는데 오로치 이 년은ㅋㅋ'}, {'user': 'ㅇㅇ#45050405', 'comment': '셰나도 좆박긴 했는데 얜 도저히 뭔생각으로 냈는지 모를 아예 상식 밖의 설계라 언급이라도 됨\n미카는ㅋㅋㅋㅋㅋ'}, {'user': '독호메', 'comment': '출시전이 제일 핫했던년...'}, {'user': 'ㅇㅇ#45050405', 'comment': '출시전이 최고 전성기일줄은'}, {'user': '맛있는힐데리아', 'comment': '스토리에서도 넘 약하게 나옴 마왕인줄 알았더만 토지신 정도인듯'}, {'user': 'ㅇㅇ#45050405', 'comment': '마왕도 아니고 그냥 센 환상종이라 떡밥도 없고 이벤 자체가 메인이랑 관련이 1도 없을줄은'}, {'user': '사축', 'comment': '인격배설 당한 퀸 나와서 컨셉도 뺏김'}, {'user': 'ㅇㅇ#45050405', 'comment': '생각해보니 유일하게 밈으로 이기는 인격배설도 진짜가 튀어나왔네ㅋㅋㅋ'}, {'user': 'ㅇㅇ#85245304', 'comment': '이벤트 스토리도 좀 진부했어가지고 더더욱 묻힌듯'}, {'user': 'ㅇㅇ#85245304', 'comment': '마왕이거나 최소한 사도이기라도 했으면 스토리상 언급도 많이 되고 나중에 재등장할 가능성도 있는데 얘는 뭐'}, {'user': 'ㅇㅇ#45050405', 'comment': '뭔 역겨운 라노벨이 튀어나올줄은 누구도 예상못함'}, {'user': 'ㅇㅇ#85245304', 'comment': 'ㄹㅇ 너무 별로였음 설정 오류는 그렇다치고 이전 스토리가 호라이즌이어서 그런가 더더욱 퀄리티가 떨어졌지'}]",https://arca.live/b/counterside/42404639,2022-01-14 01:03:42,144,0,16
