index,user,title,content,comment,link,date,view,rate,comment_count
40378764,ㅇㅇ#99402221,이거 먼가 부랄 쓰다듬는거같음요...,오로치마망이 부랄 애무하는거같아헤으응,"[{'user': 'Blacksilence', 'comment': '(emoticon)'}, {'user': 'ㅇㅇ#96199898', 'comment': '(emoticon)'}]",https://arca.live/b/counterside/40378764,2021-12-15 01:23:59,57,0,2
40378241,상점누나가좋아#52539577,피오네 치후유 오로치 바스트 모핑,제목대로잉오로치 저 정도면 꼭지보여야하는데,"[{'user': '숲토끼', 'comment': '(emoticon)'}, {'user': '초특가가챠다', 'comment': '(emoticon)'}]",https://arca.live/b/counterside/40378241,2021-12-15 01:13:35,31,3,2
40377396,누소,친구 한놈 몰루로 떠나고 배신했다,내가 오로치는 먹고 가라했더니 오늘 10뽑으로 뽑고 다시 빤스런함,"[{'user': 'purple', 'comment': '게임개발부는 어쩔 수 없지'}, {'user': '블루아카이브', 'comment': '(emoticon)'}, {'user': '활처럼휘었다', 'comment': 'ㅅㅂ ㄹㄴ?'}]",https://arca.live/b/counterside/40377396,2021-12-15 00:58:37,48,0,3
40376213,Dhehej#23829992,오로치눈나의 두툼한 핑크빛 청국장발사구멍,빨고싶다,"[{'user': '블루아카이브', 'comment': '(emoticon)'}, {'user': '독호메', 'comment': '일본캐니까 청국장이 아니라 낫토맛날듯'}]",https://arca.live/b/counterside/40376213,2021-12-15 00:40:18,38,0,2
40375999,Such,오로치 ㄹㅇ 존나 꼴린다,뽀얀 살결에 튼실한 허벅지 둔덕 빅젖 못참겠다 ㄹㅇ원조 마망과 로비에 놓으니까 로비만 봐도웃음이 끊이질않노 ㅋㅋㅋ,"[{'user': '누소', 'comment': '오'}, {'user': '독호메', 'comment': '이응이열개'}, {'user': '독호메', 'comment': '오로치를 옆에 두니까 퀸마망조차도 골반 빈약해보이네 미쳤노'}]",https://arca.live/b/counterside/40375999,2021-12-15 00:37:03,26,0,3
40375762,제주삼다수군통제사,"★확인 권장★12/14 패치관련 알면 좋은 쿠폰,공지,이벤트,공식 등 정리","12/14 패치 관련 정보 + 이벤 등 요약입니다.누락 건 이나 기간 만료 등 제보 받습니다.----금일 패치와는 관련 없지만 알면 좋은 사항----■ 재무장 관련 이슈 종합 정리 ■https://arca.live/b/counterside/37590899?p=1■ 챈에 챌린지 공략 공사 완료 ■https://arca.live/b/counterside/39876535 ■ Live In COUNTERSIDE - 12/17(금) 오후 6시 생방송 사전 안내 ■ https://arca.live/b/counterside/40070037 버그 확인이나 제보는 여기로■ 통합 버그페이지 ■ 신규버그 현재 매우많음 /공사중https://arca.live/b/counterside/32156913?p=112/14(화) 업데이트 점검 및 패치노트 안내https://arca.live/b/counterside/40283458 카운터사이드 12월 업데이트 미리보기 https://arca.live/b/counterside/39626105  렐릭 챌린지 '고급 장비 소재' 드랍률 데이터 오류 안내https://arca.live/b/counterside/40349031 2021년 12월 14일(화) 기준 업데이트 현황 안내https://arca.live/b/counterside/40373344 밀리아 레이지 밸런스 조정에 따른 리콜 및 재화 환급 기준 안내https://arca.live/b/counterside/40070051 [개발자노트 31편] T7 장비와 관련된 컨텐츠 및 시스템 사전 안내https://arca.live/b/counterside/39626084?category=%EA%B3%B5%EC%A7%80&p=1 나나하라 N행시 이벤트! 당첨자 안내https://arca.live/b/counterside/40373857 오로치의 선물 온/핫타임 안내 -장비관련 클딧할인 / 이터,클딧,정보 지급 ~12/19,20https://arca.live/b/counterside/40373894장비 강화 출근체크 안내 [7티어 기념 특별 보급] - 출첵 사료판 ~12/28 https://arca.live/b/counterside/40374031대상 유닛 채용 확률 UP 안내 -Edel Sex Partner Regina ~12/28https://arca.live/b/counterside/40373918야마타노오로치 채용 확률 UP 안내 ~12/28https://arca.live/b/counterside/40373965관리국 T7 지원 온타임 안내 - 강화모듈/이터 지급 ~12/15https://arca.live/b/counterside/40374080 ------------------------  여기 까지 12/14 관련  여기서 부터 전 패치중 아직 유효한 사항 |★ 소림이의 쿠폰 선물! SORIMSCOUPONCS  -500쿼츠  ~12/22 https://arca.live/b/counterside/38882234 ★오퍼레이터 채용 UP 안내 - 공방누나/박정자 ~12/21https://arca.live/b/counterside/39383888 ★기밀 채용 2종 복각 안내 -주시윤/찌찌퀸 ~12/28https://arca.live/b/counterside/39885385 ","[{'user': 'dlbodkel', 'comment': '(emoticon)'}, {'user': '독호메', 'comment': '(emoticon)'}, {'user': 'Aoi', 'comment': '(emoticon)'}, {'user': 'Badfinger', 'comment': '(emoticon)'}, {'user': '우치하루피', 'comment': '(emoticon)'}, {'user': 'MBT', 'comment': '(emoticon)'}]",https://arca.live/b/counterside/40375762,2021-12-15 00:33:40,69,6,6
40373965,제주삼다수군통제사,공사중)야마타노오로치 채용 확률 UP 안내,"▣ 채용 기간- 12/14(화) 점검 후 ~ 12/28(화) 오전 4시 까지▣ 채용 조건- 채용 기간 동안 대상 유닛 확률 UP!야마타노오로치 채용 확률 UP▣ 채용 대상- 확정 채용 대상 : 야마타노오로치▣ 꼭 읽어주세요!1) 운영 기간은 상황에 따라 변경될 수 있으며, 변경 시 사전 안내 드립니다.2) 확정 채용에 대해서 아래에 자세하게 안내 드립니다. - 확정 채용 횟수: 150회 해당 횟수 중 반드시 확정 채용 대상이 1명 등장합니다. - 확정 채용 사원을 획득하면 확정 채용 횟수가 초기화 됩니다. - 확정 채용 대상은 [야마타노오로치] 입니다.3) 채용 전 설정된 확률을 꼭 확인해주세요.",,https://arca.live/b/counterside/40373965,2021-12-15 00:08:11,43,0,0
40373911,밤비,님들 오로치 그래서 어디까지 봄?,"킹갓 밀리아급1티어 레인저급 (유리,가은,카일)2티어 레인저급 (재등이,구관)잡다",,https://arca.live/b/counterside/40373911,2021-12-15 00:07:34,17,0,0
40373894,제주삼다수군통제사,오로치의 선물 온/핫타임 안내,"▣ 이벤트 기간- [핫타임 이벤트] : 12/14(화) 점검 후 ~ 12/20(월)- [온타임 이벤트] : 12/16(목) ~ 12/19(일)▣ 수령 방법- 이벤트 기간 중 접속 시 해당 이벤트 효과 적용/게임 내 우편에서 직접 수령▣ 이벤트 선물1) 오로치의 선물 핫타임 이벤트- 장비 강화/튜닝 시 소모되는 크레딧 비용 20% 할인* 매일 00:00 ~ 23:59까지 핫타임 이벤트 형태로 운영됩니다.2) 오로치의 선물 온타임 이벤트- 10:00~23:59 : 이터니움 3,000 + 정보 1,000- 18:00~23:59 : 크레딧 250,000▣ 꼭 읽어주세요!1) 자세한 이벤트 관련 안내는 [이벤트 정책]에서 확인해주세요.2) 우편 만료 기간을 확인하시고 늦지 않게 우편함에서 수령해주세요.3) 게임 운영정책을 위반하신 사장님에게는 관리국에서 혜택/보상을 지급하지 않습니다.",,https://arca.live/b/counterside/40373894,2021-12-15 00:07:15,32,0,0
40373879,엿이나처무라#99513101,오로치쨩은 장비 뭐가 제일 낫냐,오로치쨩은 공속 위주임?아니면 스충 위주임?뭐가 제일 나을려나,,https://arca.live/b/counterside/40373879,2021-12-15 00:07:06,12,0,0
40373344,제주삼다수군통제사,2021년 12월 14일(화) 기준 업데이트 현황 안내,"안녕하세요. 사장님 카운터사이드 입니다.월간 업데이트 계획 및 진행 상황에 대해 안내해드립니다.2021년 12월 14일(화) 점검 기준으로 업데이트 현황은 다음과 같습니다. ■ 업데이트 현황 46% 구현 완료* 일정 재검토: 게임 내에 적용까지 장기 지연이 예상되어 계획 재수립, 검토가 필요한 항목* 지연: 최초 계획된 시점에서 적용 일정이 조정되었으나, 근시일 내 게임 적용 예정인 항목■ 업데이트 계획 상세 리스트공개 시점카테고리항목상태12/7(화) 패치노트이벤트[튜닝 바이너리] 이벤트 챌린지 진행구현 완료12/7(화) 패치노트이벤트[아나스타샤의 물자 정비] 이벤트 챌린지 진행구현 완료12/7(화) 패치노트복각[아라한 주시윤], [리플레이서 퀸] 복각 기밀 채용구현 완료12/14(화) 패치노트추가T7 장비 제작 시스템 추가구현 완료12/14(화) 패치노트추가T7 스위프트 렐릭 장비 추가구현 완료12/14(화) 패치노트추가T6 장비 업그레이드 시스템 추가구현 완료12/14(화) 패치노트추가T6, T7 장비 제작, 업그레이드 소재 파밍 콘텐츠 추가구현 완료12/14(화) 패치노트개선명함 교환소 - 극비 재무장 데이터 상품 추가구현 완료12월 업데이트 미리보기추가신규 SSR 유닛 [오로치] 추가구현 완료12월 업데이트 미리보기개선[재무장 유미나] 리뉴얼 구현 완료12월 업데이트 미리보기추가[나나하라 치후유], [에리어스], [피오네 로웰] 상설 스킨 추가구현 완료12월 업데이트 미리보기복각[오래된 공포] 이벤트 에피소드 외전 편입구현 완료12/14(화) 패치노트복각[에델 마이트너], [레지나 맥크레디] 복각 채용구현 완료12/14(화) 패치노트이벤트[장비 강화] 출근체크 이벤트 진행구현 완료12/14(화) 패치노트추가크레딧 보급 작전 추가구현 완료12/14(화) 패치노트개선모의 작전 연수 티켓 구매 방식 개선구현 완료12월 업데이트 미리보기복각[성야의 살인마] 이벤트 에피소드 복각구현 예정12월 업데이트 미리보기복각[성야의 살인마] 이벤트 미션, 상점 복각구현 예정12월 업데이트 미리보기이벤트[크리스마스] 이벤트 미션 추가구현 예정12월 업데이트 미리보기추가[알파트릭스] 카운터케이스 신규 추가구현 예정12월 업데이트 미리보기추가[화이트 레빗] 전용장비 챌린지 추가구현 예정12월 업데이트 미리보기이벤트크리스마스 출근체크 이벤트 진행구현 예정재무장 개발자 노트환급[밀리아 레이지] 리콜 & 획득 비용 환급 진행구현 예정12월 업데이트 미리보기이벤트2022 신년 서킷 링크 진행구현 예정12월 업데이트 미리보기추가챌린지 ACT. 5 추가구현 예정12월 업데이트 미리보기추가재무장 유닛 3종 추가구현 예정12월 업데이트 미리보기이벤트신년 출근체크 이벤트 진행구현 예정건틀렛 설문조사개선, 개편건틀렛 시즌 룰 삭제구현 예정개발자노트 26편추가건틀렛 친선전지연건틀렛 설문조사개선, 개편건틀렛 전략전, 랭크전 모드 개선사항 도입지연건틀렛 설문조사개선, 개편방어, 치명, 명중, 회피 능력치 성징 및 아이템 보정 제거지연건틀렛 설문조사개선, 개편오퍼레이터 밸런싱 적용지연개발자노트 26편추가1:1 채팅일정 재검토개발자노트 26편추가GGST 콜라보 유닛 음성 추가일정 재검토9월 업데이트 미리보기개선, 개편프롤로그 연출 강화일정 재검토* 지연/일정 재검토 항목은 구현 전까지 업데이트 현황에 상시적으로 안내될 예정입니다.* 지연/일정 재검토 항목은 일반적으로 개발 일정 산정, 협업 주체 커뮤니케이션과 같이 논의 필요 내용이 있어 목록 추가 및 상세 안내 전 현황 파악을 위해 추가하였습니다. ※ 12/7(화) 업데이트 적용 항목- [튜닝 바이너리] 이벤트 챌린지 진행- [아나스타샤의 물자 정비] 이벤트 챌린지 진행- [아라한 주시윤], [리플레이서 퀸] 복각 기밀 채용※ 12/7(화) 지연, 일정 재검토 항목- 건틀렛 친선전- [밀리아 레이지] 획득 비용 환급- 건틀렛 전략전, 랭크전 모드 개선사항 도입- 방어, 치명, 명중, 회피 능력치 성징 및 아이템 보정 제거- 오퍼레이터 밸런싱 적용- 1:1 채팅- GGST 콜라보 유닛 음성 추가- 프롤로그 연출 강화※ 12/14(화) 업데이트 적용 항목- T7 장비 제작 시스템 추가- T7 스위프트 렐릭 장비 추가- T6 장비 업그레이드 시스템 추가- T6, T7 장비 제작, 업그레이드 소재 파밍 콘텐츠 추가- 명함 교환소 - 극비 재무장 데이터 상품 추가- 신규 SSR 유닛 [오로치] 추가- [재무장 유미나] 리뉴얼 - [나나하라 치후유], [에리어스], [피오네 로웰] 상설 스킨 추가- [오래된 공포] 이벤트 에피소드 외전 편입- [에델 마이트너], [레지나 맥크레디] 복각 채용- [장비 강화] 출근체크 이벤트 진행- 크레딧 보급 작전 추가- 모의 작전 연수 티켓 구매 방식 개선※ 12/14(화) 지연, 일정 재검토 항목건틀렛 친선전건틀렛 전략전, 랭크전 모드 개선사항 도입방어, 치명, 명중, 회피 능력치 성징 및 아이템 보정 제거오퍼레이터 밸런싱 적용1:1 채팅GGST 콜라보 유닛 음성 추가프롤로그 연출 강화[밀리아 레이지] 리콜 & 획득 비용 환급 진행 지연 → 구현 예정 ","[{'user': '서묘', 'comment': '(emoticon)'}, {'user': '우치하루피', 'comment': '(emoticon)'}, {'user': '대적자리이헤븐즈사인민혁', 'comment': '(emoticon)'}, {'user': 'ㅇㅇ#66825526', 'comment': '(emoticon)'}]",https://arca.live/b/counterside/40373344,2021-12-15 00:00:14,68,2,4
40372891,하례아,협력전에 오로치 써볼까,딜도의 실력이 얼마나 될지 궁금하네,"[{'user': '나그거없는데', 'comment': '로자만큼 딜은 뽑을거 같은 느낌은 듬'}]",https://arca.live/b/counterside/40372891,2021-12-14 23:54:34,29,0,1
40372885,ㅇㅇ#56644259,오로치 평타 선후딜 진짜 좆같이기네,바로 쏘라고,,https://arca.live/b/counterside/40372885,2021-12-14 23:54:29,39,0,0
40372716,"ㅇㅇ, 121.133",오로치 병신판정 나니깐 관심 확 사그라들었네 ㅠㅠ,응애,"[{'user': '네모네모', 'comment': '벌써 그런판정이났나'}]",https://arca.live/b/counterside/40372716,2021-12-14 23:52:22,30,0,1
40372639,스노우랫,뭐지?사이클롭스 전복나길래 ,오로치 한번 넣어봤는데생각보다 디버프랑 완전회피 쏠쏠해서안정성이 올라가는걸?,,https://arca.live/b/counterside/40372639,2021-12-14 23:51:16,18,0,0
40372517,ㅇㅇ#65241203,오로치 = 순애강간 최적화,횡포부리던 오로치의 인격아래 초대무녀의 인격이 잠들어있다는 설정을 기반으로일상충과 친구들은 오로치를 봉인하고 잠들어있던 무녀의 인격이 깨어남초대무녀도 점점 나나하라가문의 일상에 적응해가며 마음에 드는 이성과 연인사이로 발전평범한 연인사이의 밤일을 이어가는와중 오로치의 봉인이 풀리게되고오로치는 박히고있는 자신을 발견무슨짓이냐며 뿌리치려던 찰나 초대무녀의 인격으로 전환내부적으로는 몸의 주도권을 가지려 치열한 혈투를 벌이는 와중인격을 탈취하자마자 음탕한초대무녀의 보지에 가해지는 교배프레스공격에덴동산뺨치는 순애강간 무한동력 유토피아완성 ㄷㄷ,,https://arca.live/b/counterside/40372517,2021-12-14 23:49:42,32,0,0
40370767,도리밍,오로치 스충은 별로일까,카운터 블레이즈 파밍해야하나,"[{'user': 'ㅇㅇ, 119.199', 'comment': '기모찌'}]",https://arca.live/b/counterside/40370767,2021-12-14 23:28:20,27,0,1
40370652,대적자리이헤븐즈사인민혁,야마타노 오로치,호마타예스 오로치ㅋㅋㅋㅋㅋㅋㅋㅋ,"[{'user': 'Ozymandias', 'comment': '호마타예스 오로치 vs 메도르에러 스사노오'}]",https://arca.live/b/counterside/40370652,2021-12-14 23:26:47,41,0,1
40370630,네모네모,모네야 안돼!!!,오로치에게 영혼을 뺏겨버리면!!!!!,"[{'user': '카늒네', 'comment': '(emoticon)'}, {'user': '혼란스런뉴비#53327622', 'comment': '(emoticon)'}]",https://arca.live/b/counterside/40370630,2021-12-14 23:26:33,54,1,2
40369972,대적자리이헤븐즈사인민혁,오로치 뒤에 있는 뱀,뺏어서 뱀술 담그면 어캐됨?,"[{'user': '보려고가입함#77536633', 'comment': '맛 좋은 뱀술'}, {'user': '카늒네', 'comment': '(emoticon)'}, {'user': '던붕이', 'comment': '성능좋은 정력제'}, {'user': 'VCT', 'comment': '뉴스에 그런거잇던데 뱀술에서 뱀깨서 사람문다고'}]",https://arca.live/b/counterside/40369972,2021-12-14 23:19:02,48,1,4
40369914,모닝빵우유,비틱주의) ,오로치 100렙전에 호감도 만렙찍음,"[{'user': 'ㅇㅇ#81535811', 'comment': '(emoticon)'}, {'user': '카늒네', 'comment': '(emoticon)'}, {'user': '숲토끼', 'comment': '(emoticon)'}, {'user': 'VCT', 'comment': '(emoticon)'}]",https://arca.live/b/counterside/40369914,2021-12-14 23:18:16,69,4,4
40369821,V#83851265,오로치 꼭 뽑아야하는 이유,뱀이 겁나 귀여움.,"[{'user': '대적자리이헤븐즈사인민혁', 'comment': '(emoticon)'}, {'user': '기돈곤겪기하치코', 'comment': '이제 뱀 꼬리로 섹스하는 치후유가 다음 장면인가요?'}, {'user': 'Ozymandias', 'comment': '팩트'}, {'user': 'chobo#96766903', 'comment': '뱀녀'}]",https://arca.live/b/counterside/40369821,2021-12-14 23:17:21,85,2,4
40369789,케로로소대,리타 110찍을까? 오로치 110 찍을까? ,pvp pve 생각해서 뭐부터 찍어줘어햠?,"[{'user': 'Ozymandias', 'comment': '각성 다 했음?'}, {'user': '케로로소대', 'comment': 'yes'}, {'user': 'Ozymandias', 'comment': '오로치 애매하니까 쟁여두샘'}, {'user': '케로로소대', 'comment': 'ㅇㅋ;;'}, {'user': 'ㅇㅇ, 121.179', 'comment': '오로치 평가가 아직 안 나오지 않았나'}, {'user': '케로로소대', 'comment': '검색하니까 소빈이 상위호한이라던데'}, {'user': '주블', 'comment': '오로치는 아직 연구도 안됐음\n둘 중 고르자면 리타인데, 28일에 핑챙이랑 팬드 재무장 있으니까 기다려보셈'}]",https://arca.live/b/counterside/40369789,2021-12-14 23:16:53,52,0,7
40369384,대적자리이헤븐즈사인민혁,근데 생각보다 오로치 얘기가 없다?,,"[{'user': 'ㅇㅇ#81535811', 'comment': '대신 육로치'}, {'user': '대적자리이헤븐즈사인민혁', 'comment': '(emoticon)'}, {'user': 'Ozymandias', 'comment': '오로치마루'}, {'user': '진실의문#23527495', 'comment': '고로시마루'}, {'user': '대적자리이헤븐즈사인민혁', 'comment': '(emoticon)'}]",https://arca.live/b/counterside/40369384,2021-12-14 23:12:34,46,0,5
40368426,케로로소대,뭐임 오로치 쓰레기임? ,아침만해도 좋다 이소리 많았는데? ,,https://arca.live/b/counterside/40368426,2021-12-14 23:00:33,24,0,0
40368298,두트리오,오늘 것들 질문,오로치 성능 어떰?렐릭챌 1-2밖에 못 깨면 그래도 렐릭이 나아 아니면 다른 거 돌아?,"[{'user': 'VCT', 'comment': '1 구림 궁원툴\n2 보조장비 도셈 3개다 렐릭챌인데 뭐말하는거여'}]",https://arca.live/b/counterside/40368298,2021-12-14 22:58:52,15,0,1
40368176,1q2w3,오로치 궁 계수가 5.6인가,상대 전체 디벞 스킬인데 계수도 빵빵해,,https://arca.live/b/counterside/40368176,2021-12-14 22:57:28,32,0,0
40363885,HeyHo,아무생각없이 오로치에 다꼴았는데,오로치는 오로치대로 못뽑고 스킨도 못사네 시발,,https://arca.live/b/counterside/40363885,2021-12-14 22:03:35,36,0,0
40363808,ㅇㅇ#48849829,여기 오로치가,얘하고 같은 애임?,"[{'user': '페미니스트김유식', 'comment': '비슷함'}]",https://arca.live/b/counterside/40363808,2021-12-14 22:02:26,48,1,1
40363600,ㅇㅇ#48849829,이번 오로치 성능어떤가요?,그냥 젖보고뽑나요?,"[{'user': 'Asu', 'comment': '딜도 상당함'}, {'user': 'Asu', 'comment': '오 딜도'}, {'user': 'ㅇㅇ#48849829', 'comment': '오 딜도'}, {'user': '페소라붕카린이', 'comment': '장난감이라는 말도, 쓰알 김소빈이라는 말도 보긴 했는데......\n솔직히 잘 모르겠다\n평가 나오려면  좀 더 있어야할듯'}]",https://arca.live/b/counterside/40363600,2021-12-14 21:59:40,99,0,4
40363465,Emperadium,옆동네에서 신캐 광고보고 왔는데,너네 야마타노오로치 ㅈㄴ 이쁘더라그래서 오랜만에 돌아왔음회사 인테리어가 뭔가 ㅈㄴ 바껴있고뭔진 모르겠는데 ㅈㄴ 간지나게 바꼈더라그래서 나한테 왜그러는데?말해봐 나한테 왜그러는데? 나지금 정신나갈거같아,,https://arca.live/b/counterside/40363465,2021-12-14 21:57:41,1,0,0
40361480,Badfinger,오로치 별로 안꼴림,성능이 곧 애정이라 심하게 노꼴이네,"[{'user': '밤비', 'comment': '꽤 좋지 않음?'}]",https://arca.live/b/counterside/40361480,2021-12-14 21:32:50,26,0,1
40361390,밤비,오로치 빨리 뽑아도 비틱이 아닌게 ,어차피 테포랑 ssr여려개 뽑아야함 절대 내가 천장찍은거 아니고 하물며 천장찍는 동안 ssr못 본것도 아님 그냥 너희 비틱 아니라구!!!,"[{'user': 'ㅇㅇ#96199898', 'comment': '(emoticon)'}]",https://arca.live/b/counterside/40361390,2021-12-14 21:31:40,62,3,1
40361140,ㅇㅇ#23344063,그래서 오로치 성능 어떰??,인권캐임? 로비장식용임?,"[{'user': '엘빅이', 'comment': '퀸소빈급이라던데'}, {'user': 'ㅇㅇ#23344063', 'comment': '그럼 레이드 협전말고는?? pvp는 4코 레인저 자리 없긴하겠다만'}, {'user': '엘빅이', 'comment': '퀸소빈이라니까 pvp는 못쓰고 격전은 메카 보스 아니면 오로치가 대체할듯'}, {'user': 'Asu', 'comment': '딜량이 장난아님'}, {'user': 'ㅇㅇ#23344063', 'comment': '오...'}, {'user': '건전한닉네임123', 'comment': '무난한거같은데 건공캐릭은 아닌듯 건공들이 건에선 쓰기힘들댜'}, {'user': 'ㅇㅇ#52172593', 'comment': 'PVP는 망한거같대'}]",https://arca.live/b/counterside/40361140,2021-12-14 21:28:17,111,0,7
40360596,라익스가드#56229398,오로치 템 뭐 줌?,역사와 전통의 스충?,"[{'user': '건전한닉네임123', 'comment': '블레이즈나 메공속쓰면될듯'}]",https://arca.live/b/counterside/40360596,2021-12-14 21:21:33,38,0,1
40359827,ㅇㅇ#90362386,오로치가 공익 갈아버릴거 같은데???,김소빈이 DPS 존나 무식하면서도공익한테 꼼짝 못하던게 병신 같이 낮은 명중 때문 인데오로치는 그걸 극복 했네,"[{'user': '야고#66742541', 'comment': '(emoticon)'}, {'user': 'ㅇㅇ#56644259', 'comment': '건틀렛에서 안써봤지?ㅋㅋㅋ'}, {'user': '컨섹', 'comment': 'ㅋㅋ'}, {'user': '주블', 'comment': '오로치 아니여도 공익 요즘 잘 갈림'}, {'user': 'ㅇㅇ#36099854', 'comment': '4코 말뚝 레인저 건에서 못쓰지'}]",https://arca.live/b/counterside/40359827,2021-12-14 21:11:39,59,0,5
40359556,울서윤이다했다#55762818,오로치 비틱,그래서.. 누구세요?,"[{'user': '하나팠다', 'comment': '탱크요'}, {'user': '울서윤이다했다#55762818', 'comment': '아... 탱크구나..'}, {'user': 'djdojo', 'comment': '(emoticon)'}, {'user': '정예흑우', 'comment': '롸봇 오로치 ㄷㄷ'}, {'user': '철덩이', 'comment': '(emoticon)'}]",https://arca.live/b/counterside/40359556,2021-12-14 21:08:12,61,1,5
40359406,엿이나처무라#99513101,그래서 오로치 성능이랑 평가는 어떰,오로치 건에서는 쓸만혀냐pve에서는 수준급이냐오로치 평가는 어떤것같음,"[{'user': 'zkamcc', 'comment': '가슴 1티어'}, {'user': '핑크스핑크스', 'comment': '(emoticon)'}, {'user': 'djdojo', 'comment': '(emoticon)'}, {'user': 'VCT', 'comment': '구힘'}, {'user': '하나팠다', 'comment': '장난감 수준인듯'}, {'user': '페소라붕카린이', 'comment': '소빈이 쓰알 버전이라는 덧글 봤어\n근데 정확한 평은 조금 더 기다려야할걸'}]",https://arca.live/b/counterside/40359406,2021-12-14 21:06:13,92,0,6
40358587,알다리스,근데 ㄹㅇ 오로치가 관리자 영혼 보고 어떤 반응 보일지 궁금함,"수백개의 세계, 수천년의 시간동안 겪은절망과 고통이 담긴 영혼을 보고어떤 반응이 나올지 궁금하네오로치가 겪은 절망과 고통이라고 해봤자 한 마을 수준이잖아","[{'user': 'djdojo', 'comment': '(emoticon)'}, {'user': '유나사랑해#74442742', 'comment': '그 커멸의 칼날에서 탄지로 정신 붕괴시키러 갔던놈 같은 반응 나올거 같음'}, {'user': '알다리스', 'comment': '그뭔씹'}, {'user': '유나사랑해#74442742', 'comment': '간단히 요약하면 어떻게 이런 정신이 있을수 있냐고 하면서 정신붕괴시키려다가 지가 멘탈이 나가버리는 내용임'}]",https://arca.live/b/counterside/40358587,2021-12-14 20:56:27,48,3,4
40357930,헥토르,오로치 상의 탈의 벗짤이 벌써 나왔네,,"[{'user': '나비보벳따우', 'comment': '(emoticon)'}, {'user': '스튜비급강하폭격기', 'comment': '(emoticon)'}, {'user': '뽀삐#55081939', 'comment': '(emoticon)'}, {'user': '카늒네', 'comment': '(emoticon)'}, {'user': '천공분열', 'comment': '(emoticon)'}, {'user': 'temprun', 'comment': '(emoticon)'}, {'user': '비질란테', 'comment': '(emoticon)'}, {'user': '주블', 'comment': '(emoticon)'}]",https://arca.live/b/counterside/40357930,2021-12-14 20:47:41,124,-5,8
40357591,ㅇㅇ#99626622,이제 퇴근했는데 오로치 성능 어떰,성능 괜찮음?아님 셰나처럼 이쁜 피규어임?,"[{'user': 'ㅇㅇ#66825526', 'comment': '무난하게 좋은 딜러란 소리가 잇던데 대부분 아직 몰?루겟다더라'}]",https://arca.live/b/counterside/40357591,2021-12-14 20:43:22,15,0,1
