index,user,title,content,comment,link,date,view,rate,comment_count
41518229,테렌스후드,카사 인게임 모션 모음 - 통합본 (2021.12.31 최신화),"모션 통합본 링크입니다.﻿CTL + F 눌러서 찾으면 빨리 찾을 수 있습니다.모바일은 브라우저에 내장된 찾기 기능을 이용하세요.* 캐릭터의 소속명으로 검색이 가능합니다.볼드체는 각성 유닛입니다.캐릭터 모션 정리 유저 Thanks to  @테렌스후드 /   @포포코배너제작 유저 Thanks to @닥터최고 원본글 작성 유저 Thanks to @유리알유희소속 분류   [펜릴 소대]유미나힐데주시윤타입:지크프리트 힐데타입:펜릴 유미나유미나: 익스퍼트 머시너리[알트 소대]서윤샤오린김소빈유진얼터그레시브 서윤샤오린:캐스트럴샤오린:네스트 키퍼[델타 세븐]마리아안토노프제이크워커실비아레나 쿠퍼카일 웡도미닉 킹레지날드[프리드웬 기관]엘리자베스 팬드래건로이 버넷라이언 페리어새디어스 모건엘리자베스 팬드래건:블루 블러드 [하트베리]가은루미보미미야최이나[제 4 특별기동수사대]이유미강소영[화이트 레빗]양하림한소림조호진[알파트릭스 이노베이션]이진신지아오새롬김초원가브리엘 [역삼동 주민회]김철수[초월지식학회 - ESPR] 에델 마이트너리벳레지나 맥크레디[R7 비정규 정찰대]오르카에디 피셔제시카 그린찰리 록우드[플로라 메이드 서비스] 베로니카릴리리코리스모네[구 관리국]강습 전대이수연나유빈관리국 검사관리국 총병관리국 방패병이프리트에스타크타라스크메이즈 전대류드밀라알렉스[미래 전략실]시그마[기타 미분류]에이스 오브 윙즈:이수연아인&츠바이[조디악나이츠 블루시프트]에스타로사드 슈발리에양한솔김초원오새롬에리어스 에스퀘데에스타로사 드 슈발리에:니어 아스트라이아[블랙타이드]메트로 유닛즉응 기동대[스테이츠 오브 원]통합 전투 여단웨폰즈 시스템[스틸레인] 보병 병과 편제기계화사단[퓨처 앳 워] 타이탄아라크네발리스타야누스[델타 세븐 : 패스파인더]주시영카린 웡[제 9호 기적심의회] 베네딕트 콘스탄틴신디 루퍼클로디아 넬슨[프리덤 라이더즈] 에이미 스트릭랜드히로세 아키이민서린 시엔 [카페 스트레가]유나 스프링필드라우라 베아트릭스잉그리드 요하나에블린 켈러 솔라 코덱스: 유나 스프링필드라우라 베아트릭스:퍼플 헤이즈[프론티어]니나마야리 더포[데이마인 채굴4팀]박현수최강산심소미[오피셜 서포트]제나캐시아이리아이리:베스트 마스코트[메이슨 용병 사무소]존 메이슨제인 도우토미 더 다이하드[나나하라 가문연합]나나하라 치후유나유카 미나토나나하라 치나츠오오가미 마사키하야미 사나에하야미 카나데야마타노오로치[폴른 호크]로자리아 르 프리데 프레데릭 도마 프레데릭 유마[아카데미 총학생회]  옌 싱 란체스터이디스 트윈즈[아카데미]미카 스타나이엘 블루스틸[아카데미 초등부]스카이 레이필드아르티 레나케이시 빈즈[육익]이지수나유빈에이미 퍼스트윙[호라이즌 투자기금]리타 아르세니코대시호라이즌콜드 케이스: 호라이즌[침식체]미니스트라스피라[스캐빈저]글리치오버플로기계수집가이볼브 원[외로운 악당: 론리][엘리시움 펠하모닉: 셰냐][플라티나 익스프레스: 라라 예거][프론트 베이 샤크스: 드라코][구원 기사단]루크레시아기타 분류[솔저 및 화기]카사 인게임 모션 모음 - 돌격소총카사 인게임 모션 모음 - 권총카사 인게임 모션 모음 - 기관단총카사 인게임 모션 모음 - 유탄발사기카사 인게임 모션 모음 - 산탄총카사 인게임 모션 모음 - 저격소총 카사 인게임 모션 모음 - 무반동포,미사일 런처카사 인게임 모션 모음 - 미분류화기카사 인게임 모션 모음 - 재장전[근접무기]카사 인게임 모션 모음 - 단검카사 인게임 모션 모음 - 발도검카사 인게임 모션 모음 - 한손검,쌍검카사 인게임 모션 모음 - 양손검 카사 인게임 모션 모음 - 대검카사 인게임 모션 모음 - 방패카사 인게임 모션 모음 - 미분류근접무기[원거리무기]카사 인게임 모션 모음 - 마법카사 인게임 모션 모음 - 마법(서포터)카사 인게임 모션 모음 - 레이저카사 인게임 모션 모음 - 투척무기카사 인게임 모션 모음 - 활[함선 모션] [NPC 라투디 / 모션 모음][리플레이서]리플레이서 나이트리플레이서 비숍리플레이서 퀸리플레이서 킹[길티기어]메이솔 배드가이이노램리썰 밸런타인밀리아 레이지[기타] 카사 인게임 모션 모음 - 주먹,발[스킨 라투디 / 모션 모음]봄 교복 스킨린 시엔 - 요주의 전학생유진 - 고양이 애호가아이리 - 스쿨 브레이커카일 웡 - 원리원칙의 사서에스테로사 드 슈발리에 - 정시의 수문장여름 수영복 스킨로자리아 르 프리데 - 마왕의 휴가카린 웡 - 테크니컬 다이버주시영 - VIP 검객이유미 - 해안 경비 기동대유미나 - 초보 휴양객린 시엔 - 로맨틱 체이서리브 앨런 - 알바 뛰는 기사님나나하라 치후유 - 쪽빛 무사나나하라 치나츠 - 비밀 낙원의 소녀에델 마이트너 - 해변의 탐식자이디스 트윈즈 - 꿈 속을 표류중옌 싱 란체스터 - 수중 전술 교사 릴리- 해변의 위장자리코리스 - 화끈한 물놀이론 리 - 악당의 속마음이지수 - 한여름밤의 표범엘리자베스 팬드래건 - 푸른 귀족들의 추억시그마 - 보물을 찾는 서퍼겨울 크리스마스 스킨서윤 - 눈 오는 날의 추억유미나 - 따스한 기다림샤오린 - 팀메이트와 함께오르카 - 부드럽고 달콤한 시간김소빈 - 보랏빛 광풍바니걸 스킨가은 - 다크하트 래빗가은 - 프로페셔널 이벤터미야 - 러블리 발렌타인 온엘리자베스 팬드래건 - 홍차와 초콜렛과 바니걸양하림 - 다함께 래빗한소림 - 반출임무 수행중유미나 - 후방지원 업무힐데 - 망중한의 대가레이싱걸 스킨강소영 - SC 드라이버김소빈 - 보라빛 광풍김초원 - 올라운드 오피셜루미 - 엔트리 넘버원신지아 - 공중파 마샬에리어스 에스퀘데 - 미니미 레이서어린이날 스킨이유미 - 과자점 단골제인도우 - 수상한 과학소녀에디 피셔 - 이름 없는 동화실비아 레나 쿠퍼 - 사이버 캣크리스마스 스킨실비아 레나 쿠퍼 - 연회장의 스파이알렉스 - 비장의 선물베로니카 - 둘만의 산장 파티주시윤 - 종탑의 파수꾼한소림 - 코드명 설원의 늑대모네 - 당일 배송 문제없음!1주년 스킨존 메이슨 - 흑백의 신사 오닉스각성 힐데 - 거친 선율의 오팔각성 유미나 - 결의의 아이올라이트류드밀라 - 창공을 지휘하는 라피스신지아 - 도시가 품은 진주오르카 - 꿀을 쫓는 카넬리안기타 및 상시 판매스킨힐데 - 펜릴전대 전술예장서윤 - 방송부 리더유미나 및 유미나:익스퍼트 머시너리 - 카탈리스트(비판매)에블린 켈러 - 수상한 카페 오너클로디아 넬슨 - 기적의 행방에리어스 에스퀘데 - 각별한 휴가피오네 로웰 - 은밀한 휴가나나하라 치후유 - 봄에 피는 수선화모네 - 고기잡이 소녀제이크 - 비공식 휴가새해맞이샤오린 - 상서로운 달빛가은 - 잔잔한 햇빛할로윈 스킨신디 루퍼 - 집행 소녀잉그리드 요하나 - 견습 악령 사냥꾼카린 웡 - 오싹한 이세계 사냥꾼레지나 맥크레디 - 달콤오싹한 공포각성 유나 스프링필드 - 견습 뱀파이어 프린세스세라펠 - 경국지색운동회 스킨알렉스 - 치명적인 보호자각성 서윤 - 넘볼 수 없는 라이벌나이엘 블루스틸 - 타오르는 에이스스카이 레이필드 - 블루밍 블루양하림 - 리드미컬 캐스터순수한 불순물 콜라보 스킨(?)유미나 - 이상한 회사의 신입가은 - 제(가) 선물이에요주시영 - 이세계 천재 미소녀 용병에델 마이트너 - 형용할 수 없는 플랩잭강소영 - 우리가 누구냐고 물어보면이유미 - 대답해 드리는 게 인지상정루미 - 1등은 내 차지야 키--익!양하림 - 간식 먹을 시간이야!힐데 - 성공이라 미안하다주시윤 - 대기중입니다한소림 - 박스 래빗 리퀴드웨딩 스킨로자리아 르 프리데 - 정실 대첩베로니카 - 미끼 신부미야 - 우리 결혼할까요?샤오린 - 예식장의 파수꾼캐시 - 웨딩 리포트시그마 - 순백의 파동캐릭터 모션 정리 유저 Thanks to @테렌스후드 / @포포코배너제작 유저 Thanks to @닥터최고 원본글 작성 유저 Thanks to @유리알유희* 모션 게시글 문의사항은 댓글이나 @테렌스후드 로 연락주시길 바랍니다","[{'user': '그림판뉴비#69792060', 'comment': '(emoticon)'}, {'user': 'ㅇㅇ#81020245', 'comment': '(emoticon)'}, {'user': '제이크', 'comment': '내가 댓글은 안쓰는데 항상 고맙게 보고 있수다 개추 받으쇼'}]",https://arca.live/b/counterside/41518229,2021-12-31 20:30:40,41,3,3
41513312,"ㅇㅇ, 121.179",양하림 노각성 오토는 이게 더 안정적이네,뉴오하이오마크핀리 치명타피해7렙110 이수연 허메골골체체110 오로치 스커피디피 불불 + 지피110 에블린켈러 메스충110 이프리트 디피지피 블레이즈110 카린웡 스커피지피 블레이즈110 호라이즌 허메골골 체방110 캐오린 치피셋+ @카린웡 땜에 전복 안 날 듯,,https://arca.live/b/counterside/41513312,2021-12-31 19:17:50,30,0,0
41502799,windy,치후유한테 오로치 옷 입혀보고 싶다,오래댄 생각이다,"[{'user': '주블', 'comment': '컷인 개꼴리네'}, {'user': '독호메', 'comment': '의외로 곰돌이팬티를 포기못하는'}]",https://arca.live/b/counterside/41502799,2021-12-31 16:32:31,52,0,2
41501465,Dhehej#23829992,카사에서 제일 또라이같은 창녀복은,오로치지,"[{'user': '대적자리이헤븐즈사인민혁', 'comment': '(emoticon)'}]",https://arca.live/b/counterside/41501465,2021-12-31 16:10:26,55,0,1
41501317,대적자리이헤븐즈사인민혁,카사는 꼴리는 캐가 많음,가은 힐데 옌싱 알렉스 베로롱 볶음밥 오로치어린이 모델 상점 누나,"[{'user': '록파이', 'comment': '유혹의 함교 보면서 소설쓰던 로자리아 1패'}, {'user': 'ㅇㅇ, 116.40', 'comment': '솔직히 말해봐라\n아르티나 모네를 좋아한다고 ㅋㅋ\n왜 솔직하지를 못혀냐!!'}, {'user': '쇠고기육포캔', 'comment': '이정도면 ㄹㅇ 유혹의함교 이벤트스토리 내줘야한다'}, {'user': 'Rune#94755586', 'comment': '(emoticon)'}, {'user': '엿이나처무라#99513101', 'comment': '어린이 모델은 뭐냐'}]",https://arca.live/b/counterside/41501317,2021-12-31 16:08:14,82,-1,5
41491402,나유빈,콘 업뎃 완료,오로치 나온지 2주 넘었으니까 2주 넘게 직무유기하고 있었네,"[{'user': 'temprun', 'comment': '(emoticon)'}, {'user': '독호메', 'comment': '(emoticon)'}]",https://arca.live/b/counterside/41491402,2021-12-31 13:25:56,24,0,2
41489328,하야테,올해 카운터사이드의 굵직한 패치 모음집,신년 첫 업데이트 메이즈 복각파이어펀치가 되어줘...1차 카네상스꼴리는 스킨 출시 얘 밴풀리면 섭종함 원조 각홍어 출시에피6 공개나도 이때 유입함마조 마왕 스토리 출시리플레이서 퀸 킹 나이트 추가킹 최초의 각성 패스 이때 성능은 웃음벨 그 자체만우절기념 순불 스킨 콜라보개썅년 비숍 출시격전 정식 오픈2차 카네상스하도 복각 많이해서 지금은 감흥 없지만 당시에는 감동과 충격의 스토리였다그리고 충격과 공포의 업피라PC버전 출시아직도 현역 미니스트라 출시운동회 출시1차 위기 씨발이 출시 지 컨셉에 맞게 출시하자마자 모든 컨텐츠가 혼란과 카오스바로 다음주 2차 위기이건 무려 길티기어 -스트라이브-라고!3코로 다 죽여버리는 밀리아 출시깡통과 마타도르 출시수상할정도로 밴을 안먹는 미친새끼3차 카네상스1.5주년 기념 이벤트 진행희대의 씹사기오퍼 편돌이 출시개꼴리는 스킨들 추가역대급 PV + 꾸준한 빌드업 + 뽕차는 스토리와 연출카챈 인기투표 1위의 각시윤 출시에피7 출시울지않는 너를 위해 출시현재진행형 3차 위기설명이 딱히 필요없는 역대급 분탕 여가부를 평점으로 눌러버린 카운터사이드꽝우였던 각성 호라이즌 출시 날아다니는 참피였지만 스비식 무지성 버프로 현재 1티어11월 4차나나하라 이벤트 출시호불호 갈린 이벤트우려했던것보단 괜찮은 T7 출시한동안 인격배설챈의 주범이였던 오로치 출시크리스마스 기념 없뎃복각만 있는 이벤트올해 마지막 패치노트ㅈ무장 3인 추가,,https://arca.live/b/counterside/41489328,2021-12-31 12:47:20,19,0,0
41483950,여우불,카사 떡상 방법 알려준다 직원 드루와바,"(2주년 쇼케이스 시작)""그동안의 카운터사이드는 가챠 게임과 코레류 게임의 '좋은'요소를 조화롭게 섞어 만든 게임이었습니다.""""그 중에서도 정보 재화의 존재는 저희 매출의 '17%'를 담당하고 있었습니다.""""하지만... 이제 게임의 지속성과 매출을 고려해 봤을 때, 변화가 필요하다고 생각했습니다.""""여러분들이 그동안 출시된 스킨을 많이 사주셨기에, 저희는 이 17%를 포기하기로 결정했습니다.""""이제부터 중첩작전에 소모되는 비용과 중복작전은 삭제됩니다. 이외에도 일부 작전을 제외한 대부분의 작전에 스킵이 가능하게 됩니다.""""이제 정보는 없는 재화로 패치되며, 교환소에 1:1 비율로 쿼츠와 교환할 수 있습니다.""""대규모 2주년 이벤트 스토리와 친선전 업데이트, 각성 이수연, 퀸, 오로치의 바니걸 스킨 또한 준비되어 있습니다.""""업데이트 날 저녁 8시!! 저 라니와 류금태 대표님과의 친선전 라이브도 잊으시면 안돼요~""""모든 사항은 다가오는 다음주 업데이트 때 적용될 예정이며, 저희는 이번 달 로드맵 동영상과 함께 물러나겠습니다. 감사합니다. ""(대충 간지나는 문구와 웅장한 BGM과 함께 각성 양한솔과 각성 제이크, 각성 아키의 실루엣이 보인다.)(생방으로 장장 8시간 동안 진행된 <카운터사이드 2주년 쇼케이스>는 세계 각지에서 몰려든 시청자로 실시간 50만명을 돌파했다.)(영상 마지막에 깜짝 쿠폰이 올라온다.)CSHAPPY2YEAR(기한 : 없음)- 각성 선택권 2개(융합핵 75개와 교환 가능), T5 대적자의 장비 세트 2개 -...","[{'user': 'kimjino#87804663', 'comment': '라는행복회로를 생각햇엇다 ㅋㅋ'}, {'user': 'ㅇㅇdb', 'comment': '각성 양한솔 시바려나'}, {'user': '중국몽죄인', 'comment': '잘나가다 중간에 양한솔 ㅋㅋ'}]",https://arca.live/b/counterside/41483950,2021-12-31 10:55:17,34,3,3
41479500,고보,라우라 조각 없다는놈들 다 오로치 비틱아님?,오로치 천장칠때 라우라 3개 나와서 모아놨었는데설마?10뽑 비틱?,"[{'user': '꿀때지', 'comment': '(emoticon)'}, {'user': '뷰룻', 'comment': '(emoticon)'}, {'user': '컨섹', 'comment': '라우라 뽑는다고 수시에 80장 박앗는데 시발'}, {'user': 'temprun', 'comment': '오로치를 거른 내 승리네'}, {'user': '뚜빵이', 'comment': '머지??? SR이 잔뜩 나왔음을 암시하는 비틱인것인가???????'}]",https://arca.live/b/counterside/41479500,2021-12-31 08:49:39,28,0,5
41478166,새벽비,와 근대 진짜 레벨링 할만한곳 없으니까 개빡쎄네,오로치랑 카나데 슬슬 레벨링 끝나가는데 새로 레벨링할거 안나와주나,,https://arca.live/b/counterside/41478166,2021-12-31 07:34:58,6,0,0
41475924,베르솜#71879818,오로치 강한데?,생각보다 강하네,"[{'user': '뱅레이', 'comment': 'PVE에선 갠찬음 애들 넉백도 안시켜서 안전성도 좋음'}, {'user': '블루아카이브', 'comment': '(emoticon)'}]",https://arca.live/b/counterside/41475924,2021-12-31 04:15:37,20,0,2
41465278,Dhehej#23829992,오로치 앞에서 전투불능이 되는 이유,꼴려서 전투 불가능,,https://arca.live/b/counterside/41465278,2021-12-31 00:00:07,1,0,0
41458326,검은깃털갈까마귀,다시 플4왔다,오로치 은근 괜찮네,"[{'user': '맹견댕시', 'comment': '왜 나이트 리더인댕?'}, {'user': '검은깃털갈까마귀', 'comment': '후열 고로시할라고'}, {'user': '맹견댕시', 'comment': '진심였댕? 애정픽이 아니라댕?'}, {'user': '검은깃털갈까마귀', 'comment': '둘다임'}, {'user': '맹견댕시', 'comment': '(emoticon)'}, {'user': 'Asu', 'comment': '플스 사왔다는줄'}, {'user': '견로', 'comment': '(emoticon)'}]",https://arca.live/b/counterside/41458326,2021-12-30 22:09:08,48,0,7
41455716,비질란테,그래서 오로치는 마왕이 아닌거지?,걍 별개의 세력인건가,,https://arca.live/b/counterside/41455716,2021-12-30 21:26:36,1,0,0
41424768,뿔잡,김소빈을 키우는게 맞는걸까,오로치 뽑아놓긴 했는데뉴비라 김소빈 파밍하면서 먹이는게 극한의 이득인거 같긴 함..근데 오로치가 더 이븐데 어케해야함..다이브 40층밀고 싶어서 4소대 만들어야함..,,https://arca.live/b/counterside/41424768,2021-12-30 13:00:47,6,0,0
41397695,"ㅇㅇ, 125.183",오로치 공중인줄 알고 천장쳤는데 개빡침,전당3 깨려고 공중캐인줄 알고 150장 천장 쳤는데지상캐였음 ㅋㅋㅋㅋㅋ,"[{'user': 'ㅇㅇ, 125.183', 'comment': '근데 성능도 구리다네 ;;'}, {'user': '독호메', 'comment': '(emoticon)'}, {'user': 'kimjino#87804663', 'comment': '(emoticon)'}, {'user': '블루아카이브', 'comment': '(emoticon)'}, {'user': '나유빈', 'comment': 'ㄹㅇ 오로치랑 퀸은 둥둥 떠다녀서 공중인가 싶은데 지상이더라'}, {'user': 'ㅇㅇ, 125.183', 'comment': '누가봐도 공중캐인데 ㅋㅋㅋㅋ'}, {'user': '물룽이', 'comment': '(emoticon)'}, {'user': '견로', 'comment': '아 ㅋㅋ'}]",https://arca.live/b/counterside/41397695,2021-12-29 23:30:40,66,0,8
41396202,"ㅇㅇ, 121.179",오로치 김소빈급 딜러라고 말한 놈들 싹다 나와,전부 반으로 갈라져 뒤져,"[{'user': '촤드', 'comment': '(emoticon)'}, {'user': 'kimjino#87804663', 'comment': '(emoticon)'}]",https://arca.live/b/counterside/41396202,2021-12-29 23:09:58,69,0,2
41395026,충혹마,완전회피덱,각시윤라라예거재무장 라우라셰나각등이재무장 팬드오로치하나만 더나온다면?,"[{'user': '무야홍어', 'comment': '모네카가해냈답니다'}, {'user': '충혹마', 'comment': '(emoticon)'}, {'user': '하례아', 'comment': '배신자 어디갔냐'}, {'user': '충혹마', 'comment': '좆데에 완회도 있었나?'}, {'user': '하례아', 'comment': '있지 않았나'}, {'user': '충혹마', 'comment': '방금 보고왔는데 완회는 업음'}, {'user': '하례아', 'comment': '(emoticon)'}, {'user': '촤드', 'comment': '공익완회필쑤'}, {'user': '충혹마', 'comment': '공익완회필쑤'}]",https://arca.live/b/counterside/41395026,2021-12-29 22:53:59,73,0,9
41394962,Dhehej#23829992,오로치 옷 수준,ㅗㅜㅏ,"[{'user': '촤드', 'comment': '(emoticon)'}, {'user': '렘딘', 'comment': '(emoticon)'}, {'user': 'SaBa', 'comment': '오로치 치후유 다 큰데\n왜 치나츠만...'}]",https://arca.live/b/counterside/41394962,2021-12-29 22:53:11,71,2,3
41388803,현붕이,ㅋㅋㅋ 다시 한번 체감되네,아무리 사도가 날고 뛰어도 일부 봉인된 마왕한테는 10초컷인데 오로치따위가 어케 마왕임 ㅋㅋㅋ,"[{'user': '독호메', 'comment': '미친광기의 보빔마왕'}, {'user': '꼬리를문뱀#24619419', 'comment': '뱀술 담가 먹을듯'}, {'user': '류드남친', 'comment': '(emoticon)'}, {'user': 'ㅇㅇ#92947072', 'comment': '오로치 씨발련 개같이 따먹어야됌'}, {'user': '제이크', 'comment': '이 장면 때매 에델 진짜 좆나 세보임'}, {'user': '니퍼#38747506', 'comment': '확실히 오로치는 다른 마왕에 비해서 임팩트가 없더라 치아가 쌍둥이랑 미나토 기 살려주려고 그런건지 원래 마왕중 제일 약한건지'}, {'user': '누소', 'comment': '(emoticon)'}, {'user': '배가아픈레후', 'comment': '로자리아 발톱 때선에서 정리'}, {'user': '뱅레이', 'comment': '발톱때 바로 그냥 다핥아먹음'}, {'user': '랑편#60846748', 'comment': '(emoticon)'}]",https://arca.live/b/counterside/41388803,2021-12-29 21:34:23,133,4,10
41383322,내장탕,2주년 이벤에서 각성부터 던질거 같음,2주년이니 신규 이벤 던지되이벤 극초반부터 각성 신캐 등장시켜서나나하라쪽에 강습해서 오로치를 수하로 꿀꺽한뒤에신규 마왕이나 기존 마왕하고 쌈박질 붙이는뭐 대충 저런느낌으로 2분할 이벤트에퀸처럼 쓰알없는 각성 던질거 같음,"[{'user': 'ㅇㅇ#81020245', 'comment': '제발 내년에 이 글이 념글로 가지 않게 해주세요'}, {'user': '내장탕', 'comment': '갸아아악'}]",https://arca.live/b/counterside/41383322,2021-12-29 20:27:10,44,0,2
