index,user,title,content,comment,link,date,view,rate,comment_count
40769719,별로형,오로치가 구린거냐 깡우가 단단한거냐,아니 쓰알 김소빈이면 깡우 녹여야 하는 거 아님?최피제가 10퍼든 5퍼든 연사하면 녹이는 게 맞잖아dps는 구려도 딜은 잘 나와야 하는 거잖아왜 못 녹여?,"[{'user': '카늒네', 'comment': '깡우 개쌤'}, {'user': 'temprun', 'comment': '깡우는 답이 없다'}, {'user': '크리스피크림', 'comment': '깡우 개셈'}, {'user': '별로형', 'comment': '걘  각우'}, {'user': '크리스피크림', 'comment': '반대로였누 근데 깡우 최피제에 광폭화 발동하면 보호막에 디버프 면역까지 온갖 버프란 버프는 덕지덕지 다 붙어서 진짜 드럽게 안죽음'}, {'user': 'xile#17342824', 'comment': '깡우 피 내려가면 방어력올라가는 패시브있음'}, {'user': '별로형', 'comment': '아니 그래도 그렇지 구관총보다 딜이 2배 가까이 안 나오는 건'}, {'user': 'xile#17342824', 'comment': '그건 구관총이....'}, {'user': '4G5G', 'comment': '오로치 딜 포텐이 평타강화 터져야 나오기 시작하는거라 예열이 좀 필요한 거 같은데'}]",https://arca.live/b/counterside/40769719,2021-12-20 20:06:17,119,0,9
40765789,tenra#57246128,무기챌 공략보는데,"노각성은 오로치가없고 각성은 퀸이없는데어떻게 비벼야함?기순 리타는 있음 함선은 몰루말고없음,,","[{'user': '늒네#86893131', 'comment': '함선 몰루밖에 없는거면 스펙이 딸릴거 같은데'}, {'user': 'tenra#57246128', 'comment': '1-3이라도 3별하고싶슴'}]",https://arca.live/b/counterside/40765789,2021-12-20 19:09:14,46,1,2
40765376,스트로베리샤베트,오로치는 뽑을때 자체스포 장난아니던데,뱀까지 깜장칠을 해둬야지 오로치만 깜장칠에 뱀은 말짱해서 자체스포가 오지더라고,,https://arca.live/b/counterside/40765376,2021-12-20 19:03:19,61,-1,0
40761220,여우불,이거 너무 귀여운듯,센세~센세~거리면서 따라오면그대로 오로치한테 데려가서인격배설 시켜버리고 인형처럼 껍데기만 남은 가은이를사장실 구석 선반 위에 장식해두고 싶을 정도,"[{'user': '꿀때지', 'comment': '(emoticon)'}, {'user': 'Cacao#25953018', 'comment': '에반데'}, {'user': '클러스트', 'comment': '이건 좀'}, {'user': '중국몽죄인', 'comment': '(emoticon)'}, {'user': '생각유희', 'comment': '게이야'}, {'user': '밀리에밀리', 'comment': '(emoticon)'}, {'user': '침식체는쥬긴다#29425225', 'comment': '(emoticon)'}, {'user': '토마호크스테이크', 'comment': '(emoticon)'}, {'user': '배가아픈레후', 'comment': '(emoticon)'}, {'user': '니퍼#38747506', 'comment': '(emoticon)'}]",https://arca.live/b/counterside/40761220,2021-12-20 17:59:53,46,-1,10
40760545,토마호크스테이크,오로치 최면 잘당할듯?,이터니움 3천개가 아니라 3만개씩 뿌리시라고요 예?,"[{'user': '제이크', 'comment': '(emoticon)'}, {'user': 'ㅇㅇ#64962009', 'comment': '(emoticon)'}, {'user': '류금테이오', 'comment': '(emoticon)'}, {'user': '독호메', 'comment': '바로 이거때문이었노'}, {'user': 'MBT', 'comment': '(emoticon)'}]",https://arca.live/b/counterside/40760545,2021-12-20 17:50:28,31,4,5
40757517,알다리스,오로치가 관리자 영혼을 봤을때의 반응이 궁금하다,"오로치는 자신의 협받을 심드렁하게 대하는 관리자를 보고대체 어떤 인생을 살아왔길래 역신의 협박을 저렇게 태평하게 넘기는지 궁금해서관리자의 영혼을 들여다봤는데그 찰나의 순간에 역신인 자신의 정신을 헤집어놓을 수준의 절망과 고통을 느끼고 주저 앉음무엇보다 상상도 할수없을 만큼 절망과 고통이 새겨진 영혼을 가지고 있는데도주저앉은 자신을 몸이라도 안좋냐며 걱정하는 관리자의 태평한 얼굴을 보고 소름이 끼쳐서""넌 대체... 정체가 무엇이냐...""라며 겁먹을거 같음",,https://arca.live/b/counterside/40757517,2021-12-20 17:07:21,25,2,0
40757182,별로형,아니 오로치 깡우도 못녹이네,메공속인데도 구관총보다 못녹이노디피지피 줘도 비슷비슷할거 같은데걍 기순이나 써야지 씨발,"[{'user': 'Poca', 'comment': '(emoticon)'}, {'user': '별로형', 'comment': '(emoticon)'}, {'user': '잔비나비', 'comment': '깡우면 디펜더라 역상성인데 살살녹이면 개사긴건데'}, {'user': 'ㅇㅇ#96199898', 'comment': '뭔소리노 오로치 레인저라 디펜더 깡우 상성인데'}, {'user': '잔비나비', 'comment': '내가 왜 스나이퍼로 알고있었지 미안하다....'}, {'user': 'ㅇㅇ#96199898', 'comment': 'ㅋㅋ허접콘'}, {'user': '잔비나비', 'comment': '(emoticon)'}, {'user': '별로형', 'comment': '(emoticon)'}, {'user': '뽀삐#55081939', 'comment': '(emoticon)'}, {'user': '별로형', 'comment': '(emoticon)'}, {'user': '사축', 'comment': '미쳤습니까 휴먼 뜨면\n\n빠따에 뷰지폭파나 안당하면 다행'}, {'user': '별로형', 'comment': '(emoticon)'}, {'user': 'Konzept', 'comment': '이건 구관총이야 2코 sr인데 각성 디펜더도 찢어'}, {'user': '별로형', 'comment': '(emoticon)'}]",https://arca.live/b/counterside/40757182,2021-12-20 17:02:23,118,0,14
40754089,"ㅇㅇ, 222.234",오로치 이새끼도 한광기 하고있지 ㅇㅇ..,편하게 가게 냅두지 그걸또 인격배설 시켜서 몸도 빼앗고 죽지도 살지도 못하는상태로 만들고 몇백 몇천년을 고통받는중항상 들고다니는 영혼구슬이 아마도 초대무녀일텐데,,https://arca.live/b/counterside/40754089,2021-12-20 16:14:11,9,0,0
40752948,나에엥,오로치 보자마자,이년생각나더라,"[{'user': '서묘', 'comment': '(emoticon)'}, {'user': 'DOGE76', 'comment': '항모표현은 지금봐도 어이가없노'}]",https://arca.live/b/counterside/40752948,2021-12-20 15:56:37,44,0,2
40752591,liviere,오로치가 진짜 카사캐들중 제일 꼴리는거같음,진짜 간만에 이쁘다기보다 개따먹고싶다는 생각 들게 나온 캐릭임챙녀무녀들 특유의 잡고 확 내려제끼고싶은 쭈쭈가리개랑 하반신 옷자락 실종에 터질거같은 골반까지 완벽함 쎆쓰디자인만 렬루 보면 씹 히트인데 카사도 오로치 짤 양산돼는 그날까지 존버한다 흡,"[{'user': 'Alexandros#41822309', 'comment': '(emoticon)'}, {'user': '나에엥', 'comment': '오히려 어디서 본느낌이라 노꼴임'}, {'user': 'liviere', 'comment': '(emoticon)'}, {'user': '늒네#86893131', 'comment': '취향 확실하네'}, {'user': '루마#18590506', 'comment': '(emoticon)'}, {'user': '토마호크스테이크', 'comment': '(emoticon)'}]",https://arca.live/b/counterside/40752591,2021-12-20 15:50:37,67,1,6
40752517,워렉,[모집 중] 방계라도 좋소. 나나하라가문연합에 협력해주시오.,"오로치의 위협은 사라졌지만, 잠시나마 흔들린 연합을 결속시킬 자를 모집하오.가주께서는 마음씨가 고운 분이시니, 방계도 환영할 것이오.아니, 어쩌면 오히려 방계를 더욱 달가워하실지도 모르지.모집 인원 : 1명0. 어떤 특징이 있는 컨소시엄이죠? 나나하라가문연합은 라이트한 게임 플레이를 지향하고 있는 컨소시엄으로, 뉴비 친화적인 길드입니다.1. 컨소시엄 규칙 - 3일 미접속 시 강제 탈퇴 - 아레나 불참 시 강제 탈퇴2. 협력전 압박은 없나요? 나나하라가문연합은 아레나 미참여 시의 불이익은 존재하지만, 처치점수에 대한 압박은 없습니다. 한 파딱이 자기가 막타 친다고 들 다 칼등 치게 하더니 존메모네 죽어서 처치점수 120점으로 좆박고 지렁이도 못잡은 불상사가 있었는데 그게 나야 근데 아직도 파딱임 그것도 종신파딱임 이외에도, 아레나 전략 결정 시 뉴비가 참여 가능하도록 조정하는 편입니다.3. 협력전은 어떤 방식으로 진행되나요? 나나하라가문연합의 협력전은 다음과 같은 방식으로 진행됩니다. 수요일 12시(협력전 시작)~수요일 24시: 컨소장과 임원의 아티팩트 분포 파악 및 아레나 전략 결정 수요일 24시(전략이 일찍 결정될 시 해당 시간도 당겨짐)~일요일 18시: 컨소원의 아레나 참여: 아레나 참여가 대부분 이루어졌을 경우, 7단계 10~20%까지 완급조절에 들어갑니다.: 완급조절의 이유는 모두가 참여횟수 보상을 얻기 위함이며,만약 7단계 20~30%까지 참여를 못하셨을 경우, 칼등치기를 통해 횟수를 채우시면 됩니다.일요일 18시~월요일 12시(협력전 종료): 예비조로 남아 있던 인원(대부분 임원)이 7단계를 공격해 처치합니다.: 만약 시즌 후반에 이미 참여횟수를 다 채운 컨소원이 있다면, 그 컨소원도 예비조에 포함됩니다.: 예비조라고 해서 반드시 일요일 18시 이후에 참여를 하는 건 아닙니다. 일요일 18시 후 참여를 '권장'하는 것입니다.4. 자주 하는 질문Q. 여기 치아가/치나츠/사나에 110만 들어올 수 있다면서요?A. 난 메카박이인데Q. 파딱징용 되는거 아니죠?A. 파딱 자리 다찼어 안심해Q. 쿼츠 기부 강요하나요?A. 팍씨Q. 여기 톡방 있나요?A. 뒤진다Q. 아레나 추가 입장 압박 있음?A. https://arca.live/b/counterside/29635718추가 입장하겠다고 깝치다가 메모당할 수 있음 ㅎㅎ당연히 진짜는 아님Q. 뜸A. 부기~만약 신청을 원한다면 신청 후 댓글을 남겨줘간혹가다 한꺼번에 들어와서 댓글을 남긴 사람만 받는 불상사가 일어나곤 해그리고 댓글에 신청한다고 해놓고 24시간 이내에 신청하지 않으면 다른 인원을 모집할거야","[{'user': '더글라스#96309433', 'comment': '들어가면 오로치한테 따먹힘'}, {'user': '워렉', 'comment': '(emoticon)'}, {'user': 'ㅇㅇ#79021928', 'comment': '(emoticon)'}, {'user': '워렉', 'comment': '(emoticon)'}, {'user': 'OldKing', 'comment': '여기 사나에 종신 안하면 안 받아 준다네요;'}, {'user': '워렉', 'comment': '(emoticon)'}, {'user': '아루룽', 'comment': '(emoticon)'}, {'user': '워렉', 'comment': '(emoticon)'}, {'user': '고다리나리리#12653489', 'comment': '들어가면 치아가 만날수있나요?'}, {'user': '워렉', 'comment': '(emoticon)'}, {'user': '베버', 'comment': '톡방 없으면 안들감 ㅅㄱ'}, {'user': '워렉', 'comment': '(emoticon)'}, {'user': '알파버지니스', 'comment': '你有群聊头吗?'}, {'user': '워렉', 'comment': '콜록'}, {'user': '늒네#86893131', 'comment': '디코는 없나요?'}, {'user': '워렉', 'comment': '(emoticon)'}, {'user': '고오급물티슈#98293471', 'comment': '(emoticon)'}, {'user': '고오급물티슈#98293471', 'comment': '(emoticon)'}, {'user': '워렉', 'comment': '(emoticon)'}, {'user': 'ㅇㅇ#64962009', 'comment': '(emoticon)'}, {'user': '워렉', 'comment': '(emoticon)'}, {'user': '클러스트', 'comment': '라인은 없나요?'}, {'user': '워렉', 'comment': '하르트도 없음'}, {'user': '미나링', 'comment': '여기 카나데 패스 안샀으면 강퇴한다네요...'}]",https://arca.live/b/counterside/40752517,2021-12-20 15:49:26,102,3,22
40751745,"ㅇㅇ, 121.133",카사도 오로치 역바니 퀸 역바니 출시좀,금태!!!!!!,,https://arca.live/b/counterside/40751745,2021-12-20 15:37:44,10,0,0
40740830,ㅇㅇ#50954844,스토리 안봤는데 오로치 원본이 누구임?,요즘 겜 흥미 식어서 치나츠스토리 안봤는데 오로치 얘가 원래 몸주인이 있었음?,,https://arca.live/b/counterside/40740830,2021-12-20 12:38:33,0,0,0
40740339,으으,방금 오로치 100만들고 써봤는데,100이라서 성능 발휘가 잘 안되는건가..패시브는 평타캐면서 더럽게 약한거 같은데,,https://arca.live/b/counterside/40740339,2021-12-20 12:30:32,22,0,0
40736964,사이드트랙,카사가 예쁜캐가 참 많아,"신지아, 치아가, 카린우엉, 주시영, 베로니카, 리코리스, 옌싱, 서윤, 닥등이, 에델, 레지나, 루크레시아, 오로치, 퀸, 류드밀라, 알렉스, 리벳, 팬드, 니나땜에 겜 못접음",,https://arca.live/b/counterside/40736964,2021-12-20 11:28:16,17,0,0
40733728,으으,이번주 오로치 워때?,힐데나 모네 분탕 같은걸로 전열 빡쌔게 치는애들 많은데 오로치 별로일려나?,"[{'user': 'ㅇㅇ#36099854', 'comment': '생존기 없는 4코 레인저는 들어가 있어'}, {'user': '으으', 'comment': '든든한 완전 회피가 있잖아!..'}]",https://arca.live/b/counterside/40733728,2021-12-20 10:32:35,30,0,2
40724887,토마호크스테이크,오로치 꼴리는 점,이미 한번 봉인당해봐서 재봉인 잘당할것 같음아님 말고~,"[{'user': '아루룽', 'comment': '(emoticon)'}, {'user': '토마호크스테이크', 'comment': '(emoticon)'}, {'user': '누소', 'comment': '(emoticon)'}, {'user': '토마호크스테이크', 'comment': '(emoticon)'}]",https://arca.live/b/counterside/40724887,2021-12-20 03:17:35,23,3,4
40722128,보지#81425240,근데 ㄹㅇ 확률 의심됨,구관방 110인데 구관총 100인게 말이됨?오로치뽑다가 한장 더 떠서 구관총 102되긴햇는데,"[{'user': '누소', 'comment': '줄'}, {'user': '보지#81425240', 'comment': '(emoticon)'}]",https://arca.live/b/counterside/40722128,2021-12-20 01:54:57,46,0,2
40717740,별로형,이번주는 오로치 써봐야지,깡우 녹일 생각에 행복회로 녹는다 녹아,"[{'user': '눈꽃1', 'comment': '(emoticon)'}, {'user': '초특가가챠다', 'comment': '(emoticon)'}, {'user': '가자미', 'comment': '(emoticon)'}, {'user': '컨섹', 'comment': '(emoticon)'}]",https://arca.live/b/counterside/40717740,2021-12-20 00:38:04,37,0,4
40707166,대적자리이헤븐즈사인민혁,오로치 vs 퀸,vs 가은이누구 찌찌가 제일 크냐?,"[{'user': '암드', 'comment': '(emoticon)'}, {'user': '스트로베리샤베트', 'comment': '가ㅋ은ㅋ'}]",https://arca.live/b/counterside/40707166,2021-12-19 22:12:13,38,0,2
40706881,암드,지금 카사에서 찌찌 제일큰게,오로치인가?,"[{'user': 'lemonade', 'comment': '퀸보다큼?'}, {'user': '리히테나워', 'comment': '각퀸 아님?? 오로치인가?'}, {'user': '스트로베리샤베트', 'comment': '(emoticon)'}, {'user': '비질란테', 'comment': '퀸일듯'}]",https://arca.live/b/counterside/40706881,2021-12-19 22:08:48,34,0,4
40706847,아루쨩,오로치....,안뽑아 ㅆㅂ,,https://arca.live/b/counterside/40706847,2021-12-19 22:08:26,6,0,0
40699559,ㅇㅇ#41370127,오로치 성능 어떰?,쓸만함? 뽑을까?,"[{'user': '졸린곰', 'comment': '김소빈 상위호환은 되겠다던데'}]",https://arca.live/b/counterside/40699559,2021-12-19 20:52:41,36,0,1
40696997,ㅇㅇ#98527664,초대무녀도 치나츠처럼 정조 지킨다고 옷 꽁꽁 싸맸을텐데,오로치한테 뺏기고 지 몸이치녀복장으로 돌아다니는거보면지금 무슨 생각일까,"[{'user': '딥러닝다람쥐', 'comment': '원래 복장이 오로치 복장이 아니었슬까'}, {'user': 'ㅇㅇ#98527664', 'comment': '(emoticon)'}, {'user': '극한의가능충', 'comment': '죽은 자는 말이 없음'}, {'user': 'ㅇㅇ#98527664', 'comment': '(emoticon)'}]",https://arca.live/b/counterside/40696997,2021-12-19 20:23:53,39,0,4
40696066,Dhehej#23829992,오로치 복장 ㄹㅇ 개또라이년이네,신지아 창녀복과 자웅을 겨루는듯,"[{'user': '아루룽', 'comment': '(emoticon)'}, {'user': '아내', 'comment': '신지아 옆 다 트인거 처음 알았네'}, {'user': '아카라이브아카녹화엌ㅋㅋ', 'comment': '저 젖꼭지 가리개 때문에 창녀대전은 압승'}, {'user': '렘딘', 'comment': '(emoticon)'}]",https://arca.live/b/counterside/40696066,2021-12-19 20:13:50,112,0,4
40694021,ㅇㅇ#84900491,오로치 비틱하고 싶어,그런데 보인다..천장각...,"[{'user': '숲토끼', 'comment': '(emoticon)'}]",https://arca.live/b/counterside/40694021,2021-12-19 19:48:03,44,-1,1
40690097,혼돈의가능충,얘 오로치 닮지 않았냐,얘는 오로치 닮았으니까 이제부터 오로치라고 하자복커 카붕이 1트에 오로치 뽑기 완료!,"[{'user': '초특가가챠다', 'comment': '(emoticon)'}, {'user': '혼돈의가능충', 'comment': '(emoticon)'}, {'user': '졸린곰', 'comment': '(emoticon)'}, {'user': '혼돈의가능충', 'comment': '(emoticon)'}, {'user': '중국몽죄인', 'comment': '(emoticon)'}, {'user': 'ㅇㅇ#64962009', 'comment': '(emoticon)'}]",https://arca.live/b/counterside/40690097,2021-12-19 19:00:04,45,0,6
40689985,혼돈의가능충,복커 카붕이 1뽑에 오로치ㅋㅋ,뽑아온다 딱기다려라,"[{'user': '초특가가챠다', 'comment': '(emoticon)'}, {'user': '혼돈의가능충', 'comment': '(emoticon)'}]",https://arca.live/b/counterside/40689985,2021-12-19 18:58:05,43,3,2
40689130,ㅇㅇ#97265026,오로치 3코되면 어떰,밀리아급됨??,"[{'user': '4G5G', 'comment': '그정도는 아님'}, {'user': 'MBT', 'comment': '밀리아는 딜도 쎄고 무적 넉백이라 못비벼요'}, {'user': 'MBT', 'comment': '거기에 잘맞추면 스충 90퍼까지 붙어서 스킬 존내 빨리씀'}]",https://arca.live/b/counterside/40689130,2021-12-19 18:44:43,35,0,3
40688985,dwsss,이거 안귀여우면 오로치 안뽑음,,"[{'user': '늒네#86893131', 'comment': '빨리 천장 찍고 오셈'}]",https://arca.live/b/counterside/40688985,2021-12-19 18:42:27,10,0,1
40687624,NaNi#52381415,아ㅋㅋ 오로치도 못뽑는 허접들ㅋㅋ,ㅋㅋㅋㅋ  이것도 못뽑는 새끼들 ㅋㅋ 난 단차로 먹었다고 ㅅㅂㅋㅋㅋ 개허접 쉨들ㅋㅋㅋㅋㅋ,"[{'user': '힝힝', 'comment': '(emoticon)'}]",https://arca.live/b/counterside/40687624,2021-12-19 18:18:46,35,3,1
40686873,NaNi#52381415,주간 2배 쿼츠 사는게 맞나?,지금 스킨살 쿼츠랑 오로치 뽑을 채용권 없어서 존나 고민되는데 사는게 맞을까?,,https://arca.live/b/counterside/40686873,2021-12-19 18:05:39,2,0,0
40683460,나그거없는데,오로치 생각외로 말뚝딜 ㄱㅊ네,공50 디버프 안받아서 그런가받아도 dps 12000대는 넘을거같은데김소빈 상위호환은 맞는거같은?,"[{'user': '뷰룻', 'comment': '(emoticon)'}]",https://arca.live/b/counterside/40683460,2021-12-19 16:57:45,40,0,1
40677884,씨에스,그래서 카최슴은 누구임?,제일 큰 애오로치각퀸신지아미야,"[{'user': '누소', 'comment': '퀸'}, {'user': '겨울동화샤오린#99311481', 'comment': '샤오린이요'}, {'user': '아루룽', 'comment': '오로치가 젤 커보임'}, {'user': '뱅레이', 'comment': '나유빈'}]",https://arca.live/b/counterside/40677884,2021-12-19 15:09:13,31,0,4
40674759,ㅇㅇ#96199898,뭐냐 이거? 오로치 보지 보이노? ㅋㅋㅋㅋㅋㅋ,뇌가 성욕에 절으셨군요이번만 봐드리겠습니다조심하십시오훠훠,"[{'user': '아루룽', 'comment': '(emoticon)'}, {'user': '이응이응유동', 'comment': '보여줘시발'}, {'user': '제이크', 'comment': '아씨발ㅋㅋ'}, {'user': 'ㅇㅇ#96199898', 'comment': '(emoticon)'}, {'user': 'Such', 'comment': '앰'}, {'user': 'ㅇㅇ#96199898', 'comment': '(emoticon)'}, {'user': '렘딘', 'comment': '아'}, {'user': 'ㅇㅇ#96199898', 'comment': '(emoticon)'}, {'user': 'ㅇㅇ#81071525', 'comment': '씨 ㅋㅋ'}, {'user': 'ㅇㅇ#96199898', 'comment': '(emoticon)'}, {'user': '소닉', 'comment': '씨발'}, {'user': '카늒네', 'comment': '(emoticon)'}, {'user': '배가아픈레후', 'comment': '(emoticon)'}]",https://arca.live/b/counterside/40674759,2021-12-19 14:07:49,66,5,13
40674218,swratra,오로치는 주로 용도가 뭐임?,"대충 공속셋에 스충 부옵 주니까 쓸만하다는건 느꼈는데, 무슨 용도로 쓰는 건지 모르겠음.","[{'user': '극한의가능충', 'comment': '로비'}]",https://arca.live/b/counterside/40674218,2021-12-19 13:57:05,7,0,1
40669423,새벽비,마왕은 무조건 4코임,각성같은걸 달면 또 모르겠는데로자부터 에델을 지나 개보지의 마왕 오로치까지 보면 그냥 마왕은 4코인듯,"[{'user': '독호메', 'comment': '(emoticon)'}]",https://arca.live/b/counterside/40669423,2021-12-19 12:29:44,24,0,1
40665627,밤비,이번 시즌 언제 끝남?,빨리 오로치랑 카나데로 건틀렛을 가슴으로 채우고 싶음,"[{'user': '늒네#86893131', 'comment': '20일 정도 남지 않았나'}, {'user': 'Blsa', 'comment': '1월 즈음에 끝날텐데'}, {'user': 'ㅇㅇ#81071525', 'comment': '1월 3일'}]",https://arca.live/b/counterside/40665627,2021-12-19 11:01:23,38,0,3
40663538,엘빅이,(밀리아X) 템 안바꿔도 되는 저스팩 전당5 풀오토,※ https://arca.live/b/gauntlet/39349309이 게이의 글을 아주 많이 참고하였습니다5-1킹이 버틸 템만 주면됨잡스충난 메메골골 줬는데이렇게 안줘도 깨질거임본인이 가진 가장 좋은 방템ㄱ잡스충당연히 전장은 필요 없음데빌잡공속잡스충얘도 전장 필요 없음5-2새롭게 들어온 유미가 포인트난 정말 쓰레기템을 줬는데템 옮겨주기 귀찮아서 그런거고킹이 쓰던거 옮겨주면 더 잘버틸거임그나마 난 110이라 좀 버티는데 결국 금방 죽음이건 블루브릿지 솔져들 덕분에 안밀리고 밀어버릴 수 있음어쨌든 유미가 초반에 몸 대줘서 몰루 2스까지 시간 벌어주는게 포인트없을 수 없는 유나메스충 줬는데 걍 대적자도 깨지겠지대적자 2셋 줬잖아굴러다니는 잡블레지피 있음 좋음 난 지피 2개 있네5-3여기가 젤 어려운 스테이지임나유빈 빨리 녹여서 궁 안보는게 포인트잡스피릿얘도 지피 스충 많으면 좋겠지난 지피1개 스충2개네잡블레원래 이 자리에 가은이었는데난 스충가은임근데 스충가은을 쓰면 특수기로 나유빈을 자꾸 뒤로 밀어버려서딜을 못넣고 궁을 쓰게 만들어버림난 전장이 스충이라 스충가은 고정인데전당 때문에 공속으로 템 바꿔주기 귀찮아서 이번에 새로나온 오로치를 씀문제없이 깨짐공속 가은이거나 밀리아 있는애들은 걍 그거 써도 깨짐잡탱템굳히기용 탱커후반에 궁써서 맵 끝까지 가주는데나유빈 고개돌리기용으로 괜찮음5-4이제 다 아는 얼굴들만 나온다5-3깼으면 걍 다 깬거임데빌5-5당연히 오로치는 가은이나 밀리아로 바꿔도 됨치피셋그냥 초전도 둘둘이여도 문제 없을거임잡스충노템이여도 깨지는데 궁 한번 써주는게 더 좋은거 같아서걍 아무거나 넣음보다시피 쓰레기템으로 템도 안바꿔가며 깨는 덱이라빠르진 않음그래도 나 같은 귀차니즘 걸린 놈들한텐 유용하다고 생각함아직도 전당4 도는 뉴비새끼들 있으면당장 도전해,"[{'user': '왕소라', 'comment': '(emoticon)'}]",https://arca.live/b/counterside/40663538,2021-12-19 09:58:55,41,3,1
40661195,"ㅇㅇ, 221.150",고인물인데 장비세팅은 못참겠다 ㄹㅇ,오픈시절 침식체야. 렙은 현재 90이고내가 탬컷이 안되서 지금 챌린지는 3-14 라이노에서 막혔고다이브는 48층이후로 깨지지가않아서 초기화를 47층에서 하거든쉬벌 장비세팅이 개 빡세서 메이즈스충2셋 허메골골2셋하는데 셋바튜바 다 꼴박해갖고 나머지가 십창이더라 이거 2세트씩 4세트 완성하는데 렙 78에서 85되있더라고 ㅋㅋㅋㅋㅋ카운터 애들 장비 맞춰주느라 솔저랑 메카닉 장비는 더 처참하더라 메이즈셋 두른 구관총병은 안티시즈에 안티스나이퍼셋 끼고있고 메카닉 각성캐 애들은 메이즈 스충셋도 공속셋도 안되서 겨우 부옵 한두개 스충으로 맞춰줬어.그나마 위안인건 전당이 돌아가고 캐릭터 수집도 어느정도 되있고 블레이즈나 이런거 세트는 부위별로 있긴 한데겜 하다보면 알겠지만 블레이즈나 스피릿 4셋꼈다고 모든컨텐츠에 투입이 가능한건 아니잖어... 또 튜바를 써야지...딱 이럴때 T7 스위프트 세트가 나와줘서 아 여기서 장비줍고 존버해서 챌린지랑 다이브 밀어야겠다 싶었는데1-4는 솔직히 최종컨텐츠니까 그 밑 난이도에서 뺑이치면 되겠다 싶어서 무기 방어구 보조장비 다 해봤는데 최소한 1-2까진 밀릴거라 싶었는데 여기도 탬컷이 좆같아서 무기챌 장비챌 보챌 겨우겨우 밀리거나 깨지지가 않더라 특히 무기챌인 깨지지가 않더라고 ㅋㅋ렙 90은 진짜 허송세월로 먹은 기분 확 나서 겜 할맛이 안나더라어저피 장비 천장도 구제책도 없는 마당에 그냥 돈 이제부터 적게쓰고 셋바 튜바 지르던거도 빼고카운터 패스 매번 사주던거도 돈 빼서 무과금으로 겜이나 하려고...캐릭터 수집은 천장이 있으니깐 그래도 끝이 보이기라도하지 장비세팅하다가 기분 개 좆같아서 현탐오는건 덤이더라고공략이라도 보고 열심히 하려고 했는데 그놈의 좆같은 길티기어 스트라이브 콜라보캐만 나오면 숨이 턱 막히더라. 특히 밀리아덕분에 헤딩하다가 밀리아 대체재로 공속가은이나 오로치를 쓸수있다는걸 알았으니 그걸로 만족하려고 해.머가리 봉합됬으니 그걸로 기분이 후련해졌어징징글 읽어줘서 고맙다 다들 화이팅해라,,https://arca.live/b/counterside/40661195,2021-12-19 07:57:53,17,0,0
