index,user,title,content,comment,link,date,view,rate,comment_count
34095913,sdjanfw,장비를 좀 푸는 것도 한가지 방법이 될 수도?,뭐 불타거나 꼬운건 모르겠는데결국 이 겜은 건공들의 셋바가 수입 1순위고아무리 운이 뒤지게 없어도 지금 풀려있는 장비는 엥간히 맞춘 사람도 있을텐데아싸리 장비 더 풀어버려서 고래 유저들이 셋바작 더 하게끔 하는 것도 방법일 순 있을듯애초에 게임이 개악을 거듭해오면서 정체성이 모호해져서과금 요소를 자기 손으로 죽여버렸음그리고 나오는 패키지 족족 별로임 뭐 어쩌겠음 자기들이 돈 벌기 싫다는데,"[{'user': 'Zionn', 'comment': '이미 존나 풀어서 최종템 가진애들 ㅈㄴ 많아서 7t 나오는거잖슴'}, {'user': 'sdjanfw', 'comment': '뭔가 부족할거라 생각했는데 이미 차고 넘치는 수준인가?'}, {'user': 'UT', 'comment': '장비푸는게 맞음 뉴비나 복귀한애들 메이즈 갯수부터 맞춰주고 돈 어느순간부터 굳게됨 장비 막혀서'}]",https://arca.live/b/counterside/34095913,2021-09-15 20:57,54,0,3
34095669,MBT,패키지 살게 있어야 사지,깡으로 살만한게 얼마 안되서 소비자들 지갑 닫히는건 회사가 감수해야지그렇다고 재화를 너무 퍼주는식으로 팔면 또 돈이 안되고근데 카사는 혜자로 잘 안파는듯시발련들아 쿼츠 3배 패키지 주화로 팔라고,"[{'user': 'ㅇㅇ#30940457', 'comment': 'ㄹㅇ 솔직히 살거 없음 셋튜바는 사기 싫고'}]",https://arca.live/b/counterside/34095669,2021-09-15 20:54,61,0,1
34095500,완장#69699297,애초에 카사 패키지 내는거보면 넓게가려고 하는듯?,서버 늘리는거도 그 일환같음패키지도 보면 상시 판매 패키지가 제일 좋음1.5배 주화 or 커스텀마지막 or 재건기업 패키지 같은거그리고 진짜 오 패키지 사야겠다 생각드는건 월초or 대규모 이벤트 (1.5주년 or 1주년 ) 말곤 없음평소에는 건공들이 셋바 지름 + 핵과금이 오퍼 지름으로 어느정도 수입 고정하고서버 많이 늘려서 전체적으로 규모 키우는거 같은 느낌임,"[{'user': 'ㅇㅇ#30940457', 'comment': '일본 중국 응딩이만 믿겠다'}, {'user': '왜그래쪙#59517723', 'comment': '애초에 넥슨이 퍼블리싱 하니까 그렇게 돈이 급한 것도 아니잖아'}, {'user': '완장#69699297', 'comment': '애들 봉급주고 그러려면 회사 수익이 나야지 회사 인력도 충원해야하고'}, {'user': '스피', 'comment': '패키지 맛없는거만 냄'}]",https://arca.live/b/counterside/34095500,2021-09-15 20:52,125,1,4
34095397,Zinma,잘했는데 매출이 안좋으니 걱정되서 그럼,이번 업뎃 존나 공들인거 딱봐도 티나는데 이렇게 까지 노력했고 평도 좋은데 매출은 100위권 밖이라면  다음에도 굳이 이렇게 공들여서 나올것같지가 않음 대충 과금유도 업뎃이나 패키지만 내서 매출은 쪼금 오르는데 유저는 또 카바할꺼같아서,"[{'user': 'ㅇㅇ#30940457', 'comment': '그럼 망하는거지 뭐. 회사가 잘해야지 우리가 어케 해줄 수가 없으'}, {'user': '불타는백두산', 'comment': '여기서 매출순위 올라가도 해외섭에서 버는게 더 많을텐데'}, {'user': 'Zinma', 'comment': '해외섭은 배제하고 본섭에서도 매출이 잘나와야지 15% 치즈도 해외매출이 훨씬 크지만 본섭 20~30위권 안엔 항상 들잖아'}, {'user': '불타는백두산', 'comment': '조금 진지하게 보면 전에나온 각성이 메카닉에 파밍가능한 이볼브원이라서 패스하고 각시윤 존버탄 애들도 있을테고 퀸, 킹도 1.5주년에 복각 한번 했던데다가 킹은 이미 패스로 뿌린애라 유저들이 돈 쓸 구멍이 없음'}, {'user': '스트로베리샤베트', 'comment': '컨텐츠에만 공을 들이지 말고 패키지에도 공을 들였더라면 좋았을텐데'}, {'user': 'Zinma', 'comment': '하긴 이번 패키지 진짜 살꺼 없긴 하드라 나야 뭐 튜바질 해야해서 억지로 사긴 했는데'}, {'user': 'sdjanfw', 'comment': '그간 분탕쳐온 결과물이지\n어차피 얘네도 해외섭에나 목숨 걸지 한섭에 그렇게 큰 기대 없음'}, {'user': '금은동태', 'comment': '외화벌이 해야지 뭐'}, {'user': 'ㅇ반고닉ㅇ', 'comment': '가챠겜이 가챠로 돈을 못버니 안타깝긴함'}]",https://arca.live/b/counterside/34095397,2021-09-15 20:51,209,5,9
34095071,ㅇㅇ#72553441,솔직히 매출이 나올수가없음,월정액빼면 사료대비 패키지효율이 너무 구림추석이랑 각시윤용 패키지나와도 솔직히 그냥그래욕심부리면 한번에 수십쓸각오는해야함단계적으로 올라가는게아니라 쓸려면 한번에 팍올라감,"[{'user': '꿀때지', 'comment': 'ㄹㅇ 각성캐도 정직하게 6주마다 나오는데 존버가 어느정도 되니깐 더 그런듯'}, {'user': 'ㅇㅇ#72553441', 'comment': 'ㅇㅇ 욕심만 안부리면 본인이 원하는건 챙겨감'}, {'user': 'ㅇㅇ#70185882', 'comment': '맞아 특정 이벤트할때 순위 팍오르더라'}, {'user': 'ㅇㅇ#72553441', 'comment': '가볍게 지를만한걸 만들어줬으면 좋겠음'}, {'user': '나이트바라기#72477025', 'comment': '지를게 월정액 밖에없음 아주 가끔 혹할때나 윌간 한번 사는거지'}]",https://arca.live/b/counterside/34095071,2021-09-15 20:47,167,0,5
34091077,헤이유파이널리어웨이크,걍 추석패키지나 존버해야되나 ,살만한게 없노,,https://arca.live/b/counterside/34091077,2021-09-15 19:51,23,0,0
34090798,밥은먹고다니냐,셋바는 무슨 패키지가 효율 젤 좋나,월간 1000쿼츠짜리 말고,"[{'user': '늒네#86893131', 'comment': '900 주화인가 그거'}, {'user': '밥은먹고다니냐', 'comment': '튜바랑 같이 있는거?'}, {'user': '늒네#86893131', 'comment': 'ㅇㅇ'}, {'user': '밥은먹고다니냐', 'comment': '(emoticon)'}, {'user': '프룸', 'comment': '990에 투바70 셋바40'}, {'user': '밥은먹고다니냐', 'comment': '(emoticon)'}]",https://arca.live/b/counterside/34090798,2021-09-15 19:47,54,0,6
34090685,헤이유파이널리어웨이크,만약 기업패키지 C 에서 초전도 셋템 사면은,각시윤 준다고하면 셋옵 스충주고 부옵은 뭘로 맞춤?  지피? 스충?,"[{'user': '스트로베리샤베트', 'comment': '스충스충'}, {'user': '스트로베리샤베트', 'comment': '근데 각시윤 체체도 많이 쓰고 공속도 가끔 보이고 스충도 쓰고 다 제각각이라 자세한건 몰?루'}, {'user': 'ㅇㅇ#37093991', 'comment': '초전도템에 튜바쓰지마라'}, {'user': '늒네#86893131', 'comment': '초전도 스충 줄 바엔 공속이나 체체가 낫지  않음?'}, {'user': '늒네#86893131', 'comment': '자체 스충깎 디벞 있어서 극스충 아니면 별로일듯'}]",https://arca.live/b/counterside/34090685,2021-09-15 19:45,64,0,5
34087069,상자새끼,다음주에 패키지좀 팔아 금상송!!,루크...먹어야한다고...,,https://arca.live/b/counterside/34087069,2021-09-15 19:00,16,0,0
34086546,rhyme,추석기념 혜자패키지 하나 나올수잇을까?,아님 추석이랍시고 창렬패키지 내놓을까담주 추석이라 없뎃이려나,"[{'user': 'PJ#91561166', 'comment': '없뎃임'}, {'user': '내나코', 'comment': '담주에 패키지 더 나올것같긴 한데'}, {'user': '하얀삼치#49275600', 'comment': '명절 지내러 가야지 걔들도'}]",https://arca.live/b/counterside/34086546,2021-09-15 18:50,41,0,3
34086420,앗발꿍,패키지 아무로봐도 살게없네,추석인데 왜이래,,https://arca.live/b/counterside/34086420,2021-09-15 18:48,17,0,0
34086338,"ㅇㅇ, 1.220",쿼츠 왤캐 쓸때가없음?,기밀채용 쿼츠패키지 한개사면 쓸때가없누..,"[{'user': '현붕이', 'comment': '(emoticon)'}, {'user': '힝힝', 'comment': '나중에 부족해서 눈물흘림'}, {'user': 'ㅇㅇ#74194811', 'comment': '하루 5회 보급소 초기화, 주간 기채권, 매일 모작권, 쿼츠스킨, 셋바'}, {'user': 'ㅇㅇ, 1.220', 'comment': '스킨따위 안모음'}, {'user': 'ㅇㅇ#74194811', 'comment': '그럼 셋바 풀매수'}, {'user': 'ㅇㅇ, 1.220', 'comment': '복귀라 쓸때가없어 장비칸은 1개면 되고 갤주좀 뽑고싶은데 쿼츠패키지 한개뿐임 왜 ㅅㅂ'}, {'user': 'ㅇㅇ#74194811', 'comment': '당연히 각성캐는 주화로 사야하니까'}, {'user': 'Pani', 'comment': '난 5회보급소랑 주간 기밀채용만 사고있음..\n쿼츠스킨은 자주쓰는케릭꺼만사고..'}]",https://arca.live/b/counterside/34086338,2021-09-15 18:47,83,-3,8
34085304,헤이유파이널리어웨이크,근데 지금 있는 추석패키지,아직 찐추석아니라서 맛보기 패키지인거지? 추석전 업뎃패키지 보고 박는다 ㅋㅋ,"[{'user': 'Clink', 'comment': '(emoticon)'}, {'user': '늒네#86893131', 'comment': '(emoticon)'}, {'user': 'Asu', 'comment': 'ㅉㅈ ㅈㄷㄹㄴㄱ ㅇㄷㄱㅇ?'}]",https://arca.live/b/counterside/34085304,2021-09-15 18:30,38,0,3
34085130,로아킹#14843861,길티 콜라보 다시하면 꼭 패키지 두배값으로 팔아라,,"[{'user': '지붕', 'comment': '(emoticon)'}]",https://arca.live/b/counterside/34085130,2021-09-15 18:27,44,0,1
34083465,세라펠,"우승은 필요없다, 20기채 비틱한거 쓸때가 왔군","각성 쥬지윤 149뽑, 20기채권 비틱함기채 3000장 못모아서 패키지 구매했음140뽑 시부엉...확정 획득 얻어서 념글이라도 가보자148뽑 ㅋㅋㅋ 한번만 더하면 나도 념글 티켓149뽑때 획득념글도 못가고, 스샷도 못남기고 감동도 없었음웃음거리라도 되자 꺄룩투스!","[{'user': '세라펠', 'comment': '추천말고 비추눌러'}]",https://arca.live/b/counterside/34083465,2021-09-15 17:59,99,7,1
34081355,나만각성없어,한달 반 뉴비 지친다...,각성캐 먹을라면 4달을 투자해야 되는데쿼츠도 엄청 들고요번에 기채 확정 하나 뽑으면이제 기채 패키지 안살까 생각 중,"[{'user': 'SDAKAJUXIM', 'comment': '2달반걸릴텐데 쿼츠부족함?'}, {'user': '나만각성없어', 'comment': '아 두달이네'}, {'user': '릴리는여고생', 'comment': '(emoticon)'}, {'user': '4nk', 'comment': '가챠겜의 숙명이다. 번뇌를 끊어라'}, {'user': '나만각성없어', 'comment': '(emoticon)'}, {'user': 'ydk#17706997', 'comment': '가챠겜의 숙명이다. 지갑을 꺼내라'}, {'user': '나만각성없어', 'comment': '(emoticon)'}, {'user': '에시온', 'comment': '2달 반이면 1천장일걸'}, {'user': '야한눈나', 'comment': '번뇌를 끊지 못하면 용에게 사로잡힌다'}, {'user': '데미소다자몽', 'comment': '천장쳐도 쿼츠는 기채부터 사는게 정석이긴해'}]",https://arca.live/b/counterside/34081355,2021-09-15 17:27,103,0,10
34080560,이히힝#28957736,시그마뽑기좀할까 광피감시그마땡기는데,지금 패키지사면 채용권도막주잖아,"[{'user': 'ㅇㅇ#94356841', 'comment': '(emoticon)'}, {'user': '이히힝#28957736', 'comment': '(emoticon)'}, {'user': '턱턱툭탁', 'comment': '(emoticon)'}, {'user': '이히힝#28957736', 'comment': '(emoticon)'}, {'user': 'ㅇㅇ#29202254', 'comment': '80뽑 0쓰알이라 걍 도망갔어 난'}, {'user': '이히힝#28957736', 'comment': '(emoticon)'}, {'user': '피에스', 'comment': '너그러다 나처럼 신캐 못뽑는다 이성적으로 생각하셈 현질 많이 할꺼아니면'}, {'user': '이히힝#28957736', 'comment': '30뽑만해야지롱~~~'}, {'user': '피에스', 'comment': '30뽑만해야지롱~~~'}, {'user': '이히힝#28957736', 'comment': '30뽑만해야지롱~~~'}, {'user': '피에스', 'comment': '(emoticon)'}]",https://arca.live/b/counterside/34080560,2021-09-15 17:14,76,0,11
34080187,TopGun#35725360,깊카 10만원 충전했는데 어케 사용할까,지금 천장 스택 30에서 기채 기간 마지막까지 채용권 모으면 56번정도 더 뽑을거 같은데조금더 돈 보태서 1.5배 주화 11.9만원짜리 사고 지금 주화 합치면 깡주화로 50번 뽑을 수 있거든.. 이거 괜찮으려나?아니면 지금 나와있는 다른 패키지나 기채 끝나기 전까지 나오는 패키지 지켜보는게 좋을까?,"[{'user': '하랍픽업좀', 'comment': '기채만 계산하면 1.5배깡주화가 기채패키지보다 이득이던가?'}, {'user': 'TopGun#35725360', 'comment': '그게 어떨지 고민이야'}, {'user': 'TopGun#35725360', 'comment': '그게 어떨지 고민이야'}, {'user': '하랍픽업좀', 'comment': '11.9만원 44뽑인가 나오는데\n주시윤 4.5만원 패키지가 15뽑이란 말이지\n1.5배깡주화가 1뽑당 300원 이득이긴 하네'}, {'user': 'TopGun#35725360', 'comment': '깡주화로 뽑는것도 나쁘지 않겠지..? 월정액도 항상 지르고있긴 한데'}, {'user': '하랍픽업좀', 'comment': '초회 1.5배랑 비교하니까 좋아보이는거지\n깡주화 8727주화 11.9만원이면 29뽑이라 4100원당 1뽑이라 초회만 아니면 무조건 기채있는 패키지가 혜자임'}, {'user': '하랍픽업좀', 'comment': '월간 주화 9917 33뽑 3600원당 1뽑이어도 마찬가지\n기채패키지는 거의 다 3천원당 1뽑의 값어치임\n추석패키지는 4000원이네 채용권줘서'}, {'user': 'TopGun#35725360', 'comment': '계산 자세하게 알려줘서 고마워! 그럼 이번엔 11.9로 해도 나쁘지 않을지도.. 또 천장 칠거같은데 주시윤 참을 수가 없어 ㅋㅋㅋㅋㅠ'}, {'user': '하랍픽업좀', 'comment': '11.9 -> 13091주화 -> 43뽑 -> 2767원/1뽑\n4.5 -> 1500주화+200기채->15뽑 -> 3000원/1뽑'}, {'user': '요일', 'comment': '초회 1.5는 살만 하긴해\n근데 주화로 기채사는것도 샀음?'}, {'user': 'TopGun#35725360', 'comment': '주화로 사는게 이지수 있는거야? 이지수 있는건 샀엉'}, {'user': '카붕쿤', 'comment': '기채를 노리는거면 주시윤 업뎃  풀매수 하지'}, {'user': 'TopGun#35725360', 'comment': '일단 주시윤 기채 패키지 남은거 사면 딱 10만원 나오는데 기채 450장, 주화 대략 10뽑이라 11.9 깡으로 하는게 나은가 싶어서..'}]",https://arca.live/b/counterside/34080187,2021-09-15 17:08,52,0,13
34076773,라최지,슬슬 매콤해지노,이제 사고싶은 기채패키지가 진짜 없는데,"[{'user': '동치미', 'comment': '(emoticon)'}, {'user': 'ydk#17706997', 'comment': '6회 채용으로 뜬다 ㄹㅇ'}, {'user': 'LastChance', 'comment': '(emoticon)'}, {'user': '라최지', 'comment': '(emoticon)'}]",https://arca.live/b/counterside/34076773,2021-09-15 16:11,82,0,4
34070834,보리스#63017734,기밀채용 패키지들 효율계산,기준을 기채패키지3로 잡았음기밀채용패키지 109000원 540개 1500쿼츠추석특별패키지 1일1개12000원 60개 5채용권(750쿼츠)추석특별패키지x9 108000원 540개 45채용권(6750쿼츠)주시윤패키지111000원 50개 360주화 /최대5=55000원 250개 1800주화주시윤패키지2                   45000원 200개 1500주화 /최대2=90000원 400개 3000주화효율은 추석특별패키지가 제일 좋음하지만 채용권보다 주화가 더 필요하다면주시윤패키지도 고려해볼 법 하다.,,https://arca.live/b/counterside/34070834,2021-09-15 14:33,43,0,0
34069363,카붕쿤,기업 패키지 풀매수해서,쿼츠뽑기로 결국 쳐먹었따 성녀련십련아...,"[{'user': '미나링', 'comment': '(emoticon)'}]",https://arca.live/b/counterside/34069363,2021-09-15 14:06,39,0,1
34068098,로아노크,이 패키지 효율좋은거맞음?,채용권한개 75주화잡고보면 좋은건지모르것네,"[{'user': 'ㅇㅇ#64962009', 'comment': '좋은건 맞음 200쿼츠짜리 재화를 1200원에 사는거니'}]",https://arca.live/b/counterside/34068098,2021-09-15 13:44,54,0,1
34063623,ㅇㅇ#62186313,패키지 보상 초전도T5 세트선택권 뭐받아?,또 스츙이야?,"[{'user': '나사나이다', 'comment': '무한스충'}]",https://arca.live/b/counterside/34063623,2021-09-15 12:35,11,0,1
34059105,ferdia,성녀님 뽑고싶은데 패키지 존버해야함?,깡 쿼츠는 또 너무 아깝고 지금 채용권들은 패키지들도 좀 애매한거 같고 성녀 픽업끝나기전에 신규 패키지 뜰까?,"[{'user': 'Balrbahal', 'comment': '다음주 화욜에 추석 당일이니까 뭔가 출시할거같긴한데'}, {'user': '스윈', 'comment': '기대는하지마라'}, {'user': '카붕쿤', 'comment': '안나올거같음 원래 한주전에 다 주곤 했잖어'}]",https://arca.live/b/counterside/34059105,2021-09-15 11:06,52,0,3
34055917,이잉#84605891,기밀채용하려는데 패키지 뭐가제일 효율좋음?,복귀패키지도 있음,"[{'user': 'ㅇㅇ#32331373', 'comment': '복귀패키지랑 재건기업이 효율은 젤좋음 기채패키지는 효율자체는 별론데 각성뽑으려면 그거사여됨'}, {'user': 'ㅇㅇ#68347964', 'comment': '기채 패키지 자체가 적어서'}]",https://arca.live/b/counterside/34055917,2021-09-15 10:01,33,0,2
34050104,"ㅇㅇ, 1.231",이볼브원도 천장인데 각시윤도 또 천장이네,기채 다사고 천장까지 6뽑 부족해서 1750패키지주화 사서  주화뽑 박았다아 시발,"[{'user': '학점대폭발', 'comment': '(emoticon)'}, {'user': '이터니티라바', 'comment': '운 누군가가 빨아먹은듯'}, {'user': 'ahffk', 'comment': '(emoticon)'}, {'user': '왜그래쪙#59517723', 'comment': '6뽑 부족한거면 좀 기다렸으면 됐잖아'}]",https://arca.live/b/counterside/34050104,2021-09-15 4:29,55,0,4
34048573,ㅇㅇ#23221700,재건기업 패키지 쓰알 선택권 질문 좀,성녀님 따먹으려고 이거 질렀는데여기 쓰알풀도 존버하면 추가해 줌?당장 필요한 게 없어 보여서,"[{'user': '늒네#86893131', 'comment': 'ㅇㅇ 해줌'}, {'user': '늒네#86893131', 'comment': '근데 성녀 추가되려면 얼마나 걸린진 모름'}, {'user': 'ㅇㅇ#23221700', 'comment': '아 성녀는 패키지에 있는 채용권으로 뽑음. 선택권으로는 다른 애 데려오려고'}, {'user': 'ㅇㅇ#23221700', 'comment': 'ㄱㅅㄱㅅ 추가될 때까지 기다려야겠네'}]",https://arca.live/b/counterside/34048573,2021-09-15 3:08,47,1,4
34047376,한우쟝,니들 데일리 패키지 사냐?,궁금,,https://arca.live/b/counterside/34047376,2021-09-15 2:31,16,-1,0
34045742,ㅇㅇ#38170946,소과금 기준 기채권 얻으려면 보급소 리셋 5번이 다인가?,퀘스트로 얻는거 말고패키지야 논외고 당연히,"[{'user': 'ㅇㅇ#37159935', 'comment': '쿼츠로 기밀 200 구입가능'}, {'user': '청안아이', 'comment': '주간 쿼츠 기채'}, {'user': '에트리안#99131387', 'comment': '주간 220개'}]",https://arca.live/b/counterside/34045742,2021-09-15 1:52,28,0,3
34043960,한우쟝,니들 데일리 패키지 사냐?,뭐뭐 사냐?,"[{'user': 'ㅇㅇ, 220.117', 'comment': '난 1200원짜리'}]",https://arca.live/b/counterside/34043960,2021-09-15 1:17,43,-1,1
34043279,알산나,추석 패키지도 그렇고 이벤트도 그렇고 왜이리 짜냐,민족대명절이 좆으로 보이냐?쿼츠 3배패키지 내놔,,https://arca.live/b/counterside/34043279,2021-09-15 1:04,32,0,0
34042456,ㅇㅇ#62186313,늒네 패키지사면 주는 5티어 초전도 세트선택권 뭐받는게 좋아?,"스충, 공속?주지윤때문에 공속끌리긴 하는데","[{'user': '동치미', 'comment': '좀 애매함 5t라 준종결이라..'}, {'user': 'swon#84509089', 'comment': '일단 존버\n아직 주시윤 스충이냐 공속이냐  평이 안끝났음'}, {'user': '새벽비', 'comment': '스충?안스충?'}, {'user': '새벽비', 'comment': '근대 쥬지윤 전용으로 줄거면 좀더 고민해봐'}]",https://arca.live/b/counterside/34042456,2021-09-15 0:50,29,0,4
34042231,모미지#20893788,한남들 현실에 이렇게 가슴 큰 캐릭터가 어딨음? 성상품화 토나오긔,3000천장이고각성은 픽업기간이 3주니까 그래도 혹시 모르니 2주라고 일단 잡으면기채모을 수 있는기간 8주현재 보유 기채 388매주 구매하는거 쿼츠 기채 1540(이번주꺼 샀으니까)주간 일퀘 336건포 80(이번달꺼 샀음)총 656장 모자르네 씨발;;다음 각성 패키지 풀매수 한다는 전제하에 6장 모자르다 이번달 추석패키지 좀 질러야하나?여기서 더 짜낼거 없지? 아니면 패키지 좀 질러야할까?니들은 제목 저렇게 달아야지 답글 달아주더라 변태임?,"[{'user': '밀리에밀리', 'comment': '좀치노 ㅋㅋㅋ'}, {'user': '암드', 'comment': '(emoticon)'}, {'user': '오징어다리를오물거리는오르카', 'comment': '응 변태맞아'}, {'user': '모미지#20893788', 'comment': '답좀 줘'}, {'user': '채소#80089631', 'comment': '(emoticon)'}, {'user': '학점대폭발', 'comment': '어그로 ㅅㅌㅊ'}, {'user': '채소#80089631', 'comment': '기채 다쓰고 와,느낌와따'}, {'user': '모미지#20893788', 'comment': '이미 천장 쳤음'}, {'user': '채소#80089631', 'comment': '(emoticon)'}, {'user': '채소#80089631', 'comment': '카운터패스 10렙때 주는거? 40장?? 정도'}, {'user': '모미지#20893788', 'comment': '오! 더없음?'}]",https://arca.live/b/counterside/34042231,2021-09-15 0:46,130,3,11
34041762,종근당건강#77993915,주화 수급 패키지 풀매수 할정도임??,난 그거시 궁금해!,"[{'user': '프레이마이어', 'comment': '주화1개를 15원으로 본다고들은거같은데 그러면 1번 패키지는 7500원을 5,900원에 파는거고 2번은26250원을 21000원에 파는건가?'}]",https://arca.live/b/counterside/34041762,2021-09-15 0:38,30,0,1
34041692,모미지#20893788,더 쥐어짤거 있나?,3000천장이고각성은 픽업기간이 3주니까 그래도 혹시 모르니 2주라고 일단 잡으면기채모을 수 있는기간 8주현재 보유 기채 388매주 구매하는거 쿼츠 기채 1540(이번주꺼 샀으니까)주간 일퀘 336건포 80(이번달꺼 샀음)총 656장 모자르네 씨발;;다음 각성 패키지 풀매수 한다는 전제하에 6장 모자르다 이번달 추석패키지 좀 질러야하나?여기서 더 짜낼거 없지? 아니면 패키지 좀 질러야할까?,"[{'user': '채소#80089631', 'comment': '지지뜬'}, {'user': '모미지#20893788', 'comment': '나한테 그런건 없 진짜 천장 친게 씨발...'}, {'user': '채소#80089631', 'comment': '이번엔 몰라 지지뜬'}, {'user': '채소#80089631', 'comment': '(emoticon)'}]",https://arca.live/b/counterside/34041692,2021-09-15 0:37,35,0,4
34041439,한우쟝,데일리 패키지 뭐뭐 사는게 좋냐?,살지 말지 고민임,,https://arca.live/b/counterside/34041439,2021-09-15 0:33,15,-1,0
34040220,모미지#20893788,기채일정 계산해보니까,3000천장이고각성은 픽업기간이 3주니까 그래도 혹시 모르니 2주라고 일단 잡으면기채모을 수 있는기간 8주현재 보유 기채 388매주 구매하는거 쿼츠 기채 1540(이번주꺼 샀으니까)주간 일퀘 336건포 80(이번달꺼 샀음)총 656장 모자르네 씨발;;다음 각성 패키지 풀매수 한다는 전제하에 6장 모자르다 이번달 추석패키지 좀 질러야하나?여기서 더 짜낼거 없지?,,https://arca.live/b/counterside/34040220,2021-09-15 0:15,16,0,0
34033920,모미지#20893788,추석 패키지vs주시윤 패키지,둘 중 그나마 어떤게 더 가성비 좋고 이득임?다음 각성까지 천장마련하려면 둘 중하나는 풀매수 해야겠다,"[{'user': 'LILY', 'comment': '그냥 하루에 한번 1200원짜리 채용권 ㄱㄱ'}, {'user': '모미지#20893788', 'comment': '기채때문에 그러는거'}]",https://arca.live/b/counterside/34033920,2021-09-14 22:43,59,0,2
34033673,모미지#20893788,추섭 데일리 기채vs주시윤 패키지,둘 중 그나마 어떤게 더 가성비 좋고 이득임?다음 각성까지 천장마련하려면 둘 중하나는 풀매수 해야겠다,"[{'user': '세인트케인', 'comment': '솔직히 얘네 기채 패키지는 좀 에바 참치인????듯????'}, {'user': '모미지#20893788', 'comment': '근데 천장 마련하려면 쩔수가 없다 지금 200장 있어;;'}, {'user': '세인트케인', 'comment': '(emoticon)'}, {'user': '세인트케인', 'comment': '급하면 주시윤 패키지가 나은?듯?'}, {'user': '모미지#20893788', 'comment': '데일리는 왜? 10장 더 주자너'}, {'user': '세인트케인', 'comment': '솔직히 그냥 거기서 거기임..'}]",https://arca.live/b/counterside/34033673,2021-09-14 22:40,47,0,6
34033476,아이스링크샾,추석기념 쿼츠패키지나 기채패키지 팔긴할듯,ㄹㅇ,,https://arca.live/b/counterside/34033476,2021-09-14 22:37,9,0,0
34031433,모미지#20893788,다음 신규 각성 나오기 전까지,ㄱㅊ은 기채 패키지 나올까?그리고 미니 각성 유닛 나중에 건틀렛 상점에 풀어줌?아니면 평생 못얻음?,"[{'user': '세인트케인', 'comment': '얘네 기채패키지는 이악물고 구리게 내는걸로 유명함....'}, {'user': '모미지#20893788', 'comment': '2번째 질문 답변도 해줘'}, {'user': '세인트케인', 'comment': '미니 트로피 나중에 풀어주긴할거같?음'}, {'user': '모미지#20893788', 'comment': '아직 푼적은 없고?'}, {'user': '세인트케인', 'comment': '매 시즌마다 트로피 추가시켜주긴 하는데 에이미 미니 퀸 이런애들은 추가 안해줬음 아직'}]",https://arca.live/b/counterside/34031433,2021-09-14 22:10,61,0,5
