index,user,title,content,comment,link,date,view,rate,comment_count
33679935,보리스#63017734,기밀채용 5+1 패키지 살까??,곧 주시윤 나오는데 다음주월 쿼츠기채사봐야 550개쯤될듯..5+1 기채120장 패키지 3개까지 살수있던데살만함??,"[{'user': 'ㅇㄷㄴ#69699297', 'comment': '다음주에 나오는 출시패키지를 사셈'}, {'user': '보리스#63017734', 'comment': '아 이번꺼 효율별로임? 천장3000장이라 영혼까지 끌어모아야되나 해서'}, {'user': 'ㅇㄷㄴ#69699297', 'comment': '20퍼 효율밖에 안됨 저거'}, {'user': '하랍픽업좀', 'comment': '다음주 월요일 패키지 보고 결정하자\n솔직히 5+1이어도 250주화당1뽑은 효율 ㅇㅁ듸짐'}, {'user': '보리스#63017734', 'comment': '(emoticon)'}]",https://arca.live/b/counterside/33679935,2021-09-09 18:45,34,0,5
33675481,ㅇㅇ#86291163,재화 견문록,"1.기초 재화이건 이터니움입니다.다른 게임의 피로도와 같은 개념이라 생각하시면 됩니다.초반엔 레벨 업을 할 때마다 적지 않은 양을 퍼줘서 마를 날이 없을 겁니다.물론 그 초반이 지나면 이터니움이 없어서 말라가기 시작합니다.로비 좌측 하단 배너에 있는 관리지원금,출석 보상 등으로도 소소하게 뿌립니다.이건 크레딧입니다.유닛을 성장시키고 함선도 건조하고 이 게임 내에서 핵심 재화입니다.이터니움을 태우다 보면 꽤 모이긴 하는데,주력 유닛 한 둘 성장시키다 보면 금방 사라집니다.후반 가도 장비 만들고 옵션 바꾸고 하려면 기하급수적인 크레딧이 들기 때문에 넉넉히 있다고 막 쓰지 말고 계획적으로 쓰는 것이 중요합니다.(콘에 사진이 없어서 대체)이건 정보입니다.다이브,레이드를 들어갈 때도 쓰이고,기술 레벨을 올릴 때도 쓰이고,중첩작전을 할 때도 쓰이고,카운터 케이스 개방할 때도...아무튼 게임을 하다 보면 크레딧만큼 항상 부족한 자원입니다.어쩌면 크레딧보다도 더 부족합니다.전 정보가 5자리라 많은 거 같은데요?같은 건 없습니다,주력팟 기술 레벨 좀 올려 줘야지?하면 1,2만따리는 금방 사라집니다.그래도 조금씩 쓰면서 아끼다 보면 쌓이니 아껴뒀다가 자기한테 중요한 캐릭터들을 육성할 때 사용합니다.2.육성 재화이것들은 적성핵입니다.캐릭터들의 별을 올려주는데 쓰입니다.붉은색은 카운터,푸른색은 솔저,초록색은 메카닉에만 사용할 수 있습니다.초반에 SSR들로만 덱을 짜면 적성핵 부족에 허덕일 수 있어서 R,SR들이랑 섞어가며 소대를 짜게 하는 원흉이기도 합니다.별을 어느 정도 올린 뒤 돌파를 한다면 위에 있는 적성핵들하고 특수적성핵들을 같이 소비합니다.적성핵도 적성핵이지만 특수적성핵들은 초반엔 구하기 매우 부족하니 아껴씁시다.그리고 적성핵 말고 같은 캐릭터를 넣어서 적성핵 소비를 줄인다는 선택지가 있는데,SR이나 SSR처럼 구하기 힘들다면 절대 하지 맙시다.중복이라 남아도는 캐릭터들은 100렙을 찍은 후에 훨씬 유용하게 사용할 수 있습니다.연봉협상에 쓰이는 봉투들입니다.일반 전역을 도는 거로는 레벨이 생각보다 잘 안 오르는 탓에 시간은 없고 키워야 할 게 많다면 연협에 의존을 많이 하게 됩니다.연봉 협상을 하는 데에는 크레딧이 소비되며,오른쪽으로 갈 수록 경험치를 많이 올리지만 크레딧 소비량도 같이 올라갑니다.기술 레벨을 올릴 때 사용하는 책들입니다.모든 캐릭터들 공통으로 스킬 레벨 3까진 노란 책을 사용하며,4~5렙은 붉은 책을 사용합니다.기술 레벨을 올릴 때 위에 있는 책들과 정보를 소비하며-캐릭터의 기본 등급이 높을수록-평타보단 특수기나 궁일 수록소비량이 올라갑니다.이 게임에는 스킬 레벨 5를 찍으면 대개 부가효과가 붙어 성능이 환골탈태하는 캐릭터들이 많습니다.무작정 올리기보다는 스킬 설명을 읽어보고 올리는 걸 추천하며,모르면 물어봅시다.모른다고 솔직히 말하면 사람들은 다 알려줌이건 융합핵입니다.앞에서 말한 적성핵들을 사용해 캐릭터들이 100렙까지 만렙을 찍었다면 이젠 융합핵을 쓸 차레입니다.한계 융합은 100-102-104....110까지 5번을 할 수 있으며,융합을 한 번 할 때마다 스탯 상승량이 높습니다.캐릭터를 한계 융합을 할 때 같은 캐릭 3명,아니면 일정 갯수의 융합핵을 사용하는데,SSR들은 융합 1번마다 15개의 융합핵을 사용합니다.15개면 적은 거 같은데요?아닙니다.적성핵하곤 다르게 이건 존나게 안 모입니다.낮은 등급의 캐릭터들이 연비가 좋은 이유도 같은 캐릭이 많이 모여 융합이 빠르기 때문입니다.하지만 더럽게 안 모이는 SSR들은?같은 캐릭을 3명 모으려면 한 세월입니다.이럴 때 사용하는 게 융합핵입니다.야금야금 모아서 내가 컨텐츠를 미는 데 필요한 인권 캐릭터들한테 씁시다.SSR들을 갈아도 융합핵을 주지만,절대 갈지 맙시다.3명을 모아서 융합을 하는 건 그냥 갈아서 융핵 1개로 바꾸는 것보다 훨씬 값어치가 있습니다명함입니다,R등급 이상의 캐릭터를 해고 할 때마다 줍니다.이 명함을 모아두면 위에 있는 융합핵도 사고 적성핵도 사고 정보도 사고 매우 좋은 재화입니다.꾸준히 이터니움을 태운다면 명함도 조금씩 쌓이니 모아뒀다가 상점에서 필요한 거나 주간 한정 물품들을 삽시다.위의 명함과 비슷 해 보이지만 이건 협력사들하고 주고받는 친목명함입니다.기숙사에서 주고받으실 수 있습니다.이것들은 500장씩 모아서 SR까지만 나오는 10연차를 할 수 있으며,이것들을 갈아서 위의 검은 명함으로 쓰거나 중복을 먹어 유용하게 사용할 수 있습니다.3.가챠채용 계약서입니다.저희 가챠게임 카운터사이드에서 가챠를 담당하고 있습니다.채용권 한 장당 정가로 150쿼츠 정도 하며,12시마다 새로 들어오는 상점 보급소에서 할인된 가격이나 크레딧으로도 살 수도 있습니다.쿼츠에 비해 구하기 쉬운 크레딧으로 사는 경우는 무조건 이득이기 때문에 사두면 손해 볼 일이 없습니다.일일 퀘스트 보상으로 하루에 1장씩은 무조건 건질 수 있으며,주간 퀘스트 달성도를 다 채우면 3장을 추가로 줍니다.또한 파견보상이나 패키지,카운터케이스 등 수급할 수 있는 곳도 적지 않지만,그만큼 소비하는 속도도 빠른 재화입니다.나는 가챠를 하면 천장을 쳐서라도 먹고 싶다!하면 존버를 해야 합니다.캐릭 픽업을 할 때 천장은 150스택,즉 최대 150장을 써야 정가로 먹습니다..또한 픽업이 끝나면 별도의 보상 없이 천장 스택이 터져버리기 때문에 천장에 거의 다 왔는데 픽업이 끝나면 눈물밖에 흘릴 수 없습니다.기밀채용 계약서입니다.저희 가챠게임 카운터사이드에서 가챠를 담당하고 있습니다.위에 저 파란 거랑 다른 게 뭐냐고요?이건 채용칸에 있는 기밀 채용에서만 쓸 수 있습니다.반대로 기채 역시 일반 채용에서 쓸 수 없습니다.기밀 채용으로 얻는 각성 캐릭터들은 일반 캐릭터들에 비해 많이 튼튼하거나 강합니다.ㄴ아이콘 뒤에 뭔가 번쩍번쩍 하기도 하고 등장 이펙트도 SSR과는 달라서 구분하기 쉽습니다.다만 인내심을 가지면 잘 쌓이는 채용권과는 달리 기채는 구하는 곳이 한정된 탓에 더럽게 안 모입니다.기채를 얻으려면 일일 퀘스트로 매일 4장,주간 퀘스트로 10장 언저리를 더 얻을 수 있으며,보급소 상점에서도 낮은 확률로 쿼츠로 판매를 합니다.또한 매 주 월요일마다 2750쿼츠로 기채권 220장을 판매합니다.여유가 된다면 무조건 사주시는 게 좋습니다.220장이면 충분히 천장 아닌가요?할 수도 있겠지만 기밀 채용은 1회에 기채권을 20장 사용합니다.그러면 천장은 20x150=3000,3천장입니다.다행히 기채는 다음 픽업으로 넘어가도 스택이 보존되니 열심히 모아서 꼴리는 각성을 먹읍시다.4.장비이건 건포,건틀렛 포인트입니다.이름에서 알 수 있듯이 pvp 컨텐츠인 건틀렛에서 주로 수급할 수 있습니다.건포는 일정 시간마다 리젠되며,최대 900점까지 쌓여서 수시로 빼 주는 게 좋습니다.얼마나 있는지는 우측 하단에 매칭버튼 위에 있는 ui로 확인 할 수 있습니다.ex)  <450/900>건틀렛 포인트로 살 수 있는 품목은 많지만,주로 이 게임의 종결장비라 불리는 메이즈/고르디우스를 사는 데 쓰입니다.일단 사 두면 좋은 장비들이기 때문에,건포를 꾸준히 모아서 상점을 쓸어버립시다.근데 저는 pvp가 싫어요!걱정하지 맙시다,랭크전의 악질 건공들이 싫으면 전략전만 돌려도 건포를 꾸준히 뺄 수 있습니다.전략전은 완전 오토니 약해 보이는 애들만 골라잡아서 팹시다.왼쪽 은색 도면은 튜닝 바이너리,오른쪽 금색 도면은 세트 바이너리입니다.각자 장비의 부 옵션,세트 옵션을 조정하는 데 쓰입니다.앞의 건포에서 언급한 종결 장비들의 옵션을 맞추는 데  갈아넣는 재화들입니다.튜바는 셋바에 비해 많이 모이는 편이지만 어디까지나 비해서 입니다.둘 다 진짜 존나게 안 모입니다.그럼 튜바/셋바는 안 쓰고 모아두는 게 좋나요?당연히 모아두는 게 좋습니다.아니,제발 모아두셔야 합니다!스토리를 밀면서 얻은 2T 3T 잡장비에 셋바를 바르는 걸 보여줬다간 충격을 받은 사람들이 뒷목을 잡습니다.다행히 정보글에 친절한 장비 가이드가 있지만,가급적 물어보고 사용하는 게 좋습니다.내가 현질로 이걸 사서 돌려야겠다 하면 신중히 재고 해 보시는게 좋습니다.다른 성과라도 남는 재화들하곤 달리 이건 돈을 부어도 무과금 당해버릴 가능성이 높습니다.5.귀중품이건 쿼츠입니다.유닛/창고 칸을 늘리거나,상점에서 귀중품을 사거나 할 때 쓰입니다.게임을 조금 한다면 아 이거 생각보다 잘 안 모이네라는 생각이 절로 들게 됩니다.게임 내 현질의 대부분은 후술할 관리국 주화가 담당하고 있기 때문에 별로 하는 게 없어 보입니다만쿼츠로 살 수 있는 스킨이랑 가구들도 있고,주간 기채패키지도 있고,보급소도 리롤할 수 있는 등 계속 지출이 나오는 재화입니다.수급처는 건틀렛에서 주는 주간보상,스테이지 메달 갯수에 따른 보상,업적 보상등이 있으며주화로 가끔씩 파는 쿼츠 n배 패키지 같은 가성비를 사면 대량으로 얻을 수 있습니다.이건 관리국 주화입니다.이 게임에서 유일하게 현금으로만 살 수 있는 재화입니다.엥 현질 하기 싫은데용 해도패키지,좀 이쁘다 하는 스킨들,주기적으로 열리는 패스 업그레이드까지 산다면 게임이 편해지는 영역에서 자꾸 주화가 아른거리면 자연스럽게 고민을 하게 됩니다.살 돈이 없으면 어쩔 수 없고...깡주화가 비싼 거 같으면 월정액만 사고 존버해도 많은 양의 주화를 모을 수가 있습니다.아랫동네 리니지마냥 꼭 주화를 써야 게임을 할 수 있다는 아니니 지르시기 전에 생각을 좀 해 보시는 것도 나쁘진 않습니다.하지만 상점을 둘러보다 스킨들에 좆이 잡힌다면 생각이 바뀔 수도 있고",,https://arca.live/b/counterside/33675481,2021-09-09 17:44,44,4,0
33670168,와랄랄루#65256315,기채권 과금하려면 뭐가 이득임?,이거 사는게좋음?아님 이지수 패키지가 좋음? 회사성장 패키지는 샀음,"[{'user': '야한눈나', 'comment': '금태가 이득이래...'}, {'user': 'BluSt0ne', 'comment': '이지수가 혜자래'}, {'user': '다인자유전', 'comment': '난 여기 기채권은 다 개비싸보이던데 이번 패키지는 달달해보임\n각성캐 천장으로 환산하면 빡통팩이 씹혜자긴 한데...몰?루'}, {'user': 'eca', 'comment': '주시윤 나올 때 기채패키지도 같이 나오니까 그거 사셈 굳이 살거면'}]",https://arca.live/b/counterside/33670168,2021-09-09 16:23,58,0,4
33662211,이히힝#28957736,스킨 놓쳐도 살수있잖아,30일 접었다오면 복귀기념 스킨커스텀패키지팜최신거빼고 다팔걸??근데 30일접속안하면 그대로접을듯,"[{'user': 'c0in', 'comment': '30일 접을 능지상승이면 그대로 인생살지 ㅋㅋㅋ'}, {'user': '이히힝#28957736', 'comment': '(emoticon)'}]",https://arca.live/b/counterside/33662211,2021-09-09 14:09,72,1,2
33662142,열상,쿼츠로 주간 채용권 패키지 사고싶다,,"[{'user': '땅국#36049359', 'comment': '(emoticon)'}, {'user': '지붕', 'comment': '(emoticon)'}]",https://arca.live/b/counterside/33662142,2021-09-09 14:08,52,0,2
33658722,ㄹㅇ늒네#93270120,추석때 혜자 패키지 많이 나오것제?,3주된 카붕이 현질 마려운대 지를게 없어서 발동동 하고있다,"[{'user': '제이크', 'comment': '기업성장인가 그거랑 월정액 사셈 ㄱㄱ'}, {'user': 'ㄹㅇ늒네#93270120', 'comment': '월정액1,2랑 기업성장은 이미 풀매수함'}, {'user': '카붕쿤', 'comment': '채용패킈즤 고고씡'}]",https://arca.live/b/counterside/33658722,2021-09-09 13:11,50,0,3
33654561,"ㅇㅇ, 14.6",그마 달성 후...,10월 1일에 셋바패키지 풀매수하고 챌도전 간다,,https://arca.live/b/counterside/33654561,2021-09-09 12:05,32,0,0
33648816,코코야야,응애 뉴비 저녁에 게임켜면 할거 목록,"1. 월정액 주화,쿼츠 사기2. 카운터패스 사기3. 스타터패키지 특별,123 풀매수4. 행복카사지금 게임을 못켜서 공지에 있는거보고 살거 생각해둔건데바뀐거 있으면 알려주셈 게임 UI도 다 달라져서 복귀가 아니라 진짜 응애된거같음",,https://arca.live/b/counterside/33648816,2021-09-09 10:03,18,0,0
33648385,나사나이다,셋바패키지 사야겠다,생각해보니까 셋바 600개 써서 스충 하나 띄울 운명이라고 치면 패키지 사서 카운트 40번 깎아줘야 20번 후에 딱 먹는거아님?당장 사야겠노,,https://arca.live/b/counterside/33648385,2021-09-09 9:53,18,0,0
33645481,게테라토스,사상최악의 쓰레기 셋바패키지 사지마셈,그대로 공중분해되고 크레딧도 부족해서 튜바도 못돌리고있음,"[{'user': '기돈곤겪기', 'comment': '(emoticon)'}, {'user': '마싯는감자칩', 'comment': '(emoticon)'}]",https://arca.live/b/counterside/33645481,2021-09-09 8:06,70,0,2
33641993,나뤼,맨땅계로 한달쯤 했는데 80 박음,그동안 한거 종합해봄이볼브는 솔직히 비틱으로 먹었고 킹 갖고싶어서 패키지 샀는데 퀸나옴가챠 끝나는 전날 친구한테 20빌려서 킹 천장쳤음마리아 보고 시작했는데 운좋게 외전에서 금방 떠서 제일 열심히 키움보통 스충준다길래 당연히 애정캐는 풀템 줄려고 커리지 하나 꼈지만 메스충 맞춤함선은 몰루 코핀 순으로 만들고 레이크랑 뉴디트는 선택권으로 받음 며칠전에 신은나 만들었는데 소재가 없다알비온 갖고싶어서 챌린지 티켓 사가면서 밀었는데 지금 좀 막힘그전은 2오토 되고 다이브는 8월에 45층까지 깨고 초기화했음그래도 한달만에 전략전 챌이랑 랭크전 플레 찍음리그전은 재밋어보이는데 뉴비라 쓸 캐릭풀이 좁아서 아직 무리이정도면 알차게 즐기고 있다오래보자 애들아,"[{'user': '학점대폭발', 'comment': '(emoticon)'}, {'user': '나뤼', 'comment': '(emoticon)'}, {'user': '모스모', 'comment': '-건-'}]",https://arca.live/b/counterside/33641993,2021-09-09 3:21,41,4,3
33639752,룰루,대충 담주 기채패키지 사면 110연가능은한데,주시윤 픽업때까지 노현질로 천장칠수있나?,"[{'user': '암왕제군', 'comment': '나오고 3주간 픽업할 거 같은데 계산해보셈'}, {'user': 'ㅈㅇㅈㅎ#19865107', 'comment': '애매하게 모자를거같은데'}, {'user': '씨에스', 'comment': '그안에 뜰걸'}, {'user': '박희리씨', 'comment': '주간 일퀘하고 보급소 비틱 생각하면 천장될것 같은데'}]",https://arca.live/b/counterside/33639752,2021-09-09 2:09,36,0,4
33638551,카사하는병신,셋바패키지에 크레딧좀 끼워주지,존나모자르네ㄹㅇ,,https://arca.live/b/counterside/33638551,2021-09-09 1:42,14,0,0
33635776,Cacao#25953018,애정표현대회) 저번주에 시작한 누비도 대회 참여하고 싶어,힐데랑 로자가 좋아겜 시작할때 가챠로테부터 체크하는 습관 있는데 보자마자 무지성으로 질렀음뽑았을때부터 아 얘다 싶었어스토리에서도 뽕 제대로 채워주드라로자는 패키지에 딸린 선택권 썼었음카붕이가 올린 로자짤이 넘 이뻐보였었거든쥰내 열심히 키우고스킨도 사줫어그래서 돈 없어서 유나였나 알낳는애도 못뽑음걔 궁 존나 멋있더라존버할 생각임둘다 넘 좋은데 고인물들처럼 여러개 키웟다고 할수도 없고 글도 그림도 잘 못하네대회글 이랍시고 썼는데 잘 몰루겠음아 로자랑 힐데가 상담소 하는 문학 재밌더라근데 이겜은 애사심 올리는거 기숙사랑 연봉협상밖에 없냐종신계약권 딱 2장 있는데 언제 차냐이거 너무 느리게 참,"[{'user': 'ㅇㄷㄴ#69699297', 'comment': '빈유가 취향이신거같은데 린을 추천드립니다'}, {'user': 'Cacao#25953018', 'comment': '별?루'}, {'user': 'ㅇㄷㄴ#69699297', 'comment': '(emoticon)'}, {'user': 'diqkf운터', 'comment': '(emoticon)'}, {'user': '정실부인은이수연', 'comment': '(emoticon)'}, {'user': '카이하베르츠29', 'comment': '(emoticon)'}, {'user': '방연#60601907', 'comment': '(emoticon)'}, {'user': 'Jin#18888698', 'comment': '애사심 전투 10번할 때마다 1씩 올라'}, {'user': 'Jin#18888698', 'comment': '애사심 전투 10번할 때마다 1씩 올라'}, {'user': 'Cacao#25953018', 'comment': '(emoticon)'}, {'user': 'ㅇㅇ#10692276', 'comment': '알 낳는 애ㅋㅋㅋㅋㅋ'}, {'user': '프룸', 'comment': '알ㅋㅋㅋㅋㅋ'}]",https://arca.live/b/counterside/33635776,2021-09-09 0:50,523,26,12
33633475,밥은먹고다니냐,지부 8시간 임무에 셋바 1개 주면 보냄?,패키지 없이 쌩으로 100쿼츠니까 보낼만 한거 같기도,"[{'user': '하랍픽업좀', 'comment': '보냄 씹이득이지'}, {'user': '무명#89075445', 'comment': '솔직히 보냄.ㅋㅋ'}, {'user': 'Jin#18888698', 'comment': '튜바5개도 보내는데 ㅋㅋ'}]",https://arca.live/b/counterside/33633475,2021-09-09 0:13,50,2,3
33630912,앗발꿍,추석패키지 개혜자나오겠지?,이거 사고싶긴한데 좀더 참는게낫겠지??,"[{'user': '게테라토스', 'comment': '...'}, {'user': '게테라토스', 'comment': 'https://arca.live/b/counterside/33557243?mode=best&target=all&keyword=%EB%81%BC&p=1'}, {'user': 'jjjj#72304297', 'comment': 'ㅋㅋㅋㅋㅋㅋㅋㅋㅋㅋㅋㅋㅋㅋㅋㅋㅋㅋㅋㅋㅋㅋㅋㅋㅋㅋㅋㅋㅋㅋㅋ'}, {'user': '앗발꿍', 'comment': '(emoticon)'}, {'user': 'ㅇㄷㄴ#69699297', 'comment': '셋바 관련패키지로는 저게젤 혜자급일텐데'}, {'user': '앗발꿍', 'comment': '저거 이상은없었음??'}, {'user': 'ㅇㄷㄴ#69699297', 'comment': '원래 이전엔 저거급 패키지도 없엇음'}, {'user': 'ㅇㄷㄴ#69699297', 'comment': '대신에 셋튜바말고 주화나 다른것도 필요한거면 다른패키지 효율좋은거 많긴함 잘 고민해서 사셈'}, {'user': '나사나이다', 'comment': '사고 또 사자'}, {'user': '앗발꿍', 'comment': '히익'}, {'user': '릴리는여고생', 'comment': '건공;'}]",https://arca.live/b/counterside/33630912,2021-09-08 23:35,91,1,11
33625058,나사나이다,건틀렛 안하는데 셋튜바패키지 매우 끌리네,잠재돼 있던 건틀렛 욕망이 깨어나는건가5일 남았던데 생각좀 해 봐야겠다,"[{'user': '이히힝#28957736', 'comment': '건잘안해도 템옵션맞추면 뿌듯하고 pve도 쉬워지고 그래.. 한번사봐'}, {'user': '이히힝#28957736', 'comment': '(emoticon)'}, {'user': '엿이나처무라#99513101', 'comment': '건 안해도 이젠 pve도 빡센곳들이\n많아져서 장비 셋팅 좋게 해줘야됨\n장비 구리면 못깨는데 많음'}, {'user': '주블', 'comment': '히히 질러라 질러'}, {'user': 'LastChance', 'comment': '(emoticon)'}]",https://arca.live/b/counterside/33625058,2021-09-08 22:06,71,0,5
33622154,Zinma,패키지 구매 제한이 가끔가다 좀 빡치긴 함 ,돈을 얼마를 쓰든 일단 목표 성공하면 그래도 안심이라도 되는데돈은 있는데로 써놓고 성공은 못하고 패키지도 더 못사게 제한걸어놓고 어중간하게 써야하니 너무 찝찝해,,https://arca.live/b/counterside/33622154,2021-09-08 21:21,15,0,0
33621892,Zinma,월간이랑 주간 튜바 풀매수함,다이브 튜바랑 여튼 패키지 튜바 파는거 다샀음2500개 째임이번에도 안뜨면 자살하러간다,"[{'user': 'ㅇㅇ#79729761', 'comment': '(emoticon)'}, {'user': '초특가가챠다', 'comment': '(emoticon)'}, {'user': 'Nyx#34512140', 'comment': '(emoticon)'}, {'user': '카운터사이드는서비스종료다', 'comment': '주간월간 셋튜바 풀매수하고 무과금당한 이후로 다시는 안함'}]",https://arca.live/b/counterside/33621892,2021-09-08 21:17,54,1,4
33621740,beale#84377160,중고 늒네 다음주를 위해 절찬존버중...,또 이번 셋바패키지랑 기채패키지 풀매수 예정...괴롭지만 각시윤을 위해서 참는다,"[{'user': '제주삼다수군통제사', 'comment': '다 까주고싶다'}]",https://arca.live/b/counterside/33621740,2021-09-08 21:14,38,0,1
33620331,ㅇㄷㄴ#69699297,종신계약 패키지좀 더 팔아조,쩨발,"[{'user': '늒네#86893131', 'comment': '(emoticon)'}, {'user': '카운터사이드는서비스종료다', 'comment': '린 시엔이 여기있노'}]",https://arca.live/b/counterside/33620331,2021-09-08 20:52,40,1,2
33619669,beale#84377160,지금 기채권 패키지 이득임?,깡주화랑 별차이없어보이는데 ㄴㄴ?,"[{'user': '소나기나기', 'comment': '깡주화에 채용권하고 이터도 주는거임'}, {'user': 'ㅇㄷㄴ#69699297', 'comment': '5+1은 급한거 아니면 하지마'}, {'user': 'beale#84377160', 'comment': 'ㅖㅏ'}]",https://arca.live/b/counterside/33619669,2021-09-08 20:41,48,0,3
33619304,GG,이번 한정 패키지 효율 어떰???,"맹훈련 패키지랑 채용계약서 패키지, 이거 둘 다 사거나 아니면 하나만 고르라고 한다면 뭘 고르는 게 나음?설령 산다고 해도 효율 이득인지 손해인지 잘 모르겠어서 질문해봄","[{'user': '소나기나기', 'comment': '채용패키지'}, {'user': 'ㅇㅇ#85245304', 'comment': '맹훈련은 너의 과금액이 월 30만원 이상이라면 사고 채용은 그냥 살만함'}]",https://arca.live/b/counterside/33619304,2021-09-08 20:35,26,0,2
33605704,이히힝#28957736,융합핵은 패키지로안사면 못따라잡겟어,사람들이 쿼츠로 모작권 사는거랑주화로파는 융핵패키지 효율비교해서 모작권이 훨낫다고는 하는데솔저메카닉 적성핵은 하다보면  좀 바꿔먹는다싶어도 카운터는 수가많아서 쓰알스알애들 다100찍어주려면 융핵못바꿔먹겟음..키울거많은 응애입장에서 창렬이라지만 융핵패키지 한번씩안사주면 110 넘오래걸리는듯,"[{'user': '게테라토스', 'comment': '융합패키지 사느니 로얄컴퍼니함'}, {'user': '이히힝#28957736', 'comment': '그게뭐야?'}, {'user': 'Nyx#34512140', 'comment': '일단 애들을 전부 100 찍고나서야 융핵공장이 정상작동하는데 그전까진 부족한게 맞지'}, {'user': '이히힝#28957736', 'comment': '나는 무반동포병 이런애들은 그냥거르는중.. 카운터만 스알까지 100찍게'}]",https://arca.live/b/counterside/33605704,2021-09-08 16:44,49,0,4
33604486,"ㅇㅇ, 120.50",재난지원금으로 카사 패키지 질러짐?,안해봣어,"[{'user': 'LILY', 'comment': 'x'}, {'user': '원찬스', 'comment': '현금으로 받는거아닌이상 안되지'}, {'user': 'ㅇㅇ, 221.160', 'comment': '재난 지원금을 생활비로 쓰고 생활비를 지르면 됨'}, {'user': 'Fiction', 'comment': '편의점 점주랑 좀 친하면 카드로 기프티콘이나 문상 살 수 있을걸?'}]",https://arca.live/b/counterside/33604486,2021-09-08 16:23,109,0,4
33598193,진눈깨비#98873860,이거 사면 흑우임?,패스살 주화가 부족해서 이거랑 채용권패키지 생각중인데,"[{'user': '1주년카붕이', 'comment': '채용권이나 사'}, {'user': '1주년카붕이', 'comment': '세번 살 수 있어 채용권'}, {'user': 'ㅇㅇ#17324123', 'comment': '뉴비면 사도됨'}]",https://arca.live/b/counterside/33598193,2021-09-08 14:36,53,0,3
